cached_data_used/cachefiles/convolution/RTX_3060_laptop.json
{
"device_name": "NVIDIA GeForce RTX 3060 Laptop GPU",
"kernel_name": "convolution_kernel",
"problem_size": [
4096,
4096
],
"tune_params_keys": [
"block_size_x",
"block_size_y",
"filter_height",
"filter_width",
"read_only",
"tile_size_x",
"tile_size_y",
"use_padding"
],
"tune_params": {
"block_size_x": [
1,
2,
4,
8,
16,
32,
48,
64,
96,
112,
128
],
"block_size_y": [
1,
2,
4,
8,
16,
32
],
"filter_height": [
15
],
"filter_width": [
15
],
"read_only": [
0,
1
],
"tile_size_x": [
1,
2,
3,
4,
5,
6,
7,
8
],
"tile_size_y": [
1,
2,
3,
4,
5,
6,
7,
8
],
"use_padding": [
0,
1
]
},
"cache": {
"2,32,15,15,0,1,1,0": {"block_size_x": 2, "block_size_y": 32, "filter_height": 15, "filter_width": 15, "read_only": 0, "tile_size_x": 1, "tile_size_y": 1, "use_padding": 0, "time": 19.77077465057373, "times": [19.786720275878906, 19.771520614624023, 19.771392822265625, 19.769344329833984, 19.76950454711914, 19.76905632019043, 19.767295837402344, 19.767295837402344, 19.767295837402344, 19.768320083618164], "compile_time": 0.39369799924315885, "verification_time": 0, "benchmark_time": 198.3892090001973, "strategy_time": 0, "framework_time": 96.80022800057486},
"2,32,15,15,0,1,1,1": {"block_size_x": 2, "block_size_y": 32, "filter_height": 15, "filter_width": 15, "read_only": 0, "tile_size_x": 1, "tile_size_y": 1, "use_padding": 1, "time": 6.122963285446167, "times": [5.536767959594727, 5.533696174621582, 5.534719944000244, 5.530432224273682, 5.911424160003662, 6.6263041496276855, 6.624256134033203, 6.635392189025879, 6.646783828735352, 6.649856090545654], "compile_time": 210.79093700063822, "verification_time": 0, "benchmark_time": 61.76943700029369, "strategy_time": 0, "framework_time": 0.9496909988229163},
"2,32,15,15,0,1,2,0": {"block_size_x": 2, "block_size_y": 32, "filter_height": 15, "filter_width": 15, "read_only": 0, "tile_size_x": 1, "tile_size_y": 2, "use_padding": 0, "time": 19.378787231445312, "times": [19.377151489257812, 19.375104904174805, 19.378175735473633, 19.380224227905273, 19.374048233032227, 19.382272720336914, 19.381248474121094, 19.376127243041992, 19.386367797851562, 19.377151489257812], "compile_time": 340.14403099990886, "verification_time": 0, "benchmark_time": 194.3989050005257, "strategy_time": 0, "framework_time": 1.0783649995573796},
"2,32,15,15,0,1,2,1": {"block_size_x": 2, "block_size_y": 32, "filter_height": 15, "filter_width": 15, "read_only": 0, "tile_size_x": 1, "tile_size_y": 2, "use_padding": 1, "time": 5.6945472240448, "times": [5.189663887023926, 5.1794562339782715, 5.184512138366699, 5.184512138366699, 5.185472011566162, 5.96668815612793, 6.203392028808594, 6.202367782592773, 6.297599792480469, 6.351808071136475], "compile_time": 340.13470399986545, "verification_time": 0, "benchmark_time": 57.47645600058604, "strategy_time": 0, "framework_time": 1.195822999761731},
"2,32,15,15,0,1,3,0": {"block_size_x": 2, "block_size_y": 32, "filter_height": 15, "filter_width": 15, "read_only": 0, "tile_size_x": 1, "tile_size_y": 3, "use_padding": 0, "time": 19.474912071228026, "times": [19.47750473022461, 19.46931266784668, 19.479328155517578, 19.473472595214844, 19.480575561523438, 19.47648048400879, 19.463167190551758, 19.479551315307617, 19.47648048400879, 19.473247528076172], "compile_time": 558.4729459997106, "verification_time": 0, "benchmark_time": 195.48759200006316, "strategy_time": 0, "framework_time": 1.0298990000592312},
"2,32,15,15,0,1,3,1": {"block_size_x": 2, "block_size_y": 32, "filter_height": 15, "filter_width": 15, "read_only": 0, "tile_size_x": 1, "tile_size_y": 3, "use_padding": 1, "time": 5.728156852722168, "times": [5.164031982421875, 5.161983966827393, 5.157887935638428, 5.163008213043213, 5.326752185821533, 6.22489595413208, 6.2259202003479, 6.2269439697265625, 6.314112186431885, 6.3160319328308105], "compile_time": 567.6778240003841, "verification_time": 0, "benchmark_time": 57.85761700008152, "strategy_time": 0, "framework_time": 1.2075879994881689},
"2,32,15,15,0,1,4,0": {"block_size_x": 2, "block_size_y": 32, "filter_height": 15, "filter_width": 15, "read_only": 0, "tile_size_x": 1, "tile_size_y": 4, "use_padding": 0, "time": 19.359814262390138, "times": [19.363679885864258, 19.362815856933594, 19.357664108276367, 19.35875129699707, 19.359840393066406, 19.360767364501953, 19.359487533569336, 19.356672286987305, 19.359743118286133, 19.358720779418945], "compile_time": 825.3527039996698, "verification_time": 0, "benchmark_time": 194.2712259997279, "strategy_time": 0, "framework_time": 1.0947119999400456},
"2,32,15,15,0,1,4,1": {"block_size_x": 2, "block_size_y": 32, "filter_height": 15, "filter_width": 15, "read_only": 0, "tile_size_x": 1, "tile_size_y": 4, "use_padding": 1, "time": 5.597504043579102, "times": [5.2748799324035645, 5.271552085876465, 5.2705278396606445, 5.302271842956543, 5.307392120361328, 5.305344104766846, 5.307392120361328, 6.306816101074219, 6.312960147857666, 6.315904140472412], "compile_time": 827.7186089999304, "verification_time": 0, "benchmark_time": 56.45026599995617, "strategy_time": 0, "framework_time": 1.31400999998732},
"2,32,15,15,0,1,5,0": {"block_size_x": 2, "block_size_y": 32, "filter_height": 15, "filter_width": 15, "read_only": 0, "tile_size_x": 1, "tile_size_y": 5, "use_padding": 0, "time": 24.86857624053955, "times": [26.848224639892578, 26.845184326171875, 26.846208572387695, 26.847232818603516, 26.84828758239746, 26.848255157470703, 26.845184326171875, 21.537792205810547, 19.610624313354492, 19.608768463134766], "compile_time": 1090.0382550007635, "verification_time": 0, "benchmark_time": 249.41986999965593, "strategy_time": 0, "framework_time": 1.1391589996492257},
"2,32,15,15,0,1,5,1": {"block_size_x": 2, "block_size_y": 32, "filter_height": 15, "filter_width": 15, "read_only": 0, "tile_size_x": 1, "tile_size_y": 5, "use_padding": 1, "time": 6.367526340484619, "times": [5.8081278800964355, 5.833600044250488, 5.799935817718506, 5.815296173095703, 6.488063812255859, 6.7358717918396, 6.73689603805542, 6.798336029052734, 6.8290557861328125, 6.830080032348633], "compile_time": 1092.7599380001993, "verification_time": 0, "benchmark_time": 64.31143200006773, "strategy_time": 0, "framework_time": 1.4005220000399277},
"2,32,15,15,0,1,6,0": {"block_size_x": 2, "block_size_y": 32, "filter_height": 15, "filter_width": 15, "read_only": 0, "tile_size_x": 1, "tile_size_y": 6, "use_padding": 0, "time": 25.529673385620118, "times": [27.14313507080078, 27.13907241821289, 27.143104553222656, 27.142240524291992, 27.14214324951172, 27.14214324951172, 27.14521598815918, 25.643007278442383, 19.8287353515625, 19.82793617248535], "compile_time": 1373.0465870003172, "verification_time": 0, "benchmark_time": 255.95943600001192, "strategy_time": 0, "framework_time": 1.4033839997864561},
"2,32,15,15,0,1,6,1": {"block_size_x": 2, "block_size_y": 32, "filter_height": 15, "filter_width": 15, "read_only": 0, "tile_size_x": 1, "tile_size_y": 6, "use_padding": 1, "time": 5.973974370956421, "times": [5.4824957847595215, 5.524479866027832, 5.478400230407715, 5.494527816772461, 5.5265278816223145, 6.403071880340576, 6.426464080810547, 6.418432235717773, 6.492159843444824, 6.4931840896606445], "compile_time": 1380.531961000088, "verification_time": 0, "benchmark_time": 60.39990499994019, "strategy_time": 0, "framework_time": 1.4859889997751452},
"2,32,15,15,0,1,7,0": {"block_size_x": 2, "block_size_y": 32, "filter_height": 15, "filter_width": 15, "read_only": 0, "tile_size_x": 1, "tile_size_y": 7, "use_padding": 0, "time": 26.81792335510254, "times": [27.485183715820312, 27.480064392089844, 27.488256454467773, 27.487232208251953, 27.487232208251953, 27.485055923461914, 27.489280700683594, 27.484159469604492, 27.49225616455078, 20.800512313842773], "compile_time": 1660.495176999575, "verification_time": 0, "benchmark_time": 268.9143329998842, "strategy_time": 0, "framework_time": 1.4872960009597591},
"2,32,15,15,0,1,7,1": {"block_size_x": 2, "block_size_y": 32, "filter_height": 15, "filter_width": 15, "read_only": 0, "tile_size_x": 1, "tile_size_y": 7, "use_padding": 1, "time": 6.209116840362549, "times": [5.489664077758789, 5.485504150390625, 5.494783878326416, 6.488096237182617, 6.475776195526123, 6.476799964904785, 6.546432018280029, 6.544384002685547, 6.557631969451904, 6.532095909118652], "compile_time": 1657.454721999784, "verification_time": 0, "benchmark_time": 62.684880000233534, "strategy_time": 0, "framework_time": 1.61021899930347},
"2,32,15,15,0,1,8,0": {"block_size_x": 2, "block_size_y": 32, "filter_height": 15, "filter_width": 15, "read_only": 0, "tile_size_x": 1, "tile_size_y": 8, "use_padding": 0, "time": 23.218031883239746, "times": [26.34444808959961, 26.33830451965332, 26.34236717224121, 25.644031524658203, 21.25312042236328, 21.25107192993164, 21.251007080078125, 21.251840591430664, 21.25107192993164, 21.253055572509766], "compile_time": 1955.282511000405, "verification_time": 0, "benchmark_time": 232.8846179998436, "strategy_time": 0, "framework_time": 1.5210390001811902},
"2,32,15,15,0,1,8,1": {"block_size_x": 2, "block_size_y": 32, "filter_height": 15, "filter_width": 15, "read_only": 0, "tile_size_x": 1, "tile_size_y": 8, "use_padding": 1, "time": 7.822447919845581, "times": [7.828479766845703, 7.833600044250488, 7.809023857116699, 7.838719844818115, 7.802879810333252, 7.802879810333252, 7.8100481033325195, 7.819263935089111, 7.822336196899414, 7.857247829437256], "compile_time": 1962.4280180005371, "verification_time": 0, "benchmark_time": 78.81125600033556, "strategy_time": 0, "framework_time": 1.5846799997234484},
"2,32,15,15,0,2,1,0": {"block_size_x": 2, "block_size_y": 32, "filter_height": 15, "filter_width": 15, "read_only": 0, "tile_size_x": 2, "tile_size_y": 1, "use_padding": 0, "time": 4.214681625366211, "times": [4.221951961517334, 4.211711883544922, 4.213759899139404, 4.213759899139404, 4.214784145355225, 4.212736129760742, 4.21068811416626, 4.212736129760742, 4.216832160949707, 4.217855930328369], "compile_time": 225.64838000016607, "verification_time": 0, "benchmark_time": 42.66897900015465, "strategy_time": 0, "framework_time": 1.5769129995533149},
"2,32,15,15,0,2,1,1": {"block_size_x": 2, "block_size_y": 32, "filter_height": 15, "filter_width": 15, "read_only": 0, "tile_size_x": 2, "tile_size_y": 1, "use_padding": 1, "time": 4.196348810195923, "times": [4.203423976898193, 4.196544170379639, 4.197375774383545, 4.193408012390137, 4.196352005004883, 4.196352005004883, 4.1941118240356445, 4.195263862609863, 4.195328235626221, 4.195328235626221], "compile_time": 222.49899100006587, "verification_time": 0, "benchmark_time": 42.45080599957873, "strategy_time": 0, "framework_time": 0.8763650002947543},
"2,32,15,15,0,2,2,0": {"block_size_x": 2, "block_size_y": 32, "filter_height": 15, "filter_width": 15, "read_only": 0, "tile_size_x": 2, "tile_size_y": 2, "use_padding": 0, "time": 3.926620841026306, "times": [3.935231924057007, 3.9270401000976562, 3.9239680767059326, 3.924992084503174, 3.9239680767059326, 3.9249279499053955, 3.9270079135894775, 3.924992084503174, 3.926016092300415, 3.9280641078948975], "compile_time": 421.62769100013975, "verification_time": 0, "benchmark_time": 39.77215499980957, "strategy_time": 0, "framework_time": 0.8995670004878775},
"2,32,15,15,0,2,2,1": {"block_size_x": 2, "block_size_y": 32, "filter_height": 15, "filter_width": 15, "read_only": 0, "tile_size_x": 2, "tile_size_y": 2, "use_padding": 1, "time": 3.9302976369857787, "times": [3.9382400512695312, 3.9290881156921387, 3.9280641078948975, 3.930111885070801, 3.92793607711792, 3.9280641078948975, 3.9290881156921387, 3.9290881156921387, 3.932159900665283, 3.931135892868042], "compile_time": 429.7046579995367, "verification_time": 0, "benchmark_time": 39.76264799985074, "strategy_time": 0, "framework_time": 0.8533160007573315},
"2,32,15,15,0,2,3,0": {"block_size_x": 2, "block_size_y": 32, "filter_height": 15, "filter_width": 15, "read_only": 0, "tile_size_x": 2, "tile_size_y": 3, "use_padding": 0, "time": 4.323033571243286, "times": [4.334591865539551, 4.324416160583496, 4.320256233215332, 4.319231986999512, 4.320256233215332, 4.32751989364624, 4.319231986999512, 4.322303771972656, 4.322303771972656, 4.320223808288574], "compile_time": 682.6535210002476, "verification_time": 0, "benchmark_time": 43.748179000431264, "strategy_time": 0, "framework_time": 1.1446139997133287},
"2,32,15,15,0,2,3,1": {"block_size_x": 2, "block_size_y": 32, "filter_height": 15, "filter_width": 15, "read_only": 0, "tile_size_x": 2, "tile_size_y": 3, "use_padding": 1, "time": 4.389455938339234, "times": [4.398079872131348, 4.3919358253479, 4.387775897979736, 4.388864040374756, 4.385791778564453, 4.390912055969238, 4.388864040374756, 4.385727882385254, 4.389887809753418, 4.386720180511475], "compile_time": 692.9887440001039, "verification_time": 0, "benchmark_time": 44.39539200029685, "strategy_time": 0, "framework_time": 1.0079109988510027},
"2,32,15,15,0,2,4,0": {"block_size_x": 2, "block_size_y": 32, "filter_height": 15, "filter_width": 15, "read_only": 0, "tile_size_x": 2, "tile_size_y": 4, "use_padding": 0, "time": 3.9748095750808714, "times": [3.9823360443115234, 3.9731199741363525, 3.974112033843994, 3.9719998836517334, 3.9720959663391113, 3.9720959663391113, 3.976991891860962, 3.975167989730835, 3.9741439819335938, 3.976032018661499], "compile_time": 957.1332599998641, "verification_time": 0, "benchmark_time": 40.26448199965671, "strategy_time": 0, "framework_time": 1.05777000044327},
"2,32,15,15,0,2,4,1": {"block_size_x": 2, "block_size_y": 32, "filter_height": 15, "filter_width": 15, "read_only": 0, "tile_size_x": 2, "tile_size_y": 4, "use_padding": 1, "time": 3.9993375539779663, "times": [4.008831977844238, 4.000895977020264, 3.995840072631836, 3.999743938446045, 3.9976959228515625, 3.999743938446045, 3.9976959228515625, 3.9966719150543213, 3.9987199306488037, 3.9975359439849854], "compile_time": 953.0707290005012, "verification_time": 0, "benchmark_time": 40.43034999995143, "strategy_time": 0, "framework_time": 1.2141480001446325},
"2,32,15,15,0,2,5,0": {"block_size_x": 2, "block_size_y": 32, "filter_height": 15, "filter_width": 15, "read_only": 0, "tile_size_x": 2, "tile_size_y": 5, "use_padding": 0, "time": 4.052547264099121, "times": [4.06220817565918, 4.051968097686768, 4.051968097686768, 4.049920082092285, 4.049920082092285, 4.048831939697266, 4.050848007202148, 4.051968097686768, 4.05401611328125, 4.053823947906494], "compile_time": 1231.818034000753, "verification_time": 0, "benchmark_time": 40.96151999965514, "strategy_time": 0, "framework_time": 0.9279309997509699},
"2,32,15,15,0,2,5,1": {"block_size_x": 2, "block_size_y": 32, "filter_height": 15, "filter_width": 15, "read_only": 0, "tile_size_x": 2, "tile_size_y": 5, "use_padding": 1, "time": 4.230723094940186, "times": [4.237311840057373, 4.231040000915527, 4.228096008300781, 4.229119777679443, 4.228096008300781, 4.231167793273926, 4.231967926025391, 4.229119777679443, 4.229119777679443, 4.232192039489746], "compile_time": 1231.0327619998134, "verification_time": 0, "benchmark_time": 42.79062099976727, "strategy_time": 0, "framework_time": 0.9721040005388204},
"2,32,15,15,0,2,6,0": {"block_size_x": 2, "block_size_y": 32, "filter_height": 15, "filter_width": 15, "read_only": 0, "tile_size_x": 2, "tile_size_y": 6, "use_padding": 0, "time": 4.128569650650024, "times": [4.137919902801514, 4.127744197845459, 4.128704071044922, 4.123648166656494, 4.124864101409912, 4.128799915313721, 4.129759788513184, 4.129792213439941, 4.127744197845459, 4.126719951629639], "compile_time": 1517.5886320002974, "verification_time": 0, "benchmark_time": 41.63745500045479, "strategy_time": 0, "framework_time": 1.0692789992390317},
"2,32,15,15,0,2,6,1": {"block_size_x": 2, "block_size_y": 32, "filter_height": 15, "filter_width": 15, "read_only": 0, "tile_size_x": 2, "tile_size_y": 6, "use_padding": 1, "time": 4.516675138473511, "times": [4.521984100341797, 4.517951965332031, 4.514815807342529, 4.5181121826171875, 4.514815807342529, 4.513792037963867, 4.514815807342529, 4.516863822937012, 4.519839763641357, 4.513760089874268], "compile_time": 1517.7862919999825, "verification_time": 0, "benchmark_time": 45.617841999956, "strategy_time": 0, "framework_time": 1.040213000123913},
"2,32,15,15,0,2,7,0": {"block_size_x": 2, "block_size_y": 32, "filter_height": 15, "filter_width": 15, "read_only": 0, "tile_size_x": 2, "tile_size_y": 7, "use_padding": 0, "time": 4.445203256607056, "times": [4.454400062561035, 4.442111968994141, 4.460544109344482, 4.444159984588623, 4.440063953399658, 4.443327903747559, 4.439040184020996, 4.4410881996154785, 4.445184230804443, 4.442111968994141], "compile_time": 1811.0612869995748, "verification_time": 0, "benchmark_time": 45.03044899956876, "strategy_time": 0, "framework_time": 1.1799650010289042},
"2,32,15,15,0,2,7,1": {"block_size_x": 2, "block_size_y": 32, "filter_height": 15, "filter_width": 15, "read_only": 0, "tile_size_x": 2, "tile_size_y": 7, "use_padding": 1, "time": 4.696252822875977, "times": [4.706208229064941, 4.699071884155273, 4.696063995361328, 4.696063995361328, 4.694015979766846, 4.690944194793701, 4.694015979766846, 4.696063995361328, 4.700160026550293, 4.689919948577881], "compile_time": 1813.9275690000431, "verification_time": 0, "benchmark_time": 47.48226900028385, "strategy_time": 0, "framework_time": 1.2048619992128806},
"2,32,15,15,0,2,8,0": {"block_size_x": 2, "block_size_y": 32, "filter_height": 15, "filter_width": 15, "read_only": 0, "tile_size_x": 2, "tile_size_y": 8, "use_padding": 0, "time": 4.29933762550354, "times": [4.305920124053955, 4.295743942260742, 4.284287929534912, 4.29260778427124, 4.299776077270508, 4.294432163238525, 4.3079681396484375, 4.302847862243652, 4.3079681396484375, 4.30182409286499], "compile_time": 2048.667056999875, "verification_time": 0, "benchmark_time": 43.51280300033977, "strategy_time": 0, "framework_time": 1.2838669999837293},
"2,32,15,15,0,2,8,1": {"block_size_x": 2, "block_size_y": 32, "filter_height": 15, "filter_width": 15, "read_only": 0, "tile_size_x": 2, "tile_size_y": 8, "use_padding": 1, "time": 5.480998373031616, "times": [5.490752220153809, 5.485568046569824, 5.473055839538574, 5.46611213684082, 5.484543800354004, 5.479167938232422, 5.476352214813232, 5.484543800354004, 5.485343933105469, 5.484543800354004], "compile_time": 2058.2370379997883, "verification_time": 0, "benchmark_time": 55.360246000418556, "strategy_time": 0, "framework_time": 1.1863899999298155},
"2,32,15,15,0,3,1,0": {"block_size_x": 2, "block_size_y": 32, "filter_height": 15, "filter_width": 15, "read_only": 0, "tile_size_x": 3, "tile_size_y": 1, "use_padding": 0, "time": 3.622348761558533, "times": [3.630079984664917, 3.6218879222869873, 3.6218879222869873, 3.620863914489746, 3.620863914489746, 3.620863914489746, 3.62060809135437, 3.619839906692505, 3.621664047241211, 3.6249279975891113], "compile_time": 258.7686549995851, "verification_time": 0, "benchmark_time": 36.68669400030922, "strategy_time": 0, "framework_time": 1.6400349995819852},
"2,32,15,15,0,3,1,1": {"block_size_x": 2, "block_size_y": 32, "filter_height": 15, "filter_width": 15, "read_only": 0, "tile_size_x": 3, "tile_size_y": 1, "use_padding": 1, "time": 3.4192416191101076, "times": [3.427328109741211, 3.4211840629577637, 3.4211840629577637, 3.4191360473632812, 3.414016008377075, 3.4212799072265625, 3.4139199256896973, 3.420192003250122, 3.41811203956604, 3.4160640239715576], "compile_time": 257.1558729996468, "verification_time": 0, "benchmark_time": 34.612239000125555, "strategy_time": 0, "framework_time": 0.9388610005771625},
"2,32,15,15,0,3,2,0": {"block_size_x": 2, "block_size_y": 32, "filter_height": 15, "filter_width": 15, "read_only": 0, "tile_size_x": 3, "tile_size_y": 2, "use_padding": 0, "time": 3.591993546485901, "times": [3.597440004348755, 3.5983359813690186, 3.586047887802124, 3.588063955307007, 3.5911359786987305, 3.5880959033966064, 3.5891199111938477, 3.5932159423828125, 3.5932159423828125, 3.595263957977295], "compile_time": 502.23063500015996, "verification_time": 0, "benchmark_time": 36.25796799951786, "strategy_time": 0, "framework_time": 0.8765990005485946},
"2,32,15,15,0,3,2,1": {"block_size_x": 2, "block_size_y": 32, "filter_height": 15, "filter_width": 15, "read_only": 0, "tile_size_x": 3, "tile_size_y": 2, "use_padding": 1, "time": 3.3940927982330322, "times": [3.4036478996276855, 3.39849591255188, 3.3914880752563477, 3.397631883621216, 3.39353609085083, 3.39136004447937, 3.396512031555176, 3.387392044067383, 3.388416051864624, 3.3924479484558105], "compile_time": 504.68752500000846, "verification_time": 0, "benchmark_time": 34.40488100022776, "strategy_time": 0, "framework_time": 0.9417069995834026},
"2,32,15,15,0,3,3,0": {"block_size_x": 2, "block_size_y": 32, "filter_height": 15, "filter_width": 15, "read_only": 0, "tile_size_x": 3, "tile_size_y": 3, "use_padding": 0, "time": 3.479641652107239, "times": [3.487744092941284, 3.4805760383605957, 3.4795520305633545, 3.472320079803467, 3.4836480617523193, 3.472320079803467, 3.481600046157837, 3.4795520305633545, 3.477504014968872, 3.481600046157837], "compile_time": 776.364174000264, "verification_time": 0, "benchmark_time": 35.31094500067411, "strategy_time": 0, "framework_time": 0.9006179989228258},
"2,32,15,15,0,3,3,1": {"block_size_x": 2, "block_size_y": 32, "filter_height": 15, "filter_width": 15, "read_only": 0, "tile_size_x": 3, "tile_size_y": 3, "use_padding": 1, "time": 3.3530816316604612, "times": [3.357696056365967, 3.353600025177002, 3.349503993988037, 3.3525760173797607, 3.350464105606079, 3.353600025177002, 3.3505280017852783, 3.353600025177002, 3.3525760173797607, 3.3566720485687256], "compile_time": 776.6659930002788, "verification_time": 0, "benchmark_time": 33.95964399987861, "strategy_time": 0, "framework_time": 0.920054999369313},
"2,32,15,15,0,3,4,0": {"block_size_x": 2, "block_size_y": 32, "filter_height": 15, "filter_width": 15, "read_only": 0, "tile_size_x": 3, "tile_size_y": 4, "use_padding": 0, "time": 3.452726411819458, "times": [3.4610559940338135, 3.4541759490966797, 3.4539520740509033, 3.447808027267456, 3.4508800506591797, 3.452928066253662, 3.451904058456421, 3.4529919624328613, 3.4516799449920654, 3.449887990951538], "compile_time": 1085.1770839999517, "verification_time": 0, "benchmark_time": 34.97129199968185, "strategy_time": 0, "framework_time": 0.9239490000254591},
"2,32,15,15,0,3,4,1": {"block_size_x": 2, "block_size_y": 32, "filter_height": 15, "filter_width": 15, "read_only": 0, "tile_size_x": 3, "tile_size_y": 4, "use_padding": 1, "time": 3.3029248237609865, "times": [3.309567928314209, 3.3024001121520996, 3.3013761043548584, 3.304447889328003, 3.3044159412384033, 3.3024001121520996, 3.300352096557617, 3.3024001121520996, 3.3034238815307617, 3.298464059829712], "compile_time": 1073.1431650001468, "verification_time": 0, "benchmark_time": 33.439759999964735, "strategy_time": 0, "framework_time": 0.9321109992015408},
"2,32,15,15,0,3,5,0": {"block_size_x": 2, "block_size_y": 32, "filter_height": 15, "filter_width": 15, "read_only": 0, "tile_size_x": 3, "tile_size_y": 5, "use_padding": 0, "time": 3.5739168405532835, "times": [3.5776638984680176, 3.5769600868225098, 3.5676159858703613, 3.5778560638427734, 3.5737600326538086, 3.5746240615844727, 3.5685760974884033, 3.571712017059326, 3.5778560638427734, 3.5725440979003906], "compile_time": 1389.024617999894, "verification_time": 0, "benchmark_time": 36.21475599993573, "strategy_time": 0, "framework_time": 0.9156850001090788},
"2,32,15,15,0,3,5,1": {"block_size_x": 2, "block_size_y": 32, "filter_height": 15, "filter_width": 15, "read_only": 0, "tile_size_x": 3, "tile_size_y": 5, "use_padding": 1, "time": 3.814259171485901, "times": [3.8246400356292725, 3.8143999576568604, 3.8103039264678955, 3.809119939804077, 3.8113279342651367, 3.814176082611084, 3.8092799186706543, 3.808255910873413, 3.8205440044403076, 3.8205440044403076], "compile_time": 1379.8229429994535, "verification_time": 0, "benchmark_time": 38.66098500020598, "strategy_time": 0, "framework_time": 1.400221999574569},
"2,32,15,15,0,3,6,0": {"block_size_x": 2, "block_size_y": 32, "filter_height": 15, "filter_width": 15, "read_only": 0, "tile_size_x": 3, "tile_size_y": 6, "use_padding": 0, "time": 3.6674432277679445, "times": [3.680255889892578, 3.645440101623535, 3.6669440269470215, 3.670016050338745, 3.663872003555298, 3.6730880737304688, 3.66483211517334, 3.67411208152771, 3.6659200191497803, 3.669951915740967], "compile_time": 1668.2250860003478, "verification_time": 0, "benchmark_time": 37.14629100068123, "strategy_time": 0, "framework_time": 1.1238849983783439},
"2,32,15,15,0,3,6,1": {"block_size_x": 2, "block_size_y": 32, "filter_height": 15, "filter_width": 15, "read_only": 0, "tile_size_x": 3, "tile_size_y": 6, "use_padding": 1, "time": 4.196742391586303, "times": [4.220895767211914, 4.2045440673828125, 4.199423789978027, 4.200416088104248, 4.199423789978027, 4.186111927032471, 4.198400020599365, 4.172800064086914, 4.193280220031738, 4.1921281814575195], "compile_time": 1662.447565000548, "verification_time": 0, "benchmark_time": 42.43948899966199, "strategy_time": 0, "framework_time": 1.1270240001977072},
"2,32,15,15,0,3,7,0": {"block_size_x": 2, "block_size_y": 32, "filter_height": 15, "filter_width": 15, "read_only": 0, "tile_size_x": 3, "tile_size_y": 7, "use_padding": 0, "time": 3.7236607551574705, "times": [3.728384017944336, 3.734528064727783, 3.719167947769165, 3.7171199321746826, 3.738431930541992, 3.7150719165802, 3.7160959243774414, 3.7201919555664062, 3.7222399711608887, 3.7253758907318115], "compile_time": 2086.7185150000296, "verification_time": 0, "benchmark_time": 37.67547099960211, "strategy_time": 0, "framework_time": 1.3245310010461253},
"2,32,15,15,0,3,7,1": {"block_size_x": 2, "block_size_y": 32, "filter_height": 15, "filter_width": 15, "read_only": 0, "tile_size_x": 3, "tile_size_y": 7, "use_padding": 1, "time": 4.243769645690918, "times": [4.265984058380127, 4.233312129974365, 4.236288070678711, 4.247551918029785, 4.25267219543457, 4.2485761642456055, 4.243648052215576, 4.235040187835693, 4.233215808868408, 4.241407871246338], "compile_time": 2080.0105670004996, "verification_time": 0, "benchmark_time": 42.955412000083015, "strategy_time": 0, "framework_time": 1.1371619993951754},
"2,32,15,15,0,3,8,0": {"block_size_x": 2, "block_size_y": 32, "filter_height": 15, "filter_width": 15, "read_only": 0, "tile_size_x": 3, "tile_size_y": 8, "use_padding": 0, "time": 3.544009637832642, "times": [3.551232099533081, 3.5430400371551514, 3.540992021560669, 3.551424026489258, 3.54201602935791, 3.5440640449523926, 3.5421760082244873, 3.545088052749634, 3.5400960445404053, 3.5399680137634277], "compile_time": 549.2280859998573, "verification_time": 0, "benchmark_time": 36.024398999870755, "strategy_time": 0, "framework_time": 1.3795220002066344},
"2,32,15,15,0,3,8,1": {"block_size_x": 2, "block_size_y": 32, "filter_height": 15, "filter_width": 15, "read_only": 0, "tile_size_x": 3, "tile_size_y": 8, "use_padding": 1, "time": 4.938012790679932, "times": [4.945919990539551, 4.937727928161621, 4.936704158782959, 4.937727928161621, 4.935679912567139, 4.932608127593994, 4.9397759437561035, 4.935647964477539, 4.9385600090026855, 4.9397759437561035], "compile_time": 549.2625729993961, "verification_time": 0, "benchmark_time": 49.92326200044772, "strategy_time": 0, "framework_time": 1.1467180002000532},
"2,32,15,15,0,4,1,0": {"block_size_x": 2, "block_size_y": 32, "filter_height": 15, "filter_width": 15, "read_only": 0, "tile_size_x": 4, "tile_size_y": 1, "use_padding": 0, "time": 2.8468095541000364, "times": [2.8548479080200195, 2.8528640270233154, 2.848639965057373, 2.8436479568481445, 2.846719980239868, 2.841599941253662, 2.8426239490509033, 2.8478078842163086, 2.8426239490509033, 2.846719980239868], "compile_time": 285.7852949991866, "verification_time": 0, "benchmark_time": 28.827705000367132, "strategy_time": 0, "framework_time": 1.7789090006772312},
"2,32,15,15,0,4,1,1": {"block_size_x": 2, "block_size_y": 32, "filter_height": 15, "filter_width": 15, "read_only": 0, "tile_size_x": 4, "tile_size_y": 1, "use_padding": 1, "time": 2.813273572921753, "times": [2.824160099029541, 2.8129279613494873, 2.8147199153900146, 2.810879945755005, 2.81062388420105, 2.8128321170806885, 2.8129279613494873, 2.810879945755005, 2.810879945755005, 2.811903953552246], "compile_time": 292.87590500007354, "verification_time": 0, "benchmark_time": 28.608706000341044, "strategy_time": 0, "framework_time": 0.8304819994009449},
"2,32,15,15,0,4,2,0": {"block_size_x": 2, "block_size_y": 32, "filter_height": 15, "filter_width": 15, "read_only": 0, "tile_size_x": 4, "tile_size_y": 2, "use_padding": 0, "time": 2.818934416770935, "times": [2.8263680934906006, 2.82096004486084, 2.821120023727417, 2.8149759769439697, 2.820064067840576, 2.817023992538452, 2.815840005874634, 2.8180480003356934, 2.817023992538452, 2.817919969558716], "compile_time": 562.9094890000488, "verification_time": 0, "benchmark_time": 28.648288000113098, "strategy_time": 0, "framework_time": 0.8188069996322156},
"2,32,15,15,0,4,2,1": {"block_size_x": 2, "block_size_y": 32, "filter_height": 15, "filter_width": 15, "read_only": 0, "tile_size_x": 4, "tile_size_y": 2, "use_padding": 1, "time": 2.751855969429016, "times": [2.7564480304718018, 2.751487970352173, 2.748415946960449, 2.750335931777954, 2.752511978149414, 2.750335931777954, 2.7535359859466553, 2.7494399547576904, 2.751487970352173, 2.7545599937438965], "compile_time": 571.1227249994408, "verification_time": 0, "benchmark_time": 27.9985619999934, "strategy_time": 0, "framework_time": 0.8738910000829492},
"2,32,15,15,0,4,3,0": {"block_size_x": 2, "block_size_y": 32, "filter_height": 15, "filter_width": 15, "read_only": 0, "tile_size_x": 4, "tile_size_y": 3, "use_padding": 0, "time": 2.895964813232422, "times": [2.9030399322509766, 2.8938241004943848, 2.8876800537109375, 2.890752077102661, 2.8968958854675293, 2.8917760848999023, 2.9081599712371826, 2.8937599658966064, 2.895872116088867, 2.897887945175171], "compile_time": 877.6864550000028, "verification_time": 0, "benchmark_time": 29.398643999229535, "strategy_time": 0, "framework_time": 1.178315001197916},
"2,32,15,15,0,4,3,1": {"block_size_x": 2, "block_size_y": 32, "filter_height": 15, "filter_width": 15, "read_only": 0, "tile_size_x": 4, "tile_size_y": 3, "use_padding": 1, "time": 2.9525856018066405, "times": [2.9614078998565674, 2.960383892059326, 2.949120044708252, 2.9542720317840576, 2.9511680603027344, 2.9430079460144043, 2.9511680603027344, 2.958336114883423, 2.9460160732269287, 2.9509758949279785], "compile_time": 879.8389889998361, "verification_time": 0, "benchmark_time": 29.9116080004751, "strategy_time": 0, "framework_time": 0.8937319998949533},
"2,32,15,15,0,4,4,0": {"block_size_x": 2, "block_size_y": 32, "filter_height": 15, "filter_width": 15, "read_only": 0, "tile_size_x": 4, "tile_size_y": 4, "use_padding": 0, "time": 2.800832009315491, "times": [2.8088319301605225, 2.7901759147644043, 2.7791359424591064, 2.796544075012207, 2.7893760204315186, 2.80185604095459, 2.7944960594177246, 2.810784101486206, 2.810879945755005, 2.826240062713623], "compile_time": 1212.6245540002856, "verification_time": 0, "benchmark_time": 28.39720900010434, "strategy_time": 0, "framework_time": 0.9100899997065426},
"2,32,15,15,0,4,4,1": {"block_size_x": 2, "block_size_y": 32, "filter_height": 15, "filter_width": 15, "read_only": 0, "tile_size_x": 4, "tile_size_y": 4, "use_padding": 1, "time": 2.967955136299133, "times": [3.0054399967193604, 2.964479923248291, 2.9665279388427734, 2.9614078998565674, 2.96345591545105, 2.9655039310455322, 2.96345591545105, 2.9655039310455322, 2.9623680114746094, 2.9614078998565674], "compile_time": 1215.432951999901, "verification_time": 0, "benchmark_time": 30.101635999926657, "strategy_time": 0, "framework_time": 0.869475999934366},
"2,32,15,15,0,4,5,0": {"block_size_x": 2, "block_size_y": 32, "filter_height": 15, "filter_width": 15, "read_only": 0, "tile_size_x": 4, "tile_size_y": 5, "use_padding": 0, "time": 2.8356192111968994, "times": [2.8293120861053467, 2.825216054916382, 2.826047897338867, 2.822144031524658, 2.8168320655822754, 2.81494402885437, 2.817023992538452, 2.835455894470215, 2.880511999130249, 2.8887040615081787], "compile_time": 1539.294635999795, "verification_time": 0, "benchmark_time": 28.725205000228016, "strategy_time": 0, "framework_time": 0.9483490002821782},
"2,32,15,15,0,4,5,1": {"block_size_x": 2, "block_size_y": 32, "filter_height": 15, "filter_width": 15, "read_only": 0, "tile_size_x": 4, "tile_size_y": 5, "use_padding": 1, "time": 3.178326439857483, "times": [3.199104070663452, 3.1784958839416504, 3.172384023666382, 3.1774721145629883, 3.175424098968506, 3.176448106765747, 3.1795198917388916, 3.175424098968506, 3.171328067779541, 3.177664041519165], "compile_time": 1536.3462589994015, "verification_time": 0, "benchmark_time": 32.34885900019435, "strategy_time": 0, "framework_time": 1.2698290001935675},
"2,32,15,15,0,4,6,0": {"block_size_x": 2, "block_size_y": 32, "filter_height": 15, "filter_width": 15, "read_only": 0, "tile_size_x": 4, "tile_size_y": 6, "use_padding": 0, "time": 2.8371359586715696, "times": [2.8477439880371094, 2.8375039100646973, 2.835263967514038, 2.836479902267456, 2.831360101699829, 2.8342080116271973, 2.8344318866729736, 2.8395519256591797, 2.8383359909057617, 2.836479902267456], "compile_time": 478.6817249996602, "verification_time": 0, "benchmark_time": 28.75608900012594, "strategy_time": 0, "framework_time": 1.4975829999457346},
"2,32,15,15,0,4,6,1": {"block_size_x": 2, "block_size_y": 32, "filter_height": 15, "filter_width": 15, "read_only": 0, "tile_size_x": 4, "tile_size_y": 6, "use_padding": 1, "time": 3.3821215867996215, "times": [3.3904640674591064, 3.383296012878418, 3.3783679008483887, 3.3811519145965576, 3.378175973892212, 3.383136034011841, 3.378943920135498, 3.379199981689453, 3.383136034011841, 3.3853440284729004], "compile_time": 484.04195200055256, "verification_time": 0, "benchmark_time": 34.26532600042265, "strategy_time": 0, "framework_time": 0.9763749985722825},
"2,32,15,15,0,4,7,0": {"block_size_x": 2, "block_size_y": 32, "filter_height": 15, "filter_width": 15, "read_only": 0, "tile_size_x": 4, "tile_size_y": 7, "use_padding": 0, "time": 3.028015971183777, "times": [3.037184000015259, 3.0329599380493164, 3.0298240184783936, 3.0248959064483643, 3.0208001136779785, 3.02675199508667, 3.0269439220428467, 3.022847890853882, 3.0279359817504883, 3.0300159454345703], "compile_time": 578.2683480001651, "verification_time": 0, "benchmark_time": 30.70923999985098, "strategy_time": 0, "framework_time": 1.6380849992856383},
"2,32,15,15,0,4,7,1": {"block_size_x": 2, "block_size_y": 32, "filter_height": 15, "filter_width": 15, "read_only": 0, "tile_size_x": 4, "tile_size_y": 7, "use_padding": 1, "time": 3.3908384084701537, "times": [3.4047999382019043, 3.3996798992156982, 3.3945600986480713, 3.379199981689453, 3.39353609085083, 3.3963520526885986, 3.383296012878418, 3.379199981689453, 3.38319993019104, 3.3945600986480713], "compile_time": 577.7168760005225, "verification_time": 0, "benchmark_time": 34.427063000293856, "strategy_time": 0, "framework_time": 1.492609999331762},
"2,32,15,15,0,5,1,0": {"block_size_x": 2, "block_size_y": 32, "filter_height": 15, "filter_width": 15, "read_only": 0, "tile_size_x": 5, "tile_size_y": 1, "use_padding": 0, "time": 4.518252754211426, "times": [4.5240960121154785, 4.516863822937012, 4.51584005355835, 4.51584005355835, 4.517055988311768, 4.516863822937012, 4.517888069152832, 4.517888069152832, 4.520127773284912, 4.520063877105713], "compile_time": 332.9521859996021, "verification_time": 0, "benchmark_time": 45.68260699943494, "strategy_time": 0, "framework_time": 1.7083960010495503},
"2,32,15,15,0,5,1,1": {"block_size_x": 2, "block_size_y": 32, "filter_height": 15, "filter_width": 15, "read_only": 0, "tile_size_x": 5, "tile_size_y": 1, "use_padding": 1, "time": 2.327408027648926, "times": [2.3357439041137695, 2.3244800567626953, 2.327552080154419, 2.3275198936462402, 2.3265280723571777, 2.329440116882324, 2.322432041168213, 2.327552080154419, 2.3244800567626953, 2.3283519744873047], "compile_time": 325.2287100003741, "verification_time": 0, "benchmark_time": 23.800128999937442, "strategy_time": 0, "framework_time": 2.3663169995415956},
"2,32,15,15,0,5,2,0": {"block_size_x": 2, "block_size_y": 32, "filter_height": 15, "filter_width": 15, "read_only": 0, "tile_size_x": 5, "tile_size_y": 2, "use_padding": 0, "time": 4.428108835220337, "times": [4.434944152832031, 4.427775859832764, 4.426752090454102, 4.425727844238281, 4.424704074859619, 4.426976203918457, 4.4268479347229, 4.427775859832764, 4.428736209869385, 4.430848121643066], "compile_time": 640.9248479994858, "verification_time": 0, "benchmark_time": 44.794624999667576, "strategy_time": 0, "framework_time": 0.8935200012274436},
"2,32,15,15,0,5,2,1": {"block_size_x": 2, "block_size_y": 32, "filter_height": 15, "filter_width": 15, "read_only": 0, "tile_size_x": 5, "tile_size_y": 2, "use_padding": 1, "time": 2.45075843334198, "times": [2.4584639072418213, 2.451456069946289, 2.4505600929260254, 2.4523520469665527, 2.4483840465545654, 2.449631929397583, 2.4483840465545654, 2.4494080543518066, 2.449536085128784, 2.4494080543518066], "compile_time": 634.447641999941, "verification_time": 0, "benchmark_time": 24.968146999526653, "strategy_time": 0, "framework_time": 2.3287260009965394},
"2,32,15,15,0,5,3,0": {"block_size_x": 2, "block_size_y": 32, "filter_height": 15, "filter_width": 15, "read_only": 0, "tile_size_x": 5, "tile_size_y": 3, "use_padding": 0, "time": 4.435865640640259, "times": [4.445184230804443, 4.434944152832031, 4.433919906616211, 4.432896137237549, 4.432896137237549, 4.434944152832031, 4.433919906616211, 4.435967922210693, 4.435967922210693, 4.438015937805176], "compile_time": 989.4695870007126, "verification_time": 0, "benchmark_time": 44.91612600031658, "strategy_time": 0, "framework_time": 0.9757209982126369},
"2,32,15,15,0,5,3,1": {"block_size_x": 2, "block_size_y": 32, "filter_height": 15, "filter_width": 15, "read_only": 0, "tile_size_x": 5, "tile_size_y": 3, "use_padding": 1, "time": 2.497705578804016, "times": [2.5118720531463623, 2.496511936187744, 2.495487928390503, 2.497312068939209, 2.495487928390503, 2.4944639205932617, 2.497312068939209, 2.4945600032806396, 2.4995839595794678, 2.4944639205932617], "compile_time": 985.6636630001958, "verification_time": 0, "benchmark_time": 25.34555799957161, "strategy_time": 0, "framework_time": 2.293671000188624},
"2,32,15,15,0,5,4,0": {"block_size_x": 2, "block_size_y": 32, "filter_height": 15, "filter_width": 15, "read_only": 0, "tile_size_x": 5, "tile_size_y": 4, "use_padding": 0, "time": 4.393855953216553, "times": [4.413440227508545, 4.3919358253479, 4.390751838684082, 4.391871929168701, 4.390912055969238, 4.389887809753418, 4.391871929168701, 4.3919358253479, 4.39299201965332, 4.392960071563721], "compile_time": 1374.6002949992544, "verification_time": 0, "benchmark_time": 44.47496600005252, "strategy_time": 0, "framework_time": 0.9513270006209495},
"2,32,15,15,0,5,4,1": {"block_size_x": 2, "block_size_y": 32, "filter_height": 15, "filter_width": 15, "read_only": 0, "tile_size_x": 5, "tile_size_y": 4, "use_padding": 1, "time": 2.6169440269470217, "times": [2.62556791305542, 2.618527889251709, 2.614176034927368, 2.614272117614746, 2.619391918182373, 2.614272117614746, 2.6122241020202637, 2.6112000942230225, 2.613248109817505, 2.6265599727630615], "compile_time": 1391.2262499998178, "verification_time": 0, "benchmark_time": 26.566103999357438, "strategy_time": 0, "framework_time": 1.8595160008771927},
"2,32,15,15,0,5,5,0": {"block_size_x": 2, "block_size_y": 32, "filter_height": 15, "filter_width": 15, "read_only": 0, "tile_size_x": 5, "tile_size_y": 5, "use_padding": 0, "time": 4.454988813400268, "times": [4.4615678787231445, 4.455423831939697, 4.454400062561035, 4.453375816345215, 4.452544212341309, 4.45414400100708, 4.453184127807617, 4.454400062561035, 4.454400062561035, 4.456448078155518], "compile_time": 461.66138399985357, "verification_time": 0, "benchmark_time": 44.976983000196924, "strategy_time": 0, "framework_time": 1.264753999748791},
"2,32,15,15,0,5,5,1": {"block_size_x": 2, "block_size_y": 32, "filter_height": 15, "filter_width": 15, "read_only": 0, "tile_size_x": 5, "tile_size_y": 5, "use_padding": 1, "time": 2.486499238014221, "times": [2.4924159049987793, 2.4893438816070557, 2.4872961044311523, 2.4821760654449463, 2.4832000732421875, 2.4872961044311523, 2.4875199794769287, 2.486272096633911, 2.4842240810394287, 2.48524808883667], "compile_time": 462.36005799983104, "verification_time": 0, "benchmark_time": 25.333268999929714, "strategy_time": 0, "framework_time": 1.8997840006704791},
"2,32,15,15,0,6,1,0": {"block_size_x": 2, "block_size_y": 32, "filter_height": 15, "filter_width": 15, "read_only": 0, "tile_size_x": 6, "tile_size_y": 1, "use_padding": 0, "time": 2.1809439420700074, "times": [2.1870079040527344, 2.1840639114379883, 2.1790719032287598, 2.1821439266204834, 2.181119918823242, 2.180095911026001, 2.1790719032287598, 2.1789441108703613, 2.1770238876342773, 2.180896043777466], "compile_time": 357.9610529995989, "verification_time": 0, "benchmark_time": 22.214678999262105, "strategy_time": 0, "framework_time": 0.8753760012041312},
"2,32,15,15,0,6,1,1": {"block_size_x": 2, "block_size_y": 32, "filter_height": 15, "filter_width": 15, "read_only": 0, "tile_size_x": 6, "tile_size_y": 1, "use_padding": 1, "time": 2.178118419647217, "times": [2.190335988998413, 2.1770238876342773, 2.1760001182556152, 2.173952102661133, 2.180095911026001, 2.1780478954315186, 2.1760001182556152, 2.17792010307312, 2.1768319606781006, 2.174976110458374], "compile_time": 357.8474060004737, "verification_time": 0, "benchmark_time": 22.22330999939004, "strategy_time": 0, "framework_time": 0.8233960006691632},
"2,32,15,15,0,6,2,0": {"block_size_x": 2, "block_size_y": 32, "filter_height": 15, "filter_width": 15, "read_only": 0, "tile_size_x": 6, "tile_size_y": 2, "use_padding": 0, "time": 2.14958713054657, "times": [2.16377592086792, 2.1493759155273438, 2.1534719467163086, 2.146143913269043, 2.1464641094207764, 2.14630389213562, 2.145279884338379, 2.150399923324585, 2.14630389213562, 2.1483519077301025], "compile_time": 700.6187609995322, "verification_time": 0, "benchmark_time": 21.888436999688565, "strategy_time": 0, "framework_time": 0.8270200014521834},
"2,32,15,15,0,6,2,1": {"block_size_x": 2, "block_size_y": 32, "filter_height": 15, "filter_width": 15, "read_only": 0, "tile_size_x": 6, "tile_size_y": 2, "use_padding": 1, "time": 2.1624672174453736, "times": [2.1667840480804443, 2.1626880168914795, 2.189311981201172, 2.1604480743408203, 2.1533119678497314, 2.1585919857025146, 2.1616640090942383, 2.1526401042938232, 2.165760040283203, 2.1534719467163086], "compile_time": 702.5423120003325, "verification_time": 0, "benchmark_time": 22.021284000402375, "strategy_time": 0, "framework_time": 0.8493959994666511},
"2,32,15,15,0,6,3,0": {"block_size_x": 2, "block_size_y": 32, "filter_height": 15, "filter_width": 15, "read_only": 0, "tile_size_x": 6, "tile_size_y": 3, "use_padding": 0, "time": 2.4213216066360475, "times": [2.4002559185028076, 2.3961598873138428, 2.3941121101379395, 2.3848960399627686, 2.3941121101379395, 2.3900160789489746, 2.394047975540161, 2.492192029953003, 2.490367889404297, 2.4770560264587402], "compile_time": 1092.064616999778, "verification_time": 0, "benchmark_time": 24.639319999550935, "strategy_time": 0, "framework_time": 0.8878190010364051},
"2,32,15,15,0,6,3,1": {"block_size_x": 2, "block_size_y": 32, "filter_height": 15, "filter_width": 15, "read_only": 0, "tile_size_x": 6, "tile_size_y": 3, "use_padding": 1, "time": 2.339027166366577, "times": [2.348031997680664, 2.3419198989868164, 2.343935966491699, 2.333695888519287, 2.331648111343384, 2.3431038856506348, 2.3398399353027344, 2.342848062515259, 2.3162879943847656, 2.3489599227905273], "compile_time": 1084.2110830008096, "verification_time": 0, "benchmark_time": 23.87756200005242, "strategy_time": 0, "framework_time": 1.2772689988196362},
"2,32,15,15,0,6,4,0": {"block_size_x": 2, "block_size_y": 32, "filter_height": 15, "filter_width": 15, "read_only": 0, "tile_size_x": 6, "tile_size_y": 4, "use_padding": 0, "time": 2.170140838623047, "times": [2.184191942214966, 2.173952102661133, 2.1717441082000732, 2.170880079269409, 2.1667840480804443, 2.165695905685425, 2.164736032485962, 2.1719040870666504, 2.165760040283203, 2.165760040283203], "compile_time": 418.0342190002193, "verification_time": 0, "benchmark_time": 22.18615800029511, "strategy_time": 0, "framework_time": 0.8859250001478358},
"2,32,15,15,0,6,4,1": {"block_size_x": 2, "block_size_y": 32, "filter_height": 15, "filter_width": 15, "read_only": 0, "tile_size_x": 6, "tile_size_y": 4, "use_padding": 1, "time": 2.205785608291626, "times": [2.214911937713623, 2.203552007675171, 2.204511880874634, 2.2026240825653076, 2.2056961059570312, 2.2047998905181885, 2.2056961059570312, 2.2077438831329346, 2.2056961059570312, 2.2026240825653076], "compile_time": 417.7623810001023, "verification_time": 0, "benchmark_time": 22.42805900004896, "strategy_time": 0, "framework_time": 0.8631079999759095},
"2,32,15,15,0,7,1,0": {"block_size_x": 2, "block_size_y": 32, "filter_height": 15, "filter_width": 15, "read_only": 0, "tile_size_x": 7, "tile_size_y": 1, "use_padding": 0, "time": 2.2251327991485597, "times": [2.2332799434661865, 2.225152015686035, 2.2251200675964355, 2.224128007888794, 2.2251200675964355, 2.2220799922943115, 2.2231040000915527, 2.224128007888794, 2.225087881088257, 2.224128007888794], "compile_time": 390.2336199998899, "verification_time": 0, "benchmark_time": 22.792388999732793, "strategy_time": 0, "framework_time": 0.8910860005926224},
"2,32,15,15,0,7,1,1": {"block_size_x": 2, "block_size_y": 32, "filter_height": 15, "filter_width": 15, "read_only": 0, "tile_size_x": 7, "tile_size_y": 1, "use_padding": 1, "time": 2.0110400199890135, "times": [2.0193920135498047, 2.0103039741516113, 2.0069758892059326, 2.0110080242156982, 2.008064031600952, 2.011136054992676, 2.008064031600952, 2.012160062789917, 2.011136054992676, 2.012160062789917], "compile_time": 397.6222670007701, "verification_time": 0, "benchmark_time": 20.65722800034564, "strategy_time": 0, "framework_time": 0.9034539989443147},
"2,32,15,15,0,7,2,0": {"block_size_x": 2, "block_size_y": 32, "filter_height": 15, "filter_width": 15, "read_only": 0, "tile_size_x": 7, "tile_size_y": 2, "use_padding": 0, "time": 2.2176831722259522, "times": [2.219007968902588, 2.2220799922943115, 2.2179839611053467, 2.2116799354553223, 2.220031976699829, 2.2261760234832764, 2.213887929916382, 2.214911937713623, 2.217184066772461, 2.213887929916382], "compile_time": 778.0042249996768, "verification_time": 0, "benchmark_time": 22.57850700061681, "strategy_time": 0, "framework_time": 1.1288819996480015},
"2,32,15,15,0,7,2,1": {"block_size_x": 2, "block_size_y": 32, "filter_height": 15, "filter_width": 15, "read_only": 0, "tile_size_x": 7, "tile_size_y": 2, "use_padding": 1, "time": 2.093868780136108, "times": [2.1073920726776123, 2.0940799713134766, 2.0889599323272705, 2.094048023223877, 2.0930559635162354, 2.0909759998321533, 2.0889599323272705, 2.0992000102996826, 2.0930559635162354, 2.0889599323272705], "compile_time": 780.9425779996673, "verification_time": 0, "benchmark_time": 21.249585999612464, "strategy_time": 0, "framework_time": 0.9244010007023462},
"2,32,15,15,0,7,3,0": {"block_size_x": 2, "block_size_y": 32, "filter_height": 15, "filter_width": 15, "read_only": 0, "tile_size_x": 7, "tile_size_y": 3, "use_padding": 0, "time": 2.4070528030395506, "times": [2.384704113006592, 2.3736319541931152, 2.3756799697875977, 2.3746559619903564, 2.3695359230041504, 2.372607946395874, 2.456576108932495, 2.462496042251587, 2.4535040855407715, 2.4471359252929688], "compile_time": 1226.2126460000218, "verification_time": 0, "benchmark_time": 24.433163999674434, "strategy_time": 0, "framework_time": 0.9110490000239224},
"2,32,15,15,0,7,3,1": {"block_size_x": 2, "block_size_y": 32, "filter_height": 15, "filter_width": 15, "read_only": 0, "tile_size_x": 7, "tile_size_y": 3, "use_padding": 1, "time": 2.2725631952285767, "times": [2.287616014480591, 2.273279905319214, 2.274303913116455, 2.2753279209136963, 2.2650880813598633, 2.269184112548828, 2.2763519287109375, 2.2712318897247314, 2.269184112548828, 2.264064073562622], "compile_time": 1223.615638999945, "verification_time": 0, "benchmark_time": 23.139670000091428, "strategy_time": 0, "framework_time": 0.9415009999429458},
"2,32,15,15,0,7,4,0": {"block_size_x": 2, "block_size_y": 32, "filter_height": 15, "filter_width": 15, "read_only": 0, "tile_size_x": 7, "tile_size_y": 4, "use_padding": 0, "time": 2.2046240091323854, "times": [2.2118399143218994, 2.2055039405822754, 2.2067201137542725, 2.2044479846954346, 2.2016000747680664, 2.2025599479675293, 2.208767890930176, 2.200576066970825, 2.2056961059570312, 2.1985280513763428], "compile_time": 477.09311099970364, "verification_time": 0, "benchmark_time": 22.39237800040428, "strategy_time": 0, "framework_time": 0.9338449999631848},
"2,32,15,15,0,7,4,1": {"block_size_x": 2, "block_size_y": 32, "filter_height": 15, "filter_width": 15, "read_only": 0, "tile_size_x": 7, "tile_size_y": 4, "use_padding": 1, "time": 2.1235455751419066, "times": [2.1309120655059814, 2.126847982406616, 2.12060809135437, 2.1227519512176514, 2.120703935623169, 2.12172794342041, 2.122623920440674, 2.126847982406616, 2.1196799278259277, 2.1227519512176514], "compile_time": 475.96070500003407, "verification_time": 0, "benchmark_time": 21.704366000449227, "strategy_time": 0, "framework_time": 0.9545859993522754},
"2,32,15,15,0,8,1,0": {"block_size_x": 2, "block_size_y": 32, "filter_height": 15, "filter_width": 15, "read_only": 0, "tile_size_x": 8, "tile_size_y": 1, "use_padding": 0, "time": 1.8544384241104126, "times": [1.8635200262069702, 1.855455994606018, 1.8524160385131836, 1.854464054107666, 1.854464054107666, 1.8523520231246948, 1.8534400463104248, 1.8524160385131836, 1.8565119504928589, 1.84934401512146], "compile_time": 416.9446070000049, "verification_time": 0, "benchmark_time": 19.050605000302312, "strategy_time": 0, "framework_time": 0.932752000153414},
"2,32,15,15,0,8,1,1": {"block_size_x": 2, "block_size_y": 32, "filter_height": 15, "filter_width": 15, "read_only": 0, "tile_size_x": 8, "tile_size_y": 1, "use_padding": 1, "time": 1.8597471714019775, "times": [1.869663953781128, 1.8606079816818237, 1.8585599660873413, 1.8585599660873413, 1.8585599660873413, 1.8585599660873413, 1.8585599660873413, 1.8565119504928589, 1.8583040237426758, 1.8595839738845825], "compile_time": 424.4475710002007, "verification_time": 0, "benchmark_time": 19.088281999756873, "strategy_time": 0, "framework_time": 0.951236000219069},
"2,32,15,15,0,8,2,0": {"block_size_x": 2, "block_size_y": 32, "filter_height": 15, "filter_width": 15, "read_only": 0, "tile_size_x": 8, "tile_size_y": 2, "use_padding": 0, "time": 1.911295998096466, "times": [1.9240959882736206, 1.9118080139160156, 1.908735990524292, 1.9097599983215332, 1.9118080139160156, 1.9097599983215332, 1.9107840061187744, 1.908735990524292, 1.908735990524292, 1.908735990524292], "compile_time": 853.8961749991358, "verification_time": 0, "benchmark_time": 19.6070640004109, "strategy_time": 0, "framework_time": 1.1069689999203547},
"2,32,15,15,0,8,2,1": {"block_size_x": 2, "block_size_y": 32, "filter_height": 15, "filter_width": 15, "read_only": 0, "tile_size_x": 8, "tile_size_y": 2, "use_padding": 1, "time": 1.9947551965713501, "times": [2.0142080783843994, 1.9967999458312988, 1.9907519817352295, 1.98745596408844, 1.9865599870681763, 1.985535979270935, 2.0101120471954346, 1.99891197681427, 1.9834879636764526, 1.9937280416488647], "compile_time": 864.1352760005248, "verification_time": 0, "benchmark_time": 20.281552000597003, "strategy_time": 0, "framework_time": 0.9658819990363554},
"2,32,15,15,0,8,3,0": {"block_size_x": 2, "block_size_y": 32, "filter_height": 15, "filter_width": 15, "read_only": 0, "tile_size_x": 8, "tile_size_y": 3, "use_padding": 0, "time": 1.9806944012641907, "times": [1.9927040338516235, 1.9834879636764526, 1.975167989730835, 1.9804160594940186, 1.9802559614181519, 1.9763200283050537, 1.9845119714736938, 1.9763200283050537, 1.9814399480819702, 1.9763200283050537], "compile_time": 395.35194499967474, "verification_time": 0, "benchmark_time": 20.218745000420313, "strategy_time": 0, "framework_time": 1.2120619994675508},
"2,32,15,15,0,8,3,1": {"block_size_x": 2, "block_size_y": 32, "filter_height": 15, "filter_width": 15, "read_only": 0, "tile_size_x": 8, "tile_size_y": 3, "use_padding": 1, "time": 1.9858304023742677, "times": [1.988576054573059, 1.9865599870681763, 1.985535979270935, 1.9804160594940186, 1.9834879636764526, 1.9916800260543823, 1.9906560182571411, 1.9865599870681763, 1.9814399480819702, 1.9833920001983643], "compile_time": 395.3938089998701, "verification_time": 0, "benchmark_time": 20.267214000341482, "strategy_time": 0, "framework_time": 0.965534999522788},
"2,32,15,15,1,1,1,0": {"block_size_x": 2, "block_size_y": 32, "filter_height": 15, "filter_width": 15, "read_only": 1, "tile_size_x": 1, "tile_size_y": 1, "use_padding": 0, "time": 25.864975929260254, "times": [26.840063095092773, 26.845184326171875, 26.843135833740234, 26.84601593017578, 26.840991973876953, 26.84000015258789, 26.850303649902344, 26.835968017578125, 24.293376922607422, 19.61471939086914], "compile_time": 198.77827300024364, "verification_time": 0, "benchmark_time": 259.4334699997489, "strategy_time": 0, "framework_time": 1.136242000029597},
"2,32,15,15,1,1,1,1": {"block_size_x": 2, "block_size_y": 32, "filter_height": 15, "filter_width": 15, "read_only": 1, "tile_size_x": 1, "tile_size_y": 1, "use_padding": 1, "time": 6.084467172622681, "times": [5.5214080810546875, 5.548031806945801, 5.5305280685424805, 5.517312049865723, 5.985055923461914, 6.482751846313477, 6.484992027282715, 6.53926420211792, 6.617023944854736, 6.6183037757873535], "compile_time": 197.84911399983685, "verification_time": 0, "benchmark_time": 61.41702599961718, "strategy_time": 0, "framework_time": 4.10918300076446},
"2,32,15,15,1,1,2,0": {"block_size_x": 2, "block_size_y": 32, "filter_height": 15, "filter_width": 15, "read_only": 1, "tile_size_x": 1, "tile_size_y": 2, "use_padding": 0, "time": 19.60506229400635, "times": [19.609600067138672, 19.60223960876465, 19.600351333618164, 19.604480743408203, 19.604480743408203, 19.60745620727539, 19.604480743408203, 19.60652732849121, 19.60550308227539, 19.60550308227539], "compile_time": 338.43403400078387, "verification_time": 0, "benchmark_time": 196.70182899972133, "strategy_time": 0, "framework_time": 3.9636129986320157},
"2,32,15,15,1,1,2,1": {"block_size_x": 2, "block_size_y": 32, "filter_height": 15, "filter_width": 15, "read_only": 1, "tile_size_x": 1, "tile_size_y": 2, "use_padding": 1, "time": 5.824364757537841, "times": [5.375135898590088, 5.399551868438721, 5.385183811187744, 5.390336036682129, 5.7967681884765625, 5.97379207611084, 5.9719038009643555, 6.155263900756836, 6.397759914398193, 6.397952079772949], "compile_time": 337.582934999773, "verification_time": 0, "benchmark_time": 58.83540299964807, "strategy_time": 0, "framework_time": 4.024825000669807},
"2,32,15,15,1,1,3,0": {"block_size_x": 2, "block_size_y": 32, "filter_height": 15, "filter_width": 15, "read_only": 1, "tile_size_x": 1, "tile_size_y": 3, "use_padding": 0, "time": 19.479136085510255, "times": [19.486400604248047, 19.471359252929688, 19.469280242919922, 19.47443199157715, 19.47750473022461, 19.480575561523438, 19.4836483001709, 19.477760314941406, 19.48467254638672, 19.485727310180664], "compile_time": 555.0564020004458, "verification_time": 0, "benchmark_time": 195.42762199944264, "strategy_time": 0, "framework_time": 3.470231000392232},
"2,32,15,15,1,1,3,1": {"block_size_x": 2, "block_size_y": 32, "filter_height": 15, "filter_width": 15, "read_only": 1, "tile_size_x": 1, "tile_size_y": 3, "use_padding": 1, "time": 5.61375675201416, "times": [5.171199798583984, 5.18943977355957, 5.177343845367432, 5.184512138366699, 5.182464122772217, 5.258272171020508, 6.234111785888672, 6.235136032104492, 6.235136032104492, 6.269951820373535], "compile_time": 554.4431109992729, "verification_time": 0, "benchmark_time": 56.64150199936557, "strategy_time": 0, "framework_time": 4.197636001663341},
"2,32,15,15,1,1,4,0": {"block_size_x": 2, "block_size_y": 32, "filter_height": 15, "filter_width": 15, "read_only": 1, "tile_size_x": 1, "tile_size_y": 4, "use_padding": 0, "time": 19.20176010131836, "times": [19.206144332885742, 19.202016830444336, 19.192928314208984, 19.197952270507812, 19.20636749267578, 19.2040958404541, 19.197952270507812, 19.20502471923828, 19.2040958404541, 19.20102310180664], "compile_time": 813.1836909997219, "verification_time": 0, "benchmark_time": 192.74789100018097, "strategy_time": 0, "framework_time": 3.3235750006497256},
"2,32,15,15,1,1,4,1": {"block_size_x": 2, "block_size_y": 32, "filter_height": 15, "filter_width": 15, "read_only": 1, "tile_size_x": 1, "tile_size_y": 4, "use_padding": 1, "time": 5.696668815612793, "times": [5.230527877807617, 5.263360023498535, 5.243840217590332, 5.260287761688232, 5.237696170806885, 5.647520065307617, 6.243135929107666, 6.244351863861084, 6.265600204467773, 6.3303680419921875], "compile_time": 810.5959289996463, "verification_time": 0, "benchmark_time": 57.49878900041949, "strategy_time": 0, "framework_time": 4.153498000050604},
"2,32,15,15,1,1,5,0": {"block_size_x": 2, "block_size_y": 32, "filter_height": 15, "filter_width": 15, "read_only": 1, "tile_size_x": 1, "tile_size_y": 5, "use_padding": 0, "time": 25.449353790283205, "times": [26.847232818603516, 26.841087341308594, 26.850208282470703, 26.84307289123535, 26.849279403686523, 26.846208572387695, 26.840063095092773, 26.847232818603516, 20.118528366088867, 19.610624313354492], "compile_time": 1097.2075059999042, "verification_time": 0, "benchmark_time": 255.22063199969125, "strategy_time": 0, "framework_time": 3.483540000161156},
"2,32,15,15,1,1,5,1": {"block_size_x": 2, "block_size_y": 32, "filter_height": 15, "filter_width": 15, "read_only": 1, "tile_size_x": 1, "tile_size_y": 5, "use_padding": 1, "time": 6.325648021697998, "times": [5.794816017150879, 5.797632217407227, 5.784607887268066, 5.785600185394287, 6.583295822143555, 6.66703987121582, 6.663392066955566, 6.720448017120361, 6.732800006866455, 6.726848125457764], "compile_time": 1087.3225499999535, "verification_time": 0, "benchmark_time": 63.95616199915821, "strategy_time": 0, "framework_time": 4.217307001454174},
"2,32,15,15,1,1,6,0": {"block_size_x": 2, "block_size_y": 32, "filter_height": 15, "filter_width": 15, "read_only": 1, "tile_size_x": 1, "tile_size_y": 6, "use_padding": 0, "time": 26.0128511428833, "times": [27.146207809448242, 27.13599967956543, 27.14089584350586, 27.14419174194336, 27.14112091064453, 27.14112091064453, 27.14521598815918, 27.14214324951172, 23.152639389038086, 19.83897590637207], "compile_time": 1371.9626029997016, "verification_time": 0, "benchmark_time": 260.8415810000224, "strategy_time": 0, "framework_time": 3.926155000044673},
"2,32,15,15,1,1,6,1": {"block_size_x": 2, "block_size_y": 32, "filter_height": 15, "filter_width": 15, "read_only": 1, "tile_size_x": 1, "tile_size_y": 6, "use_padding": 1, "time": 5.8761887550354, "times": [5.501952171325684, 5.523168087005615, 5.476287841796875, 5.450751781463623, 5.4824957847595215, 5.816319942474365, 6.367231845855713, 6.363135814666748, 6.372352123260498, 6.408192157745361], "compile_time": 1367.2521860007691, "verification_time": 0, "benchmark_time": 59.27574699944671, "strategy_time": 0, "framework_time": 4.225060999488051},
"2,32,15,15,1,1,7,0": {"block_size_x": 2, "block_size_y": 32, "filter_height": 15, "filter_width": 15, "read_only": 1, "tile_size_x": 1, "tile_size_y": 7, "use_padding": 0, "time": 26.761830520629882, "times": [27.487232208251953, 27.479040145874023, 27.490304946899414, 26.54515266418457, 26.5031681060791, 26.427391052246094, 26.423295974731445, 26.418176651000977, 26.422271728515625, 26.422271728515625], "compile_time": 1646.7045270001108, "verification_time": 0, "benchmark_time": 268.4555259993431, "strategy_time": 0, "framework_time": 4.2034610005430295},
"2,32,15,15,1,1,7,1": {"block_size_x": 2, "block_size_y": 32, "filter_height": 15, "filter_width": 15, "read_only": 1, "tile_size_x": 1, "tile_size_y": 7, "use_padding": 1, "time": 7.396505498886109, "times": [7.394303798675537, 7.392255783081055, 7.381951808929443, 7.389023780822754, 7.388160228729248, 7.404319763183594, 7.3963518142700195, 7.395232200622559, 7.408671855926514, 7.414783954620361], "compile_time": 2282.9958719994465, "verification_time": 0, "benchmark_time": 74.69788700018398, "strategy_time": 0, "framework_time": 4.863078000198584},
"2,32,15,15,1,1,8,0": {"block_size_x": 2, "block_size_y": 32, "filter_height": 15, "filter_width": 15, "read_only": 1, "tile_size_x": 1, "tile_size_y": 8, "use_padding": 0, "time": 23.435827255249023, "times": [26.49395179748535, 26.482688903808594, 26.496000289916992, 26.50214385986328, 26.587135314941406, 24.407039642333984, 19.34921646118164, 19.348480224609375, 19.34828758239746, 19.34332847595215], "compile_time": 2697.4578400004248, "verification_time": 0, "benchmark_time": 235.25327499919513, "strategy_time": 0, "framework_time": 4.383192999739549},
"2,32,15,15,1,1,8,1": {"block_size_x": 2, "block_size_y": 32, "filter_height": 15, "filter_width": 15, "read_only": 1, "tile_size_x": 1, "tile_size_y": 8, "use_padding": 1, "time": 7.783897638320923, "times": [7.7803521156311035, 7.789567947387695, 7.7649922370910645, 7.804863929748535, 7.762688159942627, 7.773183822631836, 7.7915520668029785, 7.797760009765625, 7.80185604095459, 7.772160053253174], "compile_time": 1933.9623509995363, "verification_time": 0, "benchmark_time": 78.465868999956, "strategy_time": 0, "framework_time": 4.46742100029951},
"2,32,15,15,1,2,1,0": {"block_size_x": 2, "block_size_y": 32, "filter_height": 15, "filter_width": 15, "read_only": 1, "tile_size_x": 2, "tile_size_y": 1, "use_padding": 0, "time": 4.403475284576416, "times": [4.40934419631958, 4.401120185852051, 4.405216217041016, 4.4021759033203125, 4.40012788772583, 4.399104118347168, 4.401120185852051, 4.400928020477295, 4.405248165130615, 4.410367965698242], "compile_time": 221.4974650005388, "verification_time": 0, "benchmark_time": 44.53810099948896, "strategy_time": 0, "framework_time": 4.347852999671886},
"2,32,15,15,1,2,1,1": {"block_size_x": 2, "block_size_y": 32, "filter_height": 15, "filter_width": 15, "read_only": 1, "tile_size_x": 2, "tile_size_y": 1, "use_padding": 1, "time": 4.363510417938232, "times": [4.370495796203613, 4.365056037902832, 4.359936237335205, 4.363264083862305, 4.3633599281311035, 4.363264083862305, 4.362239837646484, 4.361216068267822, 4.361152172088623, 4.365119934082031], "compile_time": 220.4327560002639, "verification_time": 0, "benchmark_time": 44.140025000160676, "strategy_time": 0, "framework_time": 2.574989000095229},
"2,32,15,15,1,2,2,0": {"block_size_x": 2, "block_size_y": 32, "filter_height": 15, "filter_width": 15, "read_only": 1, "tile_size_x": 2, "tile_size_y": 2, "use_padding": 0, "time": 3.922092819213867, "times": [3.930111885070801, 3.9229440689086914, 3.920896053314209, 3.920896053314209, 3.920799970626831, 3.919840097427368, 3.920896053314209, 3.920896053314209, 3.920959949493408, 3.9226880073547363], "compile_time": 417.66337399985787, "verification_time": 0, "benchmark_time": 39.677739000580914, "strategy_time": 0, "framework_time": 2.4915419999160804},
