cached_data_used/cachefiles/convolution/RTX_3090.json
{
"device_name": "NVIDIA GeForce RTX 3090",
"kernel_name": "convolution_kernel",
"problem_size": [
4096,
4096
],
"tune_params_keys": [
"block_size_x",
"block_size_y",
"filter_height",
"filter_width",
"read_only",
"tile_size_x",
"tile_size_y",
"use_padding"
],
"tune_params": {
"block_size_x": [
1,
2,
4,
8,
16,
32,
48,
64,
96,
112,
128
],
"block_size_y": [
1,
2,
4,
8,
16,
32
],
"filter_height": [
15
],
"filter_width": [
15
],
"read_only": [
0,
1
],
"tile_size_x": [
1,
2,
3,
4,
5,
6,
7,
8
],
"tile_size_y": [
1,
2,
3,
4,
5,
6,
7,
8
],
"use_padding": [
0,
1
]
},
"objective": "time",
"cache": {
"2,32,15,15,0,1,1,0": {"block_size_x": 2, "block_size_y": 32, "filter_height": 15, "filter_width": 15, "read_only": 0, "tile_size_x": 1, "tile_size_y": 1, "use_padding": 0, "time": 7.001590442657471, "times": [7.517183780670166, 7.513088226318359, 7.512063980102539, 7.511040210723877, 7.29088020324707, 6.535071849822998, 6.536191940307617, 6.535168170928955, 6.533120155334473, 6.532095909118652], "compile_time": 0.16948021948337555, "verification_time": 0, "benchmark_time": 70.39430178701878, "strategy_time": 0, "framework_time": 69.37538087368011, "timestamp": "2023-01-24 01:03:17.677311+00:00"},
"2,32,15,15,0,1,1,1": {"block_size_x": 2, "block_size_y": 32, "filter_height": 15, "filter_width": 15, "read_only": 0, "tile_size_x": 1, "tile_size_y": 1, "use_padding": 1, "time": 1.8145983815193176, "times": [1.8226239681243896, 1.8135039806365967, 1.8124799728393555, 1.8135039806365967, 1.8133759498596191, 1.8134080171585083, 1.8135039806365967, 1.8135039806365967, 1.814527988433838, 1.815551996231079], "compile_time": 211.51181496679783, "verification_time": 0, "benchmark_time": 18.73491145670414, "strategy_time": 0, "framework_time": 0.4850495606660843, "timestamp": "2023-01-24 01:03:17.908068+00:00"},
"2,32,15,15,0,1,2,0": {"block_size_x": 2, "block_size_y": 32, "filter_height": 15, "filter_width": 15, "read_only": 0, "tile_size_x": 1, "tile_size_y": 2, "use_padding": 0, "time": 6.411878490447998, "times": [6.437888145446777, 6.410240173339844, 6.407167911529541, 6.410240173339844, 6.410240173339844, 6.408192157745361, 6.409215927124023, 6.407167911529541, 6.408192157745361, 6.410240173339844], "compile_time": 350.9887084364891, "verification_time": 0, "benchmark_time": 64.51024208217859, "strategy_time": 0, "framework_time": 0.5670208483934402, "timestamp": "2023-01-24 01:03:18.324157+00:00"},
"2,32,15,15,0,1,2,1": {"block_size_x": 2, "block_size_y": 32, "filter_height": 15, "filter_width": 15, "read_only": 0, "tile_size_x": 1, "tile_size_y": 2, "use_padding": 1, "time": 1.665497624874115, "times": [1.6721919775009155, 1.663807988166809, 1.6629760265350342, 1.6650240421295166, 1.6629760265350342, 1.6629760265350342, 1.6660480499267578, 1.6660480499267578, 1.6658560037612915, 1.667072057723999], "compile_time": 347.14254830032587, "verification_time": 0, "benchmark_time": 17.07057934254408, "strategy_time": 0, "framework_time": 0.5525108426809311, "timestamp": "2023-01-24 01:03:18.688944+00:00"},
"2,32,15,15,0,1,3,0": {"block_size_x": 2, "block_size_y": 32, "filter_height": 15, "filter_width": 15, "read_only": 0, "tile_size_x": 1, "tile_size_y": 3, "use_padding": 0, "time": 6.36344313621521, "times": [6.364160060882568, 6.36300802230835, 6.366208076477051, 6.363135814666748, 6.362239837646484, 6.364160060882568, 6.363135814666748, 6.362112045288086, 6.363135814666748, 6.363135814666748], "compile_time": 567.5310045480728, "verification_time": 0, "benchmark_time": 64.07183222472668, "strategy_time": 0, "framework_time": 0.5948599427938461, "timestamp": "2023-01-24 01:03:19.321163+00:00"},
"2,32,15,15,0,1,3,1": {"block_size_x": 2, "block_size_y": 32, "filter_height": 15, "filter_width": 15, "read_only": 0, "tile_size_x": 1, "tile_size_y": 3, "use_padding": 1, "time": 1.9160160303115845, "times": [1.926144003868103, 1.9169280529022217, 1.913856029510498, 1.9139519929885864, 1.9148800373077393, 1.9148800373077393, 1.913856029510498, 1.9159040451049805, 1.9148800373077393, 1.9148800373077393], "compile_time": 577.3168643936515, "verification_time": 0, "benchmark_time": 19.764491356909275, "strategy_time": 0, "framework_time": 0.5994709208607674, "timestamp": "2023-01-24 01:03:19.918866+00:00"},
"2,32,15,15,0,1,4,0": {"block_size_x": 2, "block_size_y": 32, "filter_height": 15, "filter_width": 15, "read_only": 0, "tile_size_x": 1, "tile_size_y": 4, "use_padding": 0, "time": 7.362655925750732, "times": [7.376895904541016, 7.360511779785156, 7.36243200302124, 7.361536026000977, 7.360511779785156, 7.363584041595459, 7.360511779785156, 7.360511779785156, 7.359488010406494, 7.360576152801514], "compile_time": 835.0406717509031, "verification_time": 0, "benchmark_time": 74.11781419068575, "strategy_time": 0, "framework_time": 0.6232690066099167, "timestamp": "2023-01-24 01:03:20.828670+00:00"},
"2,32,15,15,0,1,4,1": {"block_size_x": 2, "block_size_y": 32, "filter_height": 15, "filter_width": 15, "read_only": 0, "tile_size_x": 1, "tile_size_y": 4, "use_padding": 1, "time": 1.9691519737243652, "times": [1.9752960205078125, 1.9671039581298828, 1.968127965927124, 1.9691519737243652, 1.968127965927124, 1.968127965927124, 1.968127965927124, 1.9701759815216064, 1.968127965927124, 1.9691519737243652], "compile_time": 834.536612033844, "verification_time": 0, "benchmark_time": 20.275380462408066, "strategy_time": 0, "framework_time": 0.6498284637928009, "timestamp": "2023-01-24 01:03:21.684154+00:00"},
"2,32,15,15,0,1,5,0": {"block_size_x": 2, "block_size_y": 32, "filter_height": 15, "filter_width": 15, "read_only": 0, "tile_size_x": 1, "tile_size_y": 5, "use_padding": 0, "time": 7.464959955215454, "times": [7.469056129455566, 7.463935852050781, 7.465983867645264, 7.465983867645264, 7.464960098266602, 7.463935852050781, 7.463935852050781, 7.462912082672119, 7.464960098266602, 7.463935852050781], "compile_time": 1117.274639196694, "verification_time": 0, "benchmark_time": 75.1936323940754, "strategy_time": 0, "framework_time": 0.6870413199067116, "timestamp": "2023-01-24 01:03:22.877331+00:00"},
"2,32,15,15,0,1,5,1": {"block_size_x": 2, "block_size_y": 32, "filter_height": 15, "filter_width": 15, "read_only": 0, "tile_size_x": 1, "tile_size_y": 5, "use_padding": 1, "time": 2.193414402008057, "times": [2.2005441188812256, 2.1934080123901367, 2.190335988998413, 2.1913599967956543, 2.1904959678649902, 2.190335988998413, 2.194432020187378, 2.1934080123901367, 2.196415901184082, 2.1934080123901367], "compile_time": 1120.0094977393746, "verification_time": 0, "benchmark_time": 22.425170056521893, "strategy_time": 0, "framework_time": 0.6794203072786331, "timestamp": "2023-01-24 01:03:24.020467+00:00"},
"2,32,15,15,0,1,6,0": {"block_size_x": 2, "block_size_y": 32, "filter_height": 15, "filter_width": 15, "read_only": 0, "tile_size_x": 1, "tile_size_y": 6, "use_padding": 0, "time": 7.531827163696289, "times": [7.539711952209473, 7.533567905426025, 7.530496120452881, 7.532544136047363, 7.5294718742370605, 7.530496120452881, 7.5294718742370605, 7.5294718742370605, 7.531519889831543, 7.531519889831543], "compile_time": 1405.6223258376122, "verification_time": 0, "benchmark_time": 75.69935265928507, "strategy_time": 0, "framework_time": 0.7405094802379608, "timestamp": "2023-01-24 01:03:25.502551+00:00"},
"2,32,15,15,0,1,6,1": {"block_size_x": 2, "block_size_y": 32, "filter_height": 15, "filter_width": 15, "read_only": 0, "tile_size_x": 1, "tile_size_y": 6, "use_padding": 1, "time": 2.0378368377685545, "times": [2.041856050491333, 2.033504009246826, 2.0439040660858154, 2.017280101776123, 2.040832042694092, 2.041856050491333, 2.0397119522094727, 2.0346879959106445, 2.0346879959106445, 2.0500481128692627], "compile_time": 1406.3385063782334, "verification_time": 0, "benchmark_time": 20.893311128020287, "strategy_time": 0, "framework_time": 0.6943093612790108, "timestamp": "2023-01-24 01:03:26.930500+00:00"},
"2,32,15,15,0,1,7,0": {"block_size_x": 2, "block_size_y": 32, "filter_height": 15, "filter_width": 15, "read_only": 0, "tile_size_x": 1, "tile_size_y": 7, "use_padding": 0, "time": 7.645900726318359, "times": [7.649280071258545, 7.643136024475098, 7.648255825042725, 7.650303840637207, 7.64518404006958, 7.64415979385376, 7.64415979385376, 7.643136024475098, 7.646207809448242, 7.64518404006958], "compile_time": 1700.2455117180943, "verification_time": 0, "benchmark_time": 76.96216180920601, "strategy_time": 0, "framework_time": 0.7137199863791466, "timestamp": "2023-01-24 01:03:28.708443+00:00"},
"2,32,15,15,0,1,7,1": {"block_size_x": 2, "block_size_y": 32, "filter_height": 15, "filter_width": 15, "read_only": 0, "tile_size_x": 1, "tile_size_y": 7, "use_padding": 1, "time": 2.096947193145752, "times": [2.10534405708313, 2.0992000102996826, 2.096127986907959, 2.0951039791107178, 2.096127986907959, 2.096127986907959, 2.0940799713134766, 2.0971519947052, 2.096127986907959, 2.0940799713134766], "compile_time": 1714.7615840658545, "verification_time": 0, "benchmark_time": 21.536489948630333, "strategy_time": 0, "framework_time": 0.7480299100279808, "timestamp": "2023-01-24 01:03:30.445511+00:00"},
"2,32,15,15,0,1,8,0": {"block_size_x": 2, "block_size_y": 32, "filter_height": 15, "filter_width": 15, "read_only": 0, "tile_size_x": 1, "tile_size_y": 8, "use_padding": 0, "time": 7.307571172714233, "times": [7.313407897949219, 7.306240081787109, 7.308288097381592, 7.308288097381592, 7.3072638511657715, 7.3072638511657715, 7.3072638511657715, 7.305215835571289, 7.306240081787109, 7.306240081787109], "compile_time": 2018.7527798116207, "verification_time": 0, "benchmark_time": 73.45328200608492, "strategy_time": 0, "framework_time": 0.757330097258091, "timestamp": "2023-01-24 01:03:32.538497+00:00"},
"2,32,15,15,0,1,8,1": {"block_size_x": 2, "block_size_y": 32, "filter_height": 15, "filter_width": 15, "read_only": 0, "tile_size_x": 1, "tile_size_y": 8, "use_padding": 1, "time": 2.373324751853943, "times": [2.37772798538208, 2.3736319541931152, 2.3736319541931152, 2.3736319541931152, 2.371583938598633, 2.3736319541931152, 2.3705599308013916, 2.372607946395874, 2.3705599308013916, 2.3756799697875977], "compile_time": 2021.3984986767173, "verification_time": 0, "benchmark_time": 24.32629093527794, "strategy_time": 0, "framework_time": 0.7580006495118141, "timestamp": "2023-01-24 01:03:34.585002+00:00"},
"2,32,15,15,0,2,1,0": {"block_size_x": 2, "block_size_y": 32, "filter_height": 15, "filter_width": 15, "read_only": 0, "tile_size_x": 2, "tile_size_y": 1, "use_padding": 0, "time": 1.1904000043869019, "times": [1.193984031677246, 1.1898880004882812, 1.1898880004882812, 1.1898880004882812, 1.1898880004882812, 1.1898880004882812, 1.18886399269104, 1.1909120082855225, 1.1898880004882812, 1.1909120082855225], "compile_time": 231.06390610337257, "verification_time": 0, "benchmark_time": 12.294230051338673, "strategy_time": 0, "framework_time": 0.7813600823283195, "timestamp": "2023-01-24 01:03:34.829163+00:00"},
"2,32,15,15,0,2,1,1": {"block_size_x": 2, "block_size_y": 32, "filter_height": 15, "filter_width": 15, "read_only": 0, "tile_size_x": 2, "tile_size_y": 1, "use_padding": 1, "time": 1.1860991716384888, "times": [1.1950080394744873, 1.1857919692993164, 1.1847679615020752, 1.1857919692993164, 1.183743953704834, 1.1847679615020752, 1.1857919692993164, 1.1847679615020752, 1.1847679615020752, 1.1857919692993164], "compile_time": 239.6442061290145, "verification_time": 0, "benchmark_time": 12.471329420804977, "strategy_time": 0, "framework_time": 0.7749702781438828, "timestamp": "2023-01-24 01:03:35.082076+00:00"},
"2,32,15,15,0,2,2,0": {"block_size_x": 2, "block_size_y": 32, "filter_height": 15, "filter_width": 15, "read_only": 0, "tile_size_x": 2, "tile_size_y": 2, "use_padding": 0, "time": 1.100592017173767, "times": [1.1059199571609497, 1.099776029586792, 1.099776029586792, 1.099776029586792, 1.099776029586792, 1.099776029586792, 1.100767970085144, 1.099776029586792, 1.099776029586792, 1.1008000373840332], "compile_time": 435.7849005609751, "verification_time": 0, "benchmark_time": 11.514419689774513, "strategy_time": 0, "framework_time": 0.8185906335711479, "timestamp": "2023-01-24 01:03:35.530215+00:00"},
"2,32,15,15,0,2,2,1": {"block_size_x": 2, "block_size_y": 32, "filter_height": 15, "filter_width": 15, "read_only": 0, "tile_size_x": 2, "tile_size_y": 2, "use_padding": 1, "time": 1.1002752304077148, "times": [1.1057920455932617, 1.099776029586792, 1.099776029586792, 1.0987520217895508, 1.099776029586792, 1.099776029586792, 1.099776029586792, 1.099776029586792, 1.099776029586792, 1.099776029586792], "compile_time": 437.5447994098067, "verification_time": 0, "benchmark_time": 11.60156074911356, "strategy_time": 0, "framework_time": 0.7559312507510185, "timestamp": "2023-01-24 01:03:35.980137+00:00"},
"2,32,15,15,0,2,3,0": {"block_size_x": 2, "block_size_y": 32, "filter_height": 15, "filter_width": 15, "read_only": 0, "tile_size_x": 2, "tile_size_y": 3, "use_padding": 0, "time": 1.2199455976486206, "times": [1.2288000583648682, 1.217471957206726, 1.218400001525879, 1.2175359725952148, 1.2215039730072021, 1.218559980392456, 1.2184640169143677, 1.2195839881896973, 1.2195839881896973, 1.2195520401000977], "compile_time": 703.7058668211102, "verification_time": 0, "benchmark_time": 12.782172299921513, "strategy_time": 0, "framework_time": 0.7807789370417595, "timestamp": "2023-01-24 01:03:36.697425+00:00"},
"2,32,15,15,0,2,3,1": {"block_size_x": 2, "block_size_y": 32, "filter_height": 15, "filter_width": 15, "read_only": 0, "tile_size_x": 2, "tile_size_y": 3, "use_padding": 1, "time": 1.2446720242500304, "times": [1.252351999282837, 1.2431360483169556, 1.2431360483169556, 1.2451839447021484, 1.2421120405197144, 1.2441600561141968, 1.2441600561141968, 1.2441600561141968, 1.2451839447021484, 1.2431360483169556], "compile_time": 705.694648437202, "verification_time": 0, "benchmark_time": 12.93356902897358, "strategy_time": 0, "framework_time": 0.8135885000228882, "timestamp": "2023-01-24 01:03:37.416885+00:00"},
"2,32,15,15,0,2,4,0": {"block_size_x": 2, "block_size_y": 32, "filter_height": 15, "filter_width": 15, "read_only": 0, "tile_size_x": 2, "tile_size_y": 4, "use_padding": 0, "time": 1.1166720271110535, "times": [1.1223039627075195, 1.1161600351333618, 1.1161600351333618, 1.117184042930603, 1.1151360273361206, 1.1141120195388794, 1.1151360273361206, 1.117184042930603, 1.117184042930603, 1.1161600351333618], "compile_time": 987.6702139154077, "verification_time": 0, "benchmark_time": 11.632310226559639, "strategy_time": 0, "framework_time": 0.9056301787495613, "timestamp": "2023-01-24 01:03:38.417113+00:00"},
"2,32,15,15,0,2,4,1": {"block_size_x": 2, "block_size_y": 32, "filter_height": 15, "filter_width": 15, "read_only": 0, "tile_size_x": 2, "tile_size_y": 4, "use_padding": 1, "time": 1.1267071962356567, "times": [1.1335680484771729, 1.1263999938964844, 1.1274240016937256, 1.1253759860992432, 1.1253759860992432, 1.124351978302002, 1.1263999938964844, 1.1253759860992432, 1.1253759860992432, 1.1274240016937256], "compile_time": 988.4449727833271, "verification_time": 0, "benchmark_time": 11.700481176376343, "strategy_time": 0, "framework_time": 0.8662799373269081, "timestamp": "2023-01-24 01:03:39.418145+00:00"},
"2,32,15,15,0,2,5,0": {"block_size_x": 2, "block_size_y": 32, "filter_height": 15, "filter_width": 15, "read_only": 0, "tile_size_x": 2, "tile_size_y": 5, "use_padding": 0, "time": 1.1379807710647583, "times": [1.1427839994430542, 1.136639952659607, 1.1376320123672485, 1.1386879682540894, 1.136639952659607, 1.1367679834365845, 1.1376639604568481, 1.1376639604568481, 1.1376639604568481, 1.1376639604568481], "compile_time": 1298.6923214048147, "verification_time": 0, "benchmark_time": 11.95548940449953, "strategy_time": 0, "framework_time": 0.7436703890562057, "timestamp": "2023-01-24 01:03:40.729554+00:00"},
"2,32,15,15,0,2,5,1": {"block_size_x": 2, "block_size_y": 32, "filter_height": 15, "filter_width": 15, "read_only": 0, "tile_size_x": 2, "tile_size_y": 5, "use_padding": 1, "time": 1.1934656143188476, "times": [1.2021759748458862, 1.1950080394744873, 1.1929600238800049, 1.1909120082855225, 1.1920000314712524, 1.193984031677246, 1.1919360160827637, 1.1928319931030273, 1.1919360160827637, 1.1909120082855225], "compile_time": 1309.0023314580321, "verification_time": 0, "benchmark_time": 12.50882912427187, "strategy_time": 0, "framework_time": 0.9541390463709831, "timestamp": "2023-01-24 01:03:42.052040+00:00"},
"2,32,15,15,0,2,6,0": {"block_size_x": 2, "block_size_y": 32, "filter_height": 15, "filter_width": 15, "read_only": 0, "tile_size_x": 2, "tile_size_y": 6, "use_padding": 0, "time": 1.165824043750763, "times": [1.176576018333435, 1.1663360595703125, 1.16428804397583, 1.16428804397583, 1.16428804397583, 1.1632640361785889, 1.1653120517730713, 1.1653120517730713, 1.16428804397583, 1.16428804397583], "compile_time": 1615.946057252586, "verification_time": 0, "benchmark_time": 12.119291350245476, "strategy_time": 0, "framework_time": 1.0297708213329315, "timestamp": "2023-01-24 01:03:43.681157+00:00"},
"2,32,15,15,0,2,6,1": {"block_size_x": 2, "block_size_y": 32, "filter_height": 15, "filter_width": 15, "read_only": 0, "tile_size_x": 2, "tile_size_y": 6, "use_padding": 1, "time": 1.3245440125465393, "times": [1.3383680582046509, 1.324031949043274, 1.3209600448608398, 1.324031949043274, 1.321984052658081, 1.3199360370635986, 1.3209600448608398, 1.321984052658081, 1.3281279802322388, 1.3250559568405151], "compile_time": 1612.827937118709, "verification_time": 0, "benchmark_time": 13.757300563156605, "strategy_time": 0, "framework_time": 0.9559905156493187, "timestamp": "2023-01-24 01:03:45.308725+00:00"},
"2,32,15,15,0,2,7,0": {"block_size_x": 2, "block_size_y": 32, "filter_height": 15, "filter_width": 15, "read_only": 0, "tile_size_x": 2, "tile_size_y": 7, "use_padding": 0, "time": 1.3179904103279114, "times": [1.3250559568405151, 1.316864013671875, 1.316864013671875, 1.316864013671875, 1.3178880214691162, 1.3158400058746338, 1.3158400058746338, 1.316864013671875, 1.3199360370635986, 1.3178880214691162], "compile_time": 1954.3018341064453, "verification_time": 0, "benchmark_time": 13.617441058158875, "strategy_time": 0, "framework_time": 0.9991591796278954, "timestamp": "2023-01-24 01:03:47.277665+00:00"},
"2,32,15,15,0,2,7,1": {"block_size_x": 2, "block_size_y": 32, "filter_height": 15, "filter_width": 15, "read_only": 0, "tile_size_x": 2, "tile_size_y": 7, "use_padding": 1, "time": 1.494105589389801, "times": [1.5226880311965942, 1.465343952178955, 1.5001599788665771, 1.5124479532241821, 1.4867199659347534, 1.4888960123062134, 1.5083520412445068, 1.4981119632720947, 1.4888960123062134, 1.46943998336792], "compile_time": 1938.1528235971928, "verification_time": 0, "benchmark_time": 15.482859686017036, "strategy_time": 0, "framework_time": 1.0005207732319832, "timestamp": "2023-01-24 01:03:49.232321+00:00"},
"2,32,15,15,0,2,8,0": {"block_size_x": 2, "block_size_y": 32, "filter_height": 15, "filter_width": 15, "read_only": 0, "tile_size_x": 2, "tile_size_y": 8, "use_padding": 0, "time": 1.2511167883872987, "times": [1.2584960460662842, 1.2503039836883545, 1.2513279914855957, 1.248255968093872, 1.2503039836883545, 1.2472319602966309, 1.2503039836883545, 1.2503039836883545, 1.252351999282837, 1.2522879838943481], "compile_time": 2143.4368174523115, "verification_time": 0, "benchmark_time": 13.106339611113071, "strategy_time": 0, "framework_time": 1.061401329934597, "timestamp": "2023-01-24 01:03:51.389948+00:00"},
"2,32,15,15,0,2,8,1": {"block_size_x": 2, "block_size_y": 32, "filter_height": 15, "filter_width": 15, "read_only": 0, "tile_size_x": 2, "tile_size_y": 8, "use_padding": 1, "time": 1.7809151887893677, "times": [1.798143982887268, 1.783743977546692, 1.7838079929351807, 1.772544026374817, 1.780735969543457, 1.780735969543457, 1.7776319980621338, 1.7786879539489746, 1.776479959487915, 1.7766400575637817], "compile_time": 2155.9467371553183, "verification_time": 0, "benchmark_time": 18.279200419783592, "strategy_time": 0, "framework_time": 1.0452205315232277, "timestamp": "2023-01-24 01:03:53.565241+00:00"},
"2,32,15,15,0,3,1,0": {"block_size_x": 2, "block_size_y": 32, "filter_height": 15, "filter_width": 15, "read_only": 0, "tile_size_x": 3, "tile_size_y": 1, "use_padding": 0, "time": 1.0202048182487489, "times": [1.0250240564346313, 1.0199040174484253, 1.0199040174484253, 1.018880009651184, 1.0199040174484253, 1.0199040174484253, 1.018880009651184, 1.0198400020599365, 1.0199040174484253, 1.0199040174484253], "compile_time": 271.0569864138961, "verification_time": 0, "benchmark_time": 10.65191999077797, "strategy_time": 0, "framework_time": 1.1848602443933487, "timestamp": "2023-01-24 01:03:53.848159+00:00"},
"2,32,15,15,0,3,1,1": {"block_size_x": 2, "block_size_y": 32, "filter_height": 15, "filter_width": 15, "read_only": 0, "tile_size_x": 3, "tile_size_y": 1, "use_padding": 1, "time": 0.9636864006519318, "times": [0.9728000164031982, 0.9625599980354309, 0.9625599980354309, 0.9635840058326721, 0.9625599980354309, 0.9615359902381897, 0.9625599980354309, 0.9625599980354309, 0.9635840058326721, 0.9625599980354309], "compile_time": 273.8833362236619, "verification_time": 0, "benchmark_time": 10.01168042421341, "strategy_time": 0, "framework_time": 1.0984595865011215, "timestamp": "2023-01-24 01:03:54.133174+00:00"},
"2,32,15,15,0,3,2,0": {"block_size_x": 2, "block_size_y": 32, "filter_height": 15, "filter_width": 15, "read_only": 0, "tile_size_x": 3, "tile_size_y": 2, "use_padding": 0, "time": 1.0180608034133911, "times": [1.0219520330429077, 1.0178560018539429, 1.0168319940567017, 1.0178560018539429, 1.0219520330429077, 1.0178560018539429, 1.0168319940567017, 1.0168319940567017, 1.0158079862594604, 1.0168319940567017], "compile_time": 522.8565521538258, "verification_time": 0, "benchmark_time": 10.734490118920803, "strategy_time": 0, "framework_time": 1.070239581167698, "timestamp": "2023-01-24 01:03:54.667857+00:00"},
"2,32,15,15,0,3,2,1": {"block_size_x": 2, "block_size_y": 32, "filter_height": 15, "filter_width": 15, "read_only": 0, "tile_size_x": 3, "tile_size_y": 2, "use_padding": 1, "time": 0.9629695951938629, "times": [0.9676799774169922, 0.9625599980354309, 0.9605119824409485, 0.9635840058326721, 0.9625599980354309, 0.9635840058326721, 0.9615359902381897, 0.9615359902381897, 0.9625599980354309, 0.9635840058326721], "compile_time": 523.1862301006913, "verification_time": 0, "benchmark_time": 10.061920620501041, "strategy_time": 0, "framework_time": 0.9038206189870834, "timestamp": "2023-01-24 01:03:55.202026+00:00"},
"2,32,15,15,0,3,3,0": {"block_size_x": 2, "block_size_y": 32, "filter_height": 15, "filter_width": 15, "read_only": 0, "tile_size_x": 3, "tile_size_y": 3, "use_padding": 0, "time": 0.9868287980556488, "times": [0.9932799935340881, 0.9850879907608032, 0.9861119985580444, 0.9881600141525269, 0.9850879907608032, 0.9850879907608032, 0.9871360063552856, 0.9850879907608032, 0.9861119985580444, 0.9871360063552856], "compile_time": 815.52270706743, "verification_time": 0, "benchmark_time": 10.492349974811077, "strategy_time": 0, "framework_time": 0.9116800501942635, "timestamp": "2023-01-24 01:03:56.028969+00:00"},
"2,32,15,15,0,3,3,1": {"block_size_x": 2, "block_size_y": 32, "filter_height": 15, "filter_width": 15, "read_only": 0, "tile_size_x": 3, "tile_size_y": 3, "use_padding": 1, "time": 0.9552991986274719, "times": [0.9615359902381897, 0.954367995262146, 0.9574400186538696, 0.954367995262146, 0.9564160108566284, 0.9533439874649048, 0.954367995262146, 0.954367995262146, 0.9533439874649048, 0.9534400105476379], "compile_time": 814.003037288785, "verification_time": 0, "benchmark_time": 9.982811287045479, "strategy_time": 0, "framework_time": 0.8180104196071625, "timestamp": "2023-01-24 01:03:56.853790+00:00"},
"2,32,15,15,0,3,4,0": {"block_size_x": 2, "block_size_y": 32, "filter_height": 15, "filter_width": 15, "read_only": 0, "tile_size_x": 3, "tile_size_y": 4, "use_padding": 0, "time": 0.9831423997879029, "times": [0.9881600141525269, 0.9850879907608032, 0.9820160269737244, 0.9830399751663208, 0.9830399751663208, 0.9809920191764832, 0.9830399751663208, 0.9809920191764832, 0.9820160269737244, 0.9830399751663208], "compile_time": 1137.7784637734294, "verification_time": 0, "benchmark_time": 10.480690747499466, "strategy_time": 0, "framework_time": 1.1636894196271896, "timestamp": "2023-01-24 01:03:58.003235+00:00"},
"2,32,15,15,0,3,4,1": {"block_size_x": 2, "block_size_y": 32, "filter_height": 15, "filter_width": 15, "read_only": 0, "tile_size_x": 3, "tile_size_y": 4, "use_padding": 1, "time": 0.9383935928344727, "times": [0.9410560131072998, 0.936959981918335, 0.9390079975128174, 0.9390079975128174, 0.936959981918335, 0.9379839897155762, 0.936959981918335, 0.9390079975128174, 0.9390079975128174, 0.9379839897155762], "compile_time": 1138.0362445488572, "verification_time": 0, "benchmark_time": 10.034849867224693, "strategy_time": 0, "framework_time": 1.1457903310656548, "timestamp": "2023-01-24 01:03:59.152473+00:00"},
"2,32,15,15,0,3,5,0": {"block_size_x": 2, "block_size_y": 32, "filter_height": 15, "filter_width": 15, "read_only": 0, "tile_size_x": 3, "tile_size_y": 5, "use_padding": 0, "time": 1.024716818332672, "times": [1.031167984008789, 1.0270719528198242, 1.026047945022583, 1.022976040840149, 1.0250240564346313, 1.0219520330429077, 1.022976040840149, 1.0240000486373901, 1.0240000486373901, 1.0219520330429077], "compile_time": 1473.6361904069781, "verification_time": 0, "benchmark_time": 10.610990226268768, "strategy_time": 0, "framework_time": 0.975719653069973, "timestamp": "2023-01-24 01:04:00.637714+00:00"},
"2,32,15,15,0,3,5,1": {"block_size_x": 2, "block_size_y": 32, "filter_height": 15, "filter_width": 15, "read_only": 0, "tile_size_x": 3, "tile_size_y": 5, "use_padding": 1, "time": 1.1045087814331054, "times": [1.1130880117416382, 1.1059199571609497, 1.1008000373840332, 1.1008000373840332, 1.102944016456604, 1.1038719415664673, 1.1029759645462036, 1.1038719415664673, 1.106943964958191, 1.1038719415664673], "compile_time": 1480.275341309607, "verification_time": 0, "benchmark_time": 11.657499708235264, "strategy_time": 0, "framework_time": 1.050819642841816, "timestamp": "2023-01-24 01:04:02.130715+00:00"},
"2,32,15,15,0,3,6,0": {"block_size_x": 2, "block_size_y": 32, "filter_height": 15, "filter_width": 15, "read_only": 0, "tile_size_x": 3, "tile_size_y": 6, "use_padding": 0, "time": 1.0517280101776123, "times": [1.0629119873046875, 1.0506240129470825, 1.0516480207443237, 1.0506240129470825, 1.049504041671753, 1.0516480207443237, 1.049504041671753, 1.0505919456481934, 1.0506240129470825, 1.0496000051498413], "compile_time": 1787.4909853562713, "verification_time": 0, "benchmark_time": 10.977699421346188, "strategy_time": 0, "framework_time": 1.2117726728320122, "timestamp": "2023-01-24 01:04:03.930417+00:00"},
"2,32,15,15,0,3,6,1": {"block_size_x": 2, "block_size_y": 32, "filter_height": 15, "filter_width": 15, "read_only": 0, "tile_size_x": 3, "tile_size_y": 6, "use_padding": 1, "time": 1.2386304020881653, "times": [1.2544000148773193, 1.2318719625473022, 1.235967993736267, 1.2421120405197144, 1.2390400171279907, 1.235967993736267, 1.235967993736267, 1.235967993736267, 1.2390400171279907, 1.235967993736267], "compile_time": 1778.0163763090968, "verification_time": 0, "benchmark_time": 12.927040457725525, "strategy_time": 0, "framework_time": 1.242530532181263, "timestamp": "2023-01-24 01:04:05.722624+00:00"},
"2,32,15,15,0,3,7,0": {"block_size_x": 2, "block_size_y": 32, "filter_height": 15, "filter_width": 15, "read_only": 0, "tile_size_x": 3, "tile_size_y": 7, "use_padding": 0, "time": 1.0824415922164916, "times": [1.0895359516143799, 1.0803200006484985, 1.0791679620742798, 1.0813440084457397, 1.0792959928512573, 1.0771199464797974, 1.0792640447616577, 1.082368016242981, 1.0895359516143799, 1.0864640474319458], "compile_time": 2248.6574044451118, "verification_time": 0, "benchmark_time": 11.272849515080452, "strategy_time": 0, "framework_time": 1.2514106929302216, "timestamp": "2023-01-24 01:04:07.983826+00:00"},
"2,32,15,15,0,3,7,1": {"block_size_x": 2, "block_size_y": 32, "filter_height": 15, "filter_width": 15, "read_only": 0, "tile_size_x": 3, "tile_size_y": 7, "use_padding": 1, "time": 1.2572672247886658, "times": [1.274880051612854, 1.2564480304718018, 1.2544000148773193, 1.2544000148773193, 1.2513279914855957, 1.2554240226745605, 1.2564480304718018, 1.2595200538635254, 1.2554240226745605, 1.2544000148773193], "compile_time": 2244.126065634191, "verification_time": 0, "benchmark_time": 13.142680749297142, "strategy_time": 0, "framework_time": 1.1365599930286407, "timestamp": "2023-01-24 01:04:10.242251+00:00"},
"2,32,15,15,0,3,8,0": {"block_size_x": 2, "block_size_y": 32, "filter_height": 15, "filter_width": 15, "read_only": 0, "tile_size_x": 3, "tile_size_y": 8, "use_padding": 0, "time": 1.018230390548706, "times": [1.026047945022583, 1.0178560018539429, 1.0178560018539429, 1.0178560018539429, 1.0177279710769653, 1.0168319940567017, 1.016767978668213, 1.0168319940567017, 1.0168319940567017, 1.0176960229873657], "compile_time": 573.3214011415839, "verification_time": 0, "benchmark_time": 10.543190874159336, "strategy_time": 0, "framework_time": 1.2936387211084366, "timestamp": "2023-01-24 01:04:10.827432+00:00"},
"2,32,15,15,0,3,8,1": {"block_size_x": 2, "block_size_y": 32, "filter_height": 15, "filter_width": 15, "read_only": 0, "tile_size_x": 3, "tile_size_y": 8, "use_padding": 1, "time": 1.3045024156570435, "times": [1.3087040185928345, 1.3065919876098633, 1.3035520315170288, 1.309823989868164, 1.30457603931427, 1.3035520315170288, 1.2985919713974, 1.30457603931427, 1.3035520315170288, 1.3015040159225464], "compile_time": 569.4794207811356, "verification_time": 0, "benchmark_time": 13.531869277358055, "strategy_time": 0, "framework_time": 1.323130913078785, "timestamp": "2023-01-24 01:04:11.411786+00:00"},
"2,32,15,15,0,4,1,0": {"block_size_x": 2, "block_size_y": 32, "filter_height": 15, "filter_width": 15, "read_only": 0, "tile_size_x": 4, "tile_size_y": 1, "use_padding": 0, "time": 0.7986271977424622, "times": [0.8038399815559387, 0.7976959943771362, 0.7987200021743774, 0.7987200021743774, 0.7956479787826538, 0.7976959943771362, 0.7967680096626282, 0.7976959943771362, 0.7997440099716187, 0.7997440099716187], "compile_time": 297.8263944387436, "verification_time": 0, "benchmark_time": 8.376271463930607, "strategy_time": 0, "framework_time": 1.1408692225813866, "timestamp": "2023-01-24 01:04:11.719147+00:00"},
"2,32,15,15,0,4,1,1": {"block_size_x": 2, "block_size_y": 32, "filter_height": 15, "filter_width": 15, "read_only": 0, "tile_size_x": 4, "tile_size_y": 1, "use_padding": 1, "time": 0.7917568027973175, "times": [0.7978559732437134, 0.7894080281257629, 0.7905279994010925, 0.7915520071983337, 0.7905279994010925, 0.7915520071983337, 0.7915520071983337, 0.792576014995575, 0.791487991809845, 0.7905279994010925], "compile_time": 302.7173774316907, "verification_time": 0, "benchmark_time": 8.552439510822296, "strategy_time": 0, "framework_time": 1.0720482096076012, "timestamp": "2023-01-24 01:04:12.031508+00:00"},
"2,32,15,15,0,4,2,0": {"block_size_x": 2, "block_size_y": 32, "filter_height": 15, "filter_width": 15, "read_only": 0, "tile_size_x": 4, "tile_size_y": 2, "use_padding": 0, "time": 0.7993247985839844, "times": [0.8089600205421448, 0.7987200021743774, 0.7997440099716187, 0.7987200021743774, 0.7976959943771362, 0.7976959943771362, 0.7986239790916443, 0.796671986579895, 0.7987200021743774, 0.7976959943771362], "compile_time": 592.6427124068141, "verification_time": 0, "benchmark_time": 8.357210084795952, "strategy_time": 0, "framework_time": 1.3639498502016068, "timestamp": "2023-01-24 01:04:12.633894+00:00"},
"2,32,15,15,0,4,2,1": {"block_size_x": 2, "block_size_y": 32, "filter_height": 15, "filter_width": 15, "read_only": 0, "tile_size_x": 4, "tile_size_y": 2, "use_padding": 1, "time": 0.7799807965755463, "times": [0.7884799838066101, 0.7802879810333252, 0.7772160172462463, 0.7782400250434875, 0.7782400250434875, 0.779263973236084, 0.7802879810333252, 0.779263973236084, 0.7782400250434875, 0.7802879810333252], "compile_time": 598.4144834801555, "verification_time": 0, "benchmark_time": 8.399128913879395, "strategy_time": 0, "framework_time": 1.357569359242916, "timestamp": "2023-01-24 01:04:13.242085+00:00"},
"2,32,15,15,0,4,3,0": {"block_size_x": 2, "block_size_y": 32, "filter_height": 15, "filter_width": 15, "read_only": 0, "tile_size_x": 4, "tile_size_y": 3, "use_padding": 0, "time": 0.8162303984165191, "times": [0.826367974281311, 0.8161280155181885, 0.8161280155181885, 0.8161280155181885, 0.814079999923706, 0.814079999923706, 0.8181759715080261, 0.8130559921264648, 0.8130559921264648, 0.8151040077209473], "compile_time": 932.7587382867932, "verification_time": 0, "benchmark_time": 8.760341443121433, "strategy_time": 0, "framework_time": 1.1197086423635483, "timestamp": "2023-01-24 01:04:14.184742+00:00"},
"2,32,15,15,0,4,3,1": {"block_size_x": 2, "block_size_y": 32, "filter_height": 15, "filter_width": 15, "read_only": 0, "tile_size_x": 4, "tile_size_y": 3, "use_padding": 1, "time": 0.8469504058361054, "times": [0.8509439826011658, 0.8468480110168457, 0.8447999954223633, 0.8488960266113281, 0.8447999954223633, 0.8478720188140869, 0.8468480110168457, 0.8468480110168457, 0.8458240032196045, 0.8458240032196045], "compile_time": 931.1204487457871, "verification_time": 0, "benchmark_time": 8.858970366418362, "strategy_time": 0, "framework_time": 0.8753286674618721, "timestamp": "2023-01-24 01:04:15.125612+00:00"},
"2,32,15,15,0,4,4,0": {"block_size_x": 2, "block_size_y": 32, "filter_height": 15, "filter_width": 15, "read_only": 0, "tile_size_x": 4, "tile_size_y": 4, "use_padding": 0, "time": 0.7902207911014557, "times": [0.7976959943771362, 0.7895039916038513, 0.7905279994010925, 0.7905279994010925, 0.7895039916038513, 0.7874559760093689, 0.7884799838066101, 0.7884799838066101, 0.7915520071983337, 0.7884799838066101], "compile_time": 1310.794054530561, "verification_time": 0, "benchmark_time": 8.341261185705662, "strategy_time": 0, "framework_time": 1.013588160276413, "timestamp": "2023-01-24 01:04:16.445779+00:00"},
"2,32,15,15,0,4,4,1": {"block_size_x": 2, "block_size_y": 32, "filter_height": 15, "filter_width": 15, "read_only": 0, "tile_size_x": 4, "tile_size_y": 4, "use_padding": 1, "time": 0.8339328169822693, "times": [0.8447999954223633, 0.833407998085022, 0.8335360288619995, 0.8314880132675171, 0.8335360288619995, 0.8325120210647583, 0.8335360288619995, 0.8314880132675171, 0.8325120210647583, 0.8325120210647583], "compile_time": 1304.9236750230193, "verification_time": 0, "benchmark_time": 8.957749232649803, "strategy_time": 0, "framework_time": 1.4059701934456825, "timestamp": "2023-01-24 01:04:17.761087+00:00"},
"2,32,15,15,0,4,5,0": {"block_size_x": 2, "block_size_y": 32, "filter_height": 15, "filter_width": 15, "read_only": 0, "tile_size_x": 4, "tile_size_y": 5, "use_padding": 0, "time": 0.8621855914592743, "times": [0.8826879858970642, 0.8590400218963623, 0.8601599931716919, 0.8601599931716919, 0.8620479702949524, 0.8591359853744507, 0.8601599931716919, 0.8611840009689331, 0.8581119775772095, 0.8591679930686951], "compile_time": 1646.4431025087833, "verification_time": 0, "benchmark_time": 8.97787045687437, "strategy_time": 0, "framework_time": 1.1464683338999748, "timestamp": "2023-01-24 01:04:19.417672+00:00"},
"2,32,15,15,0,4,5,1": {"block_size_x": 2, "block_size_y": 32, "filter_height": 15, "filter_width": 15, "read_only": 0, "tile_size_x": 4, "tile_size_y": 5, "use_padding": 1, "time": 0.9530239939689636, "times": [0.9676799774169922, 0.953216016292572, 0.9502720236778259, 0.9512959718704224, 0.9512959718704224, 0.9502720236778259, 0.9523199796676636, 0.9512959718704224, 0.9502720236778259, 0.9523199796676636], "compile_time": 1647.6227100938559, "verification_time": 0, "benchmark_time": 9.93437971919775, "strategy_time": 0, "framework_time": 1.0375091806054115, "timestamp": "2023-01-24 01:04:21.076282+00:00"},
"2,32,15,15,0,4,6,0": {"block_size_x": 2, "block_size_y": 32, "filter_height": 15, "filter_width": 15, "read_only": 0, "tile_size_x": 4, "tile_size_y": 6, "use_padding": 0, "time": 0.809766411781311, "times": [0.8243200182914734, 0.8089600205421448, 0.8079360127449036, 0.8069120049476624, 0.8108479976654053, 0.8069440126419067, 0.8079360127449036, 0.8089600205421448, 0.8079360127449036, 0.8069120049476624], "compile_time": 498.8543586805463, "verification_time": 0, "benchmark_time": 8.380460552871227, "strategy_time": 0, "framework_time": 0.9743813425302505, "timestamp": "2023-01-24 01:04:21.584506+00:00"},
"2,32,15,15,0,4,6,1": {"block_size_x": 2, "block_size_y": 32, "filter_height": 15, "filter_width": 15, "read_only": 0, "tile_size_x": 4, "tile_size_y": 6, "use_padding": 1, "time": 0.9678816139698029, "times": [0.9779199957847595, 0.9676799774169922, 0.9687039852142334, 0.9666560292243958, 0.9666560292243958, 0.9656320214271545, 0.9666560292243958, 0.9676480293273926, 0.9646080136299133, 0.9666560292243958], "compile_time": 497.911318205297, "verification_time": 0, "benchmark_time": 10.023979470133781, "strategy_time": 0, "framework_time": 0.9863013401627541, "timestamp": "2023-01-24 01:04:22.093445+00:00"},
"2,32,15,15,0,4,7,0": {"block_size_x": 2, "block_size_y": 32, "filter_height": 15, "filter_width": 15, "read_only": 0, "tile_size_x": 4, "tile_size_y": 7, "use_padding": 0, "time": 0.8811455965042114, "times": [0.8878080248832703, 0.881600022315979, 0.8765439987182617, 0.8785920143127441, 0.881663978099823, 0.881663978099823, 0.881663978099823, 0.8806399703025818, 0.8826879858970642, 0.8785920143127441], "compile_time": 593.7030715867877, "verification_time": 0, "benchmark_time": 9.426279924809933, "strategy_time": 0, "framework_time": 1.4871293678879738, "timestamp": "2023-01-24 01:04:22.698082+00:00"},
"2,32,15,15,0,4,7,1": {"block_size_x": 2, "block_size_y": 32, "filter_height": 15, "filter_width": 15, "read_only": 0, "tile_size_x": 4, "tile_size_y": 7, "use_padding": 1, "time": 0.9947135984897614, "times": [1.0106879472732544, 0.9912319779396057, 0.9963520169258118, 0.9943040013313293, 0.9922559857368469, 0.9902080297470093, 0.9871360063552856, 0.9953280091285706, 0.9953280091285706, 0.9943040013313293], "compile_time": 598.2702011242509, "verification_time": 0, "benchmark_time": 10.525050573050976, "strategy_time": 0, "framework_time": 1.247018575668335, "timestamp": "2023-01-24 01:04:23.308145+00:00"},
"2,32,15,15,0,5,1,0": {"block_size_x": 2, "block_size_y": 32, "filter_height": 15, "filter_width": 15, "read_only": 0, "tile_size_x": 5, "tile_size_y": 1, "use_padding": 0, "time": 1.2615647673606873, "times": [1.2666879892349243, 1.2615679502487183, 1.2615360021591187, 1.260543942451477, 1.2595200538635254, 1.2615679502487183, 1.2615679502487183, 1.260543942451477, 1.2615679502487183, 1.260543942451477], "compile_time": 344.8036964982748, "verification_time": 0, "benchmark_time": 12.995121069252491, "strategy_time": 0, "framework_time": 1.8810303881764412, "timestamp": "2023-01-24 01:04:23.667846+00:00"},
"2,32,15,15,0,5,1,1": {"block_size_x": 2, "block_size_y": 32, "filter_height": 15, "filter_width": 15, "read_only": 0, "tile_size_x": 5, "tile_size_y": 1, "use_padding": 1, "time": 0.6583200037479401, "times": [0.6635519862174988, 0.6584320068359375, 0.6573759913444519, 0.6584320068359375, 0.6573759913444519, 0.6574079990386963, 0.6565120220184326, 0.6574079990386963, 0.6582720279693604, 0.6584320068359375], "compile_time": 341.46645572036505, "verification_time": 0, "benchmark_time": 7.20630120486021, "strategy_time": 0, "framework_time": 1.2605590745806694, "timestamp": "2023-01-24 01:04:24.017797+00:00"},
"2,32,15,15,0,5,2,0": {"block_size_x": 2, "block_size_y": 32, "filter_height": 15, "filter_width": 15, "read_only": 0, "tile_size_x": 5, "tile_size_y": 2, "use_padding": 0, "time": 1.240883219242096, "times": [1.2472319602966309, 1.2410880327224731, 1.240064024925232, 1.240064024925232, 1.240064024925232, 1.2390400171279907, 1.240064024925232, 1.240064024925232, 1.2390400171279907, 1.2421120405197144], "compile_time": 663.0824217572808, "verification_time": 0, "benchmark_time": 12.832711450755596, "strategy_time": 0, "framework_time": 1.267838291823864, "timestamp": "2023-01-24 01:04:24.694999+00:00"},
"2,32,15,15,0,5,2,1": {"block_size_x": 2, "block_size_y": 32, "filter_height": 15, "filter_width": 15, "read_only": 0, "tile_size_x": 5, "tile_size_y": 2, "use_padding": 1, "time": 0.6935552060604095, "times": [0.6993920207023621, 0.6922240257263184, 0.6932479739189148, 0.6952959895133972, 0.6922240257263184, 0.6922240257263184, 0.6922240257263184, 0.6922240257263184, 0.6932479739189148, 0.6932479739189148], "compile_time": 673.9654913544655, "verification_time": 0, "benchmark_time": 7.292510941624641, "strategy_time": 0, "framework_time": 1.6008997336030006, "timestamp": "2023-01-24 01:04:25.377877+00:00"},
"2,32,15,15,0,5,3,0": {"block_size_x": 2, "block_size_y": 32, "filter_height": 15, "filter_width": 15, "read_only": 0, "tile_size_x": 5, "tile_size_y": 3, "use_padding": 0, "time": 1.2437312364578248, "times": [1.2533760070800781, 1.2421120405197144, 1.2430720329284668, 1.2421120405197144, 1.2421120405197144, 1.2431360483169556, 1.2431360483169556, 1.2421120405197144, 1.2431360483169556, 1.243008017539978], "compile_time": 1051.680527627468, "verification_time": 0, "benchmark_time": 12.86713033914566, "strategy_time": 0, "framework_time": 0.9627006947994232, "timestamp": "2023-01-24 01:04:26.443403+00:00"},
"2,32,15,15,0,5,3,1": {"block_size_x": 2, "block_size_y": 32, "filter_height": 15, "filter_width": 15, "read_only": 0, "tile_size_x": 5, "tile_size_y": 3, "use_padding": 1, "time": 0.7181311905384063, "times": [0.7260159850120544, 0.719871997833252, 0.7178239822387695, 0.7178239822387695, 0.7157760262489319, 0.7167999744415283, 0.7167999744415283, 0.7178239822387695, 0.7147520184516907, 0.7178239822387695], "compile_time": 1055.6402476504445, "verification_time": 0, "benchmark_time": 7.746720686554909, "strategy_time": 0, "framework_time": 1.3238796964287758, "timestamp": "2023-01-24 01:04:27.508131+00:00"},
"2,32,15,15,0,5,4,0": {"block_size_x": 2, "block_size_y": 32, "filter_height": 15, "filter_width": 15, "read_only": 0, "tile_size_x": 5, "tile_size_y": 4, "use_padding": 0, "time": 1.2288992166519166, "times": [1.235967993736267, 1.227776050567627, 1.2267520427703857, 1.2267520427703857, 1.2267520427703857, 1.227776050567627, 1.228767991065979, 1.2298239469528198, 1.2298239469528198, 1.2288000583648682], "compile_time": 1483.5773659870028, "verification_time": 0, "benchmark_time": 12.754150666296482, "strategy_time": 0, "framework_time": 0.9655384346842766, "timestamp": "2023-01-24 01:04:29.005446+00:00"},
"2,32,15,15,0,5,4,1": {"block_size_x": 2, "block_size_y": 32, "filter_height": 15, "filter_width": 15, "read_only": 0, "tile_size_x": 5, "tile_size_y": 4, "use_padding": 1, "time": 0.7627584099769592, "times": [0.7750080227851868, 0.7639039754867554, 0.7618560194969177, 0.7598080039024353, 0.7618560194969177, 0.7608320116996765, 0.7598080039024353, 0.7618240118026733, 0.7628800272941589, 0.7598080039024353], "compile_time": 1484.5132771879435, "verification_time": 0, "benchmark_time": 8.189770393073559, "strategy_time": 0, "framework_time": 1.6372483223676682, "timestamp": "2023-01-24 01:04:30.499807+00:00"},
"2,32,15,15,0,5,5,0": {"block_size_x": 2, "block_size_y": 32, "filter_height": 15, "filter_width": 15, "read_only": 0, "tile_size_x": 5, "tile_size_y": 5, "use_padding": 0, "time": 1.2470239639282226, "times": [1.252351999282837, 1.2472319602966309, 1.2472319602966309, 1.2451839447021484, 1.2451839447021484, 1.2451839447021484, 1.2462079524993896, 1.2472319602966309, 1.2472000122070312, 1.2472319602966309], "compile_time": 484.2568077147007, "verification_time": 0, "benchmark_time": 12.945279479026794, "strategy_time": 0, "framework_time": 1.373940147459507, "timestamp": "2023-01-24 01:04:30.998403+00:00"},
"2,32,15,15,0,5,5,1": {"block_size_x": 2, "block_size_y": 32, "filter_height": 15, "filter_width": 15, "read_only": 0, "tile_size_x": 5, "tile_size_y": 5, "use_padding": 1, "time": 0.7119647860527039, "times": [0.7188479900360107, 0.7116159796714783, 0.7127040028572083, 0.7096319794654846, 0.7086079716682434, 0.7127040028572083, 0.7125759720802307, 0.7116479873657227, 0.711679995059967, 0.7096319794654846], "compile_time": 488.0595877766609, "verification_time": 0, "benchmark_time": 7.634490728378296, "strategy_time": 0, "framework_time": 1.7432915046811104, "timestamp": "2023-01-24 01:04:31.495862+00:00"},
"2,32,15,15,0,6,1,0": {"block_size_x": 2, "block_size_y": 32, "filter_height": 15, "filter_width": 15, "read_only": 0, "tile_size_x": 6, "tile_size_y": 1, "use_padding": 0, "time": 0.619731205701828, "times": [0.6256639957427979, 0.6195840239524841, 0.6195200085639954, 0.6195200085639954, 0.6184960007667542, 0.6195200085639954, 0.6184960007667542, 0.6184960007667542, 0.6195200085639954, 0.6184960007667542], "compile_time": 378.2611349597573, "verification_time": 0, "benchmark_time": 6.663660518825054, "strategy_time": 0, "framework_time": 1.6788803040981293, "timestamp": "2023-01-24 01:04:31.882485+00:00"},
"2,32,15,15,0,6,1,1": {"block_size_x": 2, "block_size_y": 32, "filter_height": 15, "filter_width": 15, "read_only": 0, "tile_size_x": 6, "tile_size_y": 1, "use_padding": 1, "time": 0.6181791961193085, "times": [0.6246399879455566, 0.6184960007667542, 0.6184960007667542, 0.6164479851722717, 0.6174719929695129, 0.6174719929695129, 0.6164479851722717, 0.6174719929695129, 0.6173760294914246, 0.6174719929695129], "compile_time": 378.69033589959145, "verification_time": 0, "benchmark_time": 6.725950166583061, "strategy_time": 0, "framework_time": 1.0906103998422623, "timestamp": "2023-01-24 01:04:32.269007+00:00"},
"2,32,15,15,0,6,2,0": {"block_size_x": 2, "block_size_y": 32, "filter_height": 15, "filter_width": 15, "read_only": 0, "tile_size_x": 6, "tile_size_y": 2, "use_padding": 0, "time": 0.6141856014728546, "times": [0.6215680241584778, 0.6133760213851929, 0.6154239773750305, 0.6133120059967041, 0.6103039979934692, 0.6142399907112122, 0.6144639849662781, 0.6122879981994629, 0.6124799847602844, 0.6144000291824341], "compile_time": 743.1410122662783, "verification_time": 0, "benchmark_time": 6.721630692481995, "strategy_time": 0, "framework_time": 1.2634983286261559, "timestamp": "2023-01-24 01:04:33.020149+00:00"},
"2,32,15,15,0,6,2,1": {"block_size_x": 2, "block_size_y": 32, "filter_height": 15, "filter_width": 15, "read_only": 0, "tile_size_x": 6, "tile_size_y": 2, "use_padding": 1, "time": 0.6134784102439881, "times": [0.6236159801483154, 0.6123520135879517, 0.6113280057907104, 0.6144000291824341, 0.6123520135879517, 0.6123520135879517, 0.6103039979934692, 0.6123520135879517, 0.6133760213851929, 0.6123520135879517], "compile_time": 754.2555034160614, "verification_time": 0, "benchmark_time": 6.716679781675339, "strategy_time": 0, "framework_time": 1.0190503671765327, "timestamp": "2023-01-24 01:04:33.782156+00:00"},
"2,32,15,15,0,6,3,0": {"block_size_x": 2, "block_size_y": 32, "filter_height": 15, "filter_width": 15, "read_only": 0, "tile_size_x": 6, "tile_size_y": 3, "use_padding": 0, "time": 0.7198847949504852, "times": [0.7321599721908569, 0.7208960056304932, 0.7210239768028259, 0.7157760262489319, 0.7219200134277344, 0.7188479900360107, 0.7127040028572083, 0.719871997833252, 0.7188479900360107, 0.7167999744415283], "compile_time": 1153.2593378797174, "verification_time": 0, "benchmark_time": 7.807400077581406, "strategy_time": 0, "framework_time": 1.4229007065296173, "timestamp": "2023-01-24 01:04:34.944664+00:00"},
"2,32,15,15,0,6,3,1": {"block_size_x": 2, "block_size_y": 32, "filter_height": 15, "filter_width": 15, "read_only": 0, "tile_size_x": 6, "tile_size_y": 3, "use_padding": 1, "time": 0.7246528089046478, "times": [0.7310400009155273, 0.7249919772148132, 0.7249919772148132, 0.7239680290222168, 0.7239680290222168, 0.7239680290222168, 0.7219200134277344, 0.7238399982452393, 0.7248960137367249, 0.7229440212249756], "compile_time": 1155.030039139092, "verification_time": 0, "benchmark_time": 7.758589461445808, "strategy_time": 0, "framework_time": 1.4287503436207771, "timestamp": "2023-01-24 01:04:36.108899+00:00"},
"2,32,15,15,0,6,4,0": {"block_size_x": 2, "block_size_y": 32, "filter_height": 15, "filter_width": 15, "read_only": 0, "tile_size_x": 6, "tile_size_y": 4, "use_padding": 0, "time": 0.6310464084148407, "times": [0.6399359703063965, 0.6296960115432739, 0.6287360191345215, 0.6295999884605408, 0.6297600269317627, 0.6287360191345215, 0.6347200274467468, 0.6287360191345215, 0.6307839751243591, 0.6297600269317627], "compile_time": 434.0900769457221, "verification_time": 0, "benchmark_time": 6.694380193948746, "strategy_time": 0, "framework_time": 1.395300030708313, "timestamp": "2023-01-24 01:04:36.551095+00:00"},
"2,32,15,15,0,6,4,1": {"block_size_x": 2, "block_size_y": 32, "filter_height": 15, "filter_width": 15, "read_only": 0, "tile_size_x": 6, "tile_size_y": 4, "use_padding": 1, "time": 0.6323039889335632, "times": [0.6399999856948853, 0.6318079829216003, 0.6307839751243591, 0.6328319907188416, 0.6318079829216003, 0.6318079829216003, 0.6318079829216003, 0.6297600269317627, 0.6316480040550232, 0.6307839751243591], "compile_time": 437.95238714665174, "verification_time": 0, "benchmark_time": 6.759460084140301, "strategy_time": 0, "framework_time": 1.0201213881373405, "timestamp": "2023-01-24 01:04:36.996842+00:00"},
"2,32,15,15,0,7,1,0": {"block_size_x": 2, "block_size_y": 32, "filter_height": 15, "filter_width": 15, "read_only": 0, "tile_size_x": 7, "tile_size_y": 1, "use_padding": 0, "time": 0.6294400155544281, "times": [0.6369280219078064, 0.6297600269317627, 0.6287360191345215, 0.6287360191345215, 0.6287360191345215, 0.6287360191345215, 0.6277120113372803, 0.628607988357544, 0.6287360191345215, 0.6277120113372803], "compile_time": 409.0754669159651, "verification_time": 0, "benchmark_time": 6.742010824382305, "strategy_time": 0, "framework_time": 1.2622792273759842, "timestamp": "2023-01-24 01:04:37.413937+00:00"},
"2,32,15,15,0,7,1,1": {"block_size_x": 2, "block_size_y": 32, "filter_height": 15, "filter_width": 15, "read_only": 0, "tile_size_x": 7, "tile_size_y": 1, "use_padding": 1, "time": 0.574259215593338, "times": [0.5826560258865356, 0.5744640231132507, 0.5734400153160095, 0.5744640231132507, 0.5734400153160095, 0.5724160075187683, 0.5744640231132507, 0.5724160075187683, 0.5724160075187683, 0.5724160075187683], "compile_time": 412.8744974732399, "verification_time": 0, "benchmark_time": 6.19196891784668, "strategy_time": 0, "framework_time": 1.0887496173381805, "timestamp": "2023-01-24 01:04:37.834108+00:00"},
"2,32,15,15,0,7,2,0": {"block_size_x": 2, "block_size_y": 32, "filter_height": 15, "filter_width": 15, "read_only": 0, "tile_size_x": 7, "tile_size_y": 2, "use_padding": 0, "time": 0.6369279980659485, "times": [0.6481919884681702, 0.634880006313324, 0.6338559985160828, 0.6338559985160828, 0.6338559985160828, 0.6338559985160828, 0.6359040141105652, 0.6369280219078064, 0.638975977897644, 0.638975977897644], "compile_time": 839.954593218863, "verification_time": 0, "benchmark_time": 6.929551251232624, "strategy_time": 0, "framework_time": 1.0767001658678055, "timestamp": "2023-01-24 01:04:38.682085+00:00"},
"2,32,15,15,0,7,2,1": {"block_size_x": 2, "block_size_y": 32, "filter_height": 15, "filter_width": 15, "read_only": 0, "tile_size_x": 7, "tile_size_y": 2, "use_padding": 1, "time": 0.6034431993961334, "times": [0.6133760213851929, 0.605184018611908, 0.6031360030174255, 0.6031360030174255, 0.6031360030174255, 0.6031360030174255, 0.6000639796257019, 0.6000639796257019, 0.6000639796257019, 0.6031360030174255], "compile_time": 834.4657430425286, "verification_time": 0, "benchmark_time": 6.721099838614464, "strategy_time": 0, "framework_time": 1.8202606588602066, "timestamp": "2023-01-24 01:04:39.525113+00:00"},
"2,32,15,15,0,7,3,0": {"block_size_x": 2, "block_size_y": 32, "filter_height": 15, "filter_width": 15, "read_only": 0, "tile_size_x": 7, "tile_size_y": 3, "use_padding": 0, "time": 0.7056191921234131, "times": [0.7208960056304932, 0.707423985004425, 0.7024639844894409, 0.7045120000839233, 0.7024639844894409, 0.7034239768981934, 0.7045120000839233, 0.7024639844894409, 0.7055360078811646, 0.7024959921836853], "compile_time": 1331.1574906110764, "verification_time": 0, "benchmark_time": 7.516740821301937, "strategy_time": 0, "framework_time": 1.126919873058796, "timestamp": "2023-01-24 01:04:40.864929+00:00"},
"2,32,15,15,0,7,3,1": {"block_size_x": 2, "block_size_y": 32, "filter_height": 15, "filter_width": 15, "read_only": 0, "tile_size_x": 7, "tile_size_y": 3, "use_padding": 1, "time": 0.7037759840488433, "times": [0.7146239876747131, 0.7024639844894409, 0.7024639844894409, 0.7034879922866821, 0.7014399766921997, 0.7024639844894409, 0.7024639844894409, 0.7034879922866821, 0.7024319767951965, 0.7024319767951965], "compile_time": 1323.2149900868535, "verification_time": 0, "benchmark_time": 7.553719915449619, "strategy_time": 0, "framework_time": 1.5296991914510727, "timestamp": "2023-01-24 01:04:42.197246+00:00"},
"2,32,15,15,0,7,4,0": {"block_size_x": 2, "block_size_y": 32, "filter_height": 15, "filter_width": 15, "read_only": 0, "tile_size_x": 7, "tile_size_y": 4, "use_padding": 0, "time": 0.6384288132190704, "times": [0.6533120274543762, 0.6379520297050476, 0.6368640065193176, 0.6359040141105652, 0.6378880143165588, 0.6369280219078064, 0.6359040141105652, 0.6347839832305908, 0.6367999911308289, 0.6379520297050476], "compile_time": 502.4859178811312, "verification_time": 0, "benchmark_time": 6.7267389968037605, "strategy_time": 0, "framework_time": 1.5609310939908028, "timestamp": "2023-01-24 01:04:42.708038+00:00"},
"2,32,15,15,0,7,4,1": {"block_size_x": 2, "block_size_y": 32, "filter_height": 15, "filter_width": 15, "read_only": 0, "tile_size_x": 7, "tile_size_y": 4, "use_padding": 1, "time": 0.6169535934925079, "times": [0.6245120167732239, 0.6165120005607605, 0.6174719929695129, 0.6174719929695129, 0.6184960007667542, 0.6164479851722717, 0.6154239773750305, 0.6154239773750305, 0.6123520135879517, 0.6154239773750305], "compile_time": 492.45200771838427, "verification_time": 0, "benchmark_time": 6.704119965434074, "strategy_time": 0, "framework_time": 1.257910393178463, "timestamp": "2023-01-24 01:04:43.208467+00:00"},
"2,32,15,15,0,8,1,0": {"block_size_x": 2, "block_size_y": 32, "filter_height": 15, "filter_width": 15, "read_only": 0, "tile_size_x": 8, "tile_size_y": 1, "use_padding": 0, "time": 0.5291007936000824, "times": [0.5355520248413086, 0.5283839702606201, 0.5283839702606201, 0.5283839702606201, 0.5304319858551025, 0.5294079780578613, 0.5273600220680237, 0.5283839702606201, 0.5273600220680237, 0.5273600220680237], "compile_time": 440.7032672315836, "verification_time": 0, "benchmark_time": 5.617930553853512, "strategy_time": 0, "framework_time": 1.2580491602420807, "timestamp": "2023-01-24 01:04:43.656060+00:00"},
"2,32,15,15,0,8,1,1": {"block_size_x": 2, "block_size_y": 32, "filter_height": 15, "filter_width": 15, "read_only": 0, "tile_size_x": 8, "tile_size_y": 1, "use_padding": 1, "time": 0.5322751939296723, "times": [0.5386239886283875, 0.5335040092468262, 0.5304319858551025, 0.5304319858551025, 0.5314559936523438, 0.5314559936523438, 0.5314559936523438, 0.5314559936523438, 0.5314559936523438, 0.532480001449585], "compile_time": 436.45213637501, "verification_time": 0, "benchmark_time": 5.688739940524101, "strategy_time": 0, "framework_time": 1.1143004521727562, "timestamp": "2023-01-24 01:04:44.099331+00:00"},
"2,32,15,15,0,8,2,0": {"block_size_x": 2, "block_size_y": 32, "filter_height": 15, "filter_width": 15, "read_only": 0, "tile_size_x": 8, "tile_size_y": 2, "use_padding": 0, "time": 0.5978112101554871, "times": [0.605184018611908, 0.6000639796257019, 0.5949440002441406, 0.596992015838623, 0.5959680080413818, 0.596992015838623, 0.596992015838623, 0.596992015838623, 0.596992015838623, 0.596992015838623], "compile_time": 915.4318943619728, "verification_time": 0, "benchmark_time": 6.513579748570919, "strategy_time": 0, "framework_time": 1.0816091671586037, "timestamp": "2023-01-24 01:04:45.022373+00:00"},
"2,32,15,15,0,8,2,1": {"block_size_x": 2, "block_size_y": 32, "filter_height": 15, "filter_width": 15, "read_only": 0, "tile_size_x": 8, "tile_size_y": 2, "use_padding": 1, "time": 0.6122431993484497, "times": [0.6256639957427979, 0.6123520135879517, 0.6103039979934692, 0.6123520135879517, 0.6123520135879517, 0.6103039979934692, 0.6113280057907104, 0.609279990196228, 0.609279990196228, 0.6092159748077393], "compile_time": 922.2462745383382, "verification_time": 0, "benchmark_time": 6.732100620865822, "strategy_time": 0, "framework_time": 1.0793395340442657, "timestamp": "2023-01-24 01:04:45.952447+00:00"},
"2,32,15,15,0,8,3,0": {"block_size_x": 2, "block_size_y": 32, "filter_height": 15, "filter_width": 15, "read_only": 0, "tile_size_x": 8, "tile_size_y": 3, "use_padding": 0, "time": 0.5600224077701569, "times": [0.5693439841270447, 0.5610880255699158, 0.5580800175666809, 0.5570560097694397, 0.5590720176696777, 0.5582079887390137, 0.5600640177726746, 0.5580800175666809, 0.5591040253639221, 0.5601279735565186], "compile_time": 411.35593596845865, "verification_time": 0, "benchmark_time": 6.161799654364586, "strategy_time": 0, "framework_time": 1.61817017942667, "timestamp": "2023-01-24 01:04:46.371601+00:00"},
"2,32,15,15,0,8,3,1": {"block_size_x": 2, "block_size_y": 32, "filter_height": 15, "filter_width": 15, "read_only": 0, "tile_size_x": 8, "tile_size_y": 3, "use_padding": 1, "time": 0.5787647902965546, "times": [0.5847039818763733, 0.5806080102920532, 0.5775359869003296, 0.5775359869003296, 0.5765119791030884, 0.5775039792060852, 0.5785599946975708, 0.5796800255775452, 0.5775039792060852, 0.5775039792060852], "compile_time": 411.68949473649263, "verification_time": 0, "benchmark_time": 6.1657605692744255, "strategy_time": 0, "framework_time": 1.2972410768270493, "timestamp": "2023-01-24 01:04:46.790769+00:00"},
"2,32,15,15,1,1,1,0": {"block_size_x": 2, "block_size_y": 32, "filter_height": 15, "filter_width": 15, "read_only": 1, "tile_size_x": 1, "tile_size_y": 1, "use_padding": 0, "time": 7.463315105438232, "times": [7.476223945617676, 7.474175930023193, 7.4618239402771, 7.461887836456299, 7.460864067077637, 7.459839820861816, 7.459839820861816, 7.459839820861816, 7.458816051483154, 7.459839820861816], "compile_time": 211.45156305283308, "verification_time": 0, "benchmark_time": 75.1053923740983, "strategy_time": 0, "framework_time": 1.2590596452355385, "timestamp": "2023-01-24 01:04:47.078601+00:00"},
"2,32,15,15,1,1,1,1": {"block_size_x": 2, "block_size_y": 32, "filter_height": 15, "filter_width": 15, "read_only": 1, "tile_size_x": 1, "tile_size_y": 1, "use_padding": 1, "time": 2.0809696435928347, "times": [2.0828158855438232, 2.0797441005706787, 2.08076810836792, 2.0787200927734375, 2.0787200927734375, 2.0797441005706787, 2.081792116165161, 2.0838398933410645, 2.08076810836792, 2.0827839374542236], "compile_time": 201.37800369411707, "verification_time": 0, "benchmark_time": 21.227198652923107, "strategy_time": 0, "framework_time": 2.0233001559972763, "timestamp": "2023-01-24 01:04:47.303251+00:00"},
"2,32,15,15,1,1,2,0": {"block_size_x": 2, "block_size_y": 32, "filter_height": 15, "filter_width": 15, "read_only": 1, "tile_size_x": 1, "tile_size_y": 2, "use_padding": 0, "time": 7.447119951248169, "times": [7.453695774078369, 7.447519779205322, 7.445504188537598, 7.448575973510742, 7.44652795791626, 7.44649600982666, 7.44652795791626, 7.445375919342041, 7.44649600982666, 7.444479942321777], "compile_time": 348.95940590649843, "verification_time": 0, "benchmark_time": 75.04411228001118, "strategy_time": 0, "framework_time": 2.0497003570199013, "timestamp": "2023-01-24 01:04:47.729325+00:00"},
"2,32,15,15,1,1,2,1": {"block_size_x": 2, "block_size_y": 32, "filter_height": 15, "filter_width": 15, "read_only": 1, "tile_size_x": 1, "tile_size_y": 2, "use_padding": 1, "time": 2.013475251197815, "times": [2.027519941329956, 2.01200008392334, 2.012160062789917, 2.011136054992676, 2.0101120471954346, 2.012160062789917, 2.011136054992676, 2.012160062789917, 2.013184070587158, 2.013184070587158], "compile_time": 348.5346548259258, "verification_time": 0, "benchmark_time": 20.68216074258089, "strategy_time": 0, "framework_time": 2.0697293803095818, "timestamp": "2023-01-24 01:04:48.100634+00:00"},
"2,32,15,15,1,1,3,0": {"block_size_x": 2, "block_size_y": 32, "filter_height": 15, "filter_width": 15, "read_only": 1, "tile_size_x": 1, "tile_size_y": 3, "use_padding": 0, "time": 7.403699254989624, "times": [7.4055681228637695, 7.403520107269287, 7.404543876647949, 7.404384136199951, 7.402495861053467, 7.4034881591796875, 7.402431964874268, 7.403520107269287, 7.403520107269287, 7.403520107269287], "compile_time": 578.9831364527345, "verification_time": 0, "benchmark_time": 74.55564197152853, "strategy_time": 0, "framework_time": 2.0704707130789757, "timestamp": "2023-01-24 01:04:48.756265+00:00"},
"2,32,15,15,1,1,3,1": {"block_size_x": 2, "block_size_y": 32, "filter_height": 15, "filter_width": 15, "read_only": 1, "tile_size_x": 1, "tile_size_y": 3, "use_padding": 1, "time": 1.9159040331840516, "times": [1.926144003868103, 1.913856029510498, 1.9148800373077393, 1.913856029510498, 1.9148800373077393, 1.9128320217132568, 1.913856029510498, 1.9159040451049805, 1.9169280529022217, 1.9159040451049805], "compile_time": 572.2757577896118, "verification_time": 0, "benchmark_time": 19.665521569550037, "strategy_time": 0, "framework_time": 2.1112896502017975, "timestamp": "2023-01-24 01:04:49.350338+00:00"},
"2,32,15,15,1,1,4,0": {"block_size_x": 2, "block_size_y": 32, "filter_height": 15, "filter_width": 15, "read_only": 1, "tile_size_x": 1, "tile_size_y": 4, "use_padding": 0, "time": 7.311872053146362, "times": [7.321599960327148, 7.308288097381592, 7.3164801597595215, 7.314432144165039, 7.312384128570557, 7.310336112976074, 7.309311866760254, 7.308288097381592, 7.310336112976074, 7.3072638511657715], "compile_time": 835.2115722373128, "verification_time": 0, "benchmark_time": 73.58330953866243, "strategy_time": 0, "framework_time": 2.1244296804070473, "timestamp": "2023-01-24 01:04:50.261279+00:00"},
"2,32,15,15,1,1,4,1": {"block_size_x": 2, "block_size_y": 32, "filter_height": 15, "filter_width": 15, "read_only": 1, "tile_size_x": 1, "tile_size_y": 4, "use_padding": 1, "time": 1.9413727879524232, "times": [1.950719952583313, 1.9415040016174316, 1.9404799938201904, 1.9394559860229492, 1.9423680305480957, 1.9394559860229492, 1.9394559860229492, 1.940351963043213, 1.9404799938201904, 1.9394559860229492], "compile_time": 842.3828920349479, "verification_time": 0, "benchmark_time": 19.90916021168232, "strategy_time": 0, "framework_time": 2.1336907520890236, "timestamp": "2023-01-24 01:04:51.125726+00:00"},
"2,32,15,15,1,1,5,0": {"block_size_x": 2, "block_size_y": 32, "filter_height": 15, "filter_width": 15, "read_only": 1, "tile_size_x": 1, "tile_size_y": 5, "use_padding": 0, "time": 7.465356779098511, "times": [7.474175930023193, 7.465983867645264, 7.463935852050781, 7.467008113861084, 7.467008113861084, 7.462912082672119, 7.462912082672119, 7.462912082672119, 7.461887836456299, 7.464831829071045], "compile_time": 1117.717425338924, "verification_time": 0, "benchmark_time": 75.11555962264538, "strategy_time": 0, "framework_time": 2.1419404074549675, "timestamp": "2023-01-24 01:04:52.320722+00:00"},
