cached_data_used/cachefiles/convolution/RTX_Titan.json
{
"device_name": "NVIDIA TITAN RTX",
"kernel_name": "convolution_kernel",
"problem_size": [
4096,
4096
],
"tune_params_keys": [
"block_size_x",
"block_size_y",
"filter_height",
"filter_width",
"read_only",
"tile_size_x",
"tile_size_y",
"use_padding"
],
"tune_params": {
"block_size_x": [
1,
2,
4,
8,
16,
32,
48,
64,
96,
112,
128
],
"block_size_y": [
1,
2,
4,
8,
16,
32
],
"filter_height": [
15
],
"filter_width": [
15
],
"read_only": [
0,
1
],
"tile_size_x": [
1,
2,
3,
4,
5,
6,
7,
8
],
"tile_size_y": [
1,
2,
3,
4,
5,
6,
7,
8
],
"use_padding": [
0,
1
]
},
"objective": "time",
"cache": {
"2,32,15,15,0,1,1,0": {"block_size_x": 2, "block_size_y": 32, "filter_height": 15, "filter_width": 15, "read_only": 0, "tile_size_x": 1, "tile_size_y": 1, "use_padding": 0, "time": 15.079779243469238, "times": [15.125887870788574, 15.1212158203125, 15.077376365661621, 15.065792083740234, 15.068256378173828, 15.067999839782715, 15.067168235778809, 15.068863868713379, 15.068096160888672, 15.06713581085205], "compile_time": 0.1535880146548152, "verification_time": 0, "benchmark_time": 151.28522098530084, "strategy_time": 0, "framework_time": 78.73557799030095, "timestamp": "2023-01-29 03:49:35.156555+00:00"},
"2,32,15,15,0,1,1,1": {"block_size_x": 2, "block_size_y": 32, "filter_height": 15, "filter_width": 15, "read_only": 0, "tile_size_x": 1, "tile_size_y": 1, "use_padding": 1, "time": 2.6762688398361205, "times": [2.6808319091796875, 2.676608085632324, 2.6746881008148193, 2.6760001182556152, 2.6756479740142822, 2.6761279106140137, 2.6746881008148193, 2.6767361164093018, 2.6761600971221924, 2.6751999855041504], "compile_time": 202.40493898745626, "verification_time": 0, "benchmark_time": 27.177844021935016, "strategy_time": 0, "framework_time": 0.48760598292574286, "timestamp": "2023-01-29 03:49:35.386652+00:00"},
"2,32,15,15,0,1,2,0": {"block_size_x": 2, "block_size_y": 32, "filter_height": 15, "filter_width": 15, "read_only": 0, "tile_size_x": 1, "tile_size_y": 2, "use_padding": 0, "time": 14.647449493408203, "times": [14.653535842895508, 14.65129566192627, 14.64681625366211, 14.645024299621582, 14.645631790161133, 14.648320198059082, 14.646944046020508, 14.647551536560059, 14.645183563232422, 14.64419174194336], "compile_time": 357.7431730227545, "verification_time": 0, "benchmark_time": 146.8283620197326, "strategy_time": 0, "framework_time": 0.5586349871009588, "timestamp": "2023-01-29 03:49:35.891805+00:00"},
"2,32,15,15,0,1,2,1": {"block_size_x": 2, "block_size_y": 32, "filter_height": 15, "filter_width": 15, "read_only": 0, "tile_size_x": 1, "tile_size_y": 2, "use_padding": 1, "time": 2.561423969268799, "times": [2.572256088256836, 2.5589439868927, 2.558624029159546, 2.5585598945617676, 2.559839963912964, 2.559391975402832, 2.559999942779541, 2.559999942779541, 2.5607359409332275, 2.565887928009033], "compile_time": 359.06523204175755, "verification_time": 0, "benchmark_time": 26.174283993896097, "strategy_time": 0, "framework_time": 0.5734149599447846, "timestamp": "2023-01-29 03:49:36.277642+00:00"},
"2,32,15,15,0,1,3,0": {"block_size_x": 2, "block_size_y": 32, "filter_height": 15, "filter_width": 15, "read_only": 0, "tile_size_x": 1, "tile_size_y": 3, "use_padding": 0, "time": 14.639558410644531, "times": [14.646207809448242, 14.645248413085938, 14.639103889465332, 14.641887664794922, 14.637280464172363, 14.638239860534668, 14.635007858276367, 14.637056350708008, 14.638175964355469, 14.637375831604004], "compile_time": 589.8197729839012, "verification_time": 0, "benchmark_time": 146.85001299949363, "strategy_time": 0, "framework_time": 0.5880940007045865, "timestamp": "2023-01-29 03:49:37.014923+00:00"},
"2,32,15,15,0,1,3,1": {"block_size_x": 2, "block_size_y": 32, "filter_height": 15, "filter_width": 15, "read_only": 0, "tile_size_x": 1, "tile_size_y": 3, "use_padding": 1, "time": 2.502076768875122, "times": [2.506432056427002, 2.5015039443969727, 2.5021119117736816, 2.502271890640259, 2.5012800693511963, 2.5018560886383057, 2.5019519329071045, 2.500607967376709, 2.500767946243286, 2.501983880996704], "compile_time": 589.7378039662726, "verification_time": 0, "benchmark_time": 25.541060022078454, "strategy_time": 0, "framework_time": 0.636184005998075, "timestamp": "2023-01-29 03:49:37.630861+00:00"},
"2,32,15,15,0,1,4,0": {"block_size_x": 2, "block_size_y": 32, "filter_height": 15, "filter_width": 15, "read_only": 0, "tile_size_x": 1, "tile_size_y": 4, "use_padding": 0, "time": 21.01640625, "times": [21.028127670288086, 21.013471603393555, 21.022720336914062, 21.010623931884766, 21.01043128967285, 21.01888084411621, 21.020671844482422, 21.010751724243164, 21.01875114440918, 21.009632110595703], "compile_time": 870.0216080178507, "verification_time": 0, "benchmark_time": 210.6827039970085, "strategy_time": 0, "framework_time": 0.6619339692406356, "timestamp": "2023-01-29 03:49:38.712251+00:00"},
"2,32,15,15,0,1,4,1": {"block_size_x": 2, "block_size_y": 32, "filter_height": 15, "filter_width": 15, "read_only": 0, "tile_size_x": 1, "tile_size_y": 4, "use_padding": 1, "time": 2.529097628593445, "times": [2.5338239669799805, 2.521984100341797, 2.5254719257354736, 2.535423994064331, 2.5346879959106445, 2.5294721126556396, 2.5268800258636475, 2.530816078186035, 2.529344081878662, 2.5230720043182373], "compile_time": 870.7811639760621, "verification_time": 0, "benchmark_time": 25.77160601504147, "strategy_time": 0, "framework_time": 0.6726740393787622, "timestamp": "2023-01-29 03:49:39.609500+00:00"},
"2,32,15,15,0,1,5,0": {"block_size_x": 2, "block_size_y": 32, "filter_height": 15, "filter_width": 15, "read_only": 0, "tile_size_x": 1, "tile_size_y": 5, "use_padding": 0, "time": 20.327177619934083, "times": [21.245952606201172, 21.237407684326172, 21.227359771728516, 21.24140739440918, 21.23904037475586, 21.238496780395508, 21.236608505249023, 21.23801612854004, 18.617855072021484, 14.749631881713867], "compile_time": 1168.94088400295, "verification_time": 0, "benchmark_time": 203.79103702725843, "strategy_time": 0, "framework_time": 0.7742539746686816, "timestamp": "2023-01-29 03:49:40.983032+00:00"},
"2,32,15,15,0,1,5,1": {"block_size_x": 2, "block_size_y": 32, "filter_height": 15, "filter_width": 15, "read_only": 0, "tile_size_x": 1, "tile_size_y": 5, "use_padding": 1, "time": 2.829187202453613, "times": [2.811392068862915, 2.8522560596466064, 2.8247039318084717, 2.8426239490509033, 2.838207960128784, 2.8241920471191406, 2.836479902267456, 2.8206400871276855, 2.830944061279297, 2.810431957244873], "compile_time": 1139.4379929988645, "verification_time": 0, "benchmark_time": 28.80459901643917, "strategy_time": 0, "framework_time": 0.702202960383147, "timestamp": "2023-01-29 03:49:42.151999+00:00"},
"2,32,15,15,0,1,6,0": {"block_size_x": 2, "block_size_y": 32, "filter_height": 15, "filter_width": 15, "read_only": 0, "tile_size_x": 1, "tile_size_y": 6, "use_padding": 0, "time": 20.139081764221192, "times": [21.50249671936035, 21.500192642211914, 21.49990463256836, 21.498336791992188, 21.49785614013672, 21.49785614013672, 21.496639251708984, 21.03113555908203, 14.989312171936035, 14.877087593078613], "compile_time": 1447.9486809577793, "verification_time": 0, "benchmark_time": 201.993272989057, "strategy_time": 0, "framework_time": 0.7309530046768486, "timestamp": "2023-01-29 03:49:43.802696+00:00"},
"2,32,15,15,0,1,6,1": {"block_size_x": 2, "block_size_y": 32, "filter_height": 15, "filter_width": 15, "read_only": 0, "tile_size_x": 1, "tile_size_y": 6, "use_padding": 1, "time": 2.7746559619903564, "times": [2.772671937942505, 2.7623679637908936, 2.789247989654541, 2.7629120349884033, 2.7632319927215576, 2.767263889312744, 2.7748799324035645, 2.7781119346618652, 2.79203200340271, 2.7838399410247803], "compile_time": 1448.4553660149686, "verification_time": 0, "benchmark_time": 28.242043976206332, "strategy_time": 0, "framework_time": 0.7079239585436881, "timestamp": "2023-01-29 03:49:45.280123+00:00"},
"2,32,15,15,0,1,7,0": {"block_size_x": 2, "block_size_y": 32, "filter_height": 15, "filter_width": 15, "read_only": 0, "tile_size_x": 1, "tile_size_y": 7, "use_padding": 0, "time": 19.784035205841064, "times": [21.651840209960938, 21.654815673828125, 21.647680282592773, 21.64735984802246, 21.6441593170166, 21.648191452026367, 21.647008895874023, 16.309152603149414, 15.015168190002441, 14.9749755859375], "compile_time": 1746.5078399982303, "verification_time": 0, "benchmark_time": 198.4196649864316, "strategy_time": 0, "framework_time": 0.5726850358769298, "timestamp": "2023-01-29 03:49:47.225642+00:00"},
"2,32,15,15,0,1,7,1": {"block_size_x": 2, "block_size_y": 32, "filter_height": 15, "filter_width": 15, "read_only": 0, "tile_size_x": 1, "tile_size_y": 7, "use_padding": 1, "time": 4.067343997955322, "times": [2.9430079460144043, 4.200863838195801, 4.178239822387695, 4.233983993530273, 4.182015895843506, 4.198400020599365, 4.1877121925354, 4.156576156616211, 4.237215995788574, 4.155424118041992], "compile_time": 1759.904759004712, "verification_time": 0, "benchmark_time": 41.275826981291175, "strategy_time": 0, "framework_time": 0.7954619941301644, "timestamp": "2023-01-29 03:49:49.027642+00:00"},
"2,32,15,15,0,1,8,0": {"block_size_x": 2, "block_size_y": 32, "filter_height": 15, "filter_width": 15, "read_only": 0, "tile_size_x": 1, "tile_size_y": 8, "use_padding": 0, "time": 20.31494731903076, "times": [20.920320510864258, 20.920320510864258, 20.89628791809082, 20.916000366210938, 20.08678436279297, 19.918848037719727, 19.918848037719727, 19.918975830078125, 19.921024322509766, 19.73206329345703], "compile_time": 2080.586915020831, "verification_time": 0, "benchmark_time": 203.62374797696248, "strategy_time": 0, "framework_time": 0.7668230100534856, "timestamp": "2023-01-29 03:49:51.312643+00:00"},
"2,32,15,15,0,1,8,1": {"block_size_x": 2, "block_size_y": 32, "filter_height": 15, "filter_width": 15, "read_only": 0, "tile_size_x": 1, "tile_size_y": 8, "use_padding": 1, "time": 7.413785600662232, "times": [7.289567947387695, 7.3072638511657715, 7.364255905151367, 7.383967876434326, 7.409855842590332, 7.468448162078857, 7.500448226928711, 7.482272148132324, 7.49567985534668, 7.43609619140625], "compile_time": 2074.8492389684543, "verification_time": 0, "benchmark_time": 74.67703497968614, "strategy_time": 0, "framework_time": 0.779372057877481, "timestamp": "2023-01-29 03:49:53.462972+00:00"},
"2,32,15,15,0,2,1,0": {"block_size_x": 2, "block_size_y": 32, "filter_height": 15, "filter_width": 15, "read_only": 0, "tile_size_x": 2, "tile_size_y": 1, "use_padding": 0, "time": 2.2609568357467653, "times": [2.2671360969543457, 2.2609920501708984, 2.2568960189819336, 2.2589759826660156, 2.257024049758911, 2.260319948196411, 2.2641921043395996, 2.2616961002349854, 2.258944034576416, 2.2633919715881348], "compile_time": 231.02583998115733, "verification_time": 0, "benchmark_time": 23.085950990207493, "strategy_time": 0, "framework_time": 0.814272032584995, "timestamp": "2023-01-29 03:49:53.717922+00:00"},
"2,32,15,15,0,2,1,1": {"block_size_x": 2, "block_size_y": 32, "filter_height": 15, "filter_width": 15, "read_only": 0, "tile_size_x": 2, "tile_size_y": 1, "use_padding": 1, "time": 2.267734432220459, "times": [2.273279905319214, 2.2688000202178955, 2.265471935272217, 2.2671360969543457, 2.266688108444214, 2.266335964202881, 2.2671360969543457, 2.268224000930786, 2.2671360969543457, 2.2671360969543457], "compile_time": 232.31753800064325, "verification_time": 0, "benchmark_time": 23.188401013612747, "strategy_time": 0, "framework_time": 0.8024129783734679, "timestamp": "2023-01-29 03:49:53.974253+00:00"},
"2,32,15,15,0,2,2,0": {"block_size_x": 2, "block_size_y": 32, "filter_height": 15, "filter_width": 15, "read_only": 0, "tile_size_x": 2, "tile_size_y": 2, "use_padding": 0, "time": 2.183567976951599, "times": [2.1913599967956543, 2.1843199729919434, 2.1818559169769287, 2.1826560497283936, 2.1811840534210205, 2.183199882507324, 2.183135986328125, 2.1823039054870605, 2.1824960708618164, 2.1831679344177246], "compile_time": 439.10542695084587, "verification_time": 0, "benchmark_time": 22.373798012267798, "strategy_time": 0, "framework_time": 0.8414420299232006, "timestamp": "2023-01-29 03:49:54.436597+00:00"},
"2,32,15,15,0,2,2,1": {"block_size_x": 2, "block_size_y": 32, "filter_height": 15, "filter_width": 15, "read_only": 0, "tile_size_x": 2, "tile_size_y": 2, "use_padding": 1, "time": 2.1900511980056763, "times": [2.1950080394744873, 2.1892800331115723, 2.189215898513794, 2.187488079071045, 2.1908481121063232, 2.189311981201172, 2.1898880004882812, 2.1903679370880127, 2.189311981201172, 2.1897919178009033], "compile_time": 439.40552399726585, "verification_time": 0, "benchmark_time": 22.380527982022613, "strategy_time": 0, "framework_time": 0.8619319996796548, "timestamp": "2023-01-29 03:49:54.899268+00:00"},
"2,32,15,15,0,2,3,0": {"block_size_x": 2, "block_size_y": 32, "filter_height": 15, "filter_width": 15, "read_only": 0, "tile_size_x": 2, "tile_size_y": 3, "use_padding": 0, "time": 2.153619170188904, "times": [2.1625280380249023, 2.151711940765381, 2.151711940765381, 2.151711940765381, 2.1526401042938232, 2.154207944869995, 2.1536319255828857, 2.1524479389190674, 2.1524479389190674, 2.1531519889831543], "compile_time": 712.921017955523, "verification_time": 0, "benchmark_time": 22.040941985324025, "strategy_time": 0, "framework_time": 0.9749910677783191, "timestamp": "2023-01-29 03:49:55.635229+00:00"},
"2,32,15,15,0,2,3,1": {"block_size_x": 2, "block_size_y": 32, "filter_height": 15, "filter_width": 15, "read_only": 0, "tile_size_x": 2, "tile_size_y": 3, "use_padding": 1, "time": 2.216972804069519, "times": [2.220128059387207, 2.2182719707489014, 2.2159359455108643, 2.21612811088562, 2.213887929916382, 2.2179839611053467, 2.2203519344329834, 2.2182400226593018, 2.214400053024292, 2.214400053024292], "compile_time": 716.7713349917904, "verification_time": 0, "benchmark_time": 22.657424968201667, "strategy_time": 0, "framework_time": 0.8838120265863836, "timestamp": "2023-01-29 03:49:56.375566+00:00"},
"2,32,15,15,0,2,4,0": {"block_size_x": 2, "block_size_y": 32, "filter_height": 15, "filter_width": 15, "read_only": 0, "tile_size_x": 2, "tile_size_y": 4, "use_padding": 0, "time": 2.145424008369446, "times": [2.1526401042938232, 2.1458239555358887, 2.144063949584961, 2.142944097518921, 2.1410560607910156, 2.144927978515625, 2.1446399688720703, 2.1454720497131348, 2.14630389213562, 2.1463680267333984], "compile_time": 1002.2620019735768, "verification_time": 0, "benchmark_time": 21.99827099684626, "strategy_time": 0, "framework_time": 0.9044420439749956, "timestamp": "2023-01-29 03:49:57.400754+00:00"},
"2,32,15,15,0,2,4,1": {"block_size_x": 2, "block_size_y": 32, "filter_height": 15, "filter_width": 15, "read_only": 0, "tile_size_x": 2, "tile_size_y": 4, "use_padding": 1, "time": 2.211724781990051, "times": [2.220031976699829, 2.2198081016540527, 2.213887929916382, 2.207200050354004, 2.2077438831329346, 2.2038400173187256, 2.206048011779785, 2.216383934020996, 2.2118399143218994, 2.2104640007019043], "compile_time": 1003.2724019838497, "verification_time": 0, "benchmark_time": 22.67575595760718, "strategy_time": 0, "framework_time": 0.9620310738682747, "timestamp": "2023-01-29 03:49:58.427688+00:00"},
"2,32,15,15,0,2,5,0": {"block_size_x": 2, "block_size_y": 32, "filter_height": 15, "filter_width": 15, "read_only": 0, "tile_size_x": 2, "tile_size_y": 5, "use_padding": 0, "time": 2.276268792152405, "times": [2.2886080741882324, 2.2778239250183105, 2.2753279209136963, 2.276992082595825, 2.2705600261688232, 2.2712318897247314, 2.270656108856201, 2.2773759365081787, 2.2788479328155518, 2.275264024734497], "compile_time": 1315.271430008579, "verification_time": 0, "benchmark_time": 23.280929948668927, "strategy_time": 0, "framework_time": 0.9676710469648242, "timestamp": "2023-01-29 03:49:59.767231+00:00"},
"2,32,15,15,0,2,5,1": {"block_size_x": 2, "block_size_y": 32, "filter_height": 15, "filter_width": 15, "read_only": 0, "tile_size_x": 2, "tile_size_y": 5, "use_padding": 1, "time": 3.097331190109253, "times": [3.106816053390503, 3.0919361114501953, 3.0924479961395264, 3.1034560203552246, 3.0891199111938477, 3.0945279598236084, 3.109503984451294, 3.100543975830078, 3.1006720066070557, 3.0842878818511963], "compile_time": 1317.636838008184, "verification_time": 0, "benchmark_time": 31.551694963127375, "strategy_time": 0, "framework_time": 0.984991027507931, "timestamp": "2023-01-29 03:50:01.117429+00:00"},
"2,32,15,15,0,2,6,0": {"block_size_x": 2, "block_size_y": 32, "filter_height": 15, "filter_width": 15, "read_only": 0, "tile_size_x": 2, "tile_size_y": 6, "use_padding": 0, "time": 2.348102402687073, "times": [2.3515520095825195, 2.343519926071167, 2.349152088165283, 2.3488640785217285, 2.3469760417938232, 2.3520638942718506, 2.3449599742889404, 2.3499200344085693, 2.3408639430999756, 2.35315203666687], "compile_time": 1639.569755003322, "verification_time": 0, "benchmark_time": 24.069302948191762, "strategy_time": 0, "framework_time": 1.0030500125139952, "timestamp": "2023-01-29 03:50:02.782095+00:00"},
"2,32,15,15,0,2,6,1": {"block_size_x": 2, "block_size_y": 32, "filter_height": 15, "filter_width": 15, "read_only": 0, "tile_size_x": 2, "tile_size_y": 6, "use_padding": 1, "time": 3.3899103879928587, "times": [3.3975679874420166, 3.3839359283447266, 3.3893439769744873, 3.3957440853118896, 3.3853440284729004, 3.3956799507141113, 3.3969919681549072, 3.3843839168548584, 3.3813440799713135, 3.388767957687378], "compile_time": 1646.1418860126287, "verification_time": 0, "benchmark_time": 34.47341802529991, "strategy_time": 0, "framework_time": 1.0214009671472013, "timestamp": "2023-01-29 03:50:04.463755+00:00"},
"2,32,15,15,0,2,7,0": {"block_size_x": 2, "block_size_y": 32, "filter_height": 15, "filter_width": 15, "read_only": 0, "tile_size_x": 2, "tile_size_y": 7, "use_padding": 0, "time": 2.6703808307647705, "times": [2.6789441108703613, 2.6702721118927, 2.6664960384368896, 2.668544054031372, 2.669055938720703, 2.6705920696258545, 2.6696319580078125, 2.6700479984283447, 2.6685760021209717, 2.6716480255126953], "compile_time": 1974.7729820082895, "verification_time": 0, "benchmark_time": 27.179903991054744, "strategy_time": 0, "framework_time": 1.05254101799801, "timestamp": "2023-01-29 03:50:06.466784+00:00"},
"2,32,15,15,0,2,7,1": {"block_size_x": 2, "block_size_y": 32, "filter_height": 15, "filter_width": 15, "read_only": 0, "tile_size_x": 2, "tile_size_y": 7, "use_padding": 1, "time": 3.5307487726211546, "times": [3.553215980529785, 3.5246078968048096, 3.5191359519958496, 3.530751943588257, 3.5523200035095215, 3.5263679027557373, 3.5309441089630127, 3.5265920162200928, 3.5287039279937744, 3.514847993850708], "compile_time": 1978.5907469922677, "verification_time": 0, "benchmark_time": 35.88037600275129, "strategy_time": 0, "framework_time": 1.0171000030823052, "timestamp": "2023-01-29 03:50:08.482296+00:00"},
"2,32,15,15,0,2,8,0": {"block_size_x": 2, "block_size_y": 32, "filter_height": 15, "filter_width": 15, "read_only": 0, "tile_size_x": 2, "tile_size_y": 8, "use_padding": 0, "time": 2.6228415727615357, "times": [2.6329920291900635, 2.6214399337768555, 2.621407985687256, 2.6214399337768555, 2.620192050933838, 2.6197760105133057, 2.623647928237915, 2.622623920440674, 2.621407985687256, 2.623487949371338], "compile_time": 2189.2388699925505, "verification_time": 0, "benchmark_time": 26.701710012275726, "strategy_time": 0, "framework_time": 1.0700399870984256, "timestamp": "2023-01-29 03:50:10.699331+00:00"},
"2,32,15,15,0,2,8,1": {"block_size_x": 2, "block_size_y": 32, "filter_height": 15, "filter_width": 15, "read_only": 0, "tile_size_x": 2, "tile_size_y": 8, "use_padding": 1, "time": 6.5891039848327635, "times": [6.586336135864258, 6.586368083953857, 6.5879998207092285, 6.5854082107543945, 6.591263771057129, 6.594143867492676, 6.587615966796875, 6.588831901550293, 6.593791961669922, 6.589280128479004], "compile_time": 2182.909345952794, "verification_time": 0, "benchmark_time": 66.48284901166335, "strategy_time": 0, "framework_time": 1.2113300617784262, "timestamp": "2023-01-29 03:50:12.949961+00:00"},
"2,32,15,15,0,3,1,0": {"block_size_x": 2, "block_size_y": 32, "filter_height": 15, "filter_width": 15, "read_only": 0, "tile_size_x": 3, "tile_size_y": 1, "use_padding": 0, "time": 2.793644833564758, "times": [2.797919988632202, 2.7922561168670654, 2.793440103530884, 2.7928318977355957, 2.7924160957336426, 2.7944960594177246, 2.792543888092041, 2.793600082397461, 2.7934720516204834, 2.7934720516204834], "compile_time": 268.8129360321909, "verification_time": 0, "benchmark_time": 28.505314025096595, "strategy_time": 0, "framework_time": 1.202748971991241, "timestamp": "2023-01-29 03:50:13.248505+00:00"},
"2,32,15,15,0,3,1,1": {"block_size_x": 2, "block_size_y": 32, "filter_height": 15, "filter_width": 15, "read_only": 0, "tile_size_x": 3, "tile_size_y": 1, "use_padding": 1, "time": 1.7492703914642334, "times": [1.7553600072860718, 1.7503039836883545, 1.7489919662475586, 1.7469439506530762, 1.7484480142593384, 1.7473280429840088, 1.7489919662475586, 1.7489919662475586, 1.7489919662475586, 1.74835205078125], "compile_time": 269.2549319472164, "verification_time": 0, "benchmark_time": 18.126606999430805, "strategy_time": 0, "framework_time": 1.0859800386242568, "timestamp": "2023-01-29 03:50:13.536996+00:00"},
"2,32,15,15,0,3,2,0": {"block_size_x": 2, "block_size_y": 32, "filter_height": 15, "filter_width": 15, "read_only": 0, "tile_size_x": 3, "tile_size_y": 2, "use_padding": 0, "time": 2.7115679502487184, "times": [2.723520040512085, 2.7106239795684814, 2.7095038890838623, 2.7095038890838623, 2.7109758853912354, 2.7095038890838623, 2.7109439373016357, 2.7096641063690186, 2.711359977722168, 2.7100799083709717], "compile_time": 525.0938379904255, "verification_time": 0, "benchmark_time": 27.62805001111701, "strategy_time": 0, "framework_time": 1.1171199730597436, "timestamp": "2023-01-29 03:50:14.090859+00:00"},
"2,32,15,15,0,3,2,1": {"block_size_x": 2, "block_size_y": 32, "filter_height": 15, "filter_width": 15, "read_only": 0, "tile_size_x": 3, "tile_size_y": 2, "use_padding": 1, "time": 1.6944607853889466, "times": [1.7003840208053589, 1.6936960220336914, 1.693727970123291, 1.691648006439209, 1.6943999528884888, 1.6936960220336914, 1.6936639547348022, 1.6937919855117798, 1.6953599452972412, 1.6942399740219116], "compile_time": 531.0684940195642, "verification_time": 0, "benchmark_time": 17.530482029542327, "strategy_time": 0, "framework_time": 1.1082899291068316, "timestamp": "2023-01-29 03:50:14.640590+00:00"},
"2,32,15,15,0,3,3,0": {"block_size_x": 2, "block_size_y": 32, "filter_height": 15, "filter_width": 15, "read_only": 0, "tile_size_x": 3, "tile_size_y": 3, "use_padding": 0, "time": 2.7046016216278077, "times": [2.709088087081909, 2.7048959732055664, 2.702687978744507, 2.703360080718994, 2.704224109649658, 2.7046399116516113, 2.705471992492676, 2.7040960788726807, 2.703360080718994, 2.7041919231414795], "compile_time": 824.7205559746362, "verification_time": 0, "benchmark_time": 27.589322009589523, "strategy_time": 0, "framework_time": 1.166139030829072, "timestamp": "2023-01-29 03:50:15.494089+00:00"},
"2,32,15,15,0,3,3,1": {"block_size_x": 2, "block_size_y": 32, "filter_height": 15, "filter_width": 15, "read_only": 0, "tile_size_x": 3, "tile_size_y": 3, "use_padding": 1, "time": 1.8355072140693665, "times": [1.8370239734649658, 1.8355200290679932, 1.8364160060882568, 1.8330880403518677, 1.838271975517273, 1.8310400247573853, 1.8335360288619995, 1.8391040563583374, 1.8336000442504883, 1.8374719619750977], "compile_time": 826.8602970056236, "verification_time": 0, "benchmark_time": 18.85657903039828, "strategy_time": 0, "framework_time": 1.1690699611790478, "timestamp": "2023-01-29 03:50:16.341000+00:00"},
"2,32,15,15,0,3,4,0": {"block_size_x": 2, "block_size_y": 32, "filter_height": 15, "filter_width": 15, "read_only": 0, "tile_size_x": 3, "tile_size_y": 4, "use_padding": 0, "time": 2.717072010040283, "times": [2.7197439670562744, 2.7156479358673096, 2.714240074157715, 2.714848041534424, 2.7156479358673096, 2.722304105758667, 2.717695951461792, 2.7156479358673096, 2.7183361053466797, 2.7166080474853516], "compile_time": 1152.2426339797676, "verification_time": 0, "benchmark_time": 27.730578964110464, "strategy_time": 0, "framework_time": 1.3163780677132308, "timestamp": "2023-01-29 03:50:17.522314+00:00"},
"2,32,15,15,0,3,4,1": {"block_size_x": 2, "block_size_y": 32, "filter_height": 15, "filter_width": 15, "read_only": 0, "tile_size_x": 3, "tile_size_y": 4, "use_padding": 1, "time": 2.2043263912200928, "times": [2.2138240337371826, 2.2013120651245117, 2.2016000747680664, 2.2022719383239746, 2.201472043991089, 2.2056639194488525, 2.2077438831329346, 2.2047359943389893, 2.2034239768981934, 2.201215982437134], "compile_time": 1157.669662963599, "verification_time": 0, "benchmark_time": 22.656895976979285, "strategy_time": 0, "framework_time": 1.1846490669995546, "timestamp": "2023-01-29 03:50:18.703848+00:00"},
"2,32,15,15,0,3,5,0": {"block_size_x": 2, "block_size_y": 32, "filter_height": 15, "filter_width": 15, "read_only": 0, "tile_size_x": 3, "tile_size_y": 5, "use_padding": 0, "time": 2.8355551958084106, "times": [2.845855951309204, 2.8400321006774902, 2.831648111343384, 2.833695888519287, 2.830591917037964, 2.8320960998535156, 2.8363840579986572, 2.836479902267456, 2.8385279178619385, 2.83024001121521], "compile_time": 1494.1112689557485, "verification_time": 0, "benchmark_time": 28.873767994809896, "strategy_time": 0, "framework_time": 1.2628090335056186, "timestamp": "2023-01-29 03:50:20.228119+00:00"},
"2,32,15,15,0,3,5,1": {"block_size_x": 2, "block_size_y": 32, "filter_height": 15, "filter_width": 15, "read_only": 0, "tile_size_x": 3, "tile_size_y": 5, "use_padding": 1, "time": 3.1108447790145872, "times": [3.1182079315185547, 3.117055892944336, 3.1053760051727295, 3.117055892944336, 3.1109120845794678, 3.105760097503662, 3.099071979522705, 3.105695962905884, 3.110879898071289, 3.11843204498291], "compile_time": 1501.5830530319363, "verification_time": 0, "benchmark_time": 31.644692993722856, "strategy_time": 0, "framework_time": 1.2331890175119042, "timestamp": "2023-01-29 03:50:21.762603+00:00"},
"2,32,15,15,0,3,6,0": {"block_size_x": 2, "block_size_y": 32, "filter_height": 15, "filter_width": 15, "read_only": 0, "tile_size_x": 3, "tile_size_y": 6, "use_padding": 0, "time": 3.016051197052002, "times": [3.008863925933838, 2.9921600818634033, 3.0310399532318115, 3.002592086791992, 3.0035200119018555, 3.0343360900878906, 3.03769588470459, 3.019455909729004, 3.008512020111084, 3.022336006164551], "compile_time": 1871.1457579629496, "verification_time": 0, "benchmark_time": 30.67732200725004, "strategy_time": 0, "framework_time": 1.2519080191850662, "timestamp": "2023-01-29 03:50:23.665702+00:00"},
"2,32,15,15,0,3,6,1": {"block_size_x": 2, "block_size_y": 32, "filter_height": 15, "filter_width": 15, "read_only": 0, "tile_size_x": 3, "tile_size_y": 6, "use_padding": 1, "time": 3.135523200035095, "times": [3.1334400177001953, 3.1410560607910156, 3.133280038833618, 3.1354880332946777, 3.1342079639434814, 3.14572811126709, 3.1292479038238525, 3.1296639442443848, 3.1252479553222656, 3.147871971130371], "compile_time": 1871.8721690238453, "verification_time": 0, "benchmark_time": 31.849762017372996, "strategy_time": 0, "framework_time": 1.2642289511859417, "timestamp": "2023-01-29 03:50:25.570711+00:00"},
"2,32,15,15,0,3,7,0": {"block_size_x": 2, "block_size_y": 32, "filter_height": 15, "filter_width": 15, "read_only": 0, "tile_size_x": 3, "tile_size_y": 7, "use_padding": 0, "time": 3.077616024017334, "times": [3.092384099960327, 3.085952043533325, 3.0570878982543945, 3.092576026916504, 3.078144073486328, 3.0857279300689697, 3.0749120712280273, 3.1053121089935303, 3.067903995513916, 3.0361599922180176], "compile_time": 2264.3929480109364, "verification_time": 0, "benchmark_time": 31.380795990116894, "strategy_time": 0, "framework_time": 1.271439017727971, "timestamp": "2023-01-29 03:50:27.867780+00:00"},
"2,32,15,15,0,3,7,1": {"block_size_x": 2, "block_size_y": 32, "filter_height": 15, "filter_width": 15, "read_only": 0, "tile_size_x": 3, "tile_size_y": 7, "use_padding": 1, "time": 3.1708192348480226, "times": [3.1744000911712646, 3.169696092605591, 3.169408082962036, 3.1819519996643066, 3.1743040084838867, 3.166208028793335, 3.170815944671631, 3.158143997192383, 3.172800064086914, 3.170464038848877], "compile_time": 2266.1647709901445, "verification_time": 0, "benchmark_time": 32.255826983600855, "strategy_time": 0, "framework_time": 1.3290680362842977, "timestamp": "2023-01-29 03:50:30.167554+00:00"},
"2,32,15,15,0,3,8,0": {"block_size_x": 2, "block_size_y": 32, "filter_height": 15, "filter_width": 15, "read_only": 0, "tile_size_x": 3, "tile_size_y": 8, "use_padding": 0, "time": 2.7568479776382446, "times": [2.7636160850524902, 2.7443199157714844, 2.7589759826660156, 2.7369918823242188, 2.7710399627685547, 2.7750399112701416, 2.7501440048217773, 2.7674560546875, 2.7565760612487793, 2.7443199157714844], "compile_time": 573.2145730289631, "verification_time": 0, "benchmark_time": 28.168754011858255, "strategy_time": 0, "framework_time": 1.3665689621120691, "timestamp": "2023-01-29 03:50:30.770328+00:00"},
"2,32,15,15,0,3,8,1": {"block_size_x": 2, "block_size_y": 32, "filter_height": 15, "filter_width": 15, "read_only": 0, "tile_size_x": 3, "tile_size_y": 8, "use_padding": 1, "time": 4.554316759109497, "times": [4.578752040863037, 4.610943794250488, 4.572512149810791, 4.553887844085693, 4.578335762023926, 4.5590081214904785, 4.494304180145264, 4.460351943969727, 4.562943935394287, 4.572127819061279], "compile_time": 561.1079519730993, "verification_time": 0, "benchmark_time": 46.063134039286524, "strategy_time": 0, "framework_time": 1.3411580002866685, "timestamp": "2023-01-29 03:50:31.378864+00:00"},
"2,32,15,15,0,4,1,0": {"block_size_x": 2, "block_size_y": 32, "filter_height": 15, "filter_width": 15, "read_only": 0, "tile_size_x": 4, "tile_size_y": 1, "use_padding": 0, "time": 1.4907007932662963, "times": [1.499295949935913, 1.4909440279006958, 1.4892799854278564, 1.4892799854278564, 1.4888960123062134, 1.488703966140747, 1.4909440279006958, 1.4892799854278564, 1.4911680221557617, 1.4892159700393677], "compile_time": 300.49564002547413, "verification_time": 0, "benchmark_time": 15.42000100016594, "strategy_time": 0, "framework_time": 1.325008925050497, "timestamp": "2023-01-29 03:50:31.696128+00:00"},
"2,32,15,15,0,4,1,1": {"block_size_x": 2, "block_size_y": 32, "filter_height": 15, "filter_width": 15, "read_only": 0, "tile_size_x": 4, "tile_size_y": 1, "use_padding": 1, "time": 1.4969184041023254, "times": [1.509376049041748, 1.4946880340576172, 1.4964159727096558, 1.4950400590896606, 1.4939839839935303, 1.4939199686050415, 1.4972800016403198, 1.4968960285186768, 1.4952960014343262, 1.4962879419326782], "compile_time": 300.4760499461554, "verification_time": 0, "benchmark_time": 15.439210983458906, "strategy_time": 0, "framework_time": 1.5458851121366024, "timestamp": "2023-01-29 03:50:32.013614+00:00"},
"2,32,15,15,0,4,2,0": {"block_size_x": 2, "block_size_y": 32, "filter_height": 15, "filter_width": 15, "read_only": 0, "tile_size_x": 4, "tile_size_y": 2, "use_padding": 0, "time": 1.4262751936912537, "times": [1.4335999488830566, 1.426144003868103, 1.4249919652938843, 1.4254080057144165, 1.426975965499878, 1.4261120557785034, 1.4254080057144165, 1.4248000383377075, 1.4239039421081543, 1.4254080057144165], "compile_time": 597.23934403155, "verification_time": 0, "benchmark_time": 14.822996046859771, "strategy_time": 0, "framework_time": 1.5329269226640463, "timestamp": "2023-01-29 03:50:32.627235+00:00"},
"2,32,15,15,0,4,2,1": {"block_size_x": 2, "block_size_y": 32, "filter_height": 15, "filter_width": 15, "read_only": 0, "tile_size_x": 4, "tile_size_y": 2, "use_padding": 1, "time": 1.426265585422516, "times": [1.4336639642715454, 1.4247039556503296, 1.423807978630066, 1.4262399673461914, 1.4276479482650757, 1.4267840385437012, 1.4254080057144165, 1.4235199689865112, 1.4268159866333008, 1.424064040184021], "compile_time": 594.985754985828, "verification_time": 0, "benchmark_time": 14.721376996021718, "strategy_time": 0, "framework_time": 1.462597050704062, "timestamp": "2023-01-29 03:50:33.238428+00:00"},
"2,32,15,15,0,4,3,0": {"block_size_x": 2, "block_size_y": 32, "filter_height": 15, "filter_width": 15, "read_only": 0, "tile_size_x": 4, "tile_size_y": 3, "use_padding": 0, "time": 1.5204895973205566, "times": [1.5304960012435913, 1.5136640071868896, 1.5134079456329346, 1.5257600545883179, 1.5175679922103882, 1.52566397190094, 1.520416021347046, 1.522655963897705, 1.5217920541763306, 1.5134719610214233], "compile_time": 944.383463007398, "verification_time": 0, "benchmark_time": 15.862486034166068, "strategy_time": 0, "framework_time": 1.449917966965586, "timestamp": "2023-01-29 03:50:34.200147+00:00"},
"2,32,15,15,0,4,3,1": {"block_size_x": 2, "block_size_y": 32, "filter_height": 15, "filter_width": 15, "read_only": 0, "tile_size_x": 4, "tile_size_y": 3, "use_padding": 1, "time": 1.719327986240387, "times": [1.7203199863433838, 1.7151039838790894, 1.7159359455108643, 1.7203199863433838, 1.7182719707489014, 1.7200000286102295, 1.7239680290222168, 1.7203199863433838, 1.7182719707489014, 1.7207679748535156], "compile_time": 943.171153019648, "verification_time": 0, "benchmark_time": 17.671889974735677, "strategy_time": 0, "framework_time": 1.4967070310376585, "timestamp": "2023-01-29 03:50:35.162511+00:00"},
"2,32,15,15,0,4,4,0": {"block_size_x": 2, "block_size_y": 32, "filter_height": 15, "filter_width": 15, "read_only": 0, "tile_size_x": 4, "tile_size_y": 4, "use_padding": 0, "time": 1.7019808053970338, "times": [1.703935980796814, 1.7080960273742676, 1.703104019165039, 1.7071360349655151, 1.7055360078811646, 1.7095040082931519, 1.6941440105438232, 1.6947519779205322, 1.6904319524765015, 1.7031680345535278], "compile_time": 1325.7557920296676, "verification_time": 0, "benchmark_time": 17.51169201452285, "strategy_time": 0, "framework_time": 1.4886559802107513, "timestamp": "2023-01-29 03:50:36.507291+00:00"},
"2,32,15,15,0,4,4,1": {"block_size_x": 2, "block_size_y": 32, "filter_height": 15, "filter_width": 15, "read_only": 0, "tile_size_x": 4, "tile_size_y": 4, "use_padding": 1, "time": 2.1619903802871705, "times": [2.1690878868103027, 2.1570560932159424, 2.158911943435669, 2.162400007247925, 2.1600000858306885, 2.1613759994506836, 2.1606719493865967, 2.1658239364624023, 2.163935899734497, 2.160640001296997], "compile_time": 1321.5157590457238, "verification_time": 0, "benchmark_time": 22.132720972876996, "strategy_time": 0, "framework_time": 1.5550959506072104, "timestamp": "2023-01-29 03:50:37.852518+00:00"},
"2,32,15,15,0,4,5,0": {"block_size_x": 2, "block_size_y": 32, "filter_height": 15, "filter_width": 15, "read_only": 0, "tile_size_x": 4, "tile_size_y": 5, "use_padding": 0, "time": 1.8129599928855895, "times": [1.8279680013656616, 1.8112640380859375, 1.814527988433838, 1.8108799457550049, 1.8170559406280518, 1.8063360452651978, 1.807487964630127, 1.8075519800186157, 1.8142399787902832, 1.8122880458831787], "compile_time": 1719.7973349830136, "verification_time": 0, "benchmark_time": 18.682611000258476, "strategy_time": 0, "framework_time": 1.6780850128270686, "timestamp": "2023-01-29 03:50:39.592701+00:00"},
"2,32,15,15,0,4,5,1": {"block_size_x": 2, "block_size_y": 32, "filter_height": 15, "filter_width": 15, "read_only": 0, "tile_size_x": 4, "tile_size_y": 5, "use_padding": 1, "time": 2.9330496072769163, "times": [2.9409279823303223, 2.9233920574188232, 2.925856113433838, 2.9498560428619385, 2.9202558994293213, 2.9377601146698, 2.9368319511413574, 2.924639940261841, 2.937567949295044, 2.93340802192688], "compile_time": 1725.0325780478306, "verification_time": 0, "benchmark_time": 30.017187993507832, "strategy_time": 0, "framework_time": 1.5668059349991381, "timestamp": "2023-01-29 03:50:41.349341+00:00"},
"2,32,15,15,0,4,6,0": {"block_size_x": 2, "block_size_y": 32, "filter_height": 15, "filter_width": 15, "read_only": 0, "tile_size_x": 4, "tile_size_y": 6, "use_padding": 0, "time": 1.932851219177246, "times": [1.939743995666504, 1.931264042854309, 1.931264042854309, 1.9348160028457642, 1.9281280040740967, 1.931264042854309, 1.934432029724121, 1.9317439794540405, 1.9325439929962158, 1.9333120584487915], "compile_time": 486.0311300144531, "verification_time": 0, "benchmark_time": 19.859410997014493, "strategy_time": 0, "framework_time": 1.5131160034798086, "timestamp": "2023-01-29 03:50:41.856768+00:00"},
"2,32,15,15,0,4,6,1": {"block_size_x": 2, "block_size_y": 32, "filter_height": 15, "filter_width": 15, "read_only": 0, "tile_size_x": 4, "tile_size_y": 6, "use_padding": 1, "time": 2.3408799886703493, "times": [2.3491199016571045, 2.3426880836486816, 2.3412160873413086, 2.3383359909057617, 2.3408639430999756, 2.339871883392334, 2.341856002807617, 2.3469760417938232, 2.3303680419921875, 2.3375039100646973], "compile_time": 489.6098679746501, "verification_time": 0, "benchmark_time": 23.876174993347377, "strategy_time": 0, "framework_time": 1.554476039018482, "timestamp": "2023-01-29 03:50:42.371832+00:00"},
"2,32,15,15,0,4,7,0": {"block_size_x": 2, "block_size_y": 32, "filter_height": 15, "filter_width": 15, "read_only": 0, "tile_size_x": 4, "tile_size_y": 7, "use_padding": 0, "time": 1.984774398803711, "times": [1.994752049446106, 1.984768033027649, 1.9804160594940186, 1.9909119606018066, 1.9914239645004272, 1.978335976600647, 1.986624002456665, 1.983199954032898, 1.978111982345581, 1.979200005531311], "compile_time": 585.8308770111762, "verification_time": 0, "benchmark_time": 20.414946018718183, "strategy_time": 0, "framework_time": 1.5632049762643874, "timestamp": "2023-01-29 03:50:42.979664+00:00"},
"2,32,15,15,0,4,7,1": {"block_size_x": 2, "block_size_y": 32, "filter_height": 15, "filter_width": 15, "read_only": 0, "tile_size_x": 4, "tile_size_y": 7, "use_padding": 1, "time": 2.4526592254638673, "times": [2.4551360607147217, 2.451456069946289, 2.446336030960083, 2.455199956893921, 2.4471359252929688, 2.4494080543518066, 2.4494080543518066, 2.4614720344543457, 2.4573121070861816, 2.453727960586548], "compile_time": 589.5729530020617, "verification_time": 0, "benchmark_time": 25.107933033723384, "strategy_time": 0, "framework_time": 1.8014739616774023, "timestamp": "2023-01-29 03:50:43.596171+00:00"},
"2,32,15,15,0,5,1,0": {"block_size_x": 2, "block_size_y": 32, "filter_height": 15, "filter_width": 15, "read_only": 0, "tile_size_x": 5, "tile_size_y": 1, "use_padding": 0, "time": 3.6280703783035277, "times": [3.6368319988250732, 3.62719988822937, 3.626847982406616, 3.6268160343170166, 3.6267199516296387, 3.6267199516296387, 3.6270079612731934, 3.626847982406616, 3.628416061401367, 3.627295970916748], "compile_time": 341.8534559896216, "verification_time": 0, "benchmark_time": 36.86033602571115, "strategy_time": 0, "framework_time": 1.7905349959619343, "timestamp": "2023-01-29 03:50:43.976699+00:00"},
"2,32,15,15,0,5,1,1": {"block_size_x": 2, "block_size_y": 32, "filter_height": 15, "filter_width": 15, "read_only": 0, "tile_size_x": 5, "tile_size_y": 1, "use_padding": 1, "time": 1.3135680079460144, "times": [1.3284480571746826, 1.3122559785842896, 1.3127679824829102, 1.3107199668884277, 1.3127679824829102, 1.3124480247497559, 1.3109439611434937, 1.3114880323410034, 1.310752034187317, 1.313088059425354], "compile_time": 341.15932194981724, "verification_time": 0, "benchmark_time": 13.603127037640661, "strategy_time": 0, "framework_time": 1.5861850115470588, "timestamp": "2023-01-29 03:50:44.333071+00:00"},
"2,32,15,15,0,5,2,0": {"block_size_x": 2, "block_size_y": 32, "filter_height": 15, "filter_width": 15, "read_only": 0, "tile_size_x": 5, "tile_size_y": 2, "use_padding": 0, "time": 3.548192048072815, "times": [3.553152084350586, 3.5481600761413574, 3.5491840839385986, 3.547136068344116, 3.547136068344116, 3.5469119548797607, 3.5457279682159424, 3.5491840839385986, 3.547136068344116, 3.548192024230957], "compile_time": 673.8883399521001, "verification_time": 0, "benchmark_time": 36.06282302644104, "strategy_time": 0, "framework_time": 1.4629880315624177, "timestamp": "2023-01-29 03:50:45.044507+00:00"},
"2,32,15,15,0,5,2,1": {"block_size_x": 2, "block_size_y": 32, "filter_height": 15, "filter_width": 15, "read_only": 0, "tile_size_x": 5, "tile_size_y": 2, "use_padding": 1, "time": 1.3029504060745238, "times": [1.312384009361267, 1.297055959701538, 1.3003840446472168, 1.3009599447250366, 1.2992000579833984, 1.2982399463653564, 1.3073920011520386, 1.309216022491455, 1.300096035003662, 1.30457603931427], "compile_time": 675.0974399619736, "verification_time": 0, "benchmark_time": 13.554837962146848, "strategy_time": 0, "framework_time": 1.5993061242625117, "timestamp": "2023-01-29 03:50:45.734782+00:00"},
"2,32,15,15,0,5,3,0": {"block_size_x": 2, "block_size_y": 32, "filter_height": 15, "filter_width": 15, "read_only": 0, "tile_size_x": 5, "tile_size_y": 3, "use_padding": 0, "time": 3.547177624702454, "times": [3.55132794380188, 3.547136068344116, 3.546560049057007, 3.545248031616211, 3.5473599433898926, 3.547136068344116, 3.5474560260772705, 3.5466880798339844, 3.5470399856567383, 3.5458240509033203], "compile_time": 1061.277622997295, "verification_time": 0, "benchmark_time": 36.102883983403444, "strategy_time": 0, "framework_time": 1.7364639788866043, "timestamp": "2023-01-29 03:50:46.833922+00:00"},
"2,32,15,15,0,5,3,1": {"block_size_x": 2, "block_size_y": 32, "filter_height": 15, "filter_width": 15, "read_only": 0, "tile_size_x": 5, "tile_size_y": 3, "use_padding": 1, "time": 1.6139807939529418, "times": [1.624511957168579, 1.6179200410842896, 1.6117759943008423, 1.621664047241211, 1.605631947517395, 1.610751986503601, 1.615455985069275, 1.6097279787063599, 1.6138240098953247, 1.6085439920425415], "compile_time": 1062.7120599965565, "verification_time": 0, "benchmark_time": 16.641219961456954, "strategy_time": 0, "framework_time": 1.664786017499864, "timestamp": "2023-01-29 03:50:47.914964+00:00"},
"2,32,15,15,0,5,4,0": {"block_size_x": 2, "block_size_y": 32, "filter_height": 15, "filter_width": 15, "read_only": 0, "tile_size_x": 5, "tile_size_y": 4, "use_padding": 0, "time": 3.5355999946594237, "times": [3.5443201065063477, 3.529952049255371, 3.5246078968048096, 3.542623996734619, 3.530751943588257, 3.536895990371704, 3.5287039279937744, 3.5361599922180176, 3.5430400371551514, 3.5389440059661865], "compile_time": 1489.9429340148345, "verification_time": 0, "benchmark_time": 35.88567505357787, "strategy_time": 0, "framework_time": 1.775143959093839, "timestamp": "2023-01-29 03:50:49.442592+00:00"},
"2,32,15,15,0,5,4,1": {"block_size_x": 2, "block_size_y": 32, "filter_height": 15, "filter_width": 15, "read_only": 0, "tile_size_x": 5, "tile_size_y": 4, "use_padding": 1, "time": 1.9666783928871154, "times": [1.9729599952697754, 1.9660799503326416, 1.972000002861023, 1.9623680114746094, 1.9722239971160889, 1.9642239809036255, 1.9654079675674438, 1.9619840383529663, 1.9620800018310547, 1.9674559831619263], "compile_time": 1492.0599749893881, "verification_time": 0, "benchmark_time": 20.239655976183712, "strategy_time": 0, "framework_time": 1.6804050537757576, "timestamp": "2023-01-29 03:50:50.956596+00:00"},
"2,32,15,15,0,5,5,0": {"block_size_x": 2, "block_size_y": 32, "filter_height": 15, "filter_width": 15, "read_only": 0, "tile_size_x": 5, "tile_size_y": 5, "use_padding": 0, "time": 3.551094388961792, "times": [3.558432102203369, 3.5492799282073975, 3.5498878955841064, 3.551071882247925, 3.550879955291748, 3.55132794380188, 3.55020809173584, 3.5509440898895264, 3.5497279167175293, 3.5491840839385986], "compile_time": 470.09546495974064, "verification_time": 0, "benchmark_time": 36.14207304781303, "strategy_time": 0, "framework_time": 1.7896139761433005, "timestamp": "2023-01-29 03:50:51.464647+00:00"},
"2,32,15,15,0,5,5,1": {"block_size_x": 2, "block_size_y": 32, "filter_height": 15, "filter_width": 15, "read_only": 0, "tile_size_x": 5, "tile_size_y": 5, "use_padding": 1, "time": 2.0073087930679323, "times": [2.0109119415283203, 2.002239942550659, 2.002624034881592, 2.000511884689331, 2.005120038986206, 2.0049920082092285, 2.010240077972412, 2.0090880393981934, 2.016864061355591, 2.010495901107788], "compile_time": 470.60010995483026, "verification_time": 0, "benchmark_time": 20.607564016245306, "strategy_time": 0, "framework_time": 1.7174650565721095, "timestamp": "2023-01-29 03:50:51.957596+00:00"},
"2,32,15,15,0,6,1,0": {"block_size_x": 2, "block_size_y": 32, "filter_height": 15, "filter_width": 15, "read_only": 0, "tile_size_x": 6, "tile_size_y": 1, "use_padding": 0, "time": 1.2180863857269286, "times": [1.228543996810913, 1.217919945716858, 1.2183040380477905, 1.2165119647979736, 1.2151999473571777, 1.2177280187606812, 1.2146879434585571, 1.216256022453308, 1.218400001525879, 1.217311978340149], "compile_time": 375.23991300258785, "verification_time": 0, "benchmark_time": 12.699835002422333, "strategy_time": 0, "framework_time": 1.738234015647322, "timestamp": "2023-01-29 03:50:52.347297+00:00"},
"2,32,15,15,0,6,1,1": {"block_size_x": 2, "block_size_y": 32, "filter_height": 15, "filter_width": 15, "read_only": 0, "tile_size_x": 6, "tile_size_y": 1, "use_padding": 1, "time": 1.218172812461853, "times": [1.2247040271759033, 1.2166080474853516, 1.2170560359954834, 1.2185280323028564, 1.218400001525879, 1.2165119647979736, 1.218559980392456, 1.2165119647979736, 1.2168960571289062, 1.217952013015747], "compile_time": 376.3934139860794, "verification_time": 0, "benchmark_time": 12.782033998519182, "strategy_time": 0, "framework_time": 1.8388930475339293, "timestamp": "2023-01-29 03:50:52.738334+00:00"},
"2,32,15,15,0,6,2,0": {"block_size_x": 2, "block_size_y": 32, "filter_height": 15, "filter_width": 15, "read_only": 0, "tile_size_x": 6, "tile_size_y": 2, "use_padding": 0, "time": 1.2688608050346375, "times": [1.2823359966278076, 1.2695679664611816, 1.269760012626648, 1.2716799974441528, 1.2595200538635254, 1.2663999795913696, 1.265663981437683, 1.2703360319137573, 1.265120029449463, 1.2682240009307861], "compile_time": 745.872868981678, "verification_time": 0, "benchmark_time": 13.306109001860023, "strategy_time": 0, "framework_time": 1.8092940445058048, "timestamp": "2023-01-29 03:50:53.499345+00:00"},
"2,32,15,15,0,6,2,1": {"block_size_x": 2, "block_size_y": 32, "filter_height": 15, "filter_width": 15, "read_only": 0, "tile_size_x": 6, "tile_size_y": 2, "use_padding": 1, "time": 1.2839967966079713, "times": [1.289471983909607, 1.2799999713897705, 1.2779840230941772, 1.2854080200195312, 1.2818880081176758, 1.2912319898605347, 1.2840960025787354, 1.284127950668335, 1.2773120403289795, 1.2884479761123657], "compile_time": 747.3916150047444, "verification_time": 0, "benchmark_time": 13.38875904912129, "strategy_time": 0, "framework_time": 1.6781839658506215, "timestamp": "2023-01-29 03:50:54.261825+00:00"},
"2,32,15,15,0,6,3,0": {"block_size_x": 2, "block_size_y": 32, "filter_height": 15, "filter_width": 15, "read_only": 0, "tile_size_x": 6, "tile_size_y": 3, "use_padding": 0, "time": 1.5411200046539306, "times": [1.554751992225647, 1.5400960445404053, 1.5369600057601929, 1.5240960121154785, 1.5482879877090454, 1.5466560125350952, 1.5298559665679932, 1.533951997756958, 1.5460480451583862, 1.550495982170105], "compile_time": 1196.3736999896355, "verification_time": 0, "benchmark_time": 15.972095949109644, "strategy_time": 0, "framework_time": 1.8767830333672464, "timestamp": "2023-01-29 03:50:55.476072+00:00"},
"2,32,15,15,0,6,3,1": {"block_size_x": 2, "block_size_y": 32, "filter_height": 15, "filter_width": 15, "read_only": 0, "tile_size_x": 6, "tile_size_y": 3, "use_padding": 1, "time": 1.6001344084739686, "times": [1.6100800037384033, 1.605504035949707, 1.6013439893722534, 1.5953919887542725, 1.5976320505142212, 1.5974400043487549, 1.5974400043487549, 1.5995839834213257, 1.59334397315979, 1.6035840511322021], "compile_time": 1184.7453659866005, "verification_time": 0, "benchmark_time": 16.521201003342867, "strategy_time": 0, "framework_time": 1.9315319950692356, "timestamp": "2023-01-29 03:50:56.679294+00:00"},
"2,32,15,15,0,6,4,0": {"block_size_x": 2, "block_size_y": 32, "filter_height": 15, "filter_width": 15, "read_only": 0, "tile_size_x": 6, "tile_size_y": 4, "use_padding": 0, "time": 1.4215680003166198, "times": [1.423359990119934, 1.415168046951294, 1.4262399673461914, 1.4136320352554321, 1.4046080112457275, 1.4172159433364868, 1.4200639724731445, 1.4218239784240723, 1.4420160055160522, 1.4315520524978638], "compile_time": 424.36017899308354, "verification_time": 0, "benchmark_time": 14.761384984012693, "strategy_time": 0, "framework_time": 1.965983014088124, "timestamp": "2023-01-29 03:50:57.120406+00:00"},
"2,32,15,15,0,6,4,1": {"block_size_x": 2, "block_size_y": 32, "filter_height": 15, "filter_width": 15, "read_only": 0, "tile_size_x": 6, "tile_size_y": 4, "use_padding": 1, "time": 1.6255360126495362, "times": [1.6346559524536133, 1.6310720443725586, 1.6204160451889038, 1.6218559741973877, 1.6216959953308105, 1.6261119842529297, 1.6340479850769043, 1.6239360570907593, 1.619968056678772, 1.6216000318527222], "compile_time": 424.17829000623897, "verification_time": 0, "benchmark_time": 16.769969020970166, "strategy_time": 0, "framework_time": 1.9371929811313748, "timestamp": "2023-01-29 03:50:57.563315+00:00"},
"2,32,15,15,0,7,1,0": {"block_size_x": 2, "block_size_y": 32, "filter_height": 15, "filter_width": 15, "read_only": 0, "tile_size_x": 7, "tile_size_y": 1, "use_padding": 0, "time": 1.7846815824508666, "times": [1.7896000146865845, 1.7839679718017578, 1.7838079929351807, 1.7838079929351807, 1.7838399410247803, 1.7839679718017578, 1.7827520370483398, 1.7840319871902466, 1.785599946975708, 1.7854399681091309], "compile_time": 406.7951379693113, "verification_time": 0, "benchmark_time": 18.33739399444312, "strategy_time": 0, "framework_time": 2.14653107104823, "timestamp": "2023-01-29 03:50:57.990618+00:00"},
"2,32,15,15,0,7,1,1": {"block_size_x": 2, "block_size_y": 32, "filter_height": 15, "filter_width": 15, "read_only": 0, "tile_size_x": 7, "tile_size_y": 1, "use_padding": 1, "time": 1.1460255980491638, "times": [1.1550719738006592, 1.1464639902114868, 1.146880030632019, 1.1435519456863403, 1.144544005393982, 1.1448960304260254, 1.1437439918518066, 1.1445759534835815, 1.1465280055999756, 1.1440000534057617], "compile_time": 410.5812240159139, "verification_time": 0, "benchmark_time": 11.980362003669143, "strategy_time": 0, "framework_time": 1.9683109712786973, "timestamp": "2023-01-29 03:50:58.415171+00:00"},
"2,32,15,15,0,7,2,0": {"block_size_x": 2, "block_size_y": 32, "filter_height": 15, "filter_width": 15, "read_only": 0, "tile_size_x": 7, "tile_size_y": 2, "use_padding": 0, "time": 1.774720013141632, "times": [1.7832000255584717, 1.7721600532531738, 1.7776639461517334, 1.7733759880065918, 1.7694720029830933, 1.776576042175293, 1.7738560438156128, 1.7715200185775757, 1.7756160497665405, 1.7737599611282349], "compile_time": 831.9925279938616, "verification_time": 0, "benchmark_time": 18.219545017927885, "strategy_time": 0, "framework_time": 1.5606459928676486, "timestamp": "2023-01-29 03:50:59.266965+00:00"},
"2,32,15,15,0,7,2,1": {"block_size_x": 2, "block_size_y": 32, "filter_height": 15, "filter_width": 15, "read_only": 0, "tile_size_x": 7, "tile_size_y": 2, "use_padding": 1, "time": 1.276579201221466, "times": [1.27292799949646, 1.278048038482666, 1.2799999713897705, 1.2756799459457397, 1.270975947380066, 1.2759040594100952, 1.2743680477142334, 1.276352047920227, 1.2815359830856323, 1.2799999713897705], "compile_time": 830.7017600163817, "verification_time": 0, "benchmark_time": 13.386599952355027, "strategy_time": 0, "framework_time": 2.009082061704248, "timestamp": "2023-01-29 03:51:00.113085+00:00"},
"2,32,15,15,0,7,3,0": {"block_size_x": 2, "block_size_y": 32, "filter_height": 15, "filter_width": 15, "read_only": 0, "tile_size_x": 7, "tile_size_y": 3, "use_padding": 0, "time": 1.9488672137260437, "times": [1.9599360227584839, 1.959007978439331, 1.9440640211105347, 1.94595205783844, 1.945631980895996, 1.9428160190582275, 1.9523839950561523, 1.9434560537338257, 1.9395840167999268, 1.955839991569519], "compile_time": 1322.7378459996544, "verification_time": 0, "benchmark_time": 19.977148971520364, "strategy_time": 0, "framework_time": 1.9943610532209277, "timestamp": "2023-01-29 03:51:01.457816+00:00"},
"2,32,15,15,0,7,3,1": {"block_size_x": 2, "block_size_y": 32, "filter_height": 15, "filter_width": 15, "read_only": 0, "tile_size_x": 7, "tile_size_y": 3, "use_padding": 1, "time": 1.5985408186912538, "times": [1.6035840511322021, 1.5991359949111938, 1.5994880199432373, 1.5912959575653076, 1.598080039024353, 1.5950080156326294, 1.6001280546188354, 1.5974400043487549, 1.5994880199432373, 1.6017600297927856], "compile_time": 1329.0780099923722, "verification_time": 0, "benchmark_time": 16.594829969108105, "strategy_time": 0, "framework_time": 2.033021009992808, "timestamp": "2023-01-29 03:51:02.805546+00:00"},
"2,32,15,15,0,7,4,0": {"block_size_x": 2, "block_size_y": 32, "filter_height": 15, "filter_width": 15, "read_only": 0, "tile_size_x": 7, "tile_size_y": 4, "use_padding": 0, "time": 1.7705663919448853, "times": [1.785856008529663, 1.7687679529190063, 1.7715200185775757, 1.7681920528411865, 1.7741119861602783, 1.7680959701538086, 1.7613120079040527, 1.7833919525146484, 1.7713279724121094, 1.7530879974365234], "compile_time": 484.9328300333582, "verification_time": 0, "benchmark_time": 18.279644020367414, "strategy_time": 0, "framework_time": 2.082330931443721, "timestamp": "2023-01-29 03:51:03.310864+00:00"},
"2,32,15,15,0,7,4,1": {"block_size_x": 2, "block_size_y": 32, "filter_height": 15, "filter_width": 15, "read_only": 0, "tile_size_x": 7, "tile_size_y": 4, "use_padding": 1, "time": 1.6479071974754333, "times": [1.6609280109405518, 1.6424959897994995, 1.6424959897994995, 1.666368007659912, 1.6318080425262451, 1.6526399850845337, 1.6411839723587036, 1.647264003753662, 1.6463040113449097, 1.6475839614868164], "compile_time": 484.1558270272799, "verification_time": 0, "benchmark_time": 17.021726991515607, "strategy_time": 0, "framework_time": 2.0991810015402734, "timestamp": "2023-01-29 03:51:03.814165+00:00"},
"2,32,15,15,0,8,1,0": {"block_size_x": 2, "block_size_y": 32, "filter_height": 15, "filter_width": 15, "read_only": 0, "tile_size_x": 8, "tile_size_y": 1, "use_padding": 0, "time": 1.1074591994285583, "times": [1.1182080507278442, 1.1079679727554321, 1.1078720092773438, 1.1059199571609497, 1.1059199571609497, 1.1042560338974, 1.103935956954956, 1.1042239665985107, 1.1070400476455688, 1.1092480421066284], "compile_time": 440.78180904034525, "verification_time": 0, "benchmark_time": 11.579765006899834, "strategy_time": 0, "framework_time": 2.098900906275958, "timestamp": "2023-01-29 03:51:04.268649+00:00"},
"2,32,15,15,0,8,1,1": {"block_size_x": 2, "block_size_y": 32, "filter_height": 15, "filter_width": 15, "read_only": 0, "tile_size_x": 8, "tile_size_y": 1, "use_padding": 1, "time": 1.098259198665619, "times": [1.1078399419784546, 1.0973119735717773, 1.100160002708435, 1.0962239503860474, 1.094688057899475, 1.0956799983978271, 1.097856044769287, 1.0969280004501343, 1.0977280139923096, 1.0981760025024414], "compile_time": 443.66448401706293, "verification_time": 0, "benchmark_time": 11.48770604049787, "strategy_time": 0, "framework_time": 2.086500928271562, "timestamp": "2023-01-29 03:51:04.725910+00:00"},
"2,32,15,15,0,8,2,0": {"block_size_x": 2, "block_size_y": 32, "filter_height": 15, "filter_width": 15, "read_only": 0, "tile_size_x": 8, "tile_size_y": 2, "use_padding": 0, "time": 1.246880006790161, "times": [1.2555840015411377, 1.2520320415496826, 1.240671992301941, 1.2492799758911133, 1.2452800273895264, 1.2415679693222046, 1.246880054473877, 1.240831971168518, 1.252832055091858, 1.243839979171753], "compile_time": 918.1244989740662, "verification_time": 0, "benchmark_time": 13.033751980401576, "strategy_time": 0, "framework_time": 1.8276930786669254, "timestamp": "2023-01-29 03:51:05.658917+00:00"},
"2,32,15,15,0,8,2,1": {"block_size_x": 2, "block_size_y": 32, "filter_height": 15, "filter_width": 15, "read_only": 0, "tile_size_x": 8, "tile_size_y": 2, "use_padding": 1, "time": 1.253395187854767, "times": [1.275264024734497, 1.247040033340454, 1.252351999282837, 1.252511978149414, 1.2445119619369507, 1.2479039430618286, 1.2581759691238403, 1.2499200105667114, 1.2517759799957275, 1.2544959783554077], "compile_time": 919.0997499972582, "verification_time": 0, "benchmark_time": 13.080350996460766, "strategy_time": 0, "framework_time": 2.1412220085039735, "timestamp": "2023-01-29 03:51:06.593260+00:00"},
"2,32,15,15,0,8,3,0": {"block_size_x": 2, "block_size_y": 32, "filter_height": 15, "filter_width": 15, "read_only": 0, "tile_size_x": 8, "tile_size_y": 3, "use_padding": 0, "time": 1.3607743740081788, "times": [1.3701119422912598, 1.370303988456726, 1.3611199855804443, 1.3511359691619873, 1.3585920333862305, 1.3600319623947144, 1.3598719835281372, 1.3604799509048462, 1.3582079410552979, 1.3578879833221436], "compile_time": 406.03013400686905, "verification_time": 0, "benchmark_time": 14.167122018989176, "strategy_time": 0, "framework_time": 2.1649319678545, "timestamp": "2023-01-29 03:51:07.015648+00:00"},
"2,32,15,15,0,8,3,1": {"block_size_x": 2, "block_size_y": 32, "filter_height": 15, "filter_width": 15, "read_only": 0, "tile_size_x": 8, "tile_size_y": 3, "use_padding": 1, "time": 1.3577792048454285, "times": [1.363968014717102, 1.3477760553359985, 1.3572160005569458, 1.3611520528793335, 1.3557759523391724, 1.3575040102005005, 1.3543360233306885, 1.3577920198440552, 1.367743968963623, 1.3545279502868652], "compile_time": 404.44502799073234, "verification_time": 0, "benchmark_time": 14.177432982251048, "strategy_time": 0, "framework_time": 2.1389510366134346, "timestamp": "2023-01-29 03:51:07.436433+00:00"},
"2,32,15,15,1,1,1,0": {"block_size_x": 2, "block_size_y": 32, "filter_height": 15, "filter_width": 15, "read_only": 1, "tile_size_x": 1, "tile_size_y": 1, "use_padding": 0, "time": 21.50040969848633, "times": [21.503999710083008, 21.50604820251465, 21.500192642211914, 21.501920700073242, 21.49785614013672, 21.49990463256836, 21.497695922851562, 21.499584197998047, 21.498079299926758, 21.498815536499023], "compile_time": 197.53650296479464, "verification_time": 0, "benchmark_time": 215.4772779904306, "strategy_time": 0, "framework_time": 2.1694800816476345, "timestamp": "2023-01-29 03:51:07.851640+00:00"},
"2,32,15,15,1,1,1,1": {"block_size_x": 2, "block_size_y": 32, "filter_height": 15, "filter_width": 15, "read_only": 1, "tile_size_x": 1, "tile_size_y": 1, "use_padding": 1, "time": 2.6705600023269653, "times": [2.6763200759887695, 2.6719679832458496, 2.669951915740967, 2.6705920696258545, 2.668544054031372, 2.668704032897949, 2.6705920696258545, 2.6702399253845215, 2.669663906097412, 2.6690239906311035], "compile_time": 197.79835001099855, "verification_time": 0, "benchmark_time": 27.172914007678628, "strategy_time": 0, "framework_time": 2.40214797668159, "timestamp": "2023-01-29 03:51:08.079037+00:00"},
"2,32,15,15,1,1,2,0": {"block_size_x": 2, "block_size_y": 32, "filter_height": 15, "filter_width": 15, "read_only": 1, "tile_size_x": 1, "tile_size_y": 2, "use_padding": 0, "time": 14.644652938842773, "times": [14.649408340454102, 14.651391983032227, 14.643232345581055, 14.642016410827637, 14.64310359954834, 14.642656326293945, 14.643072128295898, 14.643199920654297, 14.642560005187988, 14.645888328552246], "compile_time": 352.80474700266495, "verification_time": 0, "benchmark_time": 146.82256104424596, "strategy_time": 0, "framework_time": 2.1256599575281143, "timestamp": "2023-01-29 03:51:08.580811+00:00"},
"2,32,15,15,1,1,2,1": {"block_size_x": 2, "block_size_y": 32, "filter_height": 15, "filter_width": 15, "read_only": 1, "tile_size_x": 1, "tile_size_y": 2, "use_padding": 1, "time": 2.498211169242859, "times": [2.504703998565674, 2.4983999729156494, 2.496511936187744, 2.496511936187744, 2.4979519844055176, 2.4981439113616943, 2.497215986251831, 2.4983999729156494, 2.497760057449341, 2.496511936187744], "compile_time": 349.54565501539037, "verification_time": 0, "benchmark_time": 25.478470022790134, "strategy_time": 0, "framework_time": 2.152230008505285, "timestamp": "2023-01-29 03:51:08.958012+00:00"},
"2,32,15,15,1,1,3,0": {"block_size_x": 2, "block_size_y": 32, "filter_height": 15, "filter_width": 15, "read_only": 1, "tile_size_x": 1, "tile_size_y": 3, "use_padding": 0, "time": 14.640934276580811, "times": [14.644895553588867, 14.648703575134277, 14.64089584350586, 14.639103889465332, 14.638079643249512, 14.636032104492188, 14.642271995544434, 14.640031814575195, 14.637632369995117, 14.641695976257324], "compile_time": 576.4872309518978, "verification_time": 0, "benchmark_time": 146.84892096556723, "strategy_time": 0, "framework_time": 2.4522970779798925, "timestamp": "2023-01-29 03:51:09.683824+00:00"},
"2,32,15,15,1,1,3,1": {"block_size_x": 2, "block_size_y": 32, "filter_height": 15, "filter_width": 15, "read_only": 1, "tile_size_x": 1, "tile_size_y": 3, "use_padding": 1, "time": 2.5013119697570803, "times": [2.507040023803711, 2.5026559829711914, 2.500447988510132, 2.501055955886841, 2.500607967376709, 2.500607967376709, 2.500607967376709, 2.4985599517822266, 2.500607967376709, 2.5009279251098633], "compile_time": 576.3738119858317, "verification_time": 0, "benchmark_time": 25.54980805143714, "strategy_time": 0, "framework_time": 2.1901019499637187, "timestamp": "2023-01-29 03:51:10.287962+00:00"},
"2,32,15,15,1,1,4,0": {"block_size_x": 2, "block_size_y": 32, "filter_height": 15, "filter_width": 15, "read_only": 1, "tile_size_x": 1, "tile_size_y": 4, "use_padding": 0, "time": 14.543958473205567, "times": [14.553088188171387, 14.552032470703125, 14.542207717895508, 14.544608116149902, 14.540063858032227, 14.536704063415527, 14.552224159240723, 14.540960311889648, 14.538751602172852, 14.538944244384766], "compile_time": 851.0610849480145, "verification_time": 0, "benchmark_time": 145.9435989963822, "strategy_time": 0, "framework_time": 2.2131320438347757, "timestamp": "2023-01-29 03:51:11.287205+00:00"},
"2,32,15,15,1,1,4,1": {"block_size_x": 2, "block_size_y": 32, "filter_height": 15, "filter_width": 15, "read_only": 1, "tile_size_x": 1, "tile_size_y": 4, "use_padding": 1, "time": 2.5345792055130003, "times": [2.5385921001434326, 2.5432000160217285, 2.535871982574463, 2.537343978881836, 2.531327962875366, 2.531264066696167, 2.527359962463379, 2.5320639610290527, 2.535423994064331, 2.533344030380249], "compile_time": 876.9241409609094, "verification_time": 0, "benchmark_time": 25.848815974313766, "strategy_time": 0, "framework_time": 2.2044701036065817, "timestamp": "2023-01-29 03:51:12.192206+00:00"},
"2,32,15,15,1,1,5,0": {"block_size_x": 2, "block_size_y": 32, "filter_height": 15, "filter_width": 15, "read_only": 1, "tile_size_x": 1, "tile_size_y": 5, "use_padding": 0, "time": 19.588838386535645, "times": [21.258272171020508, 21.225919723510742, 21.23980712890625, 21.23695945739746, 21.234272003173828, 21.223520278930664, 21.234336853027344, 17.8056640625, 14.743552207946777, 14.686079978942871], "compile_time": 1158.0633759731427, "verification_time": 0, "benchmark_time": 196.36478199390694, "strategy_time": 0, "framework_time": 2.216980035882443, "timestamp": "2023-01-29 03:51:13.548873+00:00"},
