cached_data_used/cachefiles/convolution/RTX_2080_Ti.json
{
"device_name": "NVIDIA GeForce RTX 2080 Ti",
"kernel_name": "convolution_kernel",
"problem_size": [
4096,
4096
],
"tune_params_keys": [
"block_size_x",
"block_size_y",
"filter_height",
"filter_width",
"read_only",
"tile_size_x",
"tile_size_y",
"use_padding"
],
"tune_params": {
"block_size_x": [
1,
2,
4,
8,
16,
32,
48,
64,
96,
112,
128
],
"block_size_y": [
1,
2,
4,
8,
16,
32
],
"filter_height": [
15
],
"filter_width": [
15
],
"read_only": [
0,
1
],
"tile_size_x": [
1,
2,
3,
4,
5,
6,
7,
8
],
"tile_size_y": [
1,
2,
3,
4,
5,
6,
7,
8
],
"use_padding": [
0,
1
]
},
"cache": {
"2,32,15,15,0,1,1,0": {"block_size_x": 2, "block_size_y": 32, "filter_height": 15, "filter_width": 15, "read_only": 0, "tile_size_x": 1, "tile_size_y": 1, "use_padding": 0, "time": 15.93639669418335, "times": [15.997759819030762, 15.987008094787598, 15.982527732849121, 15.983903884887695, 15.978495597839355, 15.981727600097656, 15.86137580871582, 15.867584228515625, 15.861824035644531, 15.861760139465332], "compile_time": 0.542292999853089, "verification_time": 0, "benchmark_time": 160.36117799967542, "strategy_time": 0, "framework_time": 80.10120700055268},
"2,32,15,15,0,1,1,1": {"block_size_x": 2, "block_size_y": 32, "filter_height": 15, "filter_width": 15, "read_only": 0, "tile_size_x": 1, "tile_size_y": 1, "use_padding": 1, "time": 2.8577247858047485, "times": [2.867136001586914, 2.859488010406494, 2.8589119911193848, 2.85699200630188, 2.8572800159454346, 2.8569600582122803, 2.8564159870147705, 2.8548479080200195, 2.853951930999756, 2.8552639484405518], "compile_time": 262.1809460001714, "verification_time": 0, "benchmark_time": 28.90602100023898, "strategy_time": 0, "framework_time": 1.1706799996318296},
"2,32,15,15,0,1,2,0": {"block_size_x": 2, "block_size_y": 32, "filter_height": 15, "filter_width": 15, "read_only": 0, "tile_size_x": 1, "tile_size_y": 2, "use_padding": 0, "time": 15.587772846221924, "times": [15.58620834350586, 15.579968452453613, 15.58124828338623, 15.577247619628906, 15.578911781311035, 15.58182430267334, 15.58732795715332, 15.607423782348633, 15.598400115966797, 15.599167823791504], "compile_time": 412.3011970000334, "verification_time": 0, "benchmark_time": 156.65773000000627, "strategy_time": 0, "framework_time": 0.4920989999845915},
"2,32,15,15,0,1,2,1": {"block_size_x": 2, "block_size_y": 32, "filter_height": 15, "filter_width": 15, "read_only": 0, "tile_size_x": 1, "tile_size_y": 2, "use_padding": 1, "time": 2.665014410018921, "times": [2.666975975036621, 2.6603519916534424, 2.659104108810425, 2.6567039489746094, 2.6604158878326416, 2.656928062438965, 2.6559040546417236, 2.656064033508301, 2.6782400608062744, 2.699455976486206], "compile_time": 451.39965099997426, "verification_time": 0, "benchmark_time": 27.071999999861873, "strategy_time": 0, "framework_time": 1.3908579999224457},
"2,32,15,15,0,1,3,0": {"block_size_x": 2, "block_size_y": 32, "filter_height": 15, "filter_width": 15, "read_only": 0, "tile_size_x": 1, "tile_size_y": 3, "use_padding": 0, "time": 15.589206314086914, "times": [15.587455749511719, 15.582624435424805, 15.580512046813965, 15.579039573669434, 15.579872131347656, 15.583359718322754, 15.58902359008789, 15.608991622924805, 15.600704193115234, 15.600480079650879], "compile_time": 700.3623529999459, "verification_time": 0, "benchmark_time": 156.72734300005686, "strategy_time": 0, "framework_time": 0.5095869996694091},
"2,32,15,15,0,1,3,1": {"block_size_x": 2, "block_size_y": 32, "filter_height": 15, "filter_width": 15, "read_only": 0, "tile_size_x": 1, "tile_size_y": 3, "use_padding": 1, "time": 2.6572160005569456, "times": [2.667072057723999, 2.660288095474243, 2.658143997192383, 2.6573760509490967, 2.655967950820923, 2.6552000045776367, 2.6556479930877686, 2.6543359756469727, 2.654207944869995, 2.6539199352264404], "compile_time": 726.2057069997354, "verification_time": 0, "benchmark_time": 26.95874700020795, "strategy_time": 0, "framework_time": 1.5233819999593834},
"2,32,15,15,0,1,4,0": {"block_size_x": 2, "block_size_y": 32, "filter_height": 15, "filter_width": 15, "read_only": 0, "tile_size_x": 1, "tile_size_y": 4, "use_padding": 0, "time": 16.618307304382324, "times": [15.461695671081543, 15.450112342834473, 15.447936058044434, 15.44921588897705, 16.295455932617188, 17.59836769104004, 17.604480743408203, 17.628864288330078, 17.622079849243164, 17.62486457824707], "compile_time": 1024.1894900000261, "verification_time": 0, "benchmark_time": 166.8734710001445, "strategy_time": 0, "framework_time": 0.5274239997561381},
"2,32,15,15,0,1,4,1": {"block_size_x": 2, "block_size_y": 32, "filter_height": 15, "filter_width": 15, "read_only": 0, "tile_size_x": 1, "tile_size_y": 4, "use_padding": 1, "time": 2.665392017364502, "times": [2.653856039047241, 2.660543918609619, 2.654848098754883, 2.656064033508301, 2.6600639820098877, 2.6594560146331787, 2.6557118892669678, 2.6419200897216797, 2.68556809425354, 2.7258880138397217], "compile_time": 1060.5792070000462, "verification_time": 0, "benchmark_time": 27.066657999966992, "strategy_time": 0, "framework_time": 1.668379999955505},
"2,32,15,15,0,1,5,0": {"block_size_x": 2, "block_size_y": 32, "filter_height": 15, "filter_width": 15, "read_only": 0, "tile_size_x": 1, "tile_size_y": 5, "use_padding": 0, "time": 22.53207359313965, "times": [22.558719635009766, 22.53209686279297, 22.518047332763672, 22.5133113861084, 22.517248153686523, 22.542335510253906, 22.541183471679688, 22.533824920654297, 22.53209686279297, 22.531871795654297], "compile_time": 1382.4894479998875, "verification_time": 0, "benchmark_time": 226.09473200009234, "strategy_time": 0, "framework_time": 0.552139999854262},
"2,32,15,15,0,1,5,1": {"block_size_x": 2, "block_size_y": 32, "filter_height": 15, "filter_width": 15, "read_only": 0, "tile_size_x": 1, "tile_size_y": 5, "use_padding": 1, "time": 2.9891679763793944, "times": [3.0139520168304443, 3.0053439140319824, 3.0123839378356934, 2.971776008605957, 2.995039939880371, 2.9917120933532715, 2.96396803855896, 2.9671359062194824, 2.979583978652954, 2.990783929824829], "compile_time": 1415.8410860000004, "verification_time": 0, "benchmark_time": 30.38235599979089, "strategy_time": 0, "framework_time": 1.7888410002342425},
"2,32,15,15,0,1,6,0": {"block_size_x": 2, "block_size_y": 32, "filter_height": 15, "filter_width": 15, "read_only": 0, "tile_size_x": 1, "tile_size_y": 6, "use_padding": 0, "time": 22.822870635986327, "times": [22.8536319732666, 22.831680297851562, 22.81273651123047, 22.80886459350586, 22.806432723999023, 22.833215713500977, 22.82569694519043, 22.81875228881836, 22.81839942932129, 22.81929588317871], "compile_time": 1738.7861239999438, "verification_time": 0, "benchmark_time": 229.0624460001709, "strategy_time": 0, "framework_time": 0.5740429996876628},
"2,32,15,15,0,1,6,1": {"block_size_x": 2, "block_size_y": 32, "filter_height": 15, "filter_width": 15, "read_only": 0, "tile_size_x": 1, "tile_size_y": 6, "use_padding": 1, "time": 2.948374366760254, "times": [2.9544320106506348, 2.949120044708252, 2.941119909286499, 2.9470720291137695, 2.9580159187316895, 2.9619200229644775, 2.9446399211883545, 2.934335947036743, 2.9490559101104736, 2.9440319538116455], "compile_time": 1775.4546870000922, "verification_time": 0, "benchmark_time": 29.944089999844437, "strategy_time": 0, "framework_time": 1.896842999940418},
"2,32,15,15,0,1,7,0": {"block_size_x": 2, "block_size_y": 32, "filter_height": 15, "filter_width": 15, "read_only": 0, "tile_size_x": 1, "tile_size_y": 7, "use_padding": 0, "time": 20.466796684265137, "times": [23.00921630859375, 22.965343475341797, 22.962400436401367, 22.966079711914062, 21.81065559387207, 18.178592681884766, 18.190336227416992, 18.192575454711914, 18.200895309448242, 18.191871643066406], "compile_time": 2110.7186200001706, "verification_time": 0, "benchmark_time": 205.43211600033828, "strategy_time": 0, "framework_time": 0.5921389993090997},
"2,32,15,15,0,1,7,1": {"block_size_x": 2, "block_size_y": 32, "filter_height": 15, "filter_width": 15, "read_only": 0, "tile_size_x": 1, "tile_size_y": 7, "use_padding": 1, "time": 4.4751296043396, "times": [4.497151851654053, 4.450240135192871, 4.468736171722412, 4.468639850616455, 4.446432113647461, 4.4356160163879395, 4.44927978515625, 4.503551959991455, 4.564288139343262, 4.467360019683838], "compile_time": 2143.725725999957, "verification_time": 0, "benchmark_time": 45.1220319996537, "strategy_time": 0, "framework_time": 2.0247210004527005},
"2,32,15,15,0,1,8,0": {"block_size_x": 2, "block_size_y": 32, "filter_height": 15, "filter_width": 15, "read_only": 0, "tile_size_x": 1, "tile_size_y": 8, "use_padding": 0, "time": 22.18976001739502, "times": [22.204736709594727, 22.198015213012695, 22.1943359375, 22.184288024902344, 22.184064865112305, 22.1975040435791, 22.194528579711914, 22.197599411010742, 22.203487396240234, 22.139039993286133], "compile_time": 2506.1236360002113, "verification_time": 0, "benchmark_time": 222.69076299971857, "strategy_time": 0, "framework_time": 0.6319519998214673},
"2,32,15,15,0,1,8,1": {"block_size_x": 2, "block_size_y": 32, "filter_height": 15, "filter_width": 15, "read_only": 0, "tile_size_x": 1, "tile_size_y": 8, "use_padding": 1, "time": 7.767366409301758, "times": [7.780767917633057, 7.765376091003418, 7.781792163848877, 7.758304119110107, 7.776576042175293, 7.780320167541504, 7.769951820373535, 7.7414398193359375, 7.7336320877075195, 7.78550386428833], "compile_time": 2539.5876989996395, "verification_time": 0, "benchmark_time": 78.1559259999085, "strategy_time": 0, "framework_time": 2.15554600026735},
"2,32,15,15,0,2,1,0": {"block_size_x": 2, "block_size_y": 32, "filter_height": 15, "filter_width": 15, "read_only": 0, "tile_size_x": 2, "tile_size_y": 1, "use_padding": 0, "time": 2.4078015804290773, "times": [2.4202558994293213, 2.412544012069702, 2.4066879749298096, 2.410207986831665, 2.4046080112457275, 2.4077439308166504, 2.4061439037323, 2.4043519496917725, 2.403712034225464, 2.4017601013183594], "compile_time": 292.27948699963235, "verification_time": 0, "benchmark_time": 24.612586999865016, "strategy_time": 0, "framework_time": 0.6811560006099171},
"2,32,15,15,0,2,1,1": {"block_size_x": 2, "block_size_y": 32, "filter_height": 15, "filter_width": 15, "read_only": 0, "tile_size_x": 2, "tile_size_y": 1, "use_padding": 1, "time": 2.4145152091979982, "times": [2.42521595954895, 2.4220480918884277, 2.4188480377197266, 2.4154880046844482, 2.4104321002960205, 2.413343906402588, 2.411679983139038, 2.4107840061187744, 2.410367965698242, 2.4069440364837646], "compile_time": 263.48705500004144, "verification_time": 0, "benchmark_time": 24.591021000105684, "strategy_time": 0, "framework_time": 0.454063000233873},
"2,32,15,15,0,2,2,0": {"block_size_x": 2, "block_size_y": 32, "filter_height": 15, "filter_width": 15, "read_only": 0, "tile_size_x": 2, "tile_size_y": 2, "use_padding": 0, "time": 2.329756832122803, "times": [2.3428800106048584, 2.334304094314575, 2.3302719593048096, 2.330751895904541, 2.32857608795166, 2.3280320167541504, 2.3274879455566406, 2.325472116470337, 2.326080083847046, 2.323712110519409], "compile_time": 518.9540100000158, "verification_time": 0, "benchmark_time": 23.66898000036599, "strategy_time": 0, "framework_time": 0.46657599978061626},
"2,32,15,15,0,2,2,1": {"block_size_x": 2, "block_size_y": 32, "filter_height": 15, "filter_width": 15, "read_only": 0, "tile_size_x": 2, "tile_size_y": 2, "use_padding": 1, "time": 2.3361119747161867, "times": [2.3471999168395996, 2.3405120372772217, 2.3390719890594482, 2.3380799293518066, 2.3343679904937744, 2.334496021270752, 2.332767963409424, 2.3334720134735107, 2.330847978591919, 2.330303907394409], "compile_time": 518.367274999946, "verification_time": 0, "benchmark_time": 23.814439000034326, "strategy_time": 0, "framework_time": 0.47061899977052235},
"2,32,15,15,0,2,3,0": {"block_size_x": 2, "block_size_y": 32, "filter_height": 15, "filter_width": 15, "read_only": 0, "tile_size_x": 2, "tile_size_y": 3, "use_padding": 0, "time": 2.2932416200637817, "times": [2.3059840202331543, 2.2966721057891846, 2.293440103530884, 2.2968640327453613, 2.291872024536133, 2.2919039726257324, 2.289504051208496, 2.2914879322052, 2.287519931793213, 2.287168025970459], "compile_time": 852.4587580000116, "verification_time": 0, "benchmark_time": 23.430141999597254, "strategy_time": 0, "framework_time": 0.4821360003006703},
"2,32,15,15,0,2,3,1": {"block_size_x": 2, "block_size_y": 32, "filter_height": 15, "filter_width": 15, "read_only": 0, "tile_size_x": 2, "tile_size_y": 3, "use_padding": 1, "time": 2.3484768152236937, "times": [2.3565759658813477, 2.355168104171753, 2.3506879806518555, 2.3511040210723877, 2.348288059234619, 2.3468799591064453, 2.345599889755249, 2.347007989883423, 2.342816114425659, 2.340640068054199], "compile_time": 852.1022680001806, "verification_time": 0, "benchmark_time": 23.93101999996361, "strategy_time": 0, "framework_time": 0.497166999593901},
"2,32,15,15,0,2,4,0": {"block_size_x": 2, "block_size_y": 32, "filter_height": 15, "filter_width": 15, "read_only": 0, "tile_size_x": 2, "tile_size_y": 4, "use_padding": 0, "time": 2.28709762096405, "times": [2.2996160984039307, 2.287616014480591, 2.2885758876800537, 2.2857279777526855, 2.2873599529266357, 2.287264108657837, 2.2849600315093994, 2.285248041152954, 2.283519983291626, 2.28108811378479], "compile_time": 1198.3469260003403, "verification_time": 0, "benchmark_time": 23.285461999876134, "strategy_time": 0, "framework_time": 0.5016129994146468},
"2,32,15,15,0,2,4,1": {"block_size_x": 2, "block_size_y": 32, "filter_height": 15, "filter_width": 15, "read_only": 0, "tile_size_x": 2, "tile_size_y": 4, "use_padding": 1, "time": 2.3511040449142455, "times": [2.363487958908081, 2.3626880645751953, 2.357088088989258, 2.347007989883423, 2.3467841148376465, 2.3529601097106934, 2.346719980239868, 2.3499839305877686, 2.3378241062164307, 2.346496105194092], "compile_time": 1198.5974610001904, "verification_time": 0, "benchmark_time": 24.095081000268692, "strategy_time": 0, "framework_time": 0.5119659995216352},
"2,32,15,15,0,2,5,0": {"block_size_x": 2, "block_size_y": 32, "filter_height": 15, "filter_width": 15, "read_only": 0, "tile_size_x": 2, "tile_size_y": 5, "use_padding": 0, "time": 2.4035808086395263, "times": [2.41046404838562, 2.40828800201416, 2.4063680171966553, 2.40230393409729, 2.40230393409729, 2.400320053100586, 2.3987200260162354, 2.397952079772949, 2.405600070953369, 2.4034879207611084], "compile_time": 1564.6546570001192, "verification_time": 0, "benchmark_time": 24.56109300010212, "strategy_time": 0, "framework_time": 0.5335169998943456},
"2,32,15,15,0,2,5,1": {"block_size_x": 2, "block_size_y": 32, "filter_height": 15, "filter_width": 15, "read_only": 0, "tile_size_x": 2, "tile_size_y": 5, "use_padding": 1, "time": 3.316201615333557, "times": [3.3686718940734863, 3.3386240005493164, 3.3235840797424316, 3.3077120780944824, 3.314784049987793, 3.2976319789886475, 3.30515193939209, 3.2964799404144287, 3.3032960891723633, 3.3060801029205322], "compile_time": 1561.5171979998195, "verification_time": 0, "benchmark_time": 33.62319899997601, "strategy_time": 0, "framework_time": 0.5371620004552824},
"2,32,15,15,0,2,6,0": {"block_size_x": 2, "block_size_y": 32, "filter_height": 15, "filter_width": 15, "read_only": 0, "tile_size_x": 2, "tile_size_y": 6, "use_padding": 0, "time": 2.52501118183136, "times": [2.538111925125122, 2.520319938659668, 2.5259199142456055, 2.532991886138916, 2.518944025039673, 2.5350399017333984, 2.523616075515747, 2.519040107727051, 2.5267839431762695, 2.5093441009521484], "compile_time": 1935.5588809999063, "verification_time": 0, "benchmark_time": 25.716460999774426, "strategy_time": 0, "framework_time": 0.5452410005091224},
"2,32,15,15,0,2,6,1": {"block_size_x": 2, "block_size_y": 32, "filter_height": 15, "filter_width": 15, "read_only": 0, "tile_size_x": 2, "tile_size_y": 6, "use_padding": 1, "time": 3.627011203765869, "times": [3.6390719413757324, 3.639456033706665, 3.6454720497131348, 3.6355199813842773, 3.6289279460906982, 3.620863914489746, 3.610624074935913, 3.622528076171875, 3.6118719577789307, 3.6157760620117188], "compile_time": 1934.8611299997174, "verification_time": 0, "benchmark_time": 36.67165199976807, "strategy_time": 0, "framework_time": 0.5574370006797835},
"2,32,15,15,0,2,7,0": {"block_size_x": 2, "block_size_y": 32, "filter_height": 15, "filter_width": 15, "read_only": 0, "tile_size_x": 2, "tile_size_y": 7, "use_padding": 0, "time": 2.850988817214966, "times": [2.856735944747925, 2.864543914794922, 2.850816011428833, 2.8497281074523926, 2.850111961364746, 2.8481600284576416, 2.85097599029541, 2.8444480895996094, 2.84934401512146, 2.8450241088867188], "compile_time": 2324.4383889996243, "verification_time": 0, "benchmark_time": 28.9210109999658, "strategy_time": 0, "framework_time": 0.5633800005853118},
"2,32,15,15,0,2,7,1": {"block_size_x": 2, "block_size_y": 32, "filter_height": 15, "filter_width": 15, "read_only": 0, "tile_size_x": 2, "tile_size_y": 7, "use_padding": 1, "time": 3.803273606300354, "times": [3.8113279342651367, 3.804640054702759, 3.806528091430664, 3.8002560138702393, 3.80729603767395, 3.805727958679199, 3.8024001121520996, 3.798975944519043, 3.7983999252319336, 3.7971839904785156], "compile_time": 2324.858557000425, "verification_time": 0, "benchmark_time": 38.45465799986414, "strategy_time": 0, "framework_time": 0.5777699993814167},
"2,32,15,15,0,2,8,0": {"block_size_x": 2, "block_size_y": 32, "filter_height": 15, "filter_width": 15, "read_only": 0, "tile_size_x": 2, "tile_size_y": 8, "use_padding": 0, "time": 2.78887357711792, "times": [2.8063039779663086, 2.780479907989502, 2.8000640869140625, 2.797823905944824, 2.785856008529663, 2.78220796585083, 2.7844159603118896, 2.7806079387664795, 2.793344020843506, 2.777631998062134], "compile_time": 2574.552995999966, "verification_time": 0, "benchmark_time": 28.380442000070616, "strategy_time": 0, "framework_time": 0.5866689998583752},
"2,32,15,15,0,2,8,1": {"block_size_x": 2, "block_size_y": 32, "filter_height": 15, "filter_width": 15, "read_only": 0, "tile_size_x": 2, "tile_size_y": 8, "use_padding": 1, "time": 7.035324811935425, "times": [7.0444159507751465, 7.034719944000244, 7.03718376159668, 7.03107213973999, 7.035583972930908, 7.0382080078125, 7.036416053771973, 7.028992176055908, 7.029983997344971, 7.036672115325928], "compile_time": 2588.8597000002846, "verification_time": 0, "benchmark_time": 70.784132999961, "strategy_time": 0, "framework_time": 0.6103699997765943},
"2,32,15,15,0,3,1,0": {"block_size_x": 2, "block_size_y": 32, "filter_height": 15, "filter_width": 15, "read_only": 0, "tile_size_x": 3, "tile_size_y": 1, "use_padding": 0, "time": 2.972860836982727, "times": [2.988032102584839, 2.9800639152526855, 2.977760076522827, 2.972640037536621, 2.971359968185425, 2.9715840816497803, 2.9712960720062256, 2.966304063796997, 2.9645440578460693, 2.965023994445801], "compile_time": 327.91135900015433, "verification_time": 0, "benchmark_time": 30.070883999997022, "strategy_time": 0, "framework_time": 0.9645119998822338},
"2,32,15,15,0,3,1,1": {"block_size_x": 2, "block_size_y": 32, "filter_height": 15, "filter_width": 15, "read_only": 0, "tile_size_x": 3, "tile_size_y": 1, "use_padding": 1, "time": 1.8713728189468384, "times": [1.8803520202636719, 1.875648021697998, 1.871359944343567, 1.8715840578079224, 1.8699840307235718, 1.8698240518569946, 1.8696000576019287, 1.869439959526062, 1.8677760362625122, 1.8681600093841553], "compile_time": 323.7189579999722, "verification_time": 0, "benchmark_time": 19.1879499998322, "strategy_time": 0, "framework_time": 0.615485000253102},
"2,32,15,15,0,3,2,0": {"block_size_x": 2, "block_size_y": 32, "filter_height": 15, "filter_width": 15, "read_only": 0, "tile_size_x": 3, "tile_size_y": 2, "use_padding": 0, "time": 2.887270379066467, "times": [2.90012788772583, 2.8921279907226562, 2.8926079273223877, 2.8885440826416016, 2.8861119747161865, 2.887295961380005, 2.8849599361419678, 2.880511999130249, 2.880352020263672, 2.880064010620117], "compile_time": 628.3011990003615, "verification_time": 0, "benchmark_time": 29.390589000286127, "strategy_time": 0, "framework_time": 0.6381299990607658},
"2,32,15,15,0,3,2,1": {"block_size_x": 2, "block_size_y": 32, "filter_height": 15, "filter_width": 15, "read_only": 0, "tile_size_x": 3, "tile_size_y": 2, "use_padding": 1, "time": 1.8035744190216065, "times": [1.8156800270080566, 1.8072320222854614, 1.8041599988937378, 1.8019839525222778, 1.8010560274124146, 1.8003840446472168, 1.8019200563430786, 1.802240014076233, 1.8015040159225464, 1.7995840311050415], "compile_time": 628.2915329998104, "verification_time": 0, "benchmark_time": 18.432259000292106, "strategy_time": 0, "framework_time": 0.6348500000967761},
"2,32,15,15,0,3,3,0": {"block_size_x": 2, "block_size_y": 32, "filter_height": 15, "filter_width": 15, "read_only": 0, "tile_size_x": 3, "tile_size_y": 3, "use_padding": 0, "time": 2.8763647794723513, "times": [2.8896639347076416, 2.8818559646606445, 2.881727933883667, 2.8784000873565674, 2.8749759197235107, 2.876255989074707, 2.8732800483703613, 2.871135950088501, 2.8671998977661133, 2.869152069091797], "compile_time": 982.8221259999737, "verification_time": 0, "benchmark_time": 29.223907999949006, "strategy_time": 0, "framework_time": 0.6429519999073818},
"2,32,15,15,0,3,3,1": {"block_size_x": 2, "block_size_y": 32, "filter_height": 15, "filter_width": 15, "read_only": 0, "tile_size_x": 3, "tile_size_y": 3, "use_padding": 1, "time": 1.9352992177009583, "times": [1.945472002029419, 1.936735987663269, 1.9400960206985474, 1.9339840412139893, 1.9308160543441772, 1.935647964477539, 1.9351040124893188, 1.934048056602478, 1.931264042854309, 1.9298239946365356], "compile_time": 985.3820930002257, "verification_time": 0, "benchmark_time": 19.837660999655782, "strategy_time": 0, "framework_time": 0.6530630002998805},
"2,32,15,15,0,3,4,0": {"block_size_x": 2, "block_size_y": 32, "filter_height": 15, "filter_width": 15, "read_only": 0, "tile_size_x": 3, "tile_size_y": 4, "use_padding": 0, "time": 2.8814720153808593, "times": [2.8962559700012207, 2.883104085922241, 2.8872320652008057, 2.880511999130249, 2.883296012878418, 2.879487991333008, 2.874783992767334, 2.8792641162872314, 2.8773438930511475, 2.8734400272369385], "compile_time": 1374.0386589997797, "verification_time": 0, "benchmark_time": 29.351523000059387, "strategy_time": 0, "framework_time": 0.6618350003009255},
"2,32,15,15,0,3,4,1": {"block_size_x": 2, "block_size_y": 32, "filter_height": 15, "filter_width": 15, "read_only": 0, "tile_size_x": 3, "tile_size_y": 4, "use_padding": 1, "time": 2.35665602684021, "times": [2.3633921146392822, 2.3592960834503174, 2.357248067855835, 2.3553600311279297, 2.3611199855804443, 2.3531839847564697, 2.353408098220825, 2.3511040210723877, 2.361567974090576, 2.3508799076080322], "compile_time": 1373.418059999949, "verification_time": 0, "benchmark_time": 24.098901999877853, "strategy_time": 0, "framework_time": 0.6795899998905952},
"2,32,15,15,0,3,5,0": {"block_size_x": 2, "block_size_y": 32, "filter_height": 15, "filter_width": 15, "read_only": 0, "tile_size_x": 3, "tile_size_y": 5, "use_padding": 0, "time": 3.001049590110779, "times": [3.0141758918762207, 3.011199951171875, 3.0082240104675293, 2.9982080459594727, 3.0021440982818604, 2.997472047805786, 2.994879961013794, 2.9947519302368164, 2.9935359954833984, 2.995903968811035], "compile_time": 1770.316223000009, "verification_time": 0, "benchmark_time": 30.489597999803664, "strategy_time": 0, "framework_time": 0.7141220003177295},
"2,32,15,15,0,3,5,1": {"block_size_x": 2, "block_size_y": 32, "filter_height": 15, "filter_width": 15, "read_only": 0, "tile_size_x": 3, "tile_size_y": 5, "use_padding": 1, "time": 3.3353280067443847, "times": [3.3361599445343018, 3.3407039642333984, 3.3300158977508545, 3.3426239490509033, 3.3422720432281494, 3.3277440071105957, 3.337088108062744, 3.340127944946289, 3.32694411277771, 3.3296000957489014], "compile_time": 1771.8981929997426, "verification_time": 0, "benchmark_time": 33.697952999773406, "strategy_time": 0, "framework_time": 0.6953680003789486},
"2,32,15,15,0,3,6,0": {"block_size_x": 2, "block_size_y": 32, "filter_height": 15, "filter_width": 15, "read_only": 0, "tile_size_x": 3, "tile_size_y": 6, "use_padding": 0, "time": 3.1762815952301025, "times": [3.2029120922088623, 3.1740479469299316, 3.170016050338745, 3.1825919151306152, 3.1723520755767822, 3.1495039463043213, 3.1680641174316406, 3.180543899536133, 3.2027199268341064, 3.1600639820098877], "compile_time": 2199.9168180000197, "verification_time": 0, "benchmark_time": 32.17772200014224, "strategy_time": 0, "framework_time": 0.7017779998932383},
"2,32,15,15,0,3,6,1": {"block_size_x": 2, "block_size_y": 32, "filter_height": 15, "filter_width": 15, "read_only": 0, "tile_size_x": 3, "tile_size_y": 6, "use_padding": 1, "time": 3.360979175567627, "times": [3.3770558834075928, 3.368959903717041, 3.367840051651001, 3.360192060470581, 3.3632960319519043, 3.3563520908355713, 3.3582398891448975, 3.356703996658325, 3.3525118827819824, 3.348639965057373], "compile_time": 2203.909629000009, "verification_time": 0, "benchmark_time": 34.09480100026485, "strategy_time": 0, "framework_time": 0.7180449997576943},
"2,32,15,15,0,3,7,0": {"block_size_x": 2, "block_size_y": 32, "filter_height": 15, "filter_width": 15, "read_only": 0, "tile_size_x": 3, "tile_size_y": 7, "use_padding": 0, "time": 3.254575991630554, "times": [3.2998080253601074, 3.224992036819458, 3.25817608833313, 3.2622718811035156, 3.2537920475006104, 3.2417919635772705, 3.2400319576263428, 3.266047954559326, 3.2365119457244873, 3.262336015701294], "compile_time": 2676.3638359998367, "verification_time": 0, "benchmark_time": 32.98352399997384, "strategy_time": 0, "framework_time": 0.7257950001076097},
"2,32,15,15,0,3,7,1": {"block_size_x": 2, "block_size_y": 32, "filter_height": 15, "filter_width": 15, "read_only": 0, "tile_size_x": 3, "tile_size_y": 7, "use_padding": 1, "time": 3.3733215808868406, "times": [3.3793280124664307, 3.375839948654175, 3.3816640377044678, 3.3667519092559814, 3.383296012878418, 3.362816095352173, 3.3520638942718506, 3.3750720024108887, 3.3771519660949707, 3.3792319297790527], "compile_time": 2679.3717380001, "verification_time": 0, "benchmark_time": 34.19369299990649, "strategy_time": 0, "framework_time": 0.7289680002031673},
"2,32,15,15,0,3,8,0": {"block_size_x": 2, "block_size_y": 32, "filter_height": 15, "filter_width": 15, "read_only": 0, "tile_size_x": 3, "tile_size_y": 8, "use_padding": 0, "time": 2.919484782218933, "times": [2.9392640590667725, 2.932512044906616, 2.932255983352661, 2.918207883834839, 2.909343957901001, 2.8999359607696533, 2.9246718883514404, 2.9141440391540527, 2.9040639400482178, 2.920448064804077], "compile_time": 675.1795609998226, "verification_time": 0, "benchmark_time": 29.617393000080483, "strategy_time": 0, "framework_time": 0.7433040000250912},
"2,32,15,15,0,3,8,1": {"block_size_x": 2, "block_size_y": 32, "filter_height": 15, "filter_width": 15, "read_only": 0, "tile_size_x": 3, "tile_size_y": 8, "use_padding": 1, "time": 4.839334440231323, "times": [4.863647937774658, 4.748000144958496, 4.864160060882568, 4.8560638427734375, 4.858528137207031, 4.7824320793151855, 4.811007976531982, 4.872191905975342, 4.874080181121826, 4.863232135772705], "compile_time": 675.7366839997303, "verification_time": 0, "benchmark_time": 48.8564080001197, "strategy_time": 0, "framework_time": 0.7496909997826151},
"2,32,15,15,0,4,1,0": {"block_size_x": 2, "block_size_y": 32, "filter_height": 15, "filter_width": 15, "read_only": 0, "tile_size_x": 4, "tile_size_y": 1, "use_padding": 0, "time": 1.5911424160003662, "times": [1.6002240180969238, 1.5936319828033447, 1.59334397315979, 1.5905280113220215, 1.589568018913269, 1.58896005153656, 1.5891200304031372, 1.5886720418930054, 1.5882240533828735, 1.5891519784927368], "compile_time": 352.3794100001396, "verification_time": 0, "benchmark_time": 16.259441999864066, "strategy_time": 0, "framework_time": 0.8440120000159368},
"2,32,15,15,0,4,1,1": {"block_size_x": 2, "block_size_y": 32, "filter_height": 15, "filter_width": 15, "read_only": 0, "tile_size_x": 4, "tile_size_y": 1, "use_padding": 1, "time": 1.5966015934944153, "times": [1.6047040224075317, 1.5994880199432373, 1.5973440408706665, 1.5953919887542725, 1.5954560041427612, 1.5943679809570312, 1.595903992652893, 1.5943039655685425, 1.5942399501800537, 1.594815969467163], "compile_time": 346.9390220002424, "verification_time": 0, "benchmark_time": 16.294134999952803, "strategy_time": 0, "framework_time": 0.7643079998160829},
"2,32,15,15,0,4,2,0": {"block_size_x": 2, "block_size_y": 32, "filter_height": 15, "filter_width": 15, "read_only": 0, "tile_size_x": 4, "tile_size_y": 2, "use_padding": 0, "time": 1.5209887862205504, "times": [1.5306559801101685, 1.5224640369415283, 1.521567940711975, 1.5221120119094849, 1.5218559503555298, 1.5196160078048706, 1.5173759460449219, 1.5172480344772339, 1.5178879499435425, 1.51910400390625], "compile_time": 709.7389310001745, "verification_time": 0, "benchmark_time": 15.69069099969056, "strategy_time": 0, "framework_time": 0.7778829999551817},
"2,32,15,15,0,4,2,1": {"block_size_x": 2, "block_size_y": 32, "filter_height": 15, "filter_width": 15, "read_only": 0, "tile_size_x": 4, "tile_size_y": 2, "use_padding": 1, "time": 1.5205183982849122, "times": [1.5301120281219482, 1.5237120389938354, 1.5213439464569092, 1.5221439599990845, 1.5177279710769653, 1.5194560289382935, 1.5185920000076294, 1.5180480480194092, 1.5175039768218994, 1.516543984413147], "compile_time": 712.0245210003304, "verification_time": 0, "benchmark_time": 15.640994000023056, "strategy_time": 0, "framework_time": 0.7905899992692866},
"2,32,15,15,0,4,3,0": {"block_size_x": 2, "block_size_y": 32, "filter_height": 15, "filter_width": 15, "read_only": 0, "tile_size_x": 4, "tile_size_y": 3, "use_padding": 0, "time": 1.6032800078392029, "times": [1.6079360246658325, 1.6027840375900269, 1.6054719686508179, 1.6023999452590942, 1.593440055847168, 1.6035840511322021, 1.6055999994277954, 1.6057599782943726, 1.6011840105056763, 1.604640007019043], "compile_time": 1122.1876320000774, "verification_time": 0, "benchmark_time": 16.443654999875434, "strategy_time": 0, "framework_time": 0.7976610004334361},
"2,32,15,15,0,4,3,1": {"block_size_x": 2, "block_size_y": 32, "filter_height": 15, "filter_width": 15, "read_only": 0, "tile_size_x": 4, "tile_size_y": 3, "use_padding": 1, "time": 1.8061183929443358, "times": [1.814784049987793, 1.8098880052566528, 1.8089599609375, 1.8063039779663086, 1.8001600503921509, 1.8052159547805786, 1.8024640083312988, 1.804927945137024, 1.8057600259780884, 1.8027199506759644], "compile_time": 1127.994637000029, "verification_time": 0, "benchmark_time": 18.43296399965766, "strategy_time": 0, "framework_time": 0.8120680004140013},
"2,32,15,15,0,4,4,0": {"block_size_x": 2, "block_size_y": 32, "filter_height": 15, "filter_width": 15, "read_only": 0, "tile_size_x": 4, "tile_size_y": 4, "use_padding": 0, "time": 1.7904191970825196, "times": [1.790079951286316, 1.7968640327453613, 1.7893760204315186, 1.7957119941711426, 1.7893120050430298, 1.7876160144805908, 1.7879040241241455, 1.7884479761123657, 1.786080002784729, 1.792799949645996], "compile_time": 1555.8878889996777, "verification_time": 0, "benchmark_time": 18.27843999990364, "strategy_time": 0, "framework_time": 0.8212060006371757},
"2,32,15,15,0,4,4,1": {"block_size_x": 2, "block_size_y": 32, "filter_height": 15, "filter_width": 15, "read_only": 0, "tile_size_x": 4, "tile_size_y": 4, "use_padding": 1, "time": 2.287715196609497, "times": [2.300096035003662, 2.2914879322052, 2.290656089782715, 2.28387188911438, 2.288800001144409, 2.278496026992798, 2.2879040241241455, 2.2917120456695557, 2.288800001144409, 2.2753279209136963], "compile_time": 1558.496729000126, "verification_time": 0, "benchmark_time": 23.33298299981834, "strategy_time": 0, "framework_time": 0.8230979997279064},
"2,32,15,15,0,4,5,0": {"block_size_x": 2, "block_size_y": 32, "filter_height": 15, "filter_width": 15, "read_only": 0, "tile_size_x": 4, "tile_size_y": 5, "use_padding": 0, "time": 1.9247071981430053, "times": [1.9271680116653442, 1.9361599683761597, 1.917631983757019, 1.9308799505233765, 1.9153920412063599, 1.9177600145339966, 1.9231040477752686, 1.9216639995574951, 1.9388799667358398, 1.9184319972991943], "compile_time": 2023.6094420001791, "verification_time": 0, "benchmark_time": 19.65913799995178, "strategy_time": 0, "framework_time": 0.834843999655277},
"2,32,15,15,0,4,5,1": {"block_size_x": 2, "block_size_y": 32, "filter_height": 15, "filter_width": 15, "read_only": 0, "tile_size_x": 4, "tile_size_y": 5, "use_padding": 1, "time": 3.119257616996765, "times": [3.1264960765838623, 3.11897611618042, 3.1246399879455566, 3.118079900741577, 3.114880084991455, 3.123584032058716, 3.1227519512176514, 3.106816053390503, 3.1239359378814697, 3.1124160289764404], "compile_time": 2023.9245140001003, "verification_time": 0, "benchmark_time": 31.59626099977686, "strategy_time": 0, "framework_time": 0.8500170001752849},
"2,32,15,15,0,4,6,0": {"block_size_x": 2, "block_size_y": 32, "filter_height": 15, "filter_width": 15, "read_only": 0, "tile_size_x": 4, "tile_size_y": 6, "use_padding": 0, "time": 2.0619296073913573, "times": [2.0745599269866943, 2.0591681003570557, 2.0630719661712646, 2.064095973968506, 2.056544065475464, 2.063231945037842, 2.0575358867645264, 2.0599679946899414, 2.0624001026153564, 2.058720111846924], "compile_time": 584.7783879999042, "verification_time": 0, "benchmark_time": 21.034762999988743, "strategy_time": 0, "framework_time": 0.8601380000072822},
"2,32,15,15,0,4,6,1": {"block_size_x": 2, "block_size_y": 32, "filter_height": 15, "filter_width": 15, "read_only": 0, "tile_size_x": 4, "tile_size_y": 6, "use_padding": 1, "time": 2.5041568279266357, "times": [2.5023040771484375, 2.5006721019744873, 2.5069758892059326, 2.504703998565674, 2.503232002258301, 2.5015039443969727, 2.506688117980957, 2.5106561183929443, 2.499936103820801, 2.5048959255218506], "compile_time": 584.0970119998019, "verification_time": 0, "benchmark_time": 25.526469999931578, "strategy_time": 0, "framework_time": 0.8686990004207473},
"2,32,15,15,0,4,7,0": {"block_size_x": 2, "block_size_y": 32, "filter_height": 15, "filter_width": 15, "read_only": 0, "tile_size_x": 4, "tile_size_y": 7, "use_padding": 0, "time": 2.1152447938919066, "times": [2.1242239475250244, 2.119391918182373, 2.1176319122314453, 2.123744010925293, 2.10915207862854, 2.113248109817505, 2.1139841079711914, 2.1096320152282715, 2.113055944442749, 2.108383893966675], "compile_time": 703.5887269998966, "verification_time": 0, "benchmark_time": 21.51248800009853, "strategy_time": 0, "framework_time": 0.874690999808081},
"2,32,15,15,0,4,7,1": {"block_size_x": 2, "block_size_y": 32, "filter_height": 15, "filter_width": 15, "read_only": 0, "tile_size_x": 4, "tile_size_y": 7, "use_padding": 1, "time": 2.6311264276504516, "times": [2.6444480419158936, 2.6350719928741455, 2.62992000579834, 2.6328320503234863, 2.6316800117492676, 2.624703884124756, 2.626784086227417, 2.631488084793091, 2.6316800117492676, 2.6226561069488525], "compile_time": 704.590645999815, "verification_time": 0, "benchmark_time": 26.73418499989566, "strategy_time": 0, "framework_time": 0.8860679999997956},
"2,32,15,15,0,5,1,0": {"block_size_x": 2, "block_size_y": 32, "filter_height": 15, "filter_width": 15, "read_only": 0, "tile_size_x": 5, "tile_size_y": 1, "use_padding": 0, "time": 3.8554399967193604, "times": [3.8669118881225586, 3.8666560649871826, 3.8575680255889893, 3.8556480407714844, 3.8551039695739746, 3.851840019226074, 3.8512959480285645, 3.850208044052124, 3.8501439094543457, 3.8490240573883057], "compile_time": 398.47338000026866, "verification_time": 0, "benchmark_time": 39.02797600039776, "strategy_time": 0, "framework_time": 0.890215999334032},
"2,32,15,15,0,5,1,1": {"block_size_x": 2, "block_size_y": 32, "filter_height": 15, "filter_width": 15, "read_only": 0, "tile_size_x": 5, "tile_size_y": 1, "use_padding": 1, "time": 1.4029855847358703, "times": [1.4113919734954834, 1.4069759845733643, 1.4032959938049316, 1.4025919437408447, 1.4030719995498657, 1.401919960975647, 1.400704026222229, 1.4004160165786743, 1.3997119665145874, 1.3997759819030762], "compile_time": 399.0259679999326, "verification_time": 0, "benchmark_time": 14.536220000081812, "strategy_time": 0, "framework_time": 0.8949580001171853},
"2,32,15,15,0,5,2,0": {"block_size_x": 2, "block_size_y": 32, "filter_height": 15, "filter_width": 15, "read_only": 0, "tile_size_x": 5, "tile_size_y": 2, "use_padding": 0, "time": 3.7690144062042235, "times": [3.7823359966278076, 3.7765119075775146, 3.769279956817627, 3.768671989440918, 3.7674560546875, 3.7670719623565674, 3.765120029449463, 3.7643520832061768, 3.764224052429199, 3.765120029449463], "compile_time": 803.2341429998269, "verification_time": 0, "benchmark_time": 38.08873700018012, "strategy_time": 0, "framework_time": 0.9058769996954652},
"2,32,15,15,0,5,2,1": {"block_size_x": 2, "block_size_y": 32, "filter_height": 15, "filter_width": 15, "read_only": 0, "tile_size_x": 5, "tile_size_y": 2, "use_padding": 1, "time": 1.3756799936294555, "times": [1.3824000358581543, 1.3760000467300415, 1.376255989074707, 1.378335952758789, 1.3742079734802246, 1.3756799697875977, 1.3700159788131714, 1.3749760389328003, 1.3706879615783691, 1.3782399892807007], "compile_time": 802.8915150002831, "verification_time": 0, "benchmark_time": 14.108513000337553, "strategy_time": 0, "framework_time": 0.9265839994441194},
"2,32,15,15,0,5,3,0": {"block_size_x": 2, "block_size_y": 32, "filter_height": 15, "filter_width": 15, "read_only": 0, "tile_size_x": 5, "tile_size_y": 3, "use_padding": 0, "time": 3.7713504314422606, "times": [3.780672073364258, 3.780224084854126, 3.771967887878418, 3.768320083618164, 3.772416114807129, 3.7711679935455322, 3.7685439586639404, 3.7669761180877686, 3.7668800354003906, 3.766335964202881], "compile_time": 1261.5700000001198, "verification_time": 0, "benchmark_time": 38.021977999960654, "strategy_time": 0, "framework_time": 0.9319280002273445},
"2,32,15,15,0,5,3,1": {"block_size_x": 2, "block_size_y": 32, "filter_height": 15, "filter_width": 15, "read_only": 0, "tile_size_x": 5, "tile_size_y": 3, "use_padding": 1, "time": 1.719971203804016, "times": [1.733407974243164, 1.7295680046081543, 1.7121599912643433, 1.7156480550765991, 1.7138880491256714, 1.7219200134277344, 1.7263679504394531, 1.724511981010437, 1.7142080068588257, 1.7080320119857788], "compile_time": 1260.4266479997932, "verification_time": 0, "benchmark_time": 17.67147800001112, "strategy_time": 0, "framework_time": 0.9441560000595928},
"2,32,15,15,0,5,4,0": {"block_size_x": 2, "block_size_y": 32, "filter_height": 15, "filter_width": 15, "read_only": 0, "tile_size_x": 5, "tile_size_y": 4, "use_padding": 0, "time": 3.740000009536743, "times": [3.7565441131591797, 3.743743896484375, 3.739583969116211, 3.733504056930542, 3.742016077041626, 3.7434558868408203, 3.736032009124756, 3.7314560413360596, 3.7422080039978027, 3.7314560413360596], "compile_time": 1755.2395430002434, "verification_time": 0, "benchmark_time": 37.92836799993893, "strategy_time": 0, "framework_time": 0.9582409998074581},
"2,32,15,15,0,5,4,1": {"block_size_x": 2, "block_size_y": 32, "filter_height": 15, "filter_width": 15, "read_only": 0, "tile_size_x": 5, "tile_size_y": 4, "use_padding": 1, "time": 2.08888635635376, "times": [2.0967679023742676, 2.089247941970825, 2.0909759998321533, 2.090399980545044, 2.0882558822631836, 2.0874879360198975, 2.0882558822631836, 2.0855040550231934, 2.0865280628204346, 2.085439920425415], "compile_time": 1752.6715759995568, "verification_time": 0, "benchmark_time": 21.429119000003993, "strategy_time": 0, "framework_time": 0.9514660000604636},
"2,32,15,15,0,5,5,0": {"block_size_x": 2, "block_size_y": 32, "filter_height": 15, "filter_width": 15, "read_only": 0, "tile_size_x": 5, "tile_size_y": 5, "use_padding": 0, "time": 3.7743584394454954, "times": [3.782655954360962, 3.777695894241333, 3.7762880325317383, 3.7731521129608154, 3.7724480628967285, 3.772128105163574, 3.772416114807129, 3.7722880840301514, 3.772416114807129, 3.7720959186553955], "compile_time": 559.9027240000396, "verification_time": 0, "benchmark_time": 38.09920699995928, "strategy_time": 0, "framework_time": 0.9716770000522956},
"2,32,15,15,0,5,5,1": {"block_size_x": 2, "block_size_y": 32, "filter_height": 15, "filter_width": 15, "read_only": 0, "tile_size_x": 5, "tile_size_y": 5, "use_padding": 1, "time": 2.1363103866577147, "times": [2.1424639225006104, 2.140160083770752, 2.131999969482422, 2.1295039653778076, 2.136352062225342, 2.131743907928467, 2.1341118812561035, 2.1386559009552, 2.13590407371521, 2.1422080993652344], "compile_time": 558.5238450003089, "verification_time": 0, "benchmark_time": 21.843220999926416, "strategy_time": 0, "framework_time": 0.9773039996616717},
"2,32,15,15,0,6,1,0": {"block_size_x": 2, "block_size_y": 32, "filter_height": 15, "filter_width": 15, "read_only": 0, "tile_size_x": 6, "tile_size_y": 1, "use_padding": 0, "time": 1.3006336092948914, "times": [1.309216022491455, 1.3027839660644531, 1.3018560409545898, 1.3004800081253052, 1.300096035003662, 1.2984319925308228, 1.2986559867858887, 1.2990080118179321, 1.2976319789886475, 1.2981760501861572], "compile_time": 442.2026590000314, "verification_time": 0, "benchmark_time": 13.50396499992712, "strategy_time": 0, "framework_time": 0.9930950000125449},
"2,32,15,15,0,6,1,1": {"block_size_x": 2, "block_size_y": 32, "filter_height": 15, "filter_width": 15, "read_only": 0, "tile_size_x": 6, "tile_size_y": 1, "use_padding": 1, "time": 1.299945592880249, "times": [1.3086719512939453, 1.301408052444458, 1.3004800081253052, 1.2984319925308228, 1.299936056137085, 1.2991679906845093, 1.2997440099716187, 1.2969919443130493, 1.2978559732437134, 1.2967679500579834], "compile_time": 441.9508979999591, "verification_time": 0, "benchmark_time": 13.530405000437895, "strategy_time": 0, "framework_time": 0.9990919998017489},
"2,32,15,15,0,6,2,0": {"block_size_x": 2, "block_size_y": 32, "filter_height": 15, "filter_width": 15, "read_only": 0, "tile_size_x": 6, "tile_size_y": 2, "use_padding": 0, "time": 1.3476192116737367, "times": [1.3557120561599731, 1.3463679552078247, 1.3442879915237427, 1.351680040359497, 1.3465919494628906, 1.3470079898834229, 1.3452800512313843, 1.3463040590286255, 1.349951982498169, 1.343008041381836], "compile_time": 888.7838489999922, "verification_time": 0, "benchmark_time": 13.988756000344438, "strategy_time": 0, "framework_time": 1.0080069996547536},
"2,32,15,15,0,6,2,1": {"block_size_x": 2, "block_size_y": 32, "filter_height": 15, "filter_width": 15, "read_only": 0, "tile_size_x": 6, "tile_size_y": 2, "use_padding": 1, "time": 1.3577568054199218, "times": [1.3714560270309448, 1.3494399785995483, 1.3601280450820923, 1.356544017791748, 1.3556159734725952, 1.3643840551376343, 1.3503680229187012, 1.3497920036315918, 1.3601919412612915, 1.3596479892730713], "compile_time": 888.0217549999543, "verification_time": 0, "benchmark_time": 14.08981800022957, "strategy_time": 0, "framework_time": 1.0273269999743206},
"2,32,15,15,0,6,3,0": {"block_size_x": 2, "block_size_y": 32, "filter_height": 15, "filter_width": 15, "read_only": 0, "tile_size_x": 6, "tile_size_y": 3, "use_padding": 0, "time": 1.626361608505249, "times": [1.6342079639434814, 1.634335994720459, 1.619968056678772, 1.6305919885635376, 1.6281280517578125, 1.6366080045700073, 1.6199040412902832, 1.6177599430084229, 1.62227201461792, 1.6198400259017944], "compile_time": 1404.1423520002354, "verification_time": 0, "benchmark_time": 16.622931999791035, "strategy_time": 0, "framework_time": 1.03379300026063},
"2,32,15,15,0,6,3,1": {"block_size_x": 2, "block_size_y": 32, "filter_height": 15, "filter_width": 15, "read_only": 0, "tile_size_x": 6, "tile_size_y": 3, "use_padding": 1, "time": 1.6997632026672362, "times": [1.7082560062408447, 1.6957759857177734, 1.7028800249099731, 1.7008960247039795, 1.6993919610977173, 1.6998399496078491, 1.7034879922866821, 1.6997120380401611, 1.6937919855117798, 1.693600058555603], "compile_time": 1410.0870409997697, "verification_time": 0, "benchmark_time": 17.40632800010644, "strategy_time": 0, "framework_time": 1.034086000345269},
"2,32,15,15,0,6,4,0": {"block_size_x": 2, "block_size_y": 32, "filter_height": 15, "filter_width": 15, "read_only": 0, "tile_size_x": 6, "tile_size_y": 4, "use_padding": 0, "time": 1.5128576040267945, "times": [1.526047945022583, 1.5128320455551147, 1.510975956916809, 1.519327998161316, 1.5052800178527832, 1.5135680437088013, 1.509376049041748, 1.5058560371398926, 1.5151360034942627, 1.5101759433746338], "compile_time": 506.0560249999071, "verification_time": 0, "benchmark_time": 15.632305000053748, "strategy_time": 0, "framework_time": 1.055652000104601},
"2,32,15,15,0,6,4,1": {"block_size_x": 2, "block_size_y": 32, "filter_height": 15, "filter_width": 15, "read_only": 0, "tile_size_x": 6, "tile_size_y": 4, "use_padding": 1, "time": 1.7158079981803893, "times": [1.7199360132217407, 1.7157119512557983, 1.7160320281982422, 1.7166719436645508, 1.7186880111694336, 1.7142720222473145, 1.7142080068588257, 1.7165119647979736, 1.713919997215271, 1.7121280431747437], "compile_time": 505.418107999958, "verification_time": 0, "benchmark_time": 17.67478600004324, "strategy_time": 0, "framework_time": 1.0598190001473995},
"2,32,15,15,0,7,1,0": {"block_size_x": 2, "block_size_y": 32, "filter_height": 15, "filter_width": 15, "read_only": 0, "tile_size_x": 7, "tile_size_y": 1, "use_padding": 0, "time": 1.9032000064849854, "times": [1.9141759872436523, 1.907520055770874, 1.9051200151443481, 1.904703974723816, 1.9008959531784058, 1.900607943534851, 1.901087999343872, 1.9005440473556519, 1.8984960317611694, 1.898848056793213], "compile_time": 490.69161799980066, "verification_time": 0, "benchmark_time": 19.35410399983084, "strategy_time": 0, "framework_time": 1.084032000562729},
"2,32,15,15,0,7,1,1": {"block_size_x": 2, "block_size_y": 32, "filter_height": 15, "filter_width": 15, "read_only": 0, "tile_size_x": 7, "tile_size_y": 1, "use_padding": 1, "time": 1.2234336018562317, "times": [1.2327359914779663, 1.2265280485153198, 1.2241920232772827, 1.221951961517334, 1.222656011581421, 1.2217600345611572, 1.2224639654159546, 1.2208960056304932, 1.2206079959869385, 1.2205439805984497], "compile_time": 482.6562660000491, "verification_time": 0, "benchmark_time": 12.486384000112594, "strategy_time": 0, "framework_time": 1.0829829998328933},
"2,32,15,15,0,7,2,0": {"block_size_x": 2, "block_size_y": 32, "filter_height": 15, "filter_width": 15, "read_only": 0, "tile_size_x": 7, "tile_size_y": 2, "use_padding": 0, "time": 1.883516800403595, "times": [1.890720009803772, 1.8879679441452026, 1.8813120126724243, 1.881983995437622, 1.8867520093917847, 1.8845759630203247, 1.8776320219039917, 1.8808000087738037, 1.8814719915390015, 1.8819520473480225], "compile_time": 992.4975010003436, "verification_time": 0, "benchmark_time": 19.289717999981804, "strategy_time": 0, "framework_time": 1.0979429998769774},
"2,32,15,15,0,7,2,1": {"block_size_x": 2, "block_size_y": 32, "filter_height": 15, "filter_width": 15, "read_only": 0, "tile_size_x": 7, "tile_size_y": 2, "use_padding": 1, "time": 1.3470911979675293, "times": [1.351647973060608, 1.3560320138931274, 1.345952033996582, 1.3434560298919678, 1.344223976135254, 1.3453760147094727, 1.351904034614563, 1.3451199531555176, 1.3456319570541382, 1.3415679931640625], "compile_time": 991.0865020001438, "verification_time": 0, "benchmark_time": 13.961492999897018, "strategy_time": 0, "framework_time": 1.0933059998023964},
"2,32,15,15,0,7,3,0": {"block_size_x": 2, "block_size_y": 32, "filter_height": 15, "filter_width": 15, "read_only": 0, "tile_size_x": 7, "tile_size_y": 3, "use_padding": 0, "time": 2.039132809638977, "times": [2.04419207572937, 2.0360960960388184, 2.042880058288574, 2.050623893737793, 2.045919895172119, 2.0342400074005127, 2.0303359031677246, 2.0402560234069824, 2.0366721153259277, 2.0301120281219482], "compile_time": 1563.1519009998556, "verification_time": 0, "benchmark_time": 20.852128000115044, "strategy_time": 0, "framework_time": 1.1089849999734724},
"2,32,15,15,0,7,3,1": {"block_size_x": 2, "block_size_y": 32, "filter_height": 15, "filter_width": 15, "read_only": 0, "tile_size_x": 7, "tile_size_y": 3, "use_padding": 1, "time": 1.6996287941932677, "times": [1.705631971359253, 1.6977920532226562, 1.7038400173187256, 1.6936960220336914, 1.70307195186615, 1.6990400552749634, 1.7015999555587769, 1.6940159797668457, 1.703935980796814, 1.6936639547348022], "compile_time": 1566.069781999886, "verification_time": 0, "benchmark_time": 17.320043000381702, "strategy_time": 0, "framework_time": 1.127333999647817},
"2,32,15,15,0,7,4,0": {"block_size_x": 2, "block_size_y": 32, "filter_height": 15, "filter_width": 15, "read_only": 0, "tile_size_x": 7, "tile_size_y": 4, "use_padding": 0, "time": 1.8918496012687682, "times": [1.891103982925415, 1.8830080032348633, 1.8923519849777222, 1.8937920331954956, 1.9027520418167114, 1.8759679794311523, 1.901695966720581, 1.9067519903182983, 1.88864004611969, 1.882431983947754], "compile_time": 573.0215489998045, "verification_time": 0, "benchmark_time": 19.3682539998008, "strategy_time": 0, "framework_time": 1.2114350006413588},
"2,32,15,15,0,7,4,1": {"block_size_x": 2, "block_size_y": 32, "filter_height": 15, "filter_width": 15, "read_only": 0, "tile_size_x": 7, "tile_size_y": 4, "use_padding": 1, "time": 1.7466239929199219, "times": [1.742784023284912, 1.7599040269851685, 1.7531839609146118, 1.73471999168396, 1.751423954963684, 1.7487679719924927, 1.7416640520095825, 1.7346559762954712, 1.7469439506530762, 1.7521920204162598], "compile_time": 575.7322269996621, "verification_time": 0, "benchmark_time": 17.84997699996893, "strategy_time": 0, "framework_time": 1.1382970001250214},
"2,32,15,15,0,8,1,0": {"block_size_x": 2, "block_size_y": 32, "filter_height": 15, "filter_width": 15, "read_only": 0, "tile_size_x": 8, "tile_size_y": 1, "use_padding": 0, "time": 1.1787200093269348, "times": [1.1874239444732666, 1.182911992073059, 1.1782079935073853, 1.1784000396728516, 1.1784319877624512, 1.1777280569076538, 1.1788480281829834, 1.1758719682693481, 1.1756800413131714, 1.1736960411071777], "compile_time": 516.5572329997303, "verification_time": 0, "benchmark_time": 12.280510999971739, "strategy_time": 0, "framework_time": 1.1420350001571933},
"2,32,15,15,0,8,1,1": {"block_size_x": 2, "block_size_y": 32, "filter_height": 15, "filter_width": 15, "read_only": 0, "tile_size_x": 8, "tile_size_y": 1, "use_padding": 1, "time": 1.1707039833068849, "times": [1.1799360513687134, 1.1733119487762451, 1.1732159852981567, 1.169119954109192, 1.1696640253067017, 1.168287992477417, 1.1679999828338623, 1.1690880060195923, 1.1683199405670166, 1.1680959463119507], "compile_time": 515.2472029999444, "verification_time": 0, "benchmark_time": 11.98454799987303, "strategy_time": 0, "framework_time": 1.1504310000418627},
"2,32,15,15,0,8,2,0": {"block_size_x": 2, "block_size_y": 32, "filter_height": 15, "filter_width": 15, "read_only": 0, "tile_size_x": 8, "tile_size_y": 2, "use_padding": 0, "time": 1.3342656135559081, "times": [1.3487679958343506, 1.3396480083465576, 1.3350080251693726, 1.3331199884414673, 1.3288960456848145, 1.3336000442504883, 1.328544020652771, 1.33843195438385, 1.3310400247573853, 1.325600028038025], "compile_time": 1082.443665000028, "verification_time": 0, "benchmark_time": 13.669887000105518, "strategy_time": 0, "framework_time": 1.1618939997788402},
"2,32,15,15,0,8,2,1": {"block_size_x": 2, "block_size_y": 32, "filter_height": 15, "filter_width": 15, "read_only": 0, "tile_size_x": 8, "tile_size_y": 2, "use_padding": 1, "time": 1.3403007864952088, "times": [1.3482240438461304, 1.3454400300979614, 1.3270399570465088, 1.3353919982910156, 1.339743971824646, 1.341439962387085, 1.3332480192184448, 1.345471978187561, 1.345855951309204, 1.3411519527435303], "compile_time": 1079.4889609996972, "verification_time": 0, "benchmark_time": 13.830812999913178, "strategy_time": 0, "framework_time": 1.1786390004999703},
"2,32,15,15,0,8,3,0": {"block_size_x": 2, "block_size_y": 32, "filter_height": 15, "filter_width": 15, "read_only": 0, "tile_size_x": 8, "tile_size_y": 3, "use_padding": 0, "time": 1.4419679999351502, "times": [1.4476159811019897, 1.4476159811019897, 1.4394240379333496, 1.4498560428619385, 1.4424320459365845, 1.4349759817123413, 1.4351040124893188, 1.4376959800720215, 1.437343955039978, 1.4476159811019897], "compile_time": 474.0612109999347, "verification_time": 0, "benchmark_time": 14.769815999898128, "strategy_time": 0, "framework_time": 1.1836640001092746},
"2,32,15,15,0,8,3,1": {"block_size_x": 2, "block_size_y": 32, "filter_height": 15, "filter_width": 15, "read_only": 0, "tile_size_x": 8, "tile_size_y": 3, "use_padding": 1, "time": 1.4423167824745178, "times": [1.4551359415054321, 1.4458880424499512, 1.4335999488830566, 1.4421440362930298, 1.4430079460144043, 1.4422719478607178, 1.4398399591445923, 1.4377280473709106, 1.441823959350586, 1.4417279958724976], "compile_time": 472.89671099997577, "verification_time": 0, "benchmark_time": 14.868865000153164, "strategy_time": 0, "framework_time": 1.1903809995601478},
"2,32,15,15,1,1,1,0": {"block_size_x": 2, "block_size_y": 32, "filter_height": 15, "filter_width": 15, "read_only": 1, "tile_size_x": 1, "tile_size_y": 1, "use_padding": 0, "time": 22.84263343811035, "times": [22.863712310791016, 22.840351104736328, 22.829055786132812, 22.829151153564453, 22.83500862121582, 22.84294319152832, 22.843488693237305, 22.8439998626709, 22.848352432250977, 22.850271224975586], "compile_time": 224.90959900005691, "verification_time": 0, "benchmark_time": 229.20172500016633, "strategy_time": 0, "framework_time": 1.3947569996162201},
"2,32,15,15,1,1,1,1": {"block_size_x": 2, "block_size_y": 32, "filter_height": 15, "filter_width": 15, "read_only": 1, "tile_size_x": 1, "tile_size_y": 1, "use_padding": 1, "time": 2.8436736106872558, "times": [2.852895975112915, 2.84553599357605, 2.844896078109741, 2.8430399894714355, 2.842560052871704, 2.842816114425659, 2.84224009513855, 2.841599941253662, 2.840575933456421, 2.840575933456421], "compile_time": 255.84551600013583, "verification_time": 0, "benchmark_time": 28.889321999940876, "strategy_time": 0, "framework_time": 6.8890110001120775},
"2,32,15,15,1,1,2,0": {"block_size_x": 2, "block_size_y": 32, "filter_height": 15, "filter_width": 15, "read_only": 1, "tile_size_x": 1, "tile_size_y": 2, "use_padding": 0, "time": 15.595999908447265, "times": [15.595135688781738, 15.590815544128418, 15.589183807373047, 15.58732795715332, 15.589119911193848, 15.592032432556152, 15.595808029174805, 15.60700798034668, 15.605759620666504, 15.607808113098145], "compile_time": 411.1971170000288, "verification_time": 0, "benchmark_time": 156.5984609997031, "strategy_time": 0, "framework_time": 1.402904000315175},
"2,32,15,15,1,1,2,1": {"block_size_x": 2, "block_size_y": 32, "filter_height": 15, "filter_width": 15, "read_only": 1, "tile_size_x": 1, "tile_size_y": 2, "use_padding": 1, "time": 2.683785605430603, "times": [2.6840319633483887, 2.6768319606781006, 2.6746881008148193, 2.6730239391326904, 2.672640085220337, 2.672384023666382, 2.6724159717559814, 2.671679973602295, 2.7013120651245117, 2.7388479709625244], "compile_time": 436.7225559999497, "verification_time": 0, "benchmark_time": 27.391136000005645, "strategy_time": 0, "framework_time": 7.044850000056613},
"2,32,15,15,1,1,3,0": {"block_size_x": 2, "block_size_y": 32, "filter_height": 15, "filter_width": 15, "read_only": 1, "tile_size_x": 1, "tile_size_y": 3, "use_padding": 0, "time": 15.691571140289307, "times": [15.695327758789062, 15.685215950012207, 15.679231643676758, 15.675359725952148, 15.67846393585205, 15.678303718566895, 15.682559967041016, 15.734944343566895, 15.706687927246094, 15.699616432189941], "compile_time": 686.8814479998946, "verification_time": 0, "benchmark_time": 157.74232600006144, "strategy_time": 0, "framework_time": 1.423342999714805},
"2,32,15,15,1,1,3,1": {"block_size_x": 2, "block_size_y": 32, "filter_height": 15, "filter_width": 15, "read_only": 1, "tile_size_x": 1, "tile_size_y": 3, "use_padding": 1, "time": 2.6838784217834473, "times": [2.6817920207977295, 2.675424098968506, 2.6729280948638916, 2.6727681159973145, 2.671231985092163, 2.6716160774230957, 2.6712958812713623, 2.670880079269409, 2.7122559547424316, 2.7385919094085693], "compile_time": 726.1850429999868, "verification_time": 0, "benchmark_time": 27.35979999988558, "strategy_time": 0, "framework_time": 7.169883000187838},
"2,32,15,15,1,1,4,0": {"block_size_x": 2, "block_size_y": 32, "filter_height": 15, "filter_width": 15, "read_only": 1, "tile_size_x": 1, "tile_size_y": 4, "use_padding": 0, "time": 15.584636688232422, "times": [15.59228801727295, 15.580191612243652, 15.576064109802246, 15.575039863586426, 15.577280044555664, 15.576607704162598, 15.580991744995117, 15.597536087036133, 15.597567558288574, 15.59280014038086], "compile_time": 1024.1897509999944, "verification_time": 0, "benchmark_time": 156.65536899996368, "strategy_time": 0, "framework_time": 1.45429799977137},
"2,32,15,15,1,1,4,1": {"block_size_x": 2, "block_size_y": 32, "filter_height": 15, "filter_width": 15, "read_only": 1, "tile_size_x": 1, "tile_size_y": 4, "use_padding": 1, "time": 2.6837536096572876, "times": [2.6907520294189453, 2.6809279918670654, 2.6910400390625, 2.6867520809173584, 2.680543899536133, 2.6831040382385254, 2.68287992477417, 2.679680109024048, 2.6855359077453613, 2.6763200759887695], "compile_time": 1058.8070389999302, "verification_time": 0, "benchmark_time": 27.315107000049466, "strategy_time": 0, "framework_time": 7.30172199973822},
"2,32,15,15,1,1,5,0": {"block_size_x": 2, "block_size_y": 32, "filter_height": 15, "filter_width": 15, "read_only": 1, "tile_size_x": 1, "tile_size_y": 5, "use_padding": 0, "time": 22.52613773345947, "times": [22.636415481567383, 22.55881690979004, 22.5380802154541, 22.5020809173584, 22.503456115722656, 22.50422477722168, 22.50511932373047, 22.5032958984375, 22.50271987915039, 22.50716781616211], "compile_time": 1378.596975000164, "verification_time": 0, "benchmark_time": 225.98558499976207, "strategy_time": 0, "framework_time": 1.469382000323094},
"2,32,15,15,1,1,5,1": {"block_size_x": 2, "block_size_y": 32, "filter_height": 15, "filter_width": 15, "read_only": 1, "tile_size_x": 1, "tile_size_y": 5, "use_padding": 1, "time": 3.0096319913864136, "times": [3.0027520656585693, 2.9832959175109863, 3.008352041244507, 3.0177600383758545, 3.0351359844207764, 3.0123839378356934, 3.001728057861328, 3.0199999809265137, 3.031359910964966, 2.9835519790649414], "compile_time": 1413.2592870000735, "verification_time": 0, "benchmark_time": 30.53898799998933, "strategy_time": 0, "framework_time": 7.406625999919925},
"2,32,15,15,1,1,6,0": {"block_size_x": 2, "block_size_y": 32, "filter_height": 15, "filter_width": 15, "read_only": 1, "tile_size_x": 1, "tile_size_y": 6, "use_padding": 0, "time": 22.845039939880373, "times": [22.9234561920166, 22.847007751464844, 22.819936752319336, 22.819839477539062, 22.83145523071289, 22.86739158630371, 22.845216751098633, 22.831615447998047, 22.833152770996094, 22.831327438354492], "compile_time": 1740.1643610000974, "verification_time": 0, "benchmark_time": 229.24776199988628, "strategy_time": 0, "framework_time": 1.471636000133003},
"2,32,15,15,1,1,6,1": {"block_size_x": 2, "block_size_y": 32, "filter_height": 15, "filter_width": 15, "read_only": 1, "tile_size_x": 1, "tile_size_y": 6, "use_padding": 1, "time": 2.9657344102859495, "times": [2.963615894317627, 2.969696044921875, 2.9734721183776855, 2.9611198902130127, 2.9703359603881836, 2.9488320350646973, 2.9679360389709473, 2.9613120555877686, 2.963263988494873, 2.977760076522827], "compile_time": 1762.6871480001682, "verification_time": 0, "benchmark_time": 30.070883000007598, "strategy_time": 0, "framework_time": 7.493589999739925},
"2,32,15,15,1,1,7,0": {"block_size_x": 2, "block_size_y": 32, "filter_height": 15, "filter_width": 15, "read_only": 1, "tile_size_x": 1, "tile_size_y": 7, "use_padding": 0, "time": 20.32864627838135, "times": [23.0645751953125, 22.994943618774414, 22.97635269165039, 22.974464416503906, 22.97772789001465, 22.991615295410156, 16.77516746520996, 16.17919921875, 16.17945671081543, 16.17296028137207], "compile_time": 2099.5986599996286, "verification_time": 0, "benchmark_time": 204.06156900025962, "strategy_time": 0, "framework_time": 1.5111170000636776},
"2,32,15,15,1,1,7,1": {"block_size_x": 2, "block_size_y": 32, "filter_height": 15, "filter_width": 15, "read_only": 1, "tile_size_x": 1, "tile_size_y": 7, "use_padding": 1, "time": 4.514252758026123, "times": [4.544640064239502, 4.576479911804199, 4.456704139709473, 4.549568176269531, 4.466911792755127, 4.502367973327637, 4.5404157638549805, 4.533599853515625, 4.489471912384033, 4.482367992401123], "compile_time": 2129.1395120001653, "verification_time": 0, "benchmark_time": 45.5865190001532, "strategy_time": 0, "framework_time": 7.6033139998799015},
"2,32,15,15,1,1,8,0": {"block_size_x": 2, "block_size_y": 32, "filter_height": 15, "filter_width": 15, "read_only": 1, "tile_size_x": 1, "tile_size_y": 8, "use_padding": 0, "time": 22.152588653564454, "times": [22.16124725341797, 22.151168823242188, 22.15123176574707, 22.147424697875977, 22.145023345947266, 22.15510368347168, 22.15065574645996, 22.148191452026367, 22.167808532714844, 22.14803123474121], "compile_time": 2488.863996999953, "verification_time": 0, "benchmark_time": 222.24575499967614, "strategy_time": 0, "framework_time": 1.610927000456286},
"2,32,15,15,1,1,8,1": {"block_size_x": 2, "block_size_y": 32, "filter_height": 15, "filter_width": 15, "read_only": 1, "tile_size_x": 1, "tile_size_y": 8, "use_padding": 1, "time": 7.915251302719116, "times": [7.724832057952881, 7.745759963989258, 7.76416015625, 7.806015968322754, 8.227680206298828, 7.980832099914551, 7.976960182189941, 7.975488185882568, 7.97379207611084, 7.976992130279541], "compile_time": 2519.375645999844, "verification_time": 0, "benchmark_time": 79.62690300018949, "strategy_time": 0, "framework_time": 7.75718999966557},
"2,32,15,15,1,2,1,0": {"block_size_x": 2, "block_size_y": 32, "filter_height": 15, "filter_width": 15, "read_only": 1, "tile_size_x": 2, "tile_size_y": 1, "use_padding": 0, "time": 2.4281183958053587, "times": [2.4373440742492676, 2.4328320026397705, 2.432255983352661, 2.4285759925842285, 2.429759979248047, 2.431839942932129, 2.4247679710388184, 2.4191360473632812, 2.4214720726013184, 2.4231998920440674], "compile_time": 286.59604499989655, "verification_time": 0, "benchmark_time": 24.637320999772783, "strategy_time": 0, "framework_time": 2.4924060003286286},
"2,32,15,15,1,2,1,1": {"block_size_x": 2, "block_size_y": 32, "filter_height": 15, "filter_width": 15, "read_only": 1, "tile_size_x": 2, "tile_size_y": 1, "use_padding": 1, "time": 2.408508801460266, "times": [2.418720006942749, 2.4159998893737793, 2.409791946411133, 2.4086079597473145, 2.406496047973633, 2.4082560539245605, 2.40828800201416, 2.403808116912842, 2.4043519496917725, 2.4007680416107178], "compile_time": 264.4369039999219, "verification_time": 0, "benchmark_time": 24.60795099977986, "strategy_time": 0, "framework_time": 1.3605000003735768},
