cached_data_used/cachefiles/pnpoly/RTX_3090.json
{
"device_name": "NVIDIA GeForce RTX 3090",
"kernel_name": "cn_pnpoly",
"problem_size": 20000000,
"tune_params_keys": [
"between_method",
"block_size_x",
"tile_size",
"use_method"
],
"tune_params": {
"between_method": [
0,
1,
2,
3
],
"block_size_x": [
32,
64,
96,
128,
160,
192,
224,
256,
288,
320,
352,
384,
416,
448,
480,
512,
544,
576,
608,
640,
672,
704,
736,
768,
800,
832,
864,
896,
928,
960,
992
],
"tile_size": [
1,
2,
4,
6,
8,
10,
12,
14,
16,
18,
20
],
"use_method": [
0,
1,
2
]
},
"objective": "time",
"cache": {
"0,32,1,0": {"between_method": 0, "block_size_x": 32, "tile_size": 1, "use_method": 0, "time": 43.55386238098144, "times": [43.293697357177734, 43.28633499145508, 43.60396957397461, 43.62752151489258, 43.621376037597656, 43.621376037597656, 43.626495361328125, 43.619327545166016, 43.621246337890625, 43.617279052734375], "compile_time": 0.03068055957555771, "verification_time": 0, "benchmark_time": 436.0794024541974, "strategy_time": 0, "framework_time": 26.815387420356274, "timestamp": "2023-01-26 01:05:09.730633+00:00"},
"0,32,1,1": {"between_method": 0, "block_size_x": 32, "tile_size": 1, "use_method": 1, "time": 42.88314247131348, "times": [42.90150451660156, 42.887168884277344, 42.8851203918457, 42.87071990966797, 42.88819122314453, 42.88902282714844, 42.877952575683594, 42.87993621826172, 42.8851203918457, 42.8666877746582], "compile_time": 114.33220095932484, "verification_time": 0, "benchmark_time": 429.451004602015, "strategy_time": 0, "framework_time": 0.4279809072613716, "timestamp": "2023-01-26 01:05:10.274872+00:00"},
"0,32,1,2": {"between_method": 0, "block_size_x": 32, "tile_size": 1, "use_method": 2, "time": 42.90027503967285, "times": [42.91584014892578, 42.90662384033203, 42.90047836303711, 42.89740753173828, 42.889217376708984, 42.88614273071289, 42.89023971557617, 42.91993713378906, 42.8851203918457, 42.9117431640625], "compile_time": 110.34165602177382, "verification_time": 0, "benchmark_time": 429.58895582705736, "strategy_time": 0, "framework_time": 0.49694906920194626, "timestamp": "2023-01-26 01:05:10.815324+00:00"},
"0,32,2,0": {"between_method": 0, "block_size_x": 32, "tile_size": 2, "use_method": 0, "time": 24.379494285583498, "times": [24.390655517578125, 24.385536193847656, 24.378368377685547, 24.381439208984375, 24.377344131469727, 24.376319885253906, 24.375295639038086, 24.374271392822266, 24.379392623901367, 24.376319885253906], "compile_time": 111.88561655580997, "verification_time": 0, "benchmark_time": 244.5550337433815, "strategy_time": 0, "framework_time": 0.5753207951784134, "timestamp": "2023-01-26 01:05:11.172366+00:00"},
"0,32,2,1": {"between_method": 0, "block_size_x": 32, "tile_size": 2, "use_method": 1, "time": 23.948902130126953, "times": [23.801855087280273, 23.91551971435547, 23.973888397216797, 23.972864151000977, 23.971839904785156, 23.968767166137695, 23.974912643432617, 23.970815658569336, 23.968767166137695, 23.969791412353516], "compile_time": 107.10051190108061, "verification_time": 0, "benchmark_time": 239.89302571862936, "strategy_time": 0, "framework_time": 0.5454514175653458, "timestamp": "2023-01-26 01:05:11.519927+00:00"},
"0,32,2,2": {"between_method": 0, "block_size_x": 32, "tile_size": 2, "use_method": 2, "time": 24.03379249572754, "times": [23.998464584350586, 23.989248275756836, 23.984128952026367, 23.982080459594727, 23.984128952026367, 23.982080459594727, 23.982080459594727, 24.10188865661621, 24.167423248291016, 24.166400909423828], "compile_time": 114.34066202491522, "verification_time": 0, "benchmark_time": 240.92702846974134, "strategy_time": 0, "framework_time": 0.5387105047702789, "timestamp": "2023-01-26 01:05:11.875756+00:00"},
"0,32,4,0": {"between_method": 0, "block_size_x": 32, "tile_size": 4, "use_method": 0, "time": 15.806348896026611, "times": [15.739904403686523, 15.739904403686523, 15.753215789794922, 15.833087921142578, 15.831040382385254, 15.830016136169434, 15.831007957458496, 15.833087921142578, 15.837183952331543, 15.835040092468262], "compile_time": 111.39960773289204, "verification_time": 0, "benchmark_time": 158.68118312209845, "strategy_time": 0, "framework_time": 0.5604298785328865, "timestamp": "2023-01-26 01:05:12.146419+00:00"},
"0,32,4,1": {"between_method": 0, "block_size_x": 32, "tile_size": 4, "use_method": 1, "time": 15.510595226287842, "times": [15.334400177001953, 15.326208114624023, 15.531904220581055, 15.560511589050293, 15.560704231262207, 15.558655738830566, 15.558655738830566, 15.557632446289062, 15.558624267578125, 15.558655738830566], "compile_time": 111.52670718729496, "verification_time": 0, "benchmark_time": 155.69240879267454, "strategy_time": 0, "framework_time": 0.5937311798334122, "timestamp": "2023-01-26 01:05:12.414253+00:00"},
"0,32,4,2": {"between_method": 0, "block_size_x": 32, "tile_size": 4, "use_method": 2, "time": 15.394707107543946, "times": [15.313887596130371, 15.309823989868164, 15.416319847106934, 15.415295600891113, 15.415295600891113, 15.414239883422852, 15.418368339538574, 15.415295600891113, 15.41427230834961, 15.41427230834961], "compile_time": 106.53614904731512, "verification_time": 0, "benchmark_time": 154.40208744257689, "strategy_time": 0, "framework_time": 0.5933009088039398, "timestamp": "2023-01-26 01:05:12.675807+00:00"},
"0,32,6,0": {"between_method": 0, "block_size_x": 32, "tile_size": 6, "use_method": 0, "time": 13.022899150848389, "times": [12.951552391052246, 12.948479652404785, 13.042688369750977, 13.042688369750977, 13.04041576385498, 13.041664123535156, 13.040639877319336, 13.039615631103516, 13.041631698608398, 13.039615631103516], "compile_time": 109.47879403829575, "verification_time": 0, "benchmark_time": 130.86356408894062, "strategy_time": 0, "framework_time": 0.5786912515759468, "timestamp": "2023-01-26 01:05:12.916750+00:00"},
"0,32,6,1": {"between_method": 0, "block_size_x": 32, "tile_size": 6, "use_method": 1, "time": 12.478131294250488, "times": [12.271424293518066, 12.2675199508667, 12.45081615447998, 12.491776466369629, 12.54911994934082, 12.54911994934082, 12.54911994934082, 12.554176330566406, 12.54911994934082, 12.54911994934082], "compile_time": 109.5651239156723, "verification_time": 0, "benchmark_time": 125.4712175577879, "strategy_time": 0, "framework_time": 0.6054500117897987, "timestamp": "2023-01-26 01:05:13.152413+00:00"},
"0,32,6,2": {"between_method": 0, "block_size_x": 32, "tile_size": 6, "use_method": 2, "time": 12.539785480499267, "times": [12.393471717834473, 12.391424179077148, 12.577759742736816, 12.576767921447754, 12.577728271484375, 12.577728271484375, 12.575743675231934, 12.575743675231934, 12.575743675231934, 12.575743675231934], "compile_time": 113.29626850783825, "verification_time": 0, "benchmark_time": 125.83074625581503, "strategy_time": 0, "framework_time": 0.6322916597127914, "timestamp": "2023-01-26 01:05:13.392195+00:00"},
"0,32,8,0": {"between_method": 0, "block_size_x": 32, "tile_size": 8, "use_method": 0, "time": 12.637286376953124, "times": [12.57472038269043, 12.57369613647461, 12.63923168182373, 12.65664005279541, 12.65561580657959, 12.65561580657959, 12.65561580657959, 12.65459156036377, 12.653568267822266, 12.653568267822266], "compile_time": 110.29681470245123, "verification_time": 0, "benchmark_time": 126.84685923159122, "strategy_time": 0, "framework_time": 0.6684018298983574, "timestamp": "2023-01-26 01:05:13.630030+00:00"},
"0,32,8,1": {"between_method": 0, "block_size_x": 32, "tile_size": 8, "use_method": 1, "time": 11.55543041229248, "times": [11.302911758422852, 11.286527633666992, 11.440128326416016, 11.65004825592041, 11.645952224731445, 11.64902400970459, 11.644927978515625, 11.643903732299805, 11.644927978515625, 11.645952224731445], "compile_time": 111.2080654129386, "verification_time": 0, "benchmark_time": 116.0544827580452, "strategy_time": 0, "framework_time": 0.7227519527077675, "timestamp": "2023-01-26 01:05:13.858039+00:00"},
"0,32,8,2": {"between_method": 0, "block_size_x": 32, "tile_size": 8, "use_method": 2, "time": 11.4821120262146, "times": [11.340800285339355, 11.332608222961426, 11.32646369934082, 11.396096229553223, 11.510784149169922, 11.554816246032715, 11.588607788085938, 11.589632034301758, 11.592703819274902, 11.588607788085938], "compile_time": 111.44493706524372, "verification_time": 0, "benchmark_time": 115.3584523126483, "strategy_time": 0, "framework_time": 0.6686011329293251, "timestamp": "2023-01-26 01:05:14.085533+00:00"},
"0,32,10,0": {"between_method": 0, "block_size_x": 32, "tile_size": 10, "use_method": 0, "time": 11.950182342529297, "times": [11.888640403747559, 11.887616157531738, 11.905023574829102, 11.97158432006836, 11.969535827636719, 11.968511581420898, 11.973631858825684, 11.988991737365723, 11.973631858825684, 11.974656105041504], "compile_time": 113.15048858523369, "verification_time": 0, "benchmark_time": 119.96171809732914, "strategy_time": 0, "framework_time": 0.7010409608483315, "timestamp": "2023-01-26 01:05:14.319368+00:00"},
"0,32,10,1": {"between_method": 0, "block_size_x": 32, "tile_size": 10, "use_method": 1, "time": 11.70319356918335, "times": [11.463680267333984, 11.4585599899292, 11.466752052307129, 11.75654411315918, 11.813887596130371, 11.812864303588867, 11.813887596130371, 11.814911842346191, 11.812864303588867, 11.817983627319336], "compile_time": 114.56911079585552, "verification_time": 0, "benchmark_time": 117.55458544939756, "strategy_time": 0, "framework_time": 0.6892122328281403, "timestamp": "2023-01-26 01:05:14.552203+00:00"},
"0,32,10,2": {"between_method": 0, "block_size_x": 32, "tile_size": 10, "use_method": 2, "time": 10.89372148513794, "times": [10.775551795959473, 10.769408226013184, 10.873855590820312, 10.93836784362793, 10.93734359741211, 10.93836784362793, 10.92915153503418, 10.926079750061035, 10.924032211303711, 10.925056457519531], "compile_time": 112.15812619775534, "verification_time": 0, "benchmark_time": 109.64216478168964, "strategy_time": 0, "framework_time": 0.7332507520914078, "timestamp": "2023-01-26 01:05:14.774758+00:00"},
"0,32,12,0": {"between_method": 0, "block_size_x": 32, "tile_size": 12, "use_method": 0, "time": 11.6300799369812, "times": [11.563008308410645, 11.559935569763184, 11.553791999816895, 11.619327545166016, 11.668479919433594, 11.66643238067627, 11.668479919433594, 11.66540813446045, 11.667455673217773, 11.668479919433594], "compile_time": 117.3359053209424, "verification_time": 0, "benchmark_time": 116.91719386726618, "strategy_time": 0, "framework_time": 0.7339008152484894, "timestamp": "2023-01-26 01:05:15.009766+00:00"},
"0,32,12,1": {"between_method": 0, "block_size_x": 32, "tile_size": 12, "use_method": 1, "time": 11.112448024749757, "times": [10.802176475524902, 10.805248260498047, 10.943488121032715, 11.226112365722656, 11.224063873291016, 11.224063873291016, 11.225088119506836, 11.223039627075195, 11.224063873291016, 11.22713565826416], "compile_time": 111.35815735906363, "verification_time": 0, "benchmark_time": 111.65739595890045, "strategy_time": 0, "framework_time": 0.7554301992058754, "timestamp": "2023-01-26 01:05:15.233560+00:00"},
"0,32,12,2": {"between_method": 0, "block_size_x": 32, "tile_size": 12, "use_method": 2, "time": 10.268262386322021, "times": [10.176511764526367, 10.186752319335938, 10.169343948364258, 10.178560256958008, 10.352640151977539, 10.33523178100586, 10.332159996032715, 10.338303565979004, 10.307583808898926, 10.305536270141602], "compile_time": 116.24786350876093, "verification_time": 0, "benchmark_time": 103.25325559824705, "strategy_time": 0, "framework_time": 0.8483510464429855, "timestamp": "2023-01-26 01:05:15.453932+00:00"},
"0,32,14,0": {"between_method": 0, "block_size_x": 32, "tile_size": 14, "use_method": 0, "time": 11.494809627532959, "times": [11.509759902954102, 11.495424270629883, 11.496447563171387, 11.494400024414062, 11.493375778198242, 11.489279747009277, 11.484160423278809, 11.503616333007812, 11.488256454467773, 11.493375778198242], "compile_time": 115.89935328811407, "verification_time": 0, "benchmark_time": 115.57676177471876, "strategy_time": 0, "framework_time": 0.7811607792973518, "timestamp": "2023-01-26 01:05:15.686212+00:00"},
"0,32,14,1": {"between_method": 0, "block_size_x": 32, "tile_size": 14, "use_method": 1, "time": 10.945638179779053, "times": [10.707967758178711, 10.695679664611816, 10.83801555633545, 11.03769588470459, 11.04588794708252, 11.02847957611084, 11.024383544921875, 11.025407791137695, 11.026432037353516, 11.026432037353516], "compile_time": 116.63409415632486, "verification_time": 0, "benchmark_time": 109.98374409973621, "strategy_time": 0, "framework_time": 0.7988810539245605, "timestamp": "2023-01-26 01:05:15.913651+00:00"},
"0,32,14,2": {"between_method": 0, "block_size_x": 32, "tile_size": 14, "use_method": 2, "time": 10.216960048675537, "times": [10.178560256958008, 10.176511764526367, 10.167296409606934, 10.188799858093262, 10.243071556091309, 10.24512004852295, 10.244095802307129, 10.242048263549805, 10.242048263549805, 10.242048263549805], "compile_time": 118.31239704042673, "verification_time": 0, "benchmark_time": 102.61342395097017, "strategy_time": 0, "framework_time": 0.8303113281726837, "timestamp": "2023-01-26 01:05:16.135429+00:00"},
"0,32,16,0": {"between_method": 0, "block_size_x": 32, "tile_size": 16, "use_method": 0, "time": 11.644927978515625, "times": [11.654144287109375, 11.65004825592041, 11.651071548461914, 11.643903732299805, 11.643903732299805, 11.644927978515625, 11.6428804397583, 11.63980770111084, 11.63980770111084, 11.638784408569336], "compile_time": 116.83670431375504, "verification_time": 0, "benchmark_time": 116.86994414776564, "strategy_time": 0, "framework_time": 0.8332803845405579, "timestamp": "2023-01-26 01:05:16.369991+00:00"},
"0,32,16,1": {"between_method": 0, "block_size_x": 32, "tile_size": 16, "use_method": 1, "time": 10.97830410003662, "times": [10.713088035583496, 10.711039543151855, 10.781696319580078, 10.790911674499512, 11.130880355834961, 11.12985610961914, 11.12985610961914, 11.134976387023926, 11.130880355834961, 11.12985610961914], "compile_time": 116.9867143034935, "verification_time": 0, "benchmark_time": 110.29393505305052, "strategy_time": 0, "framework_time": 0.8521303534507751, "timestamp": "2023-01-26 01:05:16.598147+00:00"},
"0,32,16,2": {"between_method": 0, "block_size_x": 32, "tile_size": 16, "use_method": 2, "time": 10.464972877502442, "times": [10.414079666137695, 10.41100788116455, 10.43455982208252, 10.488832473754883, 10.484736442565918, 10.483712196350098, 10.483712196350098, 10.482687950134277, 10.482687950134277, 10.483712196350098], "compile_time": 123.79765417426825, "verification_time": 0, "benchmark_time": 105.27699813246727, "strategy_time": 0, "framework_time": 0.8459407836198807, "timestamp": "2023-01-26 01:05:16.828089+00:00"},
"0,32,18,0": {"between_method": 0, "block_size_x": 32, "tile_size": 18, "use_method": 0, "time": 9.009244823455811, "times": [8.975359916687012, 8.99788761138916, 8.963071823120117, 8.962047576904297, 9.0316801071167, 9.043871879577637, 9.036800384521484, 9.036800384521484, 9.036800384521484, 9.00812816619873], "compile_time": 124.35556389391422, "verification_time": 0, "benchmark_time": 90.57083819061518, "strategy_time": 0, "framework_time": 0.8924510329961777, "timestamp": "2023-01-26 01:05:17.043929+00:00"},
"0,32,18,1": {"between_method": 0, "block_size_x": 32, "tile_size": 18, "use_method": 1, "time": 11.089001560211182, "times": [10.782719612121582, 10.772480010986328, 11.028512001037598, 11.115519523620605, 11.192319869995117, 11.201536178588867, 11.198464393615723, 11.201536178588867, 11.200511932373047, 11.196415901184082], "compile_time": 120.68596947938204, "verification_time": 0, "benchmark_time": 111.39565519988537, "strategy_time": 0, "framework_time": 0.8996222168207169, "timestamp": "2023-01-26 01:05:17.276933+00:00"},
"0,32,18,2": {"between_method": 0, "block_size_x": 32, "tile_size": 18, "use_method": 2, "time": 10.508287906646729, "times": [10.473471641540527, 10.472448348999023, 10.497023582458496, 10.525792121887207, 10.523648262023926, 10.519455909729004, 10.51852798461914, 10.51750373840332, 10.51750373840332, 10.51750373840332], "compile_time": 124.82716422528028, "verification_time": 0, "benchmark_time": 105.56828882545233, "strategy_time": 0, "framework_time": 0.9055417031049728, "timestamp": "2023-01-26 01:05:17.508257+00:00"},
"0,32,20,0": {"between_method": 0, "block_size_x": 32, "tile_size": 20, "use_method": 0, "time": 8.737689590454101, "times": [8.70809555053711, 8.700927734375, 8.698880195617676, 8.697855949401855, 8.749055862426758, 8.768511772155762, 8.763392448425293, 8.762368202209473, 8.765439987182617, 8.762368202209473], "compile_time": 123.51699266582727, "verification_time": 0, "benchmark_time": 87.92389277368784, "strategy_time": 0, "framework_time": 0.9321616962552071, "timestamp": "2023-01-26 01:05:17.720652+00:00"},
"0,32,20,1": {"between_method": 0, "block_size_x": 32, "tile_size": 20, "use_method": 1, "time": 11.20235538482666, "times": [10.959872245788574, 10.94655990600586, 11.156479835510254, 11.209728240966797, 11.289600372314453, 11.293696403503418, 11.290623664855957, 11.289600372314453, 11.297792434692383, 11.289600372314453], "compile_time": 124.22157358378172, "verification_time": 0, "benchmark_time": 112.54519782960415, "strategy_time": 0, "framework_time": 0.9313030168414116, "timestamp": "2023-01-26 01:05:17.958373+00:00"},
"0,32,20,2": {"between_method": 0, "block_size_x": 32, "tile_size": 20, "use_method": 2, "time": 10.584966468811036, "times": [10.55129623413086, 10.537983894348145, 10.539839744567871, 10.54207992553711, 10.610688209533691, 10.617888450622559, 10.612735748291016, 10.612704277038574, 10.611712455749512, 10.612735748291016], "compile_time": 126.76496803760529, "verification_time": 0, "benchmark_time": 106.48825950920582, "strategy_time": 0, "framework_time": 0.9545804932713509, "timestamp": "2023-01-26 01:05:18.192608+00:00"},
"0,64,1,0": {"between_method": 0, "block_size_x": 64, "tile_size": 1, "use_method": 0, "time": 34.51625289916992, "times": [33.2308464050293, 34.19334411621094, 34.6879997253418, 34.948001861572266, 34.685951232910156, 34.68083190917969, 34.6798095703125, 34.69004821777344, 34.69919967651367, 34.66649627685547], "compile_time": 112.2484365478158, "verification_time": 0, "benchmark_time": 345.7424147054553, "strategy_time": 0, "framework_time": 0.9711934253573418, "timestamp": "2023-01-26 01:05:18.651592+00:00"},
"0,64,1,1": {"between_method": 0, "block_size_x": 64, "tile_size": 1, "use_method": 1, "time": 35.39495658874512, "times": [33.951744079589844, 35.339263916015625, 35.721214294433594, 35.582977294921875, 35.579776763916016, 35.55430221557617, 35.55430221557617, 35.553279876708984, 35.553279876708984, 35.559425354003906], "compile_time": 111.13460455089808, "verification_time": 0, "benchmark_time": 354.5322781428695, "strategy_time": 0, "framework_time": 0.9776614606380463, "timestamp": "2023-01-26 01:05:19.118259+00:00"},
"0,64,1,2": {"between_method": 0, "block_size_x": 64, "tile_size": 1, "use_method": 2, "time": 33.58709487915039, "times": [32.149505615234375, 33.351680755615234, 34.23436737060547, 33.84012985229492, 33.68755340576172, 33.686527252197266, 33.68960189819336, 33.68950271606445, 33.68755340576172, 33.85452651977539], "compile_time": 111.66813690215349, "verification_time": 0, "benchmark_time": 336.3214312121272, "strategy_time": 0, "framework_time": 0.9893504902720451, "timestamp": "2023-01-26 01:05:19.567260+00:00"},
"0,64,2,0": {"between_method": 0, "block_size_x": 64, "tile_size": 2, "use_method": 0, "time": 21.005702018737793, "times": [20.479999542236328, 20.720640182495117, 21.039104461669922, 21.113855361938477, 21.112831115722656, 21.11382484436035, 21.112831115722656, 21.112831115722656, 21.113855361938477, 21.13724708557129], "compile_time": 110.43021455407143, "verification_time": 0, "benchmark_time": 210.49705520272255, "strategy_time": 0, "framework_time": 1.0004006326198578, "timestamp": "2023-01-26 01:05:19.889210+00:00"},
"0,64,2,1": {"between_method": 0, "block_size_x": 64, "tile_size": 2, "use_method": 1, "time": 20.777779006958006, "times": [19.986431121826172, 20.332544326782227, 20.86195182800293, 20.937728881835938, 20.938751220703125, 20.941823959350586, 20.957183837890625, 20.941823959350586, 20.939775466918945, 20.939775466918945], "compile_time": 108.58505219221115, "verification_time": 0, "benchmark_time": 208.41394271701574, "strategy_time": 0, "framework_time": 1.03004090487957, "timestamp": "2023-01-26 01:05:20.207261+00:00"},
"0,64,2,2": {"between_method": 0, "block_size_x": 64, "tile_size": 2, "use_method": 2, "time": 20.324560165405273, "times": [19.801088333129883, 20.113439559936523, 20.42470359802246, 20.41651153564453, 20.41753578186035, 20.41548728942871, 20.414464950561523, 20.414464950561523, 20.413440704345703, 20.414464950561523], "compile_time": 111.39044631272554, "verification_time": 0, "benchmark_time": 203.70214618742466, "strategy_time": 0, "framework_time": 1.054050400853157, "timestamp": "2023-01-26 01:05:20.523429+00:00"},
"0,64,4,0": {"between_method": 0, "block_size_x": 64, "tile_size": 4, "use_method": 0, "time": 14.10519027709961, "times": [13.86086368560791, 13.856767654418945, 14.05951976776123, 14.185471534729004, 14.185471534729004, 14.203904151916504, 14.194687843322754, 14.169088363647461, 14.16806411743164, 14.16806411743164], "compile_time": 111.53636500239372, "verification_time": 0, "benchmark_time": 141.64432790130377, "strategy_time": 0, "framework_time": 1.0672630742192268, "timestamp": "2023-01-26 01:05:20.777700+00:00"},
"0,64,4,1": {"between_method": 0, "block_size_x": 64, "tile_size": 4, "use_method": 1, "time": 13.668147373199464, "times": [13.252608299255371, 13.239295959472656, 13.280256271362305, 13.883392333984375, 13.936639785766602, 13.950976371765137, 13.86291217803955, 13.77280044555664, 13.751296043395996, 13.751296043395996], "compile_time": 111.52753606438637, "verification_time": 0, "benchmark_time": 137.2180227190256, "strategy_time": 0, "framework_time": 1.0661501437425613, "timestamp": "2023-01-26 01:05:21.027534+00:00"},
"0,64,4,2": {"between_method": 0, "block_size_x": 64, "tile_size": 4, "use_method": 2, "time": 13.910940837860107, "times": [13.590527534484863, 13.58233642578125, 13.910016059875488, 14.013440132141113, 14.012415885925293, 14.010368347167969, 14.007295608520508, 13.99401569366455, 13.99500846862793, 13.99398422241211], "compile_time": 109.7783837467432, "verification_time": 0, "benchmark_time": 139.68546595424414, "strategy_time": 0, "framework_time": 1.0700523853302002, "timestamp": "2023-01-26 01:05:21.278089+00:00"},
"0,64,6,0": {"between_method": 0, "block_size_x": 64, "tile_size": 6, "use_method": 0, "time": 12.176486492156982, "times": [12.000255584716797, 11.999232292175293, 11.991040229797363, 12.166144371032715, 12.26854419708252, 12.26854419708252, 12.26854419708252, 12.26854419708252, 12.266495704650879, 12.2675199508667], "compile_time": 109.72127318382263, "verification_time": 0, "benchmark_time": 122.43977189064026, "strategy_time": 0, "framework_time": 1.092161051928997, "timestamp": "2023-01-26 01:05:21.511365+00:00"},
"0,64,6,1": {"between_method": 0, "block_size_x": 64, "tile_size": 6, "use_method": 1, "time": 11.53105936050415, "times": [11.140095710754395, 11.12985610961914, 11.46777629852295, 11.576319694519043, 11.66643238067627, 11.66643238067627, 11.66540813446045, 11.66643238067627, 11.66643238067627, 11.66540813446045], "compile_time": 111.32418643683195, "verification_time": 0, "benchmark_time": 115.87992031127214, "strategy_time": 0, "framework_time": 1.1023720726370811, "timestamp": "2023-01-26 01:05:21.739693+00:00"},
"0,64,6,2": {"between_method": 0, "block_size_x": 64, "tile_size": 6, "use_method": 2, "time": 11.709030437469483, "times": [11.530240058898926, 11.522047996520996, 11.516927719116211, 11.789312362670898, 11.798527717590332, 11.798527717590332, 11.791359901428223, 11.781120300292969, 11.781120300292969, 11.781120300292969], "compile_time": 112.47901804745197, "verification_time": 0, "benchmark_time": 117.59200505912304, "strategy_time": 0, "framework_time": 1.1320523917675018, "timestamp": "2023-01-26 01:05:21.970917+00:00"},
"0,64,8,0": {"between_method": 0, "block_size_x": 64, "tile_size": 8, "use_method": 0, "time": 11.979248046875, "times": [11.853759765625, 11.835391998291016, 11.98691177368164, 12.014528274536133, 12.015616416931152, 12.017663955688477, 12.016639709472656, 12.017663955688477, 12.015616416931152, 12.018688201904297], "compile_time": 110.97314488142729, "verification_time": 0, "benchmark_time": 120.37167884409428, "strategy_time": 0, "framework_time": 1.1339914053678513, "timestamp": "2023-01-26 01:05:22.203417+00:00"},
"0,64,8,1": {"between_method": 0, "block_size_x": 64, "tile_size": 8, "use_method": 1, "time": 10.861872100830078, "times": [10.565631866455078, 10.561535835266113, 10.629088401794434, 10.981375694274902, 10.980352401733398, 10.980352401733398, 10.979328155517578, 10.981375694274902, 10.979328155517578, 10.980352401733398], "compile_time": 114.01558946818113, "verification_time": 0, "benchmark_time": 109.08043198287487, "strategy_time": 0, "framework_time": 1.164550893008709, "timestamp": "2023-01-26 01:05:22.427700+00:00"},
"0,64,8,2": {"between_method": 0, "block_size_x": 64, "tile_size": 8, "use_method": 2, "time": 10.877337646484374, "times": [10.64345645904541, 10.637311935424805, 10.678272247314453, 10.976256370544434, 10.974207878112793, 10.973183631896973, 10.974207878112793, 10.974207878112793, 10.971136093139648, 10.971136093139648], "compile_time": 108.86863246560097, "verification_time": 0, "benchmark_time": 109.18392241001129, "strategy_time": 0, "framework_time": 1.1981511488556862, "timestamp": "2023-01-26 01:05:22.646973+00:00"},
"0,64,10,0": {"between_method": 0, "block_size_x": 64, "tile_size": 10, "use_method": 0, "time": 11.72608003616333, "times": [11.595775604248047, 11.595647811889648, 11.684767723083496, 11.776000022888184, 11.774944305419922, 11.774911880493164, 11.76576042175293, 11.763520240783691, 11.76473617553711, 11.76473617553711], "compile_time": 111.20454594492912, "verification_time": 0, "benchmark_time": 117.89435427635908, "strategy_time": 0, "framework_time": 1.185971312224865, "timestamp": "2023-01-26 01:05:22.877281+00:00"},
"0,64,10,1": {"between_method": 0, "block_size_x": 64, "tile_size": 10, "use_method": 1, "time": 11.299734306335449, "times": [10.957823753356934, 10.940383911132812, 10.941439628601074, 11.330559730529785, 11.471872329711914, 11.469823837280273, 11.471872329711914, 11.471776008605957, 11.469823837280273, 11.471967697143555], "compile_time": 114.60213083773851, "verification_time": 0, "benchmark_time": 113.49407769739628, "strategy_time": 0, "framework_time": 1.3671834021806717, "timestamp": "2023-01-26 01:05:23.106768+00:00"},
"0,64,10,2": {"between_method": 0, "block_size_x": 64, "tile_size": 10, "use_method": 2, "time": 10.3316575050354, "times": [10.174464225769043, 10.161248207092285, 10.185728073120117, 10.400768280029297, 10.398719787597656, 10.399744033813477, 10.4017915725708, 10.397695541381836, 10.397695541381836, 10.398719787597656], "compile_time": 110.81954464316368, "verification_time": 0, "benchmark_time": 103.87553460896015, "strategy_time": 0, "framework_time": 1.2284629046916962, "timestamp": "2023-01-26 01:05:23.322714+00:00"},
"0,64,12,0": {"between_method": 0, "block_size_x": 64, "tile_size": 12, "use_method": 0, "time": 11.38411512374878, "times": [11.324416160583496, 11.322367668151855, 11.36128044128418, 11.405311584472656, 11.404288291931152, 11.405311584472656, 11.403264045715332, 11.405311584472656, 11.405311584472656, 11.404288291931152], "compile_time": 115.94574246555567, "verification_time": 0, "benchmark_time": 114.28319942206144, "strategy_time": 0, "framework_time": 1.2357113882899284, "timestamp": "2023-01-26 01:05:23.554200+00:00"},
"0,64,12,1": {"between_method": 0, "block_size_x": 64, "tile_size": 12, "use_method": 1, "time": 10.778009605407714, "times": [10.455039978027344, 10.447872161865234, 10.44377613067627, 10.652671813964844, 10.951680183410645, 10.952704429626465, 10.970111846923828, 10.969087600708008, 10.969087600708008, 10.968064308166504], "compile_time": 114.99667074531317, "verification_time": 0, "benchmark_time": 108.29236079007387, "strategy_time": 0, "framework_time": 1.2418031692504883, "timestamp": "2023-01-26 01:05:23.778753+00:00"},
"0,64,12,2": {"between_method": 0, "block_size_x": 64, "tile_size": 12, "use_method": 2, "time": 10.034070301055909, "times": [9.91436767578125, 9.91436767578125, 9.908191680908203, 10.061823844909668, 10.092543601989746, 10.090496063232422, 10.094592094421387, 10.089471817016602, 10.087424278259277, 10.087424278259277], "compile_time": 117.71531496196985, "verification_time": 0, "benchmark_time": 100.79752095043659, "strategy_time": 0, "framework_time": 1.2435009703040123, "timestamp": "2023-01-26 01:05:23.998532+00:00"},
"0,64,14,0": {"between_method": 0, "block_size_x": 64, "tile_size": 14, "use_method": 0, "time": 11.411251163482666, "times": [11.389951705932617, 11.384832382202148, 11.380736351013184, 11.377663612365723, 11.378687858581543, 11.376640319824219, 11.4268159866333, 11.465727806091309, 11.465727806091309, 11.465727806091309], "compile_time": 113.98783139884472, "verification_time": 0, "benchmark_time": 114.73829858005047, "strategy_time": 0, "framework_time": 1.2650806456804276, "timestamp": "2023-01-26 01:05:24.228544+00:00"},
"0,64,14,1": {"between_method": 0, "block_size_x": 64, "tile_size": 14, "use_method": 1, "time": 10.84835844039917, "times": [10.536959648132324, 10.530816078186035, 10.780672073364258, 10.958847999572754, 10.9486083984375, 10.94758415222168, 10.94758415222168, 10.945535659790039, 10.944512367248535, 10.942463874816895], "compile_time": 112.64613829553127, "verification_time": 0, "benchmark_time": 109.13313180208206, "strategy_time": 0, "framework_time": 1.3483725488185883, "timestamp": "2023-01-26 01:05:24.451695+00:00"},
"0,64,14,2": {"between_method": 0, "block_size_x": 64, "tile_size": 14, "use_method": 2, "time": 10.150505542755127, "times": [10.063872337341309, 10.056703567504883, 10.05571174621582, 10.054656028747559, 10.203136444091797, 10.21132755279541, 10.21337604522705, 10.216447830200195, 10.214400291442871, 10.215423583984375], "compile_time": 113.95867727696896, "verification_time": 0, "benchmark_time": 102.16230433434248, "strategy_time": 0, "framework_time": 1.3122819364070892, "timestamp": "2023-01-26 01:05:24.669150+00:00"},
"0,64,16,0": {"between_method": 0, "block_size_x": 64, "tile_size": 16, "use_method": 0, "time": 11.537510395050049, "times": [11.547648429870605, 11.544575691223145, 11.537407875061035, 11.536383628845215, 11.536383628845215, 11.53433609008789, 11.53433609008789, 11.535360336303711, 11.53433609008789, 11.53433609008789], "compile_time": 115.62607064843178, "verification_time": 0, "benchmark_time": 115.82331359386444, "strategy_time": 0, "framework_time": 1.3097822666168213, "timestamp": "2023-01-26 01:05:24.901932+00:00"},
"0,64,16,1": {"between_method": 0, "block_size_x": 64, "tile_size": 16, "use_method": 1, "time": 10.91706895828247, "times": [10.618880271911621, 10.614784240722656, 10.690560340881348, 11.03769588470459, 11.035648345947266, 11.035648345947266, 11.034624099731445, 11.033599853515625, 11.034624099731445, 11.034624099731445], "compile_time": 114.41490985453129, "verification_time": 0, "benchmark_time": 109.69372279942036, "strategy_time": 0, "framework_time": 1.4782315120100975, "timestamp": "2023-01-26 01:05:25.127541+00:00"},
"0,64,16,2": {"between_method": 0, "block_size_x": 64, "tile_size": 16, "use_method": 2, "time": 10.329600048065185, "times": [10.243071556091309, 10.239999771118164, 10.234880447387695, 10.232831954956055, 10.381312370300293, 10.394623756408691, 10.394623756408691, 10.393600463867188, 10.391551971435547, 10.389504432678223], "compile_time": 116.71552434563637, "verification_time": 0, "benchmark_time": 103.88777405023575, "strategy_time": 0, "framework_time": 1.3701524585485458, "timestamp": "2023-01-26 01:05:25.349536+00:00"},
"0,64,18,0": {"between_method": 0, "block_size_x": 64, "tile_size": 18, "use_method": 0, "time": 8.941465663909913, "times": [8.901632308959961, 8.897536277770996, 8.894463539123535, 8.911871910095215, 8.969216346740723, 8.968192100524902, 8.968192100524902, 8.968192100524902, 8.967167854309082, 8.968192100524902], "compile_time": 123.20383172482252, "verification_time": 0, "benchmark_time": 89.85674567520618, "strategy_time": 0, "framework_time": 1.3555530458688736, "timestamp": "2023-01-26 01:05:25.563974+00:00"},
"0,64,18,1": {"between_method": 0, "block_size_x": 64, "tile_size": 18, "use_method": 1, "time": 10.991513633728028, "times": [10.653696060180664, 10.652671813964844, 10.85747241973877, 11.074560165405273, 11.080703735351562, 11.11961555480957, 11.118592262268066, 11.118592262268066, 11.12063980102539, 11.118592262268066], "compile_time": 115.76265096664429, "verification_time": 0, "benchmark_time": 110.44388450682163, "strategy_time": 0, "framework_time": 1.3880012556910515, "timestamp": "2023-01-26 01:05:25.791590+00:00"},
"0,64,18,2": {"between_method": 0, "block_size_x": 64, "tile_size": 18, "use_method": 2, "time": 10.332569694519043, "times": [10.289152145385742, 10.280960083007812, 10.280960083007812, 10.323967933654785, 10.359807968139648, 10.357760429382324, 10.359807968139648, 10.358783721923828, 10.357760429382324, 10.356736183166504], "compile_time": 119.15874760597944, "verification_time": 0, "benchmark_time": 103.75456418842077, "strategy_time": 0, "framework_time": 1.3916222378611565, "timestamp": "2023-01-26 01:05:26.015917+00:00"},
"0,64,20,0": {"between_method": 0, "block_size_x": 64, "tile_size": 20, "use_method": 0, "time": 8.714240169525146, "times": [8.678400039672852, 8.670207977294922, 8.668160438537598, 8.71833610534668, 8.73574447631836, 8.734720230102539, 8.734720230102539, 8.733695983886719, 8.734720230102539, 8.733695983886719], "compile_time": 121.68604042381048, "verification_time": 0, "benchmark_time": 87.69776206463575, "strategy_time": 0, "framework_time": 1.4325017109513283, "timestamp": "2023-01-26 01:05:26.226755+00:00"},
"0,64,20,1": {"between_method": 0, "block_size_x": 64, "tile_size": 20, "use_method": 1, "time": 11.25406723022461, "times": [11.042816162109375, 11.035648345947266, 11.032575607299805, 11.13804817199707, 11.382783889770508, 11.380736351013184, 11.383808135986328, 11.381759643554688, 11.380736351013184, 11.381759643554688], "compile_time": 118.04041545838118, "verification_time": 0, "benchmark_time": 113.19415923207998, "strategy_time": 0, "framework_time": 1.414841040968895, "timestamp": "2023-01-26 01:05:26.459426+00:00"},
"0,64,20,2": {"between_method": 0, "block_size_x": 64, "tile_size": 20, "use_method": 2, "time": 10.450022411346435, "times": [10.41100788116455, 10.405887603759766, 10.417152404785156, 10.40998363494873, 10.454015731811523, 10.481663703918457, 10.480640411376953, 10.479616165161133, 10.480640411376953, 10.479616165161133], "compile_time": 122.10042029619217, "verification_time": 0, "benchmark_time": 105.02534825354815, "strategy_time": 0, "framework_time": 1.4607012271881104, "timestamp": "2023-01-26 01:05:26.688034+00:00"},
"0,96,1,0": {"between_method": 0, "block_size_x": 96, "tile_size": 1, "use_method": 0, "time": 36.17669143676758, "times": [35.155967712402344, 36.23219299316406, 36.359169006347656, 36.322303771972656, 36.3243522644043, 36.336639404296875, 36.325374603271484, 36.33766555786133, 36.33049774169922, 36.04275131225586], "compile_time": 109.50146242976189, "verification_time": 0, "benchmark_time": 362.40940541028976, "strategy_time": 0, "framework_time": 1.457221806049347, "timestamp": "2023-01-26 01:05:27.161425+00:00"},
"0,96,1,1": {"between_method": 0, "block_size_x": 96, "tile_size": 1, "use_method": 1, "time": 36.73803825378418, "times": [35.18668746948242, 36.93977737426758, 37.108734130859375, 36.87516784667969, 36.9172477722168, 36.87424087524414, 36.86092758178711, 36.87014389038086, 36.86092758178711, 36.88652801513672], "compile_time": 105.42278829962015, "verification_time": 0, "benchmark_time": 367.91142262518406, "strategy_time": 0, "framework_time": 1.470642164349556, "timestamp": "2023-01-26 01:05:27.636252+00:00"},
"0,96,1,2": {"between_method": 0, "block_size_x": 96, "tile_size": 1, "use_method": 2, "time": 35.810703659057616, "times": [34.83545684814453, 35.7918701171875, 35.94035339355469, 35.934207916259766, 35.937278747558594, 35.939327239990234, 35.920894622802734, 35.913726806640625, 35.94745635986328, 35.94646453857422], "compile_time": 108.73843170702457, "verification_time": 0, "benchmark_time": 358.6949920281768, "strategy_time": 0, "framework_time": 1.497841440141201, "timestamp": "2023-01-26 01:05:28.105205+00:00"},
"0,96,2,0": {"between_method": 0, "block_size_x": 96, "tile_size": 2, "use_method": 0, "time": 21.02978572845459, "times": [20.347904205322266, 20.71552085876465, 21.108671188354492, 21.175296783447266, 21.172224044799805, 21.16316795349121, 21.152767181396484, 21.163936614990234, 21.147647857666016, 21.150720596313477], "compile_time": 110.34861393272877, "verification_time": 0, "benchmark_time": 210.9139235690236, "strategy_time": 0, "framework_time": 1.4997124671936035, "timestamp": "2023-01-26 01:05:28.427989+00:00"},
"0,96,2,1": {"between_method": 0, "block_size_x": 96, "tile_size": 2, "use_method": 1, "time": 20.6178337097168, "times": [19.689472198486328, 20.197376251220703, 20.701183319091797, 20.809728622436523, 20.798559188842773, 20.808704376220703, 20.79635238647461, 20.791296005249023, 20.794368743896484, 20.791296005249023], "compile_time": 110.0261127576232, "verification_time": 0, "benchmark_time": 206.69693872332573, "strategy_time": 0, "framework_time": 1.525862142443657, "timestamp": "2023-01-26 01:05:28.746260+00:00"},
"0,96,2,2": {"between_method": 0, "block_size_x": 96, "tile_size": 2, "use_method": 2, "time": 20.22369270324707, "times": [19.551231384277344, 19.82771110534668, 20.392959594726562, 20.49126434326172, 20.42470359802246, 20.312063217163086, 20.310016632080078, 20.308992385864258, 20.308992385864258, 20.308992385864258], "compile_time": 106.149697676301, "verification_time": 0, "benchmark_time": 202.819493599236, "strategy_time": 0, "framework_time": 1.5165610238909721, "timestamp": "2023-01-26 01:05:29.056769+00:00"},
"0,96,4,0": {"between_method": 0, "block_size_x": 96, "tile_size": 4, "use_method": 0, "time": 14.06423044204712, "times": [13.848575592041016, 13.830143928527832, 13.923328399658203, 14.149632453918457, 14.147583961486816, 14.148608207702637, 14.150655746459961, 14.147583961486816, 14.147583961486816, 14.148608207702637], "compile_time": 110.3975335136056, "verification_time": 0, "benchmark_time": 141.25766698271036, "strategy_time": 0, "framework_time": 1.5627024695277214, "timestamp": "2023-01-26 01:05:29.310009+00:00"},
"0,96,4,1": {"between_method": 0, "block_size_x": 96, "tile_size": 4, "use_method": 1, "time": 13.645414352416992, "times": [13.15123176574707, 13.15225601196289, 13.648896217346191, 13.791232109069824, 13.789183616638184, 13.78713607788086, 13.78816032409668, 13.78713607788086, 13.780991554260254, 13.77791976928711], "compile_time": 105.18152732402086, "verification_time": 0, "benchmark_time": 137.03551050275564, "strategy_time": 0, "framework_time": 1.7833132296800613, "timestamp": "2023-01-26 01:05:29.554032+00:00"},
"0,96,4,2": {"between_method": 0, "block_size_x": 96, "tile_size": 4, "use_method": 2, "time": 13.828607845306397, "times": [13.539327621459961, 13.531135559082031, 13.527039527893066, 13.921279907226562, 13.962240219116211, 13.96121597290039, 13.96121597290039, 13.96019172668457, 13.96121597290039, 13.96121597290039], "compile_time": 108.76228380948305, "verification_time": 0, "benchmark_time": 138.75000271946192, "strategy_time": 0, "framework_time": 1.5738299116492271, "timestamp": "2023-01-26 01:05:29.803141+00:00"},
"0,96,6,0": {"between_method": 0, "block_size_x": 96, "tile_size": 6, "use_method": 0, "time": 12.21447687149048, "times": [11.994112014770508, 12.021759986877441, 12.16102409362793, 12.2675199508667, 12.300288200378418, 12.2675199508667, 12.297216415405273, 12.266495704650879, 12.26854419708252, 12.300288200378418], "compile_time": 111.42237484455109, "verification_time": 0, "benchmark_time": 122.73799162358046, "strategy_time": 0, "framework_time": 1.601322554051876, "timestamp": "2023-01-26 01:05:30.038924+00:00"},
"0,96,6,1": {"between_method": 0, "block_size_x": 96, "tile_size": 6, "use_method": 1, "time": 11.538636779785156, "times": [11.152383804321289, 11.140095710754395, 11.133952140808105, 11.668479919433594, 11.769856452941895, 11.768832206726074, 11.735039710998535, 11.673600196838379, 11.671551704406738, 11.672575950622559], "compile_time": 109.9940026178956, "verification_time": 0, "benchmark_time": 116.00865237414837, "strategy_time": 0, "framework_time": 1.5887320041656494, "timestamp": "2023-01-26 01:05:30.266536+00:00"},
"0,96,6,2": {"between_method": 0, "block_size_x": 96, "tile_size": 6, "use_method": 2, "time": 11.821568202972411, "times": [11.55072021484375, 11.547648429870605, 11.761664390563965, 11.908096313476562, 11.907072067260742, 11.908096313476562, 11.907072067260742, 11.907072067260742, 11.910143852233887, 11.908096313476562], "compile_time": 109.9597942084074, "verification_time": 0, "benchmark_time": 118.73787548393011, "strategy_time": 0, "framework_time": 1.613382250070572, "timestamp": "2023-01-26 01:05:30.496869+00:00"},
"0,96,8,0": {"between_method": 0, "block_size_x": 96, "tile_size": 8, "use_method": 0, "time": 12.031590461730957, "times": [11.841535568237305, 11.836416244506836, 11.882495880126953, 12.108799934387207, 12.106752395629883, 12.108799934387207, 12.106752395629883, 12.106752395629883, 12.107775688171387, 12.109824180603027], "compile_time": 114.09331858158112, "verification_time": 0, "benchmark_time": 120.91223895549774, "strategy_time": 0, "framework_time": 1.6327211633324623, "timestamp": "2023-01-26 01:05:30.733530+00:00"},
"0,96,8,1": {"between_method": 0, "block_size_x": 96, "tile_size": 8, "use_method": 1, "time": 10.886041641235352, "times": [10.568703651428223, 10.567680358886719, 10.558464050292969, 10.736639976501465, 11.069439888000488, 11.069439888000488, 11.069439888000488, 11.070464134216309, 11.079680442810059, 11.070464134216309], "compile_time": 112.04260587692261, "verification_time": 0, "benchmark_time": 109.35881175100803, "strategy_time": 0, "framework_time": 1.6371039673686028, "timestamp": "2023-01-26 01:05:30.956590+00:00"},
"0,96,8,2": {"between_method": 0, "block_size_x": 96, "tile_size": 8, "use_method": 2, "time": 10.8649471282959, "times": [10.647551536560059, 10.645503997802734, 10.637311935424805, 10.874879837036133, 10.988544464111328, 10.975232124328613, 10.970111846923828, 10.970111846923828, 10.970111846923828, 10.970111846923828], "compile_time": 112.2223362326622, "verification_time": 0, "benchmark_time": 109.03223231434822, "strategy_time": 0, "framework_time": 1.659652218222618, "timestamp": "2023-01-26 01:05:31.179539+00:00"},
"0,96,10,0": {"between_method": 0, "block_size_x": 96, "tile_size": 10, "use_method": 0, "time": 11.781222438812256, "times": [11.651071548461914, 11.653120040893555, 11.713536262512207, 11.829248428344727, 11.828224182128906, 11.826175689697266, 11.826175689697266, 11.828224182128906, 11.828224182128906, 11.828224182128906], "compile_time": 114.11070916801691, "verification_time": 0, "benchmark_time": 118.51134616881609, "strategy_time": 0, "framework_time": 1.6932412981987, "timestamp": "2023-01-26 01:05:31.413876+00:00"},
"0,96,10,1": {"between_method": 0, "block_size_x": 96, "tile_size": 10, "use_method": 1, "time": 11.334147357940674, "times": [11.001855850219727, 10.998784065246582, 10.995712280273438, 11.180031776428223, 11.527168273925781, 11.527168273925781, 11.527168273925781, 11.529248237609863, 11.527168273925781, 11.527168273925781], "compile_time": 109.87710300832987, "verification_time": 0, "benchmark_time": 113.791448995471, "strategy_time": 0, "framework_time": 1.6922615468502045, "timestamp": "2023-01-26 01:05:31.639260+00:00"},
"0,96,10,2": {"between_method": 0, "block_size_x": 96, "tile_size": 10, "use_method": 2, "time": 10.386227321624755, "times": [10.218496322631836, 10.21235179901123, 10.301440238952637, 10.449919700622559, 10.447872161865234, 10.450943946838379, 10.448896408081055, 10.44377613067627, 10.44480037689209, 10.44377613067627], "compile_time": 117.57480353116989, "verification_time": 0, "benchmark_time": 104.4610757380724, "strategy_time": 0, "framework_time": 1.716703176498413, "timestamp": "2023-01-26 01:05:31.863034+00:00"},
"0,96,12,0": {"between_method": 0, "block_size_x": 96, "tile_size": 12, "use_method": 0, "time": 11.455593490600586, "times": [11.572223663330078, 11.505663871765137, 11.500543594360352, 11.506688117980957, 11.439104080200195, 11.406335830688477, 11.406335830688477, 11.407360076904297, 11.406335830688477, 11.405344009399414], "compile_time": 113.26508782804012, "verification_time": 0, "benchmark_time": 115.06161000579596, "strategy_time": 0, "framework_time": 1.7637526616454124, "timestamp": "2023-01-26 01:05:32.093147+00:00"},
"0,96,12,1": {"between_method": 0, "block_size_x": 96, "tile_size": 12, "use_method": 1, "time": 10.829683208465577, "times": [10.503168106079102, 10.50102424621582, 10.490752220153809, 10.84108829498291, 10.993663787841797, 10.991616249084473, 10.994688034057617, 10.992639541625977, 10.993663787841797, 10.994527816772461], "compile_time": 115.52832182496786, "verification_time": 0, "benchmark_time": 108.96652191877365, "strategy_time": 0, "framework_time": 1.7628725618124008, "timestamp": "2023-01-26 01:05:32.319427+00:00"},
"0,96,12,2": {"between_method": 0, "block_size_x": 96, "tile_size": 12, "use_method": 2, "time": 10.13194236755371, "times": [9.979904174804688, 9.943039894104004, 9.970623970031738, 10.180607795715332, 10.208255767822266, 10.209152221679688, 10.209280014038086, 10.20809555053711, 10.207232475280762, 10.203231811523438], "compile_time": 113.82005829364061, "verification_time": 0, "benchmark_time": 101.92312207072973, "strategy_time": 0, "framework_time": 1.7885714769363403, "timestamp": "2023-01-26 01:05:32.536981+00:00"},
"0,96,14,0": {"between_method": 0, "block_size_x": 96, "tile_size": 14, "use_method": 0, "time": 11.476892757415772, "times": [11.397120475769043, 11.386879920959473, 11.428863525390625, 11.470848083496094, 11.469823837280273, 11.472064018249512, 11.469823837280273, 11.469823837280273, 11.732992172241211, 11.470687866210938], "compile_time": 117.79770348221064, "verification_time": 0, "benchmark_time": 115.24220183491707, "strategy_time": 0, "framework_time": 1.7725629732012749, "timestamp": "2023-01-26 01:05:32.771816+00:00"},
"0,96,14,1": {"between_method": 0, "block_size_x": 96, "tile_size": 14, "use_method": 1, "time": 10.840665721893311, "times": [10.550175666809082, 10.53593635559082, 10.528767585754395, 10.805248260498047, 11.03974437713623, 11.03974437713623, 11.040767669677734, 10.960864067077637, 10.952704429626465, 10.952704429626465], "compile_time": 115.36927055567503, "verification_time": 0, "benchmark_time": 108.93619060516357, "strategy_time": 0, "framework_time": 1.7848731949925423, "timestamp": "2023-01-26 01:05:32.997929+00:00"},
"0,96,14,2": {"between_method": 0, "block_size_x": 96, "tile_size": 14, "use_method": 2, "time": 10.169945621490479, "times": [10.068991661071777, 10.080256462097168, 10.078207969665527, 10.168319702148438, 10.218496322631836, 10.216447830200195, 10.217472076416016, 10.216320037841797, 10.216447830200195, 10.218496322631836], "compile_time": 111.86879593878984, "verification_time": 0, "benchmark_time": 102.21671219915152, "strategy_time": 0, "framework_time": 1.8047932535409927, "timestamp": "2023-01-26 01:05:33.213842+00:00"},
"0,96,16,0": {"between_method": 0, "block_size_x": 96, "tile_size": 16, "use_method": 0, "time": 11.551232147216798, "times": [11.561984062194824, 11.55891227722168, 11.554816246032715, 11.55174446105957, 11.55072021484375, 11.54969596862793, 11.552767753601074, 11.553791999816895, 11.539456367492676, 11.538432121276855], "compile_time": 118.90203505754471, "verification_time": 0, "benchmark_time": 116.07559211552143, "strategy_time": 0, "framework_time": 2.0910436287522316, "timestamp": "2023-01-26 01:05:33.450933+00:00"},
"0,96,16,1": {"between_method": 0, "block_size_x": 96, "tile_size": 16, "use_method": 1, "time": 11.001955318450928, "times": [10.710016250610352, 10.702848434448242, 10.71395206451416, 11.125760078430176, 11.123711585998535, 11.123680114746094, 11.122688293457031, 11.150336265563965, 11.123871803283691, 11.122688293457031], "compile_time": 120.5894872546196, "verification_time": 0, "benchmark_time": 110.59821397066116, "strategy_time": 0, "framework_time": 1.837272197008133, "timestamp": "2023-01-26 01:05:33.683981+00:00"},
"0,96,16,2": {"between_method": 0, "block_size_x": 96, "tile_size": 16, "use_method": 2, "time": 10.3374529838562, "times": [10.24512004852295, 10.243904113769531, 10.234880447387695, 10.297216415405273, 10.392576217651367, 10.392576217651367, 10.392576217651367, 10.391551971435547, 10.392576217651367, 10.391551971435547], "compile_time": 122.16327991336584, "verification_time": 0, "benchmark_time": 103.97624503821135, "strategy_time": 0, "framework_time": 1.839764416217804, "timestamp": "2023-01-26 01:05:33.911982+00:00"},
"0,96,18,0": {"between_method": 0, "block_size_x": 96, "tile_size": 18, "use_method": 0, "time": 9.002067184448242, "times": [8.964096069335938, 8.957951545715332, 8.954879760742188, 9.019392013549805, 9.018367767333984, 9.01734447479248, 9.017151832580566, 9.01734447479248, 9.018367767333984, 9.035776138305664], "compile_time": 124.86770283430815, "verification_time": 0, "benchmark_time": 90.55809583514929, "strategy_time": 0, "framework_time": 1.8611624836921692, "timestamp": "2023-01-26 01:05:34.129291+00:00"},
"0,96,18,1": {"between_method": 0, "block_size_x": 96, "tile_size": 18, "use_method": 1, "time": 11.173580741882324, "times": [10.869759559631348, 10.884096145629883, 10.870783805847168, 11.311103820800781, 11.305983543395996, 11.301888465881348, 11.299839973449707, 11.295743942260742, 11.297792434692383, 11.298815727233887], "compile_time": 120.87070662528276, "verification_time": 0, "benchmark_time": 112.20676638185978, "strategy_time": 0, "framework_time": 1.8718037754297256, "timestamp": "2023-01-26 01:05:34.364262+00:00"},
"0,96,18,2": {"between_method": 0, "block_size_x": 96, "tile_size": 18, "use_method": 2, "time": 10.433126544952392, "times": [10.387455940246582, 10.384384155273438, 10.380288124084473, 10.43660831451416, 10.458111763000488, 10.456064224243164, 10.457088470458984, 10.459136009216309, 10.456064224243164, 10.456064224243164], "compile_time": 124.94020350277424, "verification_time": 0, "benchmark_time": 104.89173699170351, "strategy_time": 0, "framework_time": 1.9172532483935356, "timestamp": "2023-01-26 01:05:34.596033+00:00"},
"0,96,20,0": {"between_method": 0, "block_size_x": 96, "tile_size": 20, "use_method": 0, "time": 8.74137601852417, "times": [8.678400039672852, 8.671232223510742, 8.669183731079102, 8.667136192321777, 8.720383644104004, 8.80128002166748, 8.8023042678833, 8.80128002166748, 8.80128002166748, 8.80128002166748], "compile_time": 127.03646719455719, "verification_time": 0, "benchmark_time": 87.93631102889776, "strategy_time": 0, "framework_time": 1.9020726904273033, "timestamp": "2023-01-26 01:05:34.812930+00:00"},
"0,96,20,1": {"between_method": 0, "block_size_x": 96, "tile_size": 20, "use_method": 1, "time": 11.513548851013184, "times": [11.255807876586914, 11.250687599182129, 11.419648170471191, 11.599871635437012, 11.599871635437012, 11.602944374084473, 11.602944374084473, 11.607040405273438, 11.597824096679688, 11.598848342895508], "compile_time": 121.73213995993137, "verification_time": 0, "benchmark_time": 115.81862065941095, "strategy_time": 0, "framework_time": 1.9227927550673485, "timestamp": "2023-01-26 01:05:35.052426+00:00"},
"0,96,20,2": {"between_method": 0, "block_size_x": 96, "tile_size": 20, "use_method": 2, "time": 10.479411125183105, "times": [10.441727638244629, 10.431488037109375, 10.42636775970459, 10.432512283325195, 10.508288383483887, 10.514431953430176, 10.511360168457031, 10.50931167602539, 10.50931167602539, 10.50931167602539], "compile_time": 130.0409408286214, "verification_time": 0, "benchmark_time": 105.37838749587536, "strategy_time": 0, "framework_time": 1.949012279510498, "timestamp": "2023-01-26 01:05:35.289816+00:00"},
"0,128,1,0": {"between_method": 0, "block_size_x": 128, "tile_size": 1, "use_method": 0, "time": 35.240549850463864, "times": [33.75923156738281, 34.927616119384766, 35.631103515625, 35.58195114135742, 35.580928802490234, 35.39558410644531, 35.21535873413086, 35.36793518066406, 35.542015075683594, 35.40377426147461], "compile_time": 109.4132736325264, "verification_time": 0, "benchmark_time": 352.95024048537016, "strategy_time": 0, "framework_time": 1.9499314948916435, "timestamp": "2023-01-26 01:05:35.754152+00:00"},
"0,128,1,1": {"between_method": 0, "block_size_x": 128, "tile_size": 1, "use_method": 1, "time": 35.34356422424317, "times": [33.293312072753906, 35.394561767578125, 35.68537521362305, 35.76115036010742, 35.523582458496094, 35.54304122924805, 35.80825424194336, 35.50617599487305, 35.59628677368164, 35.32390213012695], "compile_time": 112.88376618176699, "verification_time": 0, "benchmark_time": 354.00725342333317, "strategy_time": 0, "framework_time": 1.976972445845604, "timestamp": "2023-01-26 01:05:36.223041+00:00"},
"0,128,1,2": {"between_method": 0, "block_size_x": 128, "tile_size": 1, "use_method": 2, "time": 35.353583908081056, "times": [34.31321716308594, 35.63212966918945, 35.710975646972656, 35.4969596862793, 35.467262268066406, 35.37305450439453, 35.37919998168945, 35.43843078613281, 35.22560119628906, 35.49900817871094], "compile_time": 109.08071044832468, "verification_time": 0, "benchmark_time": 354.1755732148886, "strategy_time": 0, "framework_time": 1.9949236884713173, "timestamp": "2023-01-26 01:05:36.688315+00:00"},
"0,128,2,0": {"between_method": 0, "block_size_x": 128, "tile_size": 2, "use_method": 0, "time": 21.05057258605957, "times": [20.337663650512695, 20.804607391357422, 21.26848030090332, 21.191680908203125, 21.169151306152344, 21.168127059936523, 21.146623611450195, 21.139455795288086, 21.139455795288086, 21.140480041503906], "compile_time": 108.23417082428932, "verification_time": 0, "benchmark_time": 211.0326737165451, "strategy_time": 0, "framework_time": 2.0098015666007996, "timestamp": "2023-01-26 01:05:37.009614+00:00"},
"0,128,2,1": {"between_method": 0, "block_size_x": 128, "tile_size": 2, "use_method": 1, "time": 20.638080024719237, "times": [19.6812801361084, 20.179967880249023, 20.83737564086914, 20.969280242919922, 20.81996726989746, 20.7891845703125, 20.777984619140625, 20.774911880493164, 20.774911880493164, 20.775936126708984], "compile_time": 108.25640056282282, "verification_time": 0, "benchmark_time": 207.02365785837173, "strategy_time": 0, "framework_time": 2.0075319334864616, "timestamp": "2023-01-26 01:05:37.326924+00:00"},
"0,128,2,2": {"between_method": 0, "block_size_x": 128, "tile_size": 2, "use_method": 2, "time": 20.355174255371093, "times": [19.545087814331055, 19.970048904418945, 20.518911361694336, 20.65407943725586, 20.537343978881836, 20.46976089477539, 20.46463966369629, 20.46463966369629, 20.46361541748047, 20.46361541748047], "compile_time": 106.49098828434944, "verification_time": 0, "benchmark_time": 204.07128240913153, "strategy_time": 0, "framework_time": 2.0307237282395363, "timestamp": "2023-01-26 01:05:37.639539+00:00"},
"0,128,4,0": {"between_method": 0, "block_size_x": 128, "tile_size": 4, "use_method": 0, "time": 14.155567836761474, "times": [13.829119682312012, 13.826047897338867, 14.09331226348877, 14.25817584991455, 14.25715160369873, 14.259167671203613, 14.25715160369873, 14.25715160369873, 14.260224342346191, 14.25817584991455], "compile_time": 108.99665206670761, "verification_time": 0, "benchmark_time": 142.09970738738775, "strategy_time": 0, "framework_time": 2.051764167845249, "timestamp": "2023-01-26 01:05:37.892709+00:00"},
"0,128,4,1": {"between_method": 0, "block_size_x": 128, "tile_size": 4, "use_method": 1, "time": 13.65348482131958, "times": [13.159423828125, 13.146944046020508, 13.140992164611816, 13.84447956085205, 13.891584396362305, 13.891584396362305, 13.900799751281738, 13.890560150146484, 13.87724781036377, 13.791232109069824], "compile_time": 108.49670972675085, "verification_time": 0, "benchmark_time": 137.0919607579708, "strategy_time": 0, "framework_time": 2.0681722089648247, "timestamp": "2023-01-26 01:05:38.140388+00:00"},
"0,128,4,2": {"between_method": 0, "block_size_x": 128, "tile_size": 4, "use_method": 2, "time": 13.860547351837159, "times": [13.536255836486816, 13.530112266540527, 13.883392333984375, 13.957119941711426, 13.960063934326172, 13.949952125549316, 13.945952415466309, 13.948927879333496, 13.946880340576172, 13.946816444396973], "compile_time": 111.38961557298899, "verification_time": 0, "benchmark_time": 139.20683413743973, "strategy_time": 0, "framework_time": 2.0885923877358437, "timestamp": "2023-01-26 01:05:38.393096+00:00"},
"0,128,6,0": {"between_method": 0, "block_size_x": 128, "tile_size": 6, "use_method": 0, "time": 12.247526359558105, "times": [11.990015983581543, 11.983776092529297, 11.990015983581543, 12.296192169189453, 12.369855880737305, 12.368895530700684, 12.36787223815918, 12.367775917053223, 12.36787223815918, 12.372991561889648], "compile_time": 110.0360918790102, "verification_time": 0, "benchmark_time": 122.98306077718735, "strategy_time": 0, "framework_time": 2.0781923085451126, "timestamp": "2023-01-26 01:05:38.628215+00:00"},
"0,128,6,1": {"between_method": 0, "block_size_x": 128, "tile_size": 6, "use_method": 1, "time": 11.525222301483154, "times": [11.115519523620605, 11.107328414916992, 11.104255676269531, 11.473919868469238, 11.737088203430176, 11.736063957214355, 11.736063957214355, 11.744256019592285, 11.74732780456543, 11.750399589538574], "compile_time": 114.84578158706427, "verification_time": 0, "benchmark_time": 115.73406960815191, "strategy_time": 0, "framework_time": 2.1045831963419914, "timestamp": "2023-01-26 01:05:38.860921+00:00"},
"0,128,6,2": {"between_method": 0, "block_size_x": 128, "tile_size": 6, "use_method": 2, "time": 11.786547374725341, "times": [11.515904426574707, 11.507712364196777, 11.702272415161133, 11.875328063964844, 11.871232032775879, 11.876352310180664, 11.877375602722168, 11.884544372558594, 11.876352310180664, 11.878399848937988], "compile_time": 111.89190484583378, "verification_time": 0, "benchmark_time": 118.38233470916748, "strategy_time": 0, "framework_time": 2.0958418026566505, "timestamp": "2023-01-26 01:05:39.093313+00:00"},
"0,128,8,0": {"between_method": 0, "block_size_x": 128, "tile_size": 8, "use_method": 0, "time": 12.0221697807312, "times": [11.836416244506836, 11.83129596710205, 11.83027172088623, 12.05350399017334, 12.112895965576172, 12.110848426818848, 12.110848426818848, 12.110848426818848, 12.109824180603027, 12.114944458007812], "compile_time": 109.76867191493511, "verification_time": 0, "benchmark_time": 120.88628765195608, "strategy_time": 0, "framework_time": 2.103593200445175, "timestamp": "2023-01-26 01:05:39.326094+00:00"},
"0,128,8,1": {"between_method": 0, "block_size_x": 128, "tile_size": 8, "use_method": 1, "time": 10.895974445343018, "times": [10.566656112670898, 10.558464050292969, 10.704895973205566, 10.745856285095215, 11.0632963180542, 11.064319610595703, 11.064319610595703, 11.0632963180542, 11.0632963180542, 11.065343856811523], "compile_time": 113.25648799538612, "verification_time": 0, "benchmark_time": 109.49958208948374, "strategy_time": 0, "framework_time": 2.104552462697029, "timestamp": "2023-01-26 01:05:39.550976+00:00"},
"0,128,8,2": {"between_method": 0, "block_size_x": 128, "tile_size": 8, "use_method": 2, "time": 10.865356731414796, "times": [10.646528244018555, 10.636287689208984, 10.63424015045166, 10.890239715576172, 10.974207878112793, 10.973183631896973, 10.975232124328613, 10.974207878112793, 10.973183631896973, 10.976256370544434], "compile_time": 115.36596994847059, "verification_time": 0, "benchmark_time": 109.08657126128674, "strategy_time": 0, "framework_time": 2.136693336069584, "timestamp": "2023-01-26 01:05:39.777587+00:00"},
"0,128,10,0": {"between_method": 0, "block_size_x": 128, "tile_size": 10, "use_method": 0, "time": 11.749555206298828, "times": [11.592703819274902, 11.590656280517578, 11.908096313476562, 11.770879745483398, 11.772928237915039, 11.770784378051758, 11.770879745483398, 11.771743774414062, 11.771903991699219, 11.774975776672363], "compile_time": 110.39118282496929, "verification_time": 0, "benchmark_time": 118.09743568301201, "strategy_time": 0, "framework_time": 2.1505123004317284, "timestamp": "2023-01-26 01:05:40.008247+00:00"},
"0,128,10,1": {"between_method": 0, "block_size_x": 128, "tile_size": 10, "use_method": 1, "time": 11.306582260131837, "times": [10.945535659790039, 10.943488121032715, 11.16262435913086, 11.214847564697266, 11.465727806091309, 11.466591835021973, 11.465727806091309, 11.465727806091309, 11.464703559875488, 11.470848083496094], "compile_time": 109.21916365623474, "verification_time": 0, "benchmark_time": 113.58551681041718, "strategy_time": 0, "framework_time": 2.180960960686207, "timestamp": "2023-01-26 01:05:40.233255+00:00"},
"0,128,10,2": {"between_method": 0, "block_size_x": 128, "tile_size": 10, "use_method": 2, "time": 10.36152000427246, "times": [10.159104347229004, 10.150879859924316, 10.15283203125, 10.309632301330566, 10.473471641540527, 10.474431991577148, 10.476544380187988, 10.473471641540527, 10.472576141357422, 10.47225570678711], "compile_time": 111.55201494693756, "verification_time": 0, "benchmark_time": 104.07055448740721, "strategy_time": 0, "framework_time": 2.2008223459124565, "timestamp": "2023-01-26 01:05:40.451099+00:00"},
"0,128,12,0": {"between_method": 0, "block_size_x": 128, "tile_size": 12, "use_method": 0, "time": 11.452924633026123, "times": [11.33465576171875, 11.337727546691895, 11.33356761932373, 11.510784149169922, 11.529151916503906, 11.504639625549316, 11.493375778198242, 11.494400024414062, 11.49449634552002, 11.496447563171387], "compile_time": 114.75714016705751, "verification_time": 0, "benchmark_time": 115.07415864616632, "strategy_time": 0, "framework_time": 2.2322935983538628, "timestamp": "2023-01-26 01:05:40.683185+00:00"},
"0,128,12,1": {"between_method": 0, "block_size_x": 128, "tile_size": 12, "use_method": 1, "time": 10.793263816833496, "times": [10.462207794189453, 10.454015731811523, 10.638303756713867, 10.691583633422852, 10.93222427368164, 10.950655937194824, 10.950655937194824, 10.949631690979004, 10.949631690979004, 10.953727722167969], "compile_time": 113.883838057518, "verification_time": 0, "benchmark_time": 108.49292948842049, "strategy_time": 0, "framework_time": 2.5569647550582886, "timestamp": "2023-01-26 01:05:40.908143+00:00"},
"0,128,12,2": {"between_method": 0, "block_size_x": 128, "tile_size": 12, "use_method": 2, "time": 10.058044719696046, "times": [9.91641616821289, 9.910271644592285, 9.906368255615234, 9.99731159210205, 10.141695976257324, 10.140671730041504, 10.141599655151367, 10.140671730041504, 10.1396484375, 10.145792007446289], "compile_time": 116.63254257291555, "verification_time": 0, "benchmark_time": 101.00193880498409, "strategy_time": 0, "framework_time": 2.2430242970585823, "timestamp": "2023-01-26 01:05:41.128042+00:00"},
