cached_data_used/cachefiles/pnpoly/RTX_2080_Ti.json
{
"device_name": "NVIDIA GeForce RTX 2080 Ti",
"kernel_name": "cn_pnpoly",
"problem_size": 20000000,
"tune_params_keys": [
"between_method",
"block_size_x",
"tile_size",
"use_method"
],
"tune_params": {
"between_method": [
0,
1,
2,
3
],
"block_size_x": [
32,
64,
96,
128,
160,
192,
224,
256,
288,
320,
352,
384,
416,
448,
480,
512,
544,
576,
608,
640,
672,
704,
736,
768,
800,
832,
864,
896,
928,
960,
992
],
"tile_size": [
1,
2,
4,
6,
8,
10,
12,
14,
16,
18,
20
],
"use_method": [
0,
1,
2
]
},
"cache": {
"0,32,1,0": {"between_method": 0, "block_size_x": 32, "tile_size": 1, "use_method": 0, "time": 0.49451840221881865, "times": [0.49852800369262695, 0.4960640072822571, 0.4949440062046051, 0.4939520061016083, 0.4935680031776428, 0.4938560128211975, 0.4936319887638092, 0.49350398778915405, 0.4935680031776428, 0.4935680031776428], "compile_time": 0.018515000192564912, "verification_time": 0, "benchmark_time": 5.519442999911917, "strategy_time": 0, "framework_time": 75.86285699994733},
"0,32,1,1": {"between_method": 0, "block_size_x": 32, "tile_size": 1, "use_method": 1, "time": 0.496790400147438, "times": [0.5181440114974976, 0.4976640045642853, 0.4947519898414612, 0.4940800070762634, 0.49404799938201904, 0.4946880042552948, 0.4939199984073639, 0.4935680031776428, 0.49324798583984375, 0.49379199743270874], "compile_time": 112.43167299994639, "verification_time": 0, "benchmark_time": 5.505124999899635, "strategy_time": 0, "framework_time": 0.22130600018499536},
"0,32,1,2": {"between_method": 0, "block_size_x": 32, "tile_size": 1, "use_method": 2, "time": 0.49665600061416626, "times": [0.5184000134468079, 0.49692800641059875, 0.49452799558639526, 0.4935680031776428, 0.4935680031776428, 0.49478399753570557, 0.49379199743270874, 0.4935680031776428, 0.4936639964580536, 0.49375998973846436], "compile_time": 112.88033599998926, "verification_time": 0, "benchmark_time": 5.550190000121802, "strategy_time": 0, "framework_time": 0.2722629997151671},
"0,32,2,0": {"between_method": 0, "block_size_x": 32, "tile_size": 2, "use_method": 0, "time": 0.2539135992527008, "times": [0.27558401226997375, 0.2542400062084198, 0.25231999158859253, 0.2516799867153168, 0.2505599856376648, 0.2529279887676239, 0.25046399235725403, 0.25043201446533203, 0.25043201446533203, 0.2504960000514984], "compile_time": 111.4619299999049, "verification_time": 0, "benchmark_time": 2.9786679999688204, "strategy_time": 0, "framework_time": 0.27547500008040515},
"0,32,2,1": {"between_method": 0, "block_size_x": 32, "tile_size": 2, "use_method": 1, "time": 0.25445120334625243, "times": [0.27590399980545044, 0.2542079985141754, 0.25225600600242615, 0.2519040107727051, 0.2519040107727051, 0.2517760097980499, 0.25174400210380554, 0.2515200078487396, 0.2516799867153168, 0.2516160011291504], "compile_time": 109.9954759999946, "verification_time": 0, "benchmark_time": 2.9618959999879735, "strategy_time": 0, "framework_time": 0.2926020001723373},
"0,32,2,2": {"between_method": 0, "block_size_x": 32, "tile_size": 2, "use_method": 2, "time": 0.2543360024690628, "times": [0.2747200131416321, 0.2551040053367615, 0.2524160146713257, 0.2516799867153168, 0.2517760097980499, 0.2518720030784607, 0.25228801369667053, 0.2515519857406616, 0.2512640058994293, 0.25068798661231995], "compile_time": 111.09190899992427, "verification_time": 0, "benchmark_time": 2.961565000077826, "strategy_time": 0, "framework_time": 0.3020040001047164},
"0,32,4,0": {"between_method": 0, "block_size_x": 32, "tile_size": 4, "use_method": 0, "time": 0.13307839781045913, "times": [0.15404799580574036, 0.13353599607944489, 0.13155199587345123, 0.13094399869441986, 0.13075199723243713, 0.13075199723243713, 0.1305599957704544, 0.1302720010280609, 0.12902399897575378, 0.12934400141239166], "compile_time": 111.43625099998644, "verification_time": 0, "benchmark_time": 1.8964180001148634, "strategy_time": 0, "framework_time": 0.3113679999842134},
"0,32,4,1": {"between_method": 0, "block_size_x": 32, "tile_size": 4, "use_method": 1, "time": 0.13280639946460723, "times": [0.15379199385643005, 0.13312000036239624, 0.1313599944114685, 0.130048006772995, 0.1292800009250641, 0.13046400249004364, 0.12956799566745758, 0.12982399761676788, 0.12988799810409546, 0.13072000443935394], "compile_time": 110.07056699986606, "verification_time": 0, "benchmark_time": 1.8924109999716165, "strategy_time": 0, "framework_time": 0.31850800019128656},
"0,32,4,2": {"between_method": 0, "block_size_x": 32, "tile_size": 4, "use_method": 2, "time": 0.13301119953393936, "times": [0.15382400155067444, 0.13312000036239624, 0.13155199587345123, 0.13129599392414093, 0.13068799674510956, 0.130048006772995, 0.13043199479579926, 0.12934400141239166, 0.12998400628566742, 0.12982399761676788], "compile_time": 111.82862000009663, "verification_time": 0, "benchmark_time": 1.8981660000463307, "strategy_time": 0, "framework_time": 0.3358809999554069},
"0,32,6,0": {"between_method": 0, "block_size_x": 32, "tile_size": 6, "use_method": 0, "time": 0.09258239939808846, "times": [0.11414399743080139, 0.09404800087213516, 0.09011200070381165, 0.0902400016784668, 0.08991999924182892, 0.0899519994854927, 0.08873599767684937, 0.08899199962615967, 0.09011200070381165, 0.08956799656152725], "compile_time": 115.5369560001418, "verification_time": 0, "benchmark_time": 1.3594810000086, "strategy_time": 0, "framework_time": 0.3395239998553734},
"0,32,6,1": {"between_method": 0, "block_size_x": 32, "tile_size": 6, "use_method": 1, "time": 0.09258239939808846, "times": [0.11433599889278412, 0.09302400052547455, 0.09011200070381165, 0.09014400094747543, 0.08982399851083755, 0.09008000046014786, 0.09011200070381165, 0.08966399729251862, 0.08867199718952179, 0.08985599875450134], "compile_time": 112.93664100003298, "verification_time": 0, "benchmark_time": 1.3963080000394257, "strategy_time": 0, "framework_time": 0.3499329998248868},
"0,32,6,2": {"between_method": 0, "block_size_x": 32, "tile_size": 6, "use_method": 2, "time": 0.09258240014314652, "times": [0.1143679991364479, 0.09359999746084213, 0.09020800143480301, 0.09020800143480301, 0.08963199704885483, 0.08991999924182892, 0.09020800143480301, 0.08854400366544724, 0.08908800035715103, 0.09004800021648407], "compile_time": 115.88293799991334, "verification_time": 0, "benchmark_time": 1.3612130001092737, "strategy_time": 0, "framework_time": 0.35671400019055},
"0,32,8,0": {"between_method": 0, "block_size_x": 32, "tile_size": 8, "use_method": 0, "time": 0.07245119959115982, "times": [0.09398400038480759, 0.07305599749088287, 0.06998399645090103, 0.07023999840021133, 0.06972800195217133, 0.06960000097751617, 0.06937599927186966, 0.06947200000286102, 0.06963200122117996, 0.06943999975919724], "compile_time": 113.35437299999285, "verification_time": 0, "benchmark_time": 1.3089929998386651, "strategy_time": 0, "framework_time": 0.3680040001654561},
"0,32,8,1": {"between_method": 0, "block_size_x": 32, "tile_size": 8, "use_method": 1, "time": 0.07276479974389076, "times": [0.09542399644851685, 0.07337599992752075, 0.07132799923419952, 0.06966400146484375, 0.06963200122117996, 0.06937599927186966, 0.06956800073385239, 0.06963200122117996, 0.06934399902820587, 0.07030399888753891], "compile_time": 115.51917300016612, "verification_time": 0, "benchmark_time": 1.3623469999402005, "strategy_time": 0, "framework_time": 0.3765199999179458},
"0,32,8,2": {"between_method": 0, "block_size_x": 32, "tile_size": 8, "use_method": 2, "time": 0.07278720065951347, "times": [0.09401600062847137, 0.07327999919652939, 0.07036799937486649, 0.07078400254249573, 0.070592001080513, 0.07020799815654755, 0.06963200122117996, 0.06966400146484375, 0.06988800317049026, 0.06943999975919724], "compile_time": 113.33013000012215, "verification_time": 0, "benchmark_time": 1.3606180000351742, "strategy_time": 0, "framework_time": 0.45884199971624184},
"0,32,10,0": {"between_method": 0, "block_size_x": 32, "tile_size": 10, "use_method": 0, "time": 0.06046080030500889, "times": [0.08128000050783157, 0.06115199998021126, 0.058720000088214874, 0.05766399949789047, 0.05734400078654289, 0.05830400064587593, 0.05734400078654289, 0.05734400078654289, 0.05737600103020668, 0.058079998940229416], "compile_time": 116.06748600001993, "verification_time": 0, "benchmark_time": 0.8267240000350284, "strategy_time": 0, "framework_time": 0.3973049997512135},
"0,32,10,1": {"between_method": 0, "block_size_x": 32, "tile_size": 10, "use_method": 1, "time": 0.06016959957778454, "times": [0.0817599967122078, 0.060095999389886856, 0.05859199911355972, 0.0575999990105629, 0.05711999908089638, 0.05721599981188774, 0.05734400078654289, 0.05734400078654289, 0.05740800127387047, 0.05721599981188774], "compile_time": 114.55906499986668, "verification_time": 0, "benchmark_time": 0.8253050000348594, "strategy_time": 0, "framework_time": 0.4088240002602106},
"0,32,10,2": {"between_method": 0, "block_size_x": 32, "tile_size": 10, "use_method": 2, "time": 0.060390401259064676, "times": [0.08060800284147263, 0.06038400158286095, 0.05939200147986412, 0.058880001306533813, 0.05782400071620941, 0.057472001761198044, 0.057472001761198044, 0.05734400078654289, 0.05734400078654289, 0.05718399956822395], "compile_time": 115.99008100006358, "verification_time": 0, "benchmark_time": 0.8378539998830092, "strategy_time": 0, "framework_time": 0.4138699998748052},
"0,32,12,0": {"between_method": 0, "block_size_x": 32, "tile_size": 12, "use_method": 0, "time": 0.052233599871397016, "times": [0.07372800260782242, 0.052000001072883606, 0.05119999870657921, 0.05023999884724617, 0.04934399947524071, 0.04934399947524071, 0.049056001007556915, 0.04896000027656555, 0.04927999898791313, 0.04918399825692177], "compile_time": 120.34539000001132, "verification_time": 0, "benchmark_time": 0.8293939999930444, "strategy_time": 0, "framework_time": 0.4298209998978564},
"0,32,12,1": {"between_method": 0, "block_size_x": 32, "tile_size": 12, "use_method": 1, "time": 0.05214080065488815, "times": [0.07327999919652939, 0.0525440014898777, 0.05081599950790405, 0.05027199909090996, 0.04886399954557419, 0.04915200173854828, 0.04915200173854828, 0.04915200173854828, 0.049056001007556915, 0.04912000149488449], "compile_time": 116.48393099994792, "verification_time": 0, "benchmark_time": 0.8271620001778501, "strategy_time": 0, "framework_time": 0.43907899976147746},
"0,32,12,2": {"between_method": 0, "block_size_x": 32, "tile_size": 12, "use_method": 2, "time": 0.0521184004843235, "times": [0.07366400212049484, 0.05180799961090088, 0.050944000482559204, 0.04979199916124344, 0.04915200173854828, 0.04915200173854828, 0.04918399825692177, 0.04940799996256828, 0.048928000032901764, 0.04915200173854828], "compile_time": 118.83697600001142, "verification_time": 0, "benchmark_time": 0.8544760000859242, "strategy_time": 0, "framework_time": 0.44443799993132416},
"0,32,14,0": {"between_method": 0, "block_size_x": 32, "tile_size": 14, "use_method": 0, "time": 0.04643840007483959, "times": [0.06831999868154526, 0.04710400104522705, 0.04483199864625931, 0.04358400031924248, 0.04307200014591217, 0.044576000422239304, 0.043007999658584595, 0.04310400038957596, 0.043776001781225204, 0.043007999658584595], "compile_time": 122.46407099996759, "verification_time": 0, "benchmark_time": 0.8274100000562612, "strategy_time": 0, "framework_time": 0.450547000127699},
"0,32,14,1": {"between_method": 0, "block_size_x": 32, "tile_size": 14, "use_method": 1, "time": 0.04654720015823841, "times": [0.06745599955320358, 0.04684799909591675, 0.044863998889923096, 0.044895999133586884, 0.04371200129389763, 0.043168000876903534, 0.043296001851558685, 0.04364800080657005, 0.0432640016078949, 0.044319998472929], "compile_time": 120.03974200001721, "verification_time": 0, "benchmark_time": 0.8293790001516754, "strategy_time": 0, "framework_time": 0.513896999791541},
"0,32,14,2": {"between_method": 0, "block_size_x": 32, "tile_size": 14, "use_method": 2, "time": 0.046774400398135185, "times": [0.06883200258016586, 0.046879999339580536, 0.04473600164055824, 0.044319998472929, 0.04464000090956688, 0.043616000562906265, 0.044256001710891724, 0.04435199871659279, 0.043007999658584595, 0.04310400038957596], "compile_time": 123.00806200005354, "verification_time": 0, "benchmark_time": 0.8326099998612335, "strategy_time": 0, "framework_time": 0.4728470000827656},
"0,32,16,0": {"between_method": 0, "block_size_x": 32, "tile_size": 16, "use_method": 0, "time": 0.04192959927022457, "times": [0.06239999830722809, 0.04249599948525429, 0.0398080013692379, 0.039712000638246536, 0.03907199949026108, 0.04012800008058548, 0.03891199827194214, 0.03891199827194214, 0.038943998515605927, 0.03891199827194214], "compile_time": 126.69591999997465, "verification_time": 0, "benchmark_time": 0.8291960000406107, "strategy_time": 0, "framework_time": 0.48609800001031545},
"0,32,16,1": {"between_method": 0, "block_size_x": 32, "tile_size": 16, "use_method": 1, "time": 0.042051199823617935, "times": [0.06220800057053566, 0.04255999997258186, 0.04064000025391579, 0.04047999903559685, 0.0395519994199276, 0.03916800022125244, 0.03929600119590759, 0.03872000053524971, 0.03891199827194214, 0.038975998759269714], "compile_time": 123.16652100003012, "verification_time": 0, "benchmark_time": 0.8290690000194445, "strategy_time": 0, "framework_time": 0.4900599999473343},
"0,32,16,2": {"between_method": 0, "block_size_x": 32, "tile_size": 16, "use_method": 2, "time": 0.04213439933955669, "times": [0.06358399987220764, 0.04188799858093262, 0.040672000497579575, 0.040063999593257904, 0.04009599983692169, 0.03923200070858002, 0.03891199827194214, 0.038975998759269714, 0.0390079990029335, 0.03891199827194214], "compile_time": 126.4271769998686, "verification_time": 0, "benchmark_time": 0.8278939999399881, "strategy_time": 0, "framework_time": 0.49975800015999994},
"0,32,18,0": {"between_method": 0, "block_size_x": 32, "tile_size": 18, "use_method": 0, "time": 0.03878719992935657, "times": [0.061216000467538834, 0.03891199827194214, 0.037248000502586365, 0.03654399886727333, 0.035551998764276505, 0.035392001271247864, 0.035392001271247864, 0.0363520011305809, 0.03612799942493439, 0.03513599932193756], "compile_time": 130.02290100007485, "verification_time": 0, "benchmark_time": 0.8304299999508657, "strategy_time": 0, "framework_time": 0.5106539999815141},
"0,32,18,1": {"between_method": 0, "block_size_x": 32, "tile_size": 18, "use_method": 1, "time": 0.03870080038905144, "times": [0.060416001826524734, 0.0387520007789135, 0.036959998309612274, 0.0363520011305809, 0.0363520011305809, 0.03641600161790848, 0.03481600061058998, 0.03551999852061272, 0.03638400137424469, 0.0350399985909462], "compile_time": 125.18495299991628, "verification_time": 0, "benchmark_time": 0.8284509999612055, "strategy_time": 0, "framework_time": 0.5170490001091821},
"0,32,18,2": {"between_method": 0, "block_size_x": 32, "tile_size": 18, "use_method": 2, "time": 0.03893439993262291, "times": [0.06080000102519989, 0.038943998515605927, 0.03743999823927879, 0.036479998379945755, 0.03654399886727333, 0.03519999980926514, 0.03545600175857544, 0.03577600046992302, 0.036448001861572266, 0.03625600039958954], "compile_time": 128.99586200001067, "verification_time": 0, "benchmark_time": 0.8319439998558664, "strategy_time": 0, "framework_time": 0.5288190002374904},
"0,32,20,0": {"between_method": 0, "block_size_x": 32, "tile_size": 20, "use_method": 0, "time": 0.036361600086092946, "times": [0.0586559996008873, 0.036607999354600906, 0.03494400158524513, 0.03436800092458725, 0.03347200155258179, 0.03286400064826012, 0.032896000891923904, 0.033055998384952545, 0.03311999887228012, 0.03363199904561043], "compile_time": 133.19286400019337, "verification_time": 0, "benchmark_time": 0.8538029999272112, "strategy_time": 0, "framework_time": 0.5633089997445495},
"0,32,20,1": {"between_method": 0, "block_size_x": 32, "tile_size": 20, "use_method": 1, "time": 0.036240000277757645, "times": [0.05734400078654289, 0.03673600032925606, 0.03446400165557861, 0.03328000009059906, 0.03392000123858452, 0.03452799841761589, 0.03385600075125694, 0.032607998698949814, 0.03276799991726875, 0.032896000891923904], "compile_time": 127.25396600012573, "verification_time": 0, "benchmark_time": 0.8302000001094711, "strategy_time": 0, "framework_time": 0.5414539996309031},
"0,32,20,2": {"between_method": 0, "block_size_x": 32, "tile_size": 20, "use_method": 2, "time": 0.036003200337290764, "times": [0.05750399827957153, 0.03574400022625923, 0.03446400165557861, 0.033535998314619064, 0.03296000137925148, 0.032896000891923904, 0.033215999603271484, 0.033984001725912094, 0.03276799991726875, 0.03296000137925148], "compile_time": 132.53150800005642, "verification_time": 0, "benchmark_time": 0.8275679999769636, "strategy_time": 0, "framework_time": 0.5505889998858038},
"0,64,1,0": {"between_method": 0, "block_size_x": 64, "tile_size": 1, "use_method": 0, "time": 0.254067200422287, "times": [0.27532801032066345, 0.25407999753952026, 0.2526080012321472, 0.25174400210380554, 0.2516160011291504, 0.2507840096950531, 0.25071999430656433, 0.2508159875869751, 0.251583993434906, 0.2513920068740845], "compile_time": 113.48009700009243, "verification_time": 0, "benchmark_time": 2.990827000076024, "strategy_time": 0, "framework_time": 0.5639549999614246},
"0,64,1,1": {"between_method": 0, "block_size_x": 64, "tile_size": 1, "use_method": 1, "time": 0.25426880121231077, "times": [0.2761920094490051, 0.25545600056648254, 0.2518399953842163, 0.2516480088233948, 0.25174400210380554, 0.2518720030784607, 0.2517760097980499, 0.2508479952812195, 0.25062400102615356, 0.25068798661231995], "compile_time": 112.35904099999061, "verification_time": 0, "benchmark_time": 2.9660789998615655, "strategy_time": 0, "framework_time": 0.5676660000517586},
"0,64,1,2": {"between_method": 0, "block_size_x": 64, "tile_size": 1, "use_method": 2, "time": 0.25437119603157043, "times": [0.27555200457572937, 0.2550719976425171, 0.25196799635887146, 0.2516799867153168, 0.2518399953842163, 0.2516799867153168, 0.2502720057964325, 0.252128005027771, 0.2518079876899719, 0.25171199440956116], "compile_time": 113.37890000004336, "verification_time": 0, "benchmark_time": 2.9540619998442708, "strategy_time": 0, "framework_time": 0.5791700000372657},
"0,64,2,0": {"between_method": 0, "block_size_x": 64, "tile_size": 2, "use_method": 0, "time": 0.1332319974899292, "times": [0.1539199948310852, 0.133215993642807, 0.13123199343681335, 0.1308159977197647, 0.13065600395202637, 0.13075199723243713, 0.13049599528312683, 0.13046400249004364, 0.13049599528312683, 0.1302720010280609], "compile_time": 111.71659100000397, "verification_time": 0, "benchmark_time": 1.897689000088576, "strategy_time": 0, "framework_time": 0.589783999885185},
"0,64,2,1": {"between_method": 0, "block_size_x": 64, "tile_size": 2, "use_method": 1, "time": 0.13290880024433135, "times": [0.15436799824237823, 0.13331200182437897, 0.13120000064373016, 0.12992000579833984, 0.1302720010280609, 0.13023999333381653, 0.12950399518013, 0.12972800433635712, 0.130048006772995, 0.13049599528312683], "compile_time": 110.52355200013153, "verification_time": 0, "benchmark_time": 1.8709820001276967, "strategy_time": 0, "framework_time": 0.6040129997018084},
"0,64,2,2": {"between_method": 0, "block_size_x": 64, "tile_size": 2, "use_method": 2, "time": 0.1331423982977867, "times": [0.15408000349998474, 0.13369600474834442, 0.13235199451446533, 0.131071999669075, 0.13087999820709229, 0.12918399274349213, 0.1295360028743744, 0.1297599971294403, 0.13036799430847168, 0.13049599528312683], "compile_time": 111.39327499995488, "verification_time": 0, "benchmark_time": 1.8957209999825864, "strategy_time": 0, "framework_time": 0.6059190000087256},
"0,64,4,0": {"between_method": 0, "block_size_x": 64, "tile_size": 4, "use_method": 0, "time": 0.07233279943466187, "times": [0.0942080020904541, 0.07295999675989151, 0.07094399631023407, 0.07001599669456482, 0.06947200000286102, 0.0695360004901886, 0.06838399916887283, 0.06860800087451935, 0.06956800073385239, 0.06963200122117996], "compile_time": 111.83283300010771, "verification_time": 0, "benchmark_time": 1.311465000071621, "strategy_time": 0, "framework_time": 0.6153099998300604},
"0,64,4,1": {"between_method": 0, "block_size_x": 64, "tile_size": 4, "use_method": 1, "time": 0.07243840023875237, "times": [0.09388799965381622, 0.07302399724721909, 0.07081600278615952, 0.06982400268316269, 0.06963200122117996, 0.06934399902820587, 0.06963200122117996, 0.06956800073385239, 0.069023996591568, 0.06963200122117996], "compile_time": 110.28739800008225, "verification_time": 0, "benchmark_time": 1.3131430000612454, "strategy_time": 0, "framework_time": 0.6297719999110996},
"0,64,4,2": {"between_method": 0, "block_size_x": 64, "tile_size": 4, "use_method": 2, "time": 0.07228800058364868, "times": [0.09398400038480759, 0.07254400104284286, 0.0700799971818924, 0.07046400010585785, 0.06972800195217133, 0.06976000219583511, 0.06956800073385239, 0.06943999975919724, 0.06876800209283829, 0.06854400038719177], "compile_time": 112.0833610000318, "verification_time": 0, "benchmark_time": 1.3120159999289172, "strategy_time": 0, "framework_time": 0.6362430001445318},
"0,64,6,0": {"between_method": 0, "block_size_x": 64, "tile_size": 6, "use_method": 0, "time": 0.05263679958879948, "times": [0.07401599735021591, 0.05161599814891815, 0.050175998359918594, 0.05023999884724617, 0.049056001007556915, 0.05036799982190132, 0.04912000149488449, 0.04915200173854828, 0.04918399825692177, 0.05344000086188316], "compile_time": 116.42380300008881, "verification_time": 0, "benchmark_time": 0.8347409998350486, "strategy_time": 0, "framework_time": 0.6389029999809281},
"0,64,6,1": {"between_method": 0, "block_size_x": 64, "tile_size": 6, "use_method": 1, "time": 0.05193600058555603, "times": [0.07372800260782242, 0.052928000688552856, 0.04956800118088722, 0.04944000020623207, 0.04927999898791313, 0.04915200173854828, 0.04931199923157692, 0.047968000173568726, 0.048928000032901764, 0.049056001007556915], "compile_time": 113.42249299991636, "verification_time": 0, "benchmark_time": 0.8284560001357022, "strategy_time": 0, "framework_time": 0.6484949999503442},
"0,64,6,2": {"between_method": 0, "block_size_x": 64, "tile_size": 6, "use_method": 2, "time": 0.052009600773453714, "times": [0.07372800260782242, 0.0525440014898777, 0.0498879998922348, 0.04992000013589859, 0.04918399825692177, 0.04915200173854828, 0.0490880012512207, 0.0490880012512207, 0.04835199937224388, 0.04915200173854828], "compile_time": 115.26301399999284, "verification_time": 0, "benchmark_time": 0.8315490001677972, "strategy_time": 0, "framework_time": 0.6544629998188611},
"0,64,8,0": {"between_method": 0, "block_size_x": 64, "tile_size": 8, "use_method": 0, "time": 0.04183679968118668, "times": [0.06348799914121628, 0.041280001401901245, 0.03964800015091896, 0.039903998374938965, 0.039712000638246536, 0.038975998759269714, 0.03891199827194214, 0.038975998759269714, 0.03859199956059456, 0.03888000175356865], "compile_time": 113.3652369999254, "verification_time": 0, "benchmark_time": 0.8298549998926319, "strategy_time": 0, "framework_time": 0.666335000005347},
"0,64,8,1": {"between_method": 0, "block_size_x": 64, "tile_size": 8, "use_method": 1, "time": 0.041871999949216844, "times": [0.062272001057863235, 0.04259200021624565, 0.039712000638246536, 0.04054399952292442, 0.03939199820160866, 0.03862399980425835, 0.03888000175356865, 0.03891199827194214, 0.038816001266241074, 0.038975998759269714], "compile_time": 115.82982599998104, "verification_time": 0, "benchmark_time": 0.8289759998660884, "strategy_time": 0, "framework_time": 0.6798390002131782},
"0,64,8,2": {"between_method": 0, "block_size_x": 64, "tile_size": 8, "use_method": 2, "time": 0.04186559952795506, "times": [0.06278400123119354, 0.04188799858093262, 0.04073600098490715, 0.03891199827194214, 0.03891199827194214, 0.03999999910593033, 0.038656000047922134, 0.0387520007789135, 0.039103999733924866, 0.03891199827194214], "compile_time": 113.14770800004226, "verification_time": 0, "benchmark_time": 0.8297349997974379, "strategy_time": 0, "framework_time": 0.6840640000973508},
"0,64,10,0": {"between_method": 0, "block_size_x": 64, "tile_size": 10, "use_method": 0, "time": 0.036076799780130384, "times": [0.05881600081920624, 0.03686400130391121, 0.03392000123858452, 0.03356799855828285, 0.033215999603271484, 0.03302399814128876, 0.033055998384952545, 0.03276799991726875, 0.03276799991726875, 0.03276799991726875], "compile_time": 115.9061080002175, "verification_time": 0, "benchmark_time": 0.8368569999674946, "strategy_time": 0, "framework_time": 0.7110939998256072},
"0,64,10,1": {"between_method": 0, "block_size_x": 64, "tile_size": 10, "use_method": 1, "time": 0.0360384002327919, "times": [0.05555199831724167, 0.03686400130391121, 0.034304000437259674, 0.03465599939227104, 0.03276799991726875, 0.033984001725912094, 0.03385600075125694, 0.03276799991726875, 0.032896000891923904, 0.032735999673604965], "compile_time": 114.8742499999571, "verification_time": 0, "benchmark_time": 0.8316480000303272, "strategy_time": 0, "framework_time": 0.7540320000316569},
"0,64,10,2": {"between_method": 0, "block_size_x": 64, "tile_size": 10, "use_method": 2, "time": 0.036003200337290764, "times": [0.05817599967122078, 0.03673600032925606, 0.03328000009059906, 0.03433600068092346, 0.03328000009059906, 0.03296000137925148, 0.03276799991726875, 0.03283200040459633, 0.032896000891923904, 0.03276799991726875], "compile_time": 116.31675699982225, "verification_time": 0, "benchmark_time": 0.835008000194648, "strategy_time": 0, "framework_time": 0.7081689998358343},
"0,64,12,0": {"between_method": 0, "block_size_x": 64, "tile_size": 12, "use_method": 0, "time": 0.031808000057935715, "times": [0.053247999399900436, 0.03232000023126602, 0.029343999922275543, 0.03046399913728237, 0.028960000723600388, 0.028672000393271446, 0.028672000393271446, 0.028896000236272812, 0.028672000393271446, 0.028831999748945236], "compile_time": 119.1212539999924, "verification_time": 0, "benchmark_time": 0.8293700000194804, "strategy_time": 0, "framework_time": 0.7187639998846862},
"0,64,12,1": {"between_method": 0, "block_size_x": 64, "tile_size": 12, "use_method": 1, "time": 0.03217920027673245, "times": [0.05507199838757515, 0.03232000023126602, 0.030368000268936157, 0.029920000582933426, 0.029920000582933426, 0.028672000393271446, 0.0289280004799366, 0.02844800055027008, 0.029472000896930695, 0.028672000393271446], "compile_time": 118.01863699997739, "verification_time": 0, "benchmark_time": 0.8292949999031407, "strategy_time": 0, "framework_time": 0.7246170000598795},
"0,64,12,2": {"between_method": 0, "block_size_x": 64, "tile_size": 12, "use_method": 2, "time": 0.031705600395798686, "times": [0.05302400141954422, 0.032416000962257385, 0.030432000756263733, 0.028960000723600388, 0.02876799926161766, 0.028672000393271446, 0.028672000393271446, 0.02879999950528145, 0.028704000636935234, 0.02860799990594387], "compile_time": 119.833897000035, "verification_time": 0, "benchmark_time": 0.8366990000467922, "strategy_time": 0, "framework_time": 0.7680200001232151},
"0,64,14,0": {"between_method": 0, "block_size_x": 64, "tile_size": 14, "use_method": 0, "time": 0.029078399948775768, "times": [0.05081599950790405, 0.02924799919128418, 0.027264000847935677, 0.026944000273942947, 0.026623999699950218, 0.026559999212622643, 0.02595200017094612, 0.024992000311613083, 0.026623999699950218, 0.025760000571608543], "compile_time": 123.47126899999239, "verification_time": 0, "benchmark_time": 0.8286679999400803, "strategy_time": 0, "framework_time": 0.7417030001306557},
"0,64,14,1": {"between_method": 0, "block_size_x": 64, "tile_size": 14, "use_method": 1, "time": 0.028867200016975403, "times": [0.05049600079655647, 0.029920000582933426, 0.02691200003027916, 0.026464000344276428, 0.026176000013947487, 0.026079999282956123, 0.024831999093294144, 0.02627200074493885, 0.0261439997702837, 0.02537599951028824], "compile_time": 120.35844599995471, "verification_time": 0, "benchmark_time": 0.8261680000032356, "strategy_time": 0, "framework_time": 0.75700900015363},
"0,64,14,2": {"between_method": 0, "block_size_x": 64, "tile_size": 14, "use_method": 2, "time": 0.029040000028908254, "times": [0.0496320016682148, 0.029279999434947968, 0.027488000690937042, 0.026623999699950218, 0.026399999856948853, 0.02630399912595749, 0.02537599951028824, 0.026464000344276428, 0.02659199945628643, 0.026240000501275063], "compile_time": 123.09194499994192, "verification_time": 0, "benchmark_time": 0.8304819998556923, "strategy_time": 0, "framework_time": 0.7575840002118639},
"0,64,16,0": {"between_method": 0, "block_size_x": 64, "tile_size": 16, "use_method": 0, "time": 0.026806400157511234, "times": [0.04864000156521797, 0.02672000043094158, 0.024992000311613083, 0.0244159996509552, 0.024159999564290047, 0.024191999807953835, 0.02393599972128868, 0.023231999948620796, 0.023455999791622162, 0.024320000782608986], "compile_time": 127.78485100011494, "verification_time": 0, "benchmark_time": 0.8300010001676128, "strategy_time": 0, "framework_time": 0.7779519999076001},
"0,64,16,1": {"between_method": 0, "block_size_x": 64, "tile_size": 16, "use_method": 1, "time": 0.02705600019544363, "times": [0.04899200052022934, 0.027135999873280525, 0.02521600015461445, 0.024927999824285507, 0.02457600086927414, 0.024320000782608986, 0.024447999894618988, 0.024224000051617622, 0.023296000435948372, 0.023423999547958374], "compile_time": 123.53410299988354, "verification_time": 0, "benchmark_time": 0.8334320000358275, "strategy_time": 0, "framework_time": 0.7868370000778668},
"0,64,16,2": {"between_method": 0, "block_size_x": 64, "tile_size": 16, "use_method": 2, "time": 0.027014400251209734, "times": [0.047680001705884933, 0.027103999629616737, 0.025760000571608543, 0.02457600086927414, 0.0244159996509552, 0.024480000138282776, 0.024383999407291412, 0.02377600036561489, 0.0244159996509552, 0.023552000522613525], "compile_time": 127.35663199987357, "verification_time": 0, "benchmark_time": 0.826273000029687, "strategy_time": 0, "framework_time": 0.786038000114786},
"0,64,18,0": {"between_method": 0, "block_size_x": 64, "tile_size": 18, "use_method": 0, "time": 0.02541119996458292, "times": [0.046879999339580536, 0.026399999856948853, 0.024447999894618988, 0.022816000506281853, 0.022175999358296394, 0.02147199958562851, 0.022592000663280487, 0.022495999932289124, 0.02236800082027912, 0.022463999688625336], "compile_time": 130.00192600020455, "verification_time": 0, "benchmark_time": 0.833022000051642, "strategy_time": 0, "framework_time": 0.8045349998155871},
"0,64,18,1": {"between_method": 0, "block_size_x": 64, "tile_size": 18, "use_method": 1, "time": 0.025500800088047983, "times": [0.047200001776218414, 0.026559999212622643, 0.02412799932062626, 0.02252800017595291, 0.023552000522613525, 0.02143999934196472, 0.02252800017595291, 0.022207999601960182, 0.02252800017595291, 0.022336000576615334], "compile_time": 126.52479300004416, "verification_time": 0, "benchmark_time": 0.8284309999453399, "strategy_time": 0, "framework_time": 0.8072929999798362},
"0,64,18,2": {"between_method": 0, "block_size_x": 64, "tile_size": 18, "use_method": 2, "time": 0.024998399987816812, "times": [0.046751998364925385, 0.024671999737620354, 0.022975999861955643, 0.02252800017595291, 0.02252800017595291, 0.022431999444961548, 0.02236800082027912, 0.02252800017595291, 0.021824000403285027, 0.021376000717282295], "compile_time": 130.470497000033, "verification_time": 0, "benchmark_time": 0.8295099999031663, "strategy_time": 0, "framework_time": 0.8162090000496391},
"0,64,20,0": {"between_method": 0, "block_size_x": 64, "tile_size": 20, "use_method": 0, "time": 0.023715200275182723, "times": [0.04521600157022476, 0.024064000695943832, 0.021503999829292297, 0.02223999984562397, 0.021088000386953354, 0.020608000457286835, 0.020479999482631683, 0.0208320003002882, 0.020640000700950623, 0.020479999482631683], "compile_time": 133.9095000000725, "verification_time": 0, "benchmark_time": 0.8306370000354946, "strategy_time": 0, "framework_time": 0.8328449998771248},
"0,64,20,1": {"between_method": 0, "block_size_x": 64, "tile_size": 20, "use_method": 1, "time": 0.024131199903786184, "times": [0.045152001082897186, 0.024480000138282776, 0.02223999984562397, 0.022304000332951546, 0.02127999998629093, 0.021056000143289566, 0.021983999758958817, 0.021663999184966087, 0.020479999482631683, 0.02067199908196926], "compile_time": 129.08324499994706, "verification_time": 0, "benchmark_time": 0.8296979999613541, "strategy_time": 0, "framework_time": 0.8367300001737021},
"0,64,20,2": {"between_method": 0, "block_size_x": 64, "tile_size": 20, "use_method": 2, "time": 0.0234783997759223, "times": [0.04495999962091446, 0.023296000435948372, 0.02239999920129776, 0.020479999482631683, 0.02163200080394745, 0.020479999482631683, 0.020479999482631683, 0.020191999152302742, 0.020479999482631683, 0.02038400061428547], "compile_time": 134.8314219999338, "verification_time": 0, "benchmark_time": 0.8286170000246784, "strategy_time": 0, "framework_time": 0.8349900001576316},
"0,96,1,0": {"between_method": 0, "block_size_x": 96, "tile_size": 1, "use_method": 0, "time": 0.17324160039424896, "times": [0.1945600062608719, 0.17375999689102173, 0.17187200486660004, 0.17129600048065186, 0.17056000232696533, 0.16998399794101715, 0.16998399794101715, 0.16998399794101715, 0.1701440066099167, 0.17027199268341064], "compile_time": 113.54803799986257, "verification_time": 0, "benchmark_time": 2.3766990000240185, "strategy_time": 0, "framework_time": 0.852665000138586},
"0,96,1,1": {"between_method": 0, "block_size_x": 96, "tile_size": 1, "use_method": 1, "time": 0.17319999933242797, "times": [0.19446399807929993, 0.17401599884033203, 0.17206400632858276, 0.17052799463272095, 0.16998399794101715, 0.17103999853134155, 0.16995200514793396, 0.16998399794101715, 0.16998399794101715, 0.16998399794101715], "compile_time": 112.50877999987097, "verification_time": 0, "benchmark_time": 2.3759960001825675, "strategy_time": 0, "framework_time": 0.8580490000440477},
"0,96,1,2": {"between_method": 0, "block_size_x": 96, "tile_size": 1, "use_method": 2, "time": 0.17347200214862823, "times": [0.19484800100326538, 0.1740799993276596, 0.17180800437927246, 0.1708800047636032, 0.16998399794101715, 0.1711360067129135, 0.1709440052509308, 0.16998399794101715, 0.17107200622558594, 0.16998399794101715], "compile_time": 112.96191100018405, "verification_time": 0, "benchmark_time": 2.3790630000348756, "strategy_time": 0, "framework_time": 0.8718849996967037},
"0,96,2,0": {"between_method": 0, "block_size_x": 96, "tile_size": 2, "use_method": 0, "time": 0.09268159940838813, "times": [0.11443199962377548, 0.09324800223112106, 0.09062399715185165, 0.09068799763917923, 0.0899839997291565, 0.08908800035715103, 0.09001599997282028, 0.08979199826717377, 0.08928000181913376, 0.08966399729251862], "compile_time": 111.88182900013999, "verification_time": 0, "benchmark_time": 1.3666160000411764, "strategy_time": 0, "framework_time": 0.8766829998876347},
"0,96,2,1": {"between_method": 0, "block_size_x": 96, "tile_size": 2, "use_method": 1, "time": 0.09222399890422821, "times": [0.11289600282907486, 0.09270399808883667, 0.0907839983701706, 0.08991999924182892, 0.08892799913883209, 0.088639996945858, 0.08892799913883209, 0.08979199826717377, 0.08975999802350998, 0.08988799899816513], "compile_time": 110.38476200019431, "verification_time": 0, "benchmark_time": 1.3646190000144998, "strategy_time": 0, "framework_time": 0.8925719998842396},
"0,96,2,2": {"between_method": 0, "block_size_x": 96, "tile_size": 2, "use_method": 2, "time": 0.09272319972515106, "times": [0.1143679991364479, 0.09247999638319016, 0.09120000153779984, 0.09017600119113922, 0.09011200070381165, 0.09008000046014786, 0.09004800021648407, 0.08899199962615967, 0.09008000046014786, 0.0896959975361824], "compile_time": 111.7263080000157, "verification_time": 0, "benchmark_time": 1.3617290001093352, "strategy_time": 0, "framework_time": 0.8971859999746812},
"0,96,4,0": {"between_method": 0, "block_size_x": 96, "tile_size": 4, "use_method": 0, "time": 0.05188480094075203, "times": [0.07254400104284286, 0.05260799825191498, 0.05011200159788132, 0.04915200173854828, 0.04915200173854828, 0.05004800111055374, 0.04915200173854828, 0.04915200173854828, 0.048895999789237976, 0.0480320006608963], "compile_time": 112.1830949998639, "verification_time": 0, "benchmark_time": 0.8271159999821975, "strategy_time": 0, "framework_time": 0.9126130003096478},
"0,96,4,1": {"between_method": 0, "block_size_x": 96, "tile_size": 4, "use_method": 1, "time": 0.05221440009772778, "times": [0.07360000163316727, 0.05142400041222572, 0.05081599950790405, 0.05023999884724617, 0.049056001007556915, 0.05027199909090996, 0.049247998744249344, 0.04915200173854828, 0.04918399825692177, 0.04915200173854828], "compile_time": 110.1934529999653, "verification_time": 0, "benchmark_time": 0.830874999792286, "strategy_time": 0, "framework_time": 0.9178070001780725},
"0,96,4,2": {"between_method": 0, "block_size_x": 96, "tile_size": 4, "use_method": 2, "time": 0.05203199982643127, "times": [0.07347200065851212, 0.05283199995756149, 0.05056000128388405, 0.049855999648571014, 0.04947200044989586, 0.049247998744249344, 0.04927999898791313, 0.04870399832725525, 0.04800000041723251, 0.048895999789237976], "compile_time": 111.75804600020456, "verification_time": 0, "benchmark_time": 0.8315899999615795, "strategy_time": 0, "framework_time": 0.9193229998345487},
"0,96,6,0": {"between_method": 0, "block_size_x": 96, "tile_size": 6, "use_method": 0, "time": 0.03886720053851604, "times": [0.05939200147986412, 0.0390079990029335, 0.03686400130391121, 0.036448001861572266, 0.036607999354600906, 0.036479998379945755, 0.03638400137424469, 0.03673600032925606, 0.03542400151491165, 0.03532800078392029], "compile_time": 115.57656800005134, "verification_time": 0, "benchmark_time": 0.8172010000180308, "strategy_time": 0, "framework_time": 0.9317009998994763},
"0,96,6,1": {"between_method": 0, "block_size_x": 96, "tile_size": 6, "use_method": 1, "time": 0.03853760026395321, "times": [0.05920000001788139, 0.038784001022577286, 0.036768000572919846, 0.03683200106024742, 0.03654399886727333, 0.03519999980926514, 0.035360001027584076, 0.03561599925160408, 0.03625600039958954, 0.03481600061058998], "compile_time": 113.65271500017116, "verification_time": 0, "benchmark_time": 0.8279609999135573, "strategy_time": 0, "framework_time": 0.9387189998051326},
"0,96,6,2": {"between_method": 0, "block_size_x": 96, "tile_size": 6, "use_method": 2, "time": 0.03918719962239266, "times": [0.06419199705123901, 0.03891199827194214, 0.03686400130391121, 0.036607999354600906, 0.036479998379945755, 0.035711999982595444, 0.0363520011305809, 0.03558399900794029, 0.0363520011305809, 0.03481600061058998], "compile_time": 115.30936600001951, "verification_time": 0, "benchmark_time": 0.834725000004255, "strategy_time": 0, "framework_time": 0.9639820000302279},
"0,96,8,0": {"between_method": 0, "block_size_x": 96, "tile_size": 8, "use_method": 0, "time": 0.03200960010290146, "times": [0.05337600037455559, 0.03190400078892708, 0.03049599938094616, 0.028960000723600388, 0.029791999608278275, 0.029664000496268272, 0.02937600016593933, 0.028672000393271446, 0.02908799983561039, 0.02876799926161766], "compile_time": 113.77828799982126, "verification_time": 0, "benchmark_time": 0.8524089998900308, "strategy_time": 0, "framework_time": 0.9609670003101201},
"0,96,8,1": {"between_method": 0, "block_size_x": 96, "tile_size": 8, "use_method": 1, "time": 0.03196479994803667, "times": [0.05190400034189224, 0.03145600110292435, 0.030719999223947525, 0.029791999608278275, 0.0297279991209507, 0.029952000826597214, 0.028672000393271446, 0.02879999950528145, 0.028831999748945236, 0.029791999608278275], "compile_time": 115.79831799986096, "verification_time": 0, "benchmark_time": 0.8277800000087154, "strategy_time": 0, "framework_time": 0.9750280000844214},
"0,96,8,2": {"between_method": 0, "block_size_x": 96, "tile_size": 8, "use_method": 2, "time": 0.031680000387132166, "times": [0.053888000547885895, 0.03155200183391571, 0.030400000512599945, 0.028672000393271446, 0.028672000393271446, 0.028672000393271446, 0.028672000393271446, 0.028672000393271446, 0.02876799926161766, 0.028831999748945236], "compile_time": 113.68905399990581, "verification_time": 0, "benchmark_time": 0.8297680001305707, "strategy_time": 0, "framework_time": 0.9778599999208382},
"0,96,10,0": {"between_method": 0, "block_size_x": 96, "tile_size": 10, "use_method": 0, "time": 0.027699200063943864, "times": [0.04771199822425842, 0.028416000306606293, 0.026367999613285065, 0.024800000712275505, 0.02579200081527233, 0.024992000311613083, 0.024927999824285507, 0.024671999737620354, 0.02473600022494793, 0.02457600086927414], "compile_time": 116.5829340000073, "verification_time": 0, "benchmark_time": 0.8351169999514241, "strategy_time": 0, "framework_time": 0.9871049999219395},
"0,96,10,1": {"between_method": 0, "block_size_x": 96, "tile_size": 10, "use_method": 1, "time": 0.02785280030220747, "times": [0.0490880012512207, 0.028384000062942505, 0.026176000013947487, 0.02550400048494339, 0.024960000067949295, 0.02457600086927414, 0.024671999737620354, 0.02489599958062172, 0.02473600022494793, 0.025536000728607178], "compile_time": 115.00352500002009, "verification_time": 0, "benchmark_time": 0.7945319998725608, "strategy_time": 0, "framework_time": 1.0037100000772625},
"0,96,10,2": {"between_method": 0, "block_size_x": 96, "tile_size": 10, "use_method": 2, "time": 0.027894400246441364, "times": [0.04944000020623207, 0.028575999662280083, 0.026176000013947487, 0.025439999997615814, 0.02457600086927414, 0.02457600086927414, 0.024992000311613083, 0.02502400055527687, 0.025567999109625816, 0.02457600086927414], "compile_time": 116.23692499983918, "verification_time": 0, "benchmark_time": 0.8288789999824075, "strategy_time": 0, "framework_time": 1.002891000098316},
"0,96,12,0": {"between_method": 0, "block_size_x": 96, "tile_size": 12, "use_method": 0, "time": 0.025401600264012815, "times": [0.047200001776218414, 0.025280000641942024, 0.024224000051617622, 0.023615999147295952, 0.022624000906944275, 0.02252800017595291, 0.02252800017595291, 0.022463999688625336, 0.02112000063061714, 0.022431999444961548], "compile_time": 119.00917699995262, "verification_time": 0, "benchmark_time": 0.8318359998611413, "strategy_time": 0, "framework_time": 1.0074470001200098},
"0,96,12,1": {"between_method": 0, "block_size_x": 96, "tile_size": 12, "use_method": 1, "time": 0.025222399830818178, "times": [0.046560000628232956, 0.02630399912595749, 0.023903999477624893, 0.02252800017595291, 0.022207999601960182, 0.02147199958562851, 0.022463999688625336, 0.022207999601960182, 0.022112000733613968, 0.022463999688625336], "compile_time": 117.3020290000295, "verification_time": 0, "benchmark_time": 0.8296149999296176, "strategy_time": 0, "framework_time": 1.031823999937842},
"0,96,12,2": {"between_method": 0, "block_size_x": 96, "tile_size": 12, "use_method": 2, "time": 0.025436799973249435, "times": [0.04739199951291084, 0.025087999179959297, 0.023520000278949738, 0.022816000506281853, 0.023520000278949738, 0.022624000906944275, 0.022463999688625336, 0.022175999358296394, 0.022431999444961548, 0.022336000576615334], "compile_time": 119.14780699999028, "verification_time": 0, "benchmark_time": 0.8313599998928112, "strategy_time": 0, "framework_time": 1.0335590002341632},
"0,96,14,0": {"between_method": 0, "block_size_x": 96, "tile_size": 14, "use_method": 0, "time": 0.024015999957919122, "times": [0.045184001326560974, 0.022816000506281853, 0.022431999444961548, 0.026623999699950218, 0.020959999412298203, 0.020479999482631683, 0.020479999482631683, 0.020447999238967896, 0.02038400061428547, 0.02035200037062168], "compile_time": 122.84574999989673, "verification_time": 0, "benchmark_time": 0.8391949997985648, "strategy_time": 0, "framework_time": 1.0414790003778762},
"0,96,14,1": {"between_method": 0, "block_size_x": 96, "tile_size": 14, "use_method": 1, "time": 0.023123199865221978, "times": [0.044895999133586884, 0.022911999374628067, 0.021376000717282295, 0.02131200022995472, 0.020320000126957893, 0.020479999482631683, 0.020255999639630318, 0.01945599913597107, 0.020287999883294106, 0.019936000928282738], "compile_time": 119.29763800003457, "verification_time": 0, "benchmark_time": 0.8294909998767253, "strategy_time": 0, "framework_time": 1.0495579999769689},
"0,96,14,2": {"between_method": 0, "block_size_x": 96, "tile_size": 14, "use_method": 2, "time": 0.02338239997625351, "times": [0.04492799937725067, 0.023744000121951103, 0.021247999742627144, 0.02115200087428093, 0.020479999482631683, 0.020416000857949257, 0.020479999482631683, 0.020479999482631683, 0.020287999883294106, 0.020608000457286835], "compile_time": 122.28009599994039, "verification_time": 0, "benchmark_time": 0.8310460000302555, "strategy_time": 0, "framework_time": 1.054103000114992},
"0,96,16,0": {"between_method": 0, "block_size_x": 96, "tile_size": 16, "use_method": 0, "time": 0.022092800214886667, "times": [0.04278400167822838, 0.02252800017595291, 0.02038400061428547, 0.019936000928282738, 0.018848000094294548, 0.019039999693632126, 0.018912000581622124, 0.019231999292969704, 0.01974399946630001, 0.019519999623298645], "compile_time": 126.025977999916, "verification_time": 0, "benchmark_time": 0.8306820000143489, "strategy_time": 0, "framework_time": 1.0717770001065219},
"0,96,16,1": {"between_method": 0, "block_size_x": 96, "tile_size": 16, "use_method": 1, "time": 0.02183360029011965, "times": [0.044256001710891724, 0.02252800017595291, 0.020800000056624413, 0.01894400082528591, 0.018432000651955605, 0.01865600049495697, 0.01897599920630455, 0.018432000651955605, 0.01852799952030182, 0.018783999606966972], "compile_time": 122.35030700003335, "verification_time": 0, "benchmark_time": 0.8269219999874622, "strategy_time": 0, "framework_time": 1.0799609999594395},
"0,96,16,2": {"between_method": 0, "block_size_x": 96, "tile_size": 16, "use_method": 2, "time": 0.021712000109255315, "times": [0.04310400038957596, 0.022495999932289124, 0.02022399939596653, 0.019328000023961067, 0.019007999449968338, 0.018432000651955605, 0.018848000094294548, 0.018432000651955605, 0.018624000251293182, 0.018624000251293182], "compile_time": 126.02689100003772, "verification_time": 0, "benchmark_time": 0.827646999823628, "strategy_time": 0, "framework_time": 1.0844800001450494},
"0,96,18,0": {"between_method": 0, "block_size_x": 96, "tile_size": 18, "use_method": 0, "time": 0.020771200023591518, "times": [0.04243199899792671, 0.021088000386953354, 0.01990400068461895, 0.018303999677300453, 0.01727999933063984, 0.01772800087928772, 0.017920000478625298, 0.01711999997496605, 0.018112000077962875, 0.017823999747633934], "compile_time": 128.94757100002607, "verification_time": 0, "benchmark_time": 0.8311959998081875, "strategy_time": 0, "framework_time": 1.0914940000930073},
"0,96,18,1": {"between_method": 0, "block_size_x": 96, "tile_size": 18, "use_method": 1, "time": 0.021318400651216506, "times": [0.041760001331567764, 0.021856000646948814, 0.01942400075495243, 0.01942400075495243, 0.018432000651955605, 0.018432000651955605, 0.018432000651955605, 0.018400000408291817, 0.018432000651955605, 0.018592000007629395], "compile_time": 125.74518099995657, "verification_time": 0, "benchmark_time": 0.8032440000533825, "strategy_time": 0, "framework_time": 1.1012299999038078},
"0,96,18,2": {"between_method": 0, "block_size_x": 96, "tile_size": 18, "use_method": 2, "time": 0.020700800232589245, "times": [0.04179200157523155, 0.020479999482631683, 0.01894400082528591, 0.017664000391960144, 0.018239999189972878, 0.01881599985063076, 0.018271999433636665, 0.01772800087928772, 0.016992000862956047, 0.018079999834299088], "compile_time": 129.9574440001834, "verification_time": 0, "benchmark_time": 0.8380179999676329, "strategy_time": 0, "framework_time": 1.1151559999689198},
"0,96,20,0": {"between_method": 0, "block_size_x": 96, "tile_size": 20, "use_method": 0, "time": 0.0198591997846961, "times": [0.03993599861860275, 0.020479999482631683, 0.018239999189972878, 0.01664000004529953, 0.017503999173641205, 0.017791999503970146, 0.01772800087928772, 0.017472000792622566, 0.016383999958634377, 0.016416000202298164], "compile_time": 132.9822239999885, "verification_time": 0, "benchmark_time": 0.8316710000144667, "strategy_time": 0, "framework_time": 1.1114260000795184},
"0,96,20,1": {"between_method": 0, "block_size_x": 96, "tile_size": 20, "use_method": 1, "time": 0.020748800225555898, "times": [0.04291199892759323, 0.02112000063061714, 0.018432000651955605, 0.018432000651955605, 0.018303999677300453, 0.017184000462293625, 0.01817600056529045, 0.017664000391960144, 0.016992000862956047, 0.018271999433636665], "compile_time": 128.90973000003214, "verification_time": 0, "benchmark_time": 0.8304719999614463, "strategy_time": 0, "framework_time": 1.195030999951996},
"0,96,20,2": {"between_method": 0, "block_size_x": 96, "tile_size": 20, "use_method": 2, "time": 0.020124799758195876, "times": [0.04095999896526337, 0.020287999883294106, 0.01833599992096424, 0.017664000391960144, 0.018239999189972878, 0.01711999997496605, 0.017791999503970146, 0.017535999417304993, 0.016448000445961952, 0.016863999888300896], "compile_time": 133.98586700009218, "verification_time": 0, "benchmark_time": 0.8314500000778935, "strategy_time": 0, "framework_time": 1.1413949998768658},
"0,128,1,0": {"between_method": 0, "block_size_x": 128, "tile_size": 1, "use_method": 0, "time": 0.13318400084972382, "times": [0.15360000729560852, 0.13417600095272064, 0.13116799294948578, 0.13078400492668152, 0.1300159990787506, 0.12966400384902954, 0.1297920048236847, 0.13123199343681335, 0.13075199723243713, 0.13065600395202637], "compile_time": 115.2882920000593, "verification_time": 0, "benchmark_time": 1.9100179999895772, "strategy_time": 0, "framework_time": 1.147130999925139},
"0,128,1,1": {"between_method": 0, "block_size_x": 128, "tile_size": 1, "use_method": 1, "time": 0.1333535999059677, "times": [0.1546880006790161, 0.13312000036239624, 0.1313599944114685, 0.1308159977197647, 0.1308480054140091, 0.13046400249004364, 0.12982399761676788, 0.13068799674510956, 0.13091200590133667, 0.1308159977197647], "compile_time": 114.85663999997087, "verification_time": 0, "benchmark_time": 1.898540000183857, "strategy_time": 0, "framework_time": 1.1489019998407457},
"0,128,1,2": {"between_method": 0, "block_size_x": 128, "tile_size": 1, "use_method": 2, "time": 0.13319360017776488, "times": [0.15360000729560852, 0.1337919980287552, 0.131071999669075, 0.12995199859142303, 0.12985600531101227, 0.13065600395202637, 0.13129599392414093, 0.13094399869441986, 0.1305599957704544, 0.13020800054073334], "compile_time": 115.26488799995604, "verification_time": 0, "benchmark_time": 1.890168000045378, "strategy_time": 0, "framework_time": 1.1674370000491763},
"0,128,2,0": {"between_method": 0, "block_size_x": 128, "tile_size": 2, "use_method": 0, "time": 0.0727104015648365, "times": [0.0942080020904541, 0.0719040036201477, 0.0713919997215271, 0.06963200122117996, 0.07056000083684921, 0.06969600170850754, 0.06950400024652481, 0.07081600278615952, 0.06972800195217133, 0.06966400146484375], "compile_time": 113.06917399997474, "verification_time": 0, "benchmark_time": 1.3065000000551663, "strategy_time": 0, "framework_time": 1.175836999891544},
"0,128,2,1": {"between_method": 0, "block_size_x": 128, "tile_size": 2, "use_method": 1, "time": 0.07279360070824623, "times": [0.0942080020904541, 0.07257600128650665, 0.07088000327348709, 0.07001599669456482, 0.06963200122117996, 0.07094399631023407, 0.0697920024394989, 0.06976000219583511, 0.06972800195217133, 0.07039999961853027], "compile_time": 110.66343899983622, "verification_time": 0, "benchmark_time": 1.36194600008821, "strategy_time": 0, "framework_time": 1.1740270001610043},
"0,128,2,2": {"between_method": 0, "block_size_x": 128, "tile_size": 2, "use_method": 2, "time": 0.07258240059018135, "times": [0.09401600062847137, 0.07257600128650665, 0.07135999947786331, 0.06972800195217133, 0.06963200122117996, 0.07017599791288376, 0.06940799951553345, 0.06921599805355072, 0.06982400268316269, 0.06988800317049026], "compile_time": 111.71585700003561, "verification_time": 0, "benchmark_time": 1.3627959999666928, "strategy_time": 0, "framework_time": 1.1998059999314137},
"0,128,4,0": {"between_method": 0, "block_size_x": 128, "tile_size": 4, "use_method": 0, "time": 0.042054399475455286, "times": [0.06326399743556976, 0.04278400167822838, 0.04124800115823746, 0.03968000039458275, 0.03903999924659729, 0.03891199827194214, 0.03891199827194214, 0.03916800022125244, 0.03862399980425835, 0.03891199827194214], "compile_time": 111.75715099989247, "verification_time": 0, "benchmark_time": 0.8263029999397986, "strategy_time": 0, "framework_time": 1.2039900002491777},
"0,128,4,1": {"between_method": 0, "block_size_x": 128, "tile_size": 4, "use_method": 1, "time": 0.04236799962818623, "times": [0.06374400109052658, 0.042847998440265656, 0.03977600112557411, 0.04044799879193306, 0.039135999977588654, 0.039423998445272446, 0.04041599854826927, 0.03920000046491623, 0.03977600112557411, 0.03891199827194214], "compile_time": 110.76675100002831, "verification_time": 0, "benchmark_time": 0.8279910000510426, "strategy_time": 0, "framework_time": 1.2097159997210838},
"0,128,4,2": {"between_method": 0, "block_size_x": 128, "tile_size": 4, "use_method": 2, "time": 0.042950399592518805, "times": [0.06332799792289734, 0.043007999658584595, 0.040608000010252, 0.039744000881910324, 0.04505600035190582, 0.040383998304605484, 0.03936000168323517, 0.03939199820160866, 0.03920000046491623, 0.039423998445272446], "compile_time": 111.90483399991535, "verification_time": 0, "benchmark_time": 0.8363359997929365, "strategy_time": 0, "framework_time": 1.2224740003148327},
"0,128,6,0": {"between_method": 0, "block_size_x": 128, "tile_size": 6, "use_method": 0, "time": 0.03189119976013899, "times": [0.05273599922657013, 0.03276799991726875, 0.030719999223947525, 0.029055999591946602, 0.02876799926161766, 0.028672000393271446, 0.02876799926161766, 0.02879999950528145, 0.0289280004799366, 0.02969600073993206], "compile_time": 115.75050500005091, "verification_time": 0, "benchmark_time": 0.8272289999240456, "strategy_time": 0, "framework_time": 1.2311660000250413},
"0,128,6,1": {"between_method": 0, "block_size_x": 128, "tile_size": 6, "use_method": 1, "time": 0.0322207996621728, "times": [0.05315199866890907, 0.0326399989426136, 0.030719999223947525, 0.03030399978160858, 0.030271999537944794, 0.02908799983561039, 0.029791999608278275, 0.028672000393271446, 0.028672000393271446, 0.028896000236272812], "compile_time": 113.09977799987792, "verification_time": 0, "benchmark_time": 0.8266500001354871, "strategy_time": 0, "framework_time": 1.238606000015352},
"0,128,6,2": {"between_method": 0, "block_size_x": 128, "tile_size": 6, "use_method": 2, "time": 0.03245119992643595, "times": [0.05385600030422211, 0.03248000144958496, 0.030719999223947525, 0.029759999364614487, 0.030079999938607216, 0.029503999277949333, 0.03001599945127964, 0.029664000496268272, 0.029759999364614487, 0.028672000393271446], "compile_time": 115.45032899994112, "verification_time": 0, "benchmark_time": 0.8302290000301582, "strategy_time": 0, "framework_time": 1.2421000001268112},
"0,128,8,0": {"between_method": 0, "block_size_x": 128, "tile_size": 8, "use_method": 0, "time": 0.026934400014579297, "times": [0.04870399832725525, 0.027264000847935677, 0.02595200017094612, 0.02457600086927414, 0.024320000782608986, 0.024351999163627625, 0.02377600036561489, 0.023264000192284584, 0.024224000051617622, 0.022911999374628067], "compile_time": 114.06550299989249, "verification_time": 0, "benchmark_time": 0.8279840001250705, "strategy_time": 0, "framework_time": 1.2574960001074942},
"0,128,8,1": {"between_method": 0, "block_size_x": 128, "tile_size": 8, "use_method": 1, "time": 0.02660800013691187, "times": [0.047648001462221146, 0.026623999699950218, 0.024927999824285507, 0.02348800003528595, 0.023391999304294586, 0.024671999737620354, 0.024288000538945198, 0.02425600029528141, 0.02380800060927868, 0.022975999861955643], "compile_time": 115.94266099996275, "verification_time": 0, "benchmark_time": 0.8289419999982783, "strategy_time": 0, "framework_time": 1.2743279999085644},
"0,128,8,2": {"between_method": 0, "block_size_x": 128, "tile_size": 8, "use_method": 2, "time": 0.02706880010664463, "times": [0.04771199822425842, 0.027712000533938408, 0.025280000641942024, 0.025536000728607178, 0.024480000138282776, 0.0244159996509552, 0.02393599972128868, 0.023264000192284584, 0.024512000381946564, 0.023840000852942467], "compile_time": 113.9361259999987, "verification_time": 0, "benchmark_time": 0.8279179999135522, "strategy_time": 0, "framework_time": 1.2654300001031515},
"0,128,10,0": {"between_method": 0, "block_size_x": 128, "tile_size": 10, "use_method": 0, "time": 0.023868799768388273, "times": [0.04543999955058098, 0.024191999807953835, 0.022431999444961548, 0.022016000002622604, 0.021215999498963356, 0.021056000143289566, 0.020576000213623047, 0.020320000126957893, 0.020479999482631683, 0.020959999412298203], "compile_time": 116.49083799989057, "verification_time": 0, "benchmark_time": 0.8304119999138493, "strategy_time": 0, "framework_time": 1.2860420001743478},
"0,128,10,1": {"between_method": 0, "block_size_x": 128, "tile_size": 10, "use_method": 1, "time": 0.023951999843120575, "times": [0.045152001082897186, 0.024159999564290047, 0.022143999114632607, 0.021344000473618507, 0.020479999482631683, 0.021727999672293663, 0.021663999184966087, 0.02160000056028366, 0.020479999482631683, 0.020767999812960625], "compile_time": 115.19588700002714, "verification_time": 0, "benchmark_time": 0.8288169999559614, "strategy_time": 0, "framework_time": 1.3106580001931434},
"0,128,10,2": {"between_method": 0, "block_size_x": 128, "tile_size": 10, "use_method": 2, "time": 0.02448319997638464, "times": [0.045024000108242035, 0.024447999894618988, 0.022752000018954277, 0.022431999444961548, 0.021888000890612602, 0.02191999927163124, 0.022016000002622604, 0.021023999899625778, 0.021568000316619873, 0.02175999991595745], "compile_time": 116.47550899988346, "verification_time": 0, "benchmark_time": 0.8304479999878822, "strategy_time": 0, "framework_time": 1.3030980001076387},
"0,128,12,0": {"between_method": 0, "block_size_x": 128, "tile_size": 12, "use_method": 0, "time": 0.02200960014015436, "times": [0.04297599941492081, 0.02252800017595291, 0.020479999482631683, 0.01894400082528591, 0.019840000197291374, 0.019936000928282738, 0.019711999222636223, 0.018432000651955605, 0.018624000251293182, 0.018624000251293182], "compile_time": 119.43720499994015, "verification_time": 0, "benchmark_time": 0.8291700000881974, "strategy_time": 0, "framework_time": 1.312056999950073},
"0,128,12,1": {"between_method": 0, "block_size_x": 128, "tile_size": 12, "use_method": 1, "time": 0.022163200378417968, "times": [0.043168000876903534, 0.022943999618291855, 0.020479999482631683, 0.020096000283956528, 0.01894400082528591, 0.01990400068461895, 0.019392000511288643, 0.018432000651955605, 0.018880000337958336, 0.019392000511288643], "compile_time": 117.12245699982304, "verification_time": 0, "benchmark_time": 0.8213169999180536, "strategy_time": 0, "framework_time": 1.326028000221413},
"0,128,12,2": {"between_method": 0, "block_size_x": 128, "tile_size": 12, "use_method": 2, "time": 0.02186879999935627, "times": [0.043007999658584595, 0.022431999444961548, 0.02051199972629547, 0.02022399939596653, 0.01881599985063076, 0.018432000651955605, 0.01894400082528591, 0.018880000337958336, 0.01881599985063076, 0.018624000251293182], "compile_time": 119.2028030000074, "verification_time": 0, "benchmark_time": 0.8251149999978225, "strategy_time": 0, "framework_time": 1.332720000164045},
"0,128,14,0": {"between_method": 0, "block_size_x": 128, "tile_size": 14, "use_method": 0, "time": 0.020787199959158897, "times": [0.042847998440265656, 0.020927999168634415, 0.01990400068461895, 0.018400000408291817, 0.018271999433636665, 0.01820800080895424, 0.017855999991297722, 0.017696000635623932, 0.016831999644637108, 0.01692800037562847], "compile_time": 122.75887200007674, "verification_time": 0, "benchmark_time": 0.830818999929761, "strategy_time": 0, "framework_time": 1.3304670001161867},
"0,128,14,1": {"between_method": 0, "block_size_x": 128, "tile_size": 14, "use_method": 1, "time": 0.020707199722528456, "times": [0.04198399931192398, 0.021536000072956085, 0.018719999119639397, 0.018112000077962875, 0.018015999346971512, 0.017920000478625298, 0.018015999346971512, 0.016896000131964684, 0.018239999189972878, 0.017632000148296356], "compile_time": 119.70897200012587, "verification_time": 0, "benchmark_time": 0.8323249999193649, "strategy_time": 0, "framework_time": 1.3564930000029563},
"0,128,14,2": {"between_method": 0, "block_size_x": 128, "tile_size": 14, "use_method": 2, "time": 0.020643200166523455, "times": [0.04278400167822838, 0.020447999238967896, 0.018432000651955605, 0.01820800080895424, 0.018432000651955605, 0.017311999574303627, 0.017311999574303627, 0.017184000462293625, 0.018239999189972878, 0.018079999834299088], "compile_time": 122.7837849999105, "verification_time": 0, "benchmark_time": 0.8302010000988957, "strategy_time": 0, "framework_time": 1.3595390000773477},
"0,128,16,0": {"between_method": 0, "block_size_x": 128, "tile_size": 16, "use_method": 0, "time": 0.019590399973094464, "times": [0.04095999896526337, 0.020191999152302742, 0.018400000408291817, 0.01744000054895878, 0.01740800030529499, 0.017343999817967415, 0.016575999557971954, 0.016224000602960587, 0.016224000602960587, 0.015135999768972397], "compile_time": 126.44390299988117, "verification_time": 0, "benchmark_time": 0.8305240000936465, "strategy_time": 0, "framework_time": 1.3772370000424417},
"0,128,16,1": {"between_method": 0, "block_size_x": 128, "tile_size": 16, "use_method": 1, "time": 0.020121599920094012, "times": [0.041439998894929886, 0.020287999883294106, 0.018144000321626663, 0.017952000722289085, 0.017855999991297722, 0.017983999103307724, 0.016383999958634377, 0.01679999940097332, 0.017696000635623932, 0.016672000288963318], "compile_time": 122.41491200006749, "verification_time": 0, "benchmark_time": 0.8252729999185249, "strategy_time": 0, "framework_time": 1.3746309998623474},
"0,128,16,2": {"between_method": 0, "block_size_x": 128, "tile_size": 16, "use_method": 2, "time": 0.019177600182592867, "times": [0.03964800015091896, 0.02035200037062168, 0.017184000462293625, 0.01635199971497059, 0.016383999958634377, 0.016383999958634377, 0.016448000445961952, 0.016383999958634377, 0.016383999958634377, 0.016256000846624374], "compile_time": 126.30065899998044, "verification_time": 0, "benchmark_time": 0.8222020001085184, "strategy_time": 0, "framework_time": 1.3860020001175144},
"0,128,18,0": {"between_method": 0, "block_size_x": 128, "tile_size": 18, "use_method": 0, "time": 0.01848640013486147, "times": [0.03907199949026108, 0.01913600042462349, 0.01759999990463257, 0.016256000846624374, 0.016224000602960587, 0.01600000075995922, 0.014720000326633453, 0.015168000012636185, 0.015807999297976494, 0.014879999682307243], "compile_time": 129.72546200012403, "verification_time": 0, "benchmark_time": 0.8256829999027104, "strategy_time": 0, "framework_time": 1.4003730000240466},
