cached_data_used/cachefiles/pnpoly/RTX_3060_laptop.json
{
"device_name": "NVIDIA GeForce RTX 3060 Laptop GPU",
"kernel_name": "cn_pnpoly",
"problem_size": 20000000,
"tune_params_keys": [
"between_method",
"block_size_x",
"tile_size",
"use_method"
],
"tune_params": {
"between_method": [
0,
1,
2,
3
],
"block_size_x": [
32,
64,
96,
128,
160,
192,
224,
256,
288,
320,
352,
384,
416,
448,
480,
512,
544,
576,
608,
640,
672,
704,
736,
768,
800,
832,
864,
896,
928,
960,
992
],
"tile_size": [
1,
2,
4,
6,
8,
10,
12,
14,
16,
18,
20
],
"use_method": [
0,
1,
2
]
},
"cache": {
"0,32,1,0": {"between_method": 0, "block_size_x": 32, "tile_size": 1, "use_method": 0, "time": 132.1463592529297, "times": [132.74905395507812, 132.72781372070312, 132.71347045898438, 132.70220947265625, 132.70425415039062, 132.8046112060547, 131.95468139648438, 131.00425720214844, 131.05661010742188, 131.046630859375], "compile_time": 0.10736799981714285, "verification_time": 0, "benchmark_time": 1322.6053669998237, "strategy_time": 0, "framework_time": 80.92147500042302},
"0,32,1,1": {"between_method": 0, "block_size_x": 32, "tile_size": 1, "use_method": 1, "time": 131.8039077758789, "times": [130.5701141357422, 130.92874145507812, 130.4954833984375, 130.4442901611328, 130.31219482421875, 130.30911254882812, 134.90176391601562, 136.6741180419922, 132.31692504882812, 131.08633422851562], "compile_time": 180.26962600015395, "verification_time": 0, "benchmark_time": 1319.1646099999161, "strategy_time": 0, "framework_time": 1.2738019997868832},
"0,32,1,2": {"between_method": 0, "block_size_x": 32, "tile_size": 1, "use_method": 2, "time": 129.3608383178711, "times": [128.87142944335938, 129.14373779296875, 129.12742614746094, 129.19500732421875, 129.2440643310547, 129.1130828857422, 129.4633026123047, 129.91148376464844, 129.76947021484375, 129.76937866210938], "compile_time": 112.54104199997528, "verification_time": 0, "benchmark_time": 1294.6746490001715, "strategy_time": 0, "framework_time": 1.2436799997885828},
"0,32,2,0": {"between_method": 0, "block_size_x": 32, "tile_size": 2, "use_method": 0, "time": 74.8291519165039, "times": [73.87017822265625, 74.53395080566406, 74.88921356201172, 75.03257751464844, 75.072509765625, 74.8062744140625, 74.79705810546875, 74.8829116821289, 75.10118103027344, 75.3056640625], "compile_time": 178.42861100007212, "verification_time": 0, "benchmark_time": 749.3739110000206, "strategy_time": 0, "framework_time": 1.4759609998691303},
"0,32,2,1": {"between_method": 0, "block_size_x": 32, "tile_size": 2, "use_method": 1, "time": 73.94475021362305, "times": [72.92928314208984, 74.0423355102539, 74.19699096679688, 74.0278091430664, 74.0157470703125, 74.11711883544922, 74.0679702758789, 74.0218276977539, 74.00755310058594, 74.02086639404297], "compile_time": 175.97172600017075, "verification_time": 0, "benchmark_time": 740.5394419999993, "strategy_time": 0, "framework_time": 1.4989239996339165},
"0,32,2,2": {"between_method": 0, "block_size_x": 32, "tile_size": 2, "use_method": 2, "time": 74.1948226928711, "times": [73.16566467285156, 73.99628448486328, 74.20211029052734, 74.27891540527344, 74.24307250976562, 74.40892791748047, 74.33113861083984, 74.49088287353516, 74.48985290527344, 74.34137725830078], "compile_time": 176.4982270001383, "verification_time": 0, "benchmark_time": 743.2065949999469, "strategy_time": 0, "framework_time": 1.5801479999026924},
"0,32,4,0": {"between_method": 0, "block_size_x": 32, "tile_size": 4, "use_method": 0, "time": 48.81876754760742, "times": [47.86054229736328, 48.89484786987305, 48.891902923583984, 48.891807556152344, 48.8908805847168, 48.908287048339844, 48.8908805847168, 48.88566589355469, 48.9218864440918, 49.15097427368164], "compile_time": 177.84480900013477, "verification_time": 0, "benchmark_time": 489.0030469998692, "strategy_time": 0, "framework_time": 1.4077569999244588},
"0,32,4,1": {"between_method": 0, "block_size_x": 32, "tile_size": 4, "use_method": 1, "time": 48.7393440246582, "times": [46.94425582885742, 48.89168167114258, 48.80668640136719, 48.92979049682617, 49.01375961303711, 48.916481018066406, 48.9615364074707, 48.89891052246094, 49.017601013183594, 49.01273727416992], "compile_time": 169.68951200010451, "verification_time": 0, "benchmark_time": 488.5119020000275, "strategy_time": 0, "framework_time": 0.6566089998614189},
"0,32,4,2": {"between_method": 0, "block_size_x": 32, "tile_size": 4, "use_method": 2, "time": 47.934135055541994, "times": [46.24998474121094, 48.13017654418945, 48.068321228027344, 48.165889739990234, 48.36454391479492, 48.08697509765625, 48.0819206237793, 48.07270431518555, 48.06553649902344, 48.0552978515625], "compile_time": 178.433072000189, "verification_time": 0, "benchmark_time": 480.3760859999784, "strategy_time": 0, "framework_time": 1.7023149998749432},
"0,32,6,0": {"between_method": 0, "block_size_x": 32, "tile_size": 6, "use_method": 0, "time": 40.470515441894534, "times": [38.979583740234375, 40.47974395751953, 40.66739273071289, 40.66304016113281, 40.66582489013672, 40.64051055908203, 40.50431823730469, 40.65971374511719, 40.66294479370117, 40.782081604003906], "compile_time": 183.0801190001239, "verification_time": 0, "benchmark_time": 405.67308999993656, "strategy_time": 0, "framework_time": 1.6308419999404578},
"0,32,6,1": {"between_method": 0, "block_size_x": 32, "tile_size": 6, "use_method": 1, "time": 39.68842887878418, "times": [37.508094787597656, 39.49363327026367, 39.92268753051758, 39.98419189453125, 40.07936096191406, 40.1102409362793, 39.942142486572266, 39.93619155883789, 39.93907165527344, 39.96867370605469], "compile_time": 106.5637849999348, "verification_time": 0, "benchmark_time": 397.78743500005476, "strategy_time": 0, "framework_time": 1.4889280000716099},
"0,32,6,2": {"between_method": 0, "block_size_x": 32, "tile_size": 6, "use_method": 2, "time": 39.266758346557616, "times": [37.42185592651367, 39.14131164550781, 39.47622299194336, 39.49443054199219, 39.49568176269531, 39.58067321777344, 39.47808074951172, 39.574462890625, 39.50614547729492, 39.49871826171875], "compile_time": 182.59970999997677, "verification_time": 0, "benchmark_time": 393.55473800014806, "strategy_time": 0, "framework_time": 1.6077709999535728},
"0,32,8,0": {"between_method": 0, "block_size_x": 32, "tile_size": 8, "use_method": 0, "time": 39.49170265197754, "times": [38.063392639160156, 39.51833724975586, 39.67990493774414, 39.66147232055664, 39.764991760253906, 39.68307113647461, 39.64313507080078, 39.63385772705078, 39.632896423339844, 39.63596725463867], "compile_time": 103.91647599999487, "verification_time": 0, "benchmark_time": 395.8653069998945, "strategy_time": 0, "framework_time": 0.5466869999963819},
"0,32,8,1": {"between_method": 0, "block_size_x": 32, "tile_size": 8, "use_method": 1, "time": 36.431901168823245, "times": [34.01932907104492, 36.752384185791016, 36.67660903930664, 36.681888580322266, 36.67350387573242, 36.676414489746094, 36.67884826660156, 36.674560546875, 36.67660903930664, 36.80886459350586], "compile_time": 112.02743599983478, "verification_time": 0, "benchmark_time": 365.130143999977, "strategy_time": 0, "framework_time": 1.5104290002909693},
"0,32,8,2": {"between_method": 0, "block_size_x": 32, "tile_size": 8, "use_method": 2, "time": 36.07558975219727, "times": [34.15244674682617, 36.37964630126953, 36.232479095458984, 36.29568099975586, 36.26393508911133, 36.26700973510742, 36.27827072143555, 36.29545593261719, 36.27391815185547, 36.317054748535156], "compile_time": 112.2449649999453, "verification_time": 0, "benchmark_time": 361.7666580000787, "strategy_time": 0, "framework_time": 1.5745620000870986},
"0,32,10,0": {"between_method": 0, "block_size_x": 32, "tile_size": 10, "use_method": 0, "time": 37.25462760925293, "times": [35.84716796875, 37.292030334472656, 37.489376068115234, 37.43155288696289, 37.48012924194336, 37.42611312866211, 37.412864685058594, 37.411041259765625, 37.41798400878906, 37.338016510009766], "compile_time": 113.63766299996314, "verification_time": 0, "benchmark_time": 373.34398999996665, "strategy_time": 0, "framework_time": 1.2455780001801031},
"0,32,10,1": {"between_method": 0, "block_size_x": 32, "tile_size": 10, "use_method": 1, "time": 37.318594741821286, "times": [34.925567626953125, 37.07289505004883, 37.531551361083984, 37.68310546875, 37.67808151245117, 37.63999938964844, 37.64940643310547, 37.66563034057617, 37.67193603515625, 37.66777420043945], "compile_time": 161.59845799984396, "verification_time": 0, "benchmark_time": 374.02502200006893, "strategy_time": 0, "framework_time": 0.7503599999836297},
"0,32,10,2": {"between_method": 0, "block_size_x": 32, "tile_size": 10, "use_method": 2, "time": 34.059984588623045, "times": [32.48640060424805, 33.83184051513672, 34.34988784790039, 34.288352966308594, 34.28044891357422, 34.27532958984375, 34.27107238769531, 34.2740478515625, 34.26918411254883, 34.27328109741211], "compile_time": 185.3101389999665, "verification_time": 0, "benchmark_time": 341.5327520001483, "strategy_time": 0, "framework_time": 1.8408769997222407},
"0,32,12,0": {"between_method": 0, "block_size_x": 32, "tile_size": 12, "use_method": 0, "time": 36.01517181396484, "times": [34.85456085205078, 36.013057708740234, 36.1267204284668, 36.08678436279297, 36.180992126464844, 36.23936080932617, 36.180992126464844, 36.15641784667969, 36.157440185546875, 36.155391693115234], "compile_time": 181.34509099991192, "verification_time": 0, "benchmark_time": 361.183586000152, "strategy_time": 0, "framework_time": 0.7955070000207343},
"0,32,12,1": {"between_method": 0, "block_size_x": 32, "tile_size": 12, "use_method": 1, "time": 35.47062454223633, "times": [32.758785247802734, 35.87571334838867, 35.87071990966797, 35.57984161376953, 35.58399963378906, 35.72633743286133, 35.87891387939453, 35.87481689453125, 35.81951904296875, 35.73759841918945], "compile_time": 184.1464089998226, "verification_time": 0, "benchmark_time": 355.61239799994837, "strategy_time": 0, "framework_time": 1.9802010003786563},
"0,32,12,2": {"between_method": 0, "block_size_x": 32, "tile_size": 12, "use_method": 2, "time": 32.16844177246094, "times": [30.648319244384766, 32.40140914916992, 32.28364944458008, 32.339969635009766, 32.33875274658203, 32.333824157714844, 32.33484649658203, 32.33497619628906, 32.33484649658203, 32.333824157714844], "compile_time": 180.9714650000842, "verification_time": 0, "benchmark_time": 322.6443510000081, "strategy_time": 0, "framework_time": 1.4736219998212619},
"0,32,14,0": {"between_method": 0, "block_size_x": 32, "tile_size": 14, "use_method": 0, "time": 35.467145919799805, "times": [34.553855895996094, 35.67180633544922, 35.553279876708984, 35.54508972167969, 35.54716873168945, 35.566593170166016, 35.553279876708984, 35.551231384277344, 35.54508972167969, 35.58406448364258], "compile_time": 190.79471700001704, "verification_time": 0, "benchmark_time": 355.63805000015236, "strategy_time": 0, "framework_time": 2.128406999872823},
"0,32,14,1": {"between_method": 0, "block_size_x": 32, "tile_size": 14, "use_method": 1, "time": 34.75646057128906, "times": [32.13715362548828, 34.68083190917969, 35.18463897705078, 35.1486701965332, 35.0832633972168, 35.07174301147461, 35.06585693359375, 35.06380844116211, 35.062782287597656, 35.06585693359375], "compile_time": 181.37523599989436, "verification_time": 0, "benchmark_time": 348.55249000020194, "strategy_time": 0, "framework_time": 2.207357999850501},
"0,32,14,2": {"between_method": 0, "block_size_x": 32, "tile_size": 14, "use_method": 2, "time": 31.882370376586913, "times": [30.59916877746582, 31.5361270904541, 32.08287811279297, 32.01747131347656, 32.02473449707031, 32.02867126464844, 32.0340461730957, 32.18431854248047, 32.158687591552734, 32.15760040283203], "compile_time": 181.83006999993268, "verification_time": 0, "benchmark_time": 319.8102349999772, "strategy_time": 0, "framework_time": 2.231371000107174},
"0,32,16,0": {"between_method": 0, "block_size_x": 32, "tile_size": 16, "use_method": 0, "time": 35.73552703857422, "times": [35.204097747802734, 35.68617630004883, 35.835838317871094, 35.822593688964844, 35.80307388305664, 35.80313491821289, 35.8040657043457, 35.799041748046875, 35.79801559448242, 35.799232482910156], "compile_time": 194.90144099995632, "verification_time": 0, "benchmark_time": 358.31421300008515, "strategy_time": 0, "framework_time": 2.281863999996858},
"0,32,16,1": {"between_method": 0, "block_size_x": 32, "tile_size": 16, "use_method": 1, "time": 34.97465934753418, "times": [32.17695999145508, 34.9378547668457, 35.40591812133789, 35.28704071044922, 35.370880126953125, 35.20512008666992, 35.34540939331055, 35.27561569213867, 35.371009826660156, 35.370784759521484], "compile_time": 190.07823200013263, "verification_time": 0, "benchmark_time": 350.70790700001453, "strategy_time": 0, "framework_time": 2.2618929997406667},
"0,32,16,2": {"between_method": 0, "block_size_x": 32, "tile_size": 16, "use_method": 2, "time": 32.544156837463376, "times": [31.471616744995117, 32.57465744018555, 32.701568603515625, 32.6376953125, 32.675743103027344, 32.6748161315918, 32.67705535888672, 32.67891311645508, 32.67366409301758, 32.675838470458984], "compile_time": 196.22424700014562, "verification_time": 0, "benchmark_time": 326.44951199995376, "strategy_time": 0, "framework_time": 2.225514999963707},
"0,32,18,0": {"between_method": 0, "block_size_x": 32, "tile_size": 18, "use_method": 0, "time": 27.98169937133789, "times": [27.025407791137695, 27.676511764526367, 28.179296493530273, 28.123008728027344, 28.121248245239258, 28.11903953552246, 28.1210880279541, 28.211200714111328, 28.120128631591797, 28.12006378173828], "compile_time": 198.20270599984724, "verification_time": 0, "benchmark_time": 280.7978670000466, "strategy_time": 0, "framework_time": 2.2831350001979445},
"0,32,18,1": {"between_method": 0, "block_size_x": 32, "tile_size": 18, "use_method": 1, "time": 35.451270294189456, "times": [32.77926254272461, 35.19977569580078, 35.86867141723633, 35.780609130859375, 35.944576263427734, 35.89324951171875, 35.70380783081055, 35.78163146972656, 35.77958297729492, 35.78153610229492], "compile_time": 194.35510499988595, "verification_time": 0, "benchmark_time": 355.42690000011135, "strategy_time": 0, "framework_time": 2.3710919999757607},
"0,32,18,2": {"between_method": 0, "block_size_x": 32, "tile_size": 18, "use_method": 2, "time": 32.56403484344482, "times": [31.5545597076416, 32.289791107177734, 32.854270935058594, 32.7883186340332, 32.69228744506836, 32.6932487487793, 32.6932487487793, 32.691200256347656, 32.692222595214844, 32.691200256347656], "compile_time": 200.597635999884, "verification_time": 0, "benchmark_time": 326.53711800003293, "strategy_time": 0, "framework_time": 2.385070000173073},
"0,32,20,0": {"between_method": 0, "block_size_x": 32, "tile_size": 20, "use_method": 0, "time": 27.150883293151857, "times": [26.13862419128418, 27.08684730529785, 27.274240493774414, 27.222015380859375, 27.29587173461914, 27.26723289489746, 27.3305606842041, 27.296768188476562, 27.278400421142578, 27.31827163696289], "compile_time": 202.8957120000996, "verification_time": 0, "benchmark_time": 272.46654800001124, "strategy_time": 0, "framework_time": 2.4613779999071994},
"0,32,20,1": {"between_method": 0, "block_size_x": 32, "tile_size": 20, "use_method": 1, "time": 35.65443458557129, "times": [32.886783599853516, 35.560447692871094, 36.03337478637695, 35.88198471069336, 36.15129470825195, 36.148223876953125, 36.14924621582031, 35.924991607666016, 35.8287353515625, 35.97926330566406], "compile_time": 196.65767400010736, "verification_time": 0, "benchmark_time": 357.485687999997, "strategy_time": 0, "framework_time": 2.4643419997119054},
"0,32,20,2": {"between_method": 0, "block_size_x": 32, "tile_size": 20, "use_method": 2, "time": 32.69001579284668, "times": [31.646591186523438, 32.76483154296875, 32.78428649902344, 32.78540802001953, 32.785152435302734, 32.78847885131836, 32.78643035888672, 32.82432174682617, 32.79872131347656, 32.935935974121094], "compile_time": 203.3542749998105, "verification_time": 0, "benchmark_time": 327.92931399990266, "strategy_time": 0, "framework_time": 2.526800000168805},
"0,64,1,0": {"between_method": 0, "block_size_x": 64, "tile_size": 1, "use_method": 0, "time": 107.30504608154297, "times": [104.29235076904297, 106.43968200683594, 106.42329406738281, 106.36595153808594, 105.9420166015625, 105.93689727783203, 105.94406127929688, 106.9455337524414, 115.14777374267578, 109.61289978027344], "compile_time": 170.96661599998697, "verification_time": 0, "benchmark_time": 1074.034655000105, "strategy_time": 0, "framework_time": 2.5406919999113597},
"0,64,1,1": {"between_method": 0, "block_size_x": 64, "tile_size": 1, "use_method": 1, "time": 110.8364158630371, "times": [107.15132904052734, 109.8249282836914, 109.8055648803711, 109.80044555664062, 109.80249786376953, 109.80147552490234, 109.80044555664062, 113.60972595214844, 117.22035217285156, 111.54739379882812], "compile_time": 178.9304540000103, "verification_time": 0, "benchmark_time": 1109.309297999971, "strategy_time": 0, "framework_time": 2.5127559999873483},
"0,64,1,2": {"between_method": 0, "block_size_x": 64, "tile_size": 1, "use_method": 2, "time": 104.83681564331054, "times": [102.33523559570312, 104.22054290771484, 104.17964935302734, 103.73017883300781, 103.73011016845703, 103.72796630859375, 103.72898864746094, 103.81311798095703, 111.41104125976562, 107.49132537841797], "compile_time": 178.947289000007, "verification_time": 0, "benchmark_time": 1049.2895410000074, "strategy_time": 0, "framework_time": 2.5464889999966545},
"0,64,2,0": {"between_method": 0, "block_size_x": 64, "tile_size": 2, "use_method": 0, "time": 66.03763275146484, "times": [63.425537109375, 66.40640258789062, 66.3552017211914, 66.22908782958984, 66.19136047363281, 66.34598541259766, 66.37567901611328, 66.34896087646484, 66.34803009033203, 66.35008239746094], "compile_time": 176.31924300007995, "verification_time": 0, "benchmark_time": 661.2461500001245, "strategy_time": 0, "framework_time": 2.6114039997082727},
"0,64,2,1": {"between_method": 0, "block_size_x": 64, "tile_size": 2, "use_method": 1, "time": 65.08255577087402, "times": [61.811710357666016, 65.75411224365234, 65.61894226074219, 65.59846496582031, 65.56979370117188, 65.29535675048828, 65.2943344116211, 65.2943344116211, 65.29417419433594, 65.2943344116211], "compile_time": 174.45899800009101, "verification_time": 0, "benchmark_time": 651.695552000092, "strategy_time": 0, "framework_time": 2.5956209999549174},
"0,64,2,2": {"between_method": 0, "block_size_x": 64, "tile_size": 2, "use_method": 2, "time": 64.4035514831543, "times": [62.09648132324219, 64.49868774414062, 64.69939422607422, 64.69631958007812, 64.6983642578125, 64.69631958007812, 64.6941146850586, 64.72089385986328, 64.66969299316406, 64.56524658203125], "compile_time": 176.05291800009581, "verification_time": 0, "benchmark_time": 645.0083390000145, "strategy_time": 0, "framework_time": 2.705018999904496},
"0,64,4,0": {"between_method": 0, "block_size_x": 64, "tile_size": 4, "use_method": 0, "time": 44.50294075012207, "times": [41.768959045410156, 44.89625549316406, 44.669952392578125, 44.82457733154297, 44.825599670410156, 44.83174514770508, 44.73952102661133, 44.823551177978516, 44.82476806640625, 44.82447814941406], "compile_time": 178.06258900009198, "verification_time": 0, "benchmark_time": 446.00697300006686, "strategy_time": 0, "framework_time": 2.706435999925816},
"0,64,4,1": {"between_method": 0, "block_size_x": 64, "tile_size": 4, "use_method": 1, "time": 43.64102325439453, "times": [40.190975189208984, 43.86406326293945, 44.04742431640625, 44.04524612426758, 44.04326248168945, 44.04323196411133, 44.045310974121094, 44.04342269897461, 44.04528045654297, 44.042015075683594], "compile_time": 175.51683700003196, "verification_time": 0, "benchmark_time": 437.3010300000715, "strategy_time": 0, "framework_time": 2.790089999734846},
"0,64,4,2": {"between_method": 0, "block_size_x": 64, "tile_size": 4, "use_method": 2, "time": 43.879411697387695, "times": [40.6888313293457, 44.00230407714844, 44.1446418762207, 44.08524703979492, 44.269569396972656, 44.37196731567383, 44.368831634521484, 44.24601745605469, 44.34944152832031, 44.26726531982422], "compile_time": 175.95517300014762, "verification_time": 0, "benchmark_time": 439.8482569999942, "strategy_time": 0, "framework_time": 2.8207039999870176},
"0,64,6,0": {"between_method": 0, "block_size_x": 64, "tile_size": 6, "use_method": 0, "time": 38.215864944458005, "times": [35.943424224853516, 38.551422119140625, 38.41843032836914, 38.4450569152832, 38.46553421020508, 38.46451187133789, 38.4705924987793, 38.46758270263672, 38.46553421020508, 38.46656036376953], "compile_time": 181.44881600005647, "verification_time": 0, "benchmark_time": 382.9601659999753, "strategy_time": 0, "framework_time": 2.812063999954262},
"0,64,6,1": {"between_method": 0, "block_size_x": 64, "tile_size": 6, "use_method": 1, "time": 36.90454444885254, "times": [33.61689758300781, 37.07487869262695, 37.39955139160156, 37.32582473754883, 37.412864685058594, 37.301246643066406, 37.2592658996582, 37.219329833984375, 37.217281341552734, 37.21830368041992], "compile_time": 178.92866800002594, "verification_time": 0, "benchmark_time": 369.90056900003765, "strategy_time": 0, "framework_time": 2.9314959999737766},
"0,64,6,2": {"between_method": 0, "block_size_x": 64, "tile_size": 6, "use_method": 2, "time": 37.13411178588867, "times": [34.530303955078125, 37.26006317138672, 37.372032165527344, 37.343040466308594, 37.46611022949219, 37.46815872192383, 37.46713638305664, 37.466209411621094, 37.46713638305664, 37.50092697143555], "compile_time": 181.1438059999091, "verification_time": 0, "benchmark_time": 372.2704940000767, "strategy_time": 0, "framework_time": 2.8590609999810113},
"0,64,8,0": {"between_method": 0, "block_size_x": 64, "tile_size": 8, "use_method": 0, "time": 37.6033821105957, "times": [35.63417434692383, 37.24595260620117, 37.89811325073242, 37.894142150878906, 37.89708709716797, 37.89507293701172, 37.894142150878906, 37.89094543457031, 37.89107131958008, 37.89311981201172], "compile_time": 178.85358800003814, "verification_time": 0, "benchmark_time": 376.987950000057, "strategy_time": 0, "framework_time": 2.9664739997770084},
"0,64,8,1": {"between_method": 0, "block_size_x": 64, "tile_size": 8, "use_method": 1, "time": 34.65757160186767, "times": [31.586111068725586, 34.272254943847656, 35.12422561645508, 35.09862518310547, 35.09657669067383, 35.009376525878906, 35.09779357910156, 35.09862518310547, 35.09657669067383, 35.095550537109375], "compile_time": 183.85402600006273, "verification_time": 0, "benchmark_time": 347.4572789998547, "strategy_time": 0, "framework_time": 2.9018279999490915},
"0,64,8,2": {"between_method": 0, "block_size_x": 64, "tile_size": 8, "use_method": 2, "time": 34.39675235748291, "times": [31.974336624145508, 34.534400939941406, 34.698238372802734, 34.599937438964844, 34.69696044921875, 34.69401550292969, 34.693119049072266, 34.69232177734375, 34.69209671020508, 34.69209671020508], "compile_time": 178.01081200013869, "verification_time": 0, "benchmark_time": 344.90803199992115, "strategy_time": 0, "framework_time": 3.027642000006381},
"0,64,10,0": {"between_method": 0, "block_size_x": 64, "tile_size": 10, "use_method": 0, "time": 36.50941505432129, "times": [34.688961029052734, 36.428897857666016, 36.70732879638672, 36.63792037963867, 36.75852966308594, 36.75852966308594, 36.76057434082031, 36.761600494384766, 36.796417236328125, 36.79539108276367], "compile_time": 182.476878999978, "verification_time": 0, "benchmark_time": 366.11117500001455, "strategy_time": 0, "framework_time": 2.9947609998544067},
"0,64,10,1": {"between_method": 0, "block_size_x": 64, "tile_size": 10, "use_method": 1, "time": 36.036150741577146, "times": [33.28307342529297, 36.36735916137695, 36.34688186645508, 36.34067153930664, 36.338497161865234, 36.33769607543945, 36.33766555786133, 36.33638381958008, 36.336639404296875, 36.336639404296875], "compile_time": 182.3144489999322, "verification_time": 0, "benchmark_time": 361.3178519999565, "strategy_time": 0, "framework_time": 2.9909360000601737},
"0,64,10,2": {"between_method": 0, "block_size_x": 64, "tile_size": 10, "use_method": 2, "time": 32.53294715881348, "times": [30.40563201904297, 32.166656494140625, 32.91843032836914, 32.903167724609375, 32.82227325439453, 32.82115173339844, 32.82124710083008, 32.82534408569336, 32.82227325439453, 32.82329559326172], "compile_time": 183.04049500011388, "verification_time": 0, "benchmark_time": 326.1518110000452, "strategy_time": 0, "framework_time": 3.0911849996755336},
"0,64,12,0": {"between_method": 0, "block_size_x": 64, "tile_size": 12, "use_method": 0, "time": 35.45996170043945, "times": [33.91680145263672, 35.5491828918457, 35.63315200805664, 35.546112060546875, 35.534847259521484, 35.68435287475586, 35.68230438232422, 35.68537521362305, 35.683135986328125, 35.68435287475586], "compile_time": 175.25550700020176, "verification_time": 0, "benchmark_time": 355.48328699997, "strategy_time": 0, "framework_time": 3.098466999745142},
"0,64,12,1": {"between_method": 0, "block_size_x": 64, "tile_size": 12, "use_method": 1, "time": 34.540380859375, "times": [31.291168212890625, 34.76582336425781, 34.80268859863281, 34.80767822265625, 34.956031799316406, 34.9562873840332, 34.9562873840332, 34.955265045166016, 34.955265045166016, 34.957313537597656], "compile_time": 183.89759399997274, "verification_time": 0, "benchmark_time": 346.29237300009663, "strategy_time": 0, "framework_time": 3.1239829997957713},
"0,64,12,2": {"between_method": 0, "block_size_x": 64, "tile_size": 12, "use_method": 2, "time": 31.521052360534668, "times": [29.68160057067871, 31.070207595825195, 31.877119064331055, 31.870975494384766, 31.80031967163086, 31.79929542541504, 31.79827117919922, 31.800159454345703, 31.80134391784668, 31.711231231689453], "compile_time": 185.4457800000091, "verification_time": 0, "benchmark_time": 316.1250129999189, "strategy_time": 0, "framework_time": 3.1846000001678476},
"0,64,14,0": {"between_method": 0, "block_size_x": 64, "tile_size": 14, "use_method": 0, "time": 35.32122230529785, "times": [34.149375915527344, 35.359745025634766, 35.368961334228516, 35.41904067993164, 35.44575881958008, 35.47331237792969, 35.483646392822266, 35.56351852416992, 35.5153923034668, 35.4334716796875], "compile_time": 190.5244380000113, "verification_time": 0, "benchmark_time": 354.0442549999625, "strategy_time": 0, "framework_time": 3.141478000088682},
"0,64,14,1": {"between_method": 0, "block_size_x": 64, "tile_size": 14, "use_method": 1, "time": 34.43412189483642, "times": [31.884000778198242, 34.20979309082031, 34.92863845825195, 34.89689636230469, 34.763648986816406, 34.73196792602539, 34.733055114746094, 34.729984283447266, 34.731201171875, 34.732032775878906], "compile_time": 186.98591700012912, "verification_time": 0, "benchmark_time": 345.3232309998384, "strategy_time": 0, "framework_time": 3.2101809999858233},
"0,64,14,2": {"between_method": 0, "block_size_x": 64, "tile_size": 14, "use_method": 2, "time": 31.602249717712404, "times": [30.13737678527832, 31.141855239868164, 31.843040466308594, 31.845375061035156, 31.841279983520508, 31.84435272216797, 31.842304229736328, 31.84435272216797, 31.841279983520508, 31.841279983520508], "compile_time": 191.20594300011362, "verification_time": 0, "benchmark_time": 317.01010400001906, "strategy_time": 0, "framework_time": 3.2475450000220007},
"0,64,16,0": {"between_method": 0, "block_size_x": 64, "tile_size": 16, "use_method": 0, "time": 35.394233322143556, "times": [34.41561508178711, 35.40480041503906, 35.55219268798828, 35.5676155090332, 35.50092697143555, 35.50105667114258, 35.500030517578125, 35.50105667114258, 35.500030517578125, 35.49900817871094], "compile_time": 186.3960529999531, "verification_time": 0, "benchmark_time": 354.7136499998942, "strategy_time": 0, "framework_time": 3.2802510002056806},
"0,64,16,1": {"between_method": 0, "block_size_x": 64, "tile_size": 16, "use_method": 1, "time": 34.633901023864745, "times": [31.936384201049805, 34.99599838256836, 34.99513626098633, 34.94303894042969, 34.94297790527344, 34.9409294128418, 34.941951751708984, 34.9409294128418, 34.9224967956543, 34.77916717529297], "compile_time": 188.99786499991933, "verification_time": 0, "benchmark_time": 347.2696789999645, "strategy_time": 0, "framework_time": 3.3353840001382196},
"0,64,16,2": {"between_method": 0, "block_size_x": 64, "tile_size": 16, "use_method": 2, "time": 32.060422325134276, "times": [30.713823318481445, 31.79520034790039, 32.17203140258789, 32.173057556152344, 32.17407989501953, 32.2979850769043, 32.324607849121094, 32.319488525390625, 32.315486907958984, 32.31846237182617], "compile_time": 193.88191000007282, "verification_time": 0, "benchmark_time": 321.34898799995426, "strategy_time": 0, "framework_time": 3.348650999896563},
"0,64,18,0": {"between_method": 0, "block_size_x": 64, "tile_size": 18, "use_method": 0, "time": 27.77411518096924, "times": [26.608640670776367, 27.249664306640625, 27.93471908569336, 27.99616050720215, 27.94495964050293, 28.04819107055664, 27.994112014770508, 27.93267250061035, 28.057632446289062, 27.97439956665039], "compile_time": 199.02385000000322, "verification_time": 0, "benchmark_time": 278.6616270000195, "strategy_time": 0, "framework_time": 3.37629199998446},
"0,64,18,1": {"between_method": 0, "block_size_x": 64, "tile_size": 18, "use_method": 1, "time": 35.05138626098633, "times": [32.529151916503906, 34.995201110839844, 35.43648147583008, 35.364864349365234, 35.26982498168945, 35.291168212890625, 35.4354248046875, 35.43244934082031, 35.433345794677734, 35.325950622558594], "compile_time": 193.7131600000157, "verification_time": 0, "benchmark_time": 351.48560900006487, "strategy_time": 0, "framework_time": 3.40030300003491},
"0,64,18,2": {"between_method": 0, "block_size_x": 64, "tile_size": 18, "use_method": 2, "time": 32.17331199645996, "times": [30.920703887939453, 32.36454391479492, 32.33670425415039, 32.244510650634766, 32.24166488647461, 32.24166488647461, 32.24473571777344, 32.36646270751953, 32.38608169555664, 32.38604736328125], "compile_time": 199.31043899987344, "verification_time": 0, "benchmark_time": 322.58549099992706, "strategy_time": 0, "framework_time": 3.4283460001915955},
"0,64,20,0": {"between_method": 0, "block_size_x": 64, "tile_size": 20, "use_method": 0, "time": 26.992921829223633, "times": [25.833280563354492, 26.409984588623047, 27.019392013549805, 27.253664016723633, 27.189407348632812, 27.14214324951172, 27.322368621826172, 27.247392654418945, 27.298816680908203, 27.2127685546875], "compile_time": 203.61721800009036, "verification_time": 0, "benchmark_time": 270.86549599994214, "strategy_time": 0, "framework_time": 3.4951769998770033},
"0,64,20,1": {"between_method": 0, "block_size_x": 64, "tile_size": 20, "use_method": 1, "time": 35.7659553527832, "times": [33.335296630859375, 36.013057708740234, 36.03148651123047, 36.1420783996582, 36.01612854003906, 35.98643112182617, 35.989505767822266, 35.985408782958984, 36.146175384521484, 36.01398468017578], "compile_time": 196.9581329999528, "verification_time": 0, "benchmark_time": 358.63827299999684, "strategy_time": 0, "framework_time": 3.4920040000088193},
"0,64,20,2": {"between_method": 0, "block_size_x": 64, "tile_size": 20, "use_method": 2, "time": 32.27633571624756, "times": [31.133760452270508, 32.2242546081543, 32.498687744140625, 32.47411346435547, 32.40345764160156, 32.4031982421875, 32.40550231933594, 32.40940856933594, 32.40547180175781, 32.40550231933594], "compile_time": 201.5939000000344, "verification_time": 0, "benchmark_time": 323.74394999988, "strategy_time": 0, "framework_time": 3.54299099990385},
"0,96,1,0": {"between_method": 0, "block_size_x": 96, "tile_size": 1, "use_method": 0, "time": 107.52932891845703, "times": [103.94204711914062, 106.74671936035156, 106.70470428466797, 106.6935043334961, 106.70480346679688, 106.6012191772461, 106.70387268066406, 107.37561798095703, 114.63782501220703, 109.18297576904297], "compile_time": 179.2162339997958, "verification_time": 0, "benchmark_time": 1076.264732000027, "strategy_time": 0, "framework_time": 3.5266750001028413},
"0,96,1,1": {"between_method": 0, "block_size_x": 96, "tile_size": 1, "use_method": 1, "time": 113.24712677001953, "times": [109.25055694580078, 112.27734375, 112.09318542480469, 112.19558715820312, 112.42495727539062, 112.11571502685547, 112.37580871582031, 117.92179107666016, 118.50240325927734, 113.31391906738281], "compile_time": 166.76802200004204, "verification_time": 0, "benchmark_time": 1133.3920629999739, "strategy_time": 0, "framework_time": 3.524260999938633},
"0,96,1,2": {"between_method": 0, "block_size_x": 96, "tile_size": 1, "use_method": 2, "time": 105.8605125427246, "times": [103.3359375, 104.75318145751953, 104.75110626220703, 104.76441955566406, 104.75827026367188, 104.73983764648438, 104.79513549804688, 104.9793930053711, 113.09270477294922, 108.63513946533203], "compile_time": 178.66655400007403, "verification_time": 0, "benchmark_time": 1059.560018999946, "strategy_time": 0, "framework_time": 3.6246929998924315},
"0,96,2,0": {"between_method": 0, "block_size_x": 96, "tile_size": 2, "use_method": 0, "time": 65.72480583190918, "times": [63.278079986572266, 66.1739501953125, 65.93843078613281, 65.93331146240234, 65.93321228027344, 65.9639663696289, 65.94048309326172, 65.93433380126953, 65.93011474609375, 66.22217559814453], "compile_time": 175.684763000163, "verification_time": 0, "benchmark_time": 658.2508189999317, "strategy_time": 0, "framework_time": 3.606132999948386},
"0,96,2,1": {"between_method": 0, "block_size_x": 96, "tile_size": 2, "use_method": 1, "time": 65.03350868225098, "times": [61.30790328979492, 65.65376281738281, 65.48480224609375, 65.48992156982422, 65.2779541015625, 65.27792358398438, 65.2748794555664, 65.5656967163086, 65.47955322265625, 65.52268981933594], "compile_time": 174.82099700009712, "verification_time": 0, "benchmark_time": 651.356781000004, "strategy_time": 0, "framework_time": 3.546978999793282},
"0,96,2,2": {"between_method": 0, "block_size_x": 96, "tile_size": 2, "use_method": 2, "time": 64.21928749084472, "times": [61.6478385925293, 64.51712036132812, 64.50688171386719, 64.50176239013672, 64.50688171386719, 64.5027847290039, 64.50367736816406, 64.49664306640625, 64.50355529785156, 64.50572967529297], "compile_time": 175.65998600002786, "verification_time": 0, "benchmark_time": 643.1329759998334, "strategy_time": 0, "framework_time": 3.6859209999420273},
"0,96,4,0": {"between_method": 0, "block_size_x": 96, "tile_size": 4, "use_method": 0, "time": 44.51965179443359, "times": [41.882625579833984, 44.881919860839844, 44.7704963684082, 44.74467086791992, 44.76620864868164, 44.76825714111328, 44.77030563354492, 44.76825714111328, 44.97407913208008, 44.86969757080078], "compile_time": 165.1949990000503, "verification_time": 0, "benchmark_time": 446.13143500009755, "strategy_time": 0, "framework_time": 3.6910629999056255},
"0,96,4,1": {"between_method": 0, "block_size_x": 96, "tile_size": 4, "use_method": 1, "time": 43.81073913574219, "times": [40.47769546508789, 44.09446334838867, 44.05043029785156, 44.20608139038086, 44.214271545410156, 44.21343994140625, 44.21244812011719, 44.21324920654297, 44.212223052978516, 44.21308898925781], "compile_time": 174.30751500000952, "verification_time": 0, "benchmark_time": 439.1331980000359, "strategy_time": 0, "framework_time": 3.7494669998068275},
"0,96,4,2": {"between_method": 0, "block_size_x": 96, "tile_size": 4, "use_method": 2, "time": 43.98098220825195, "times": [41.399295806884766, 44.14873504638672, 44.224510192871094, 44.214271545410156, 44.245792388916016, 44.419071197509766, 44.417022705078125, 44.31974411010742, 44.21324920654297, 44.2081298828125], "compile_time": 176.20229400017706, "verification_time": 0, "benchmark_time": 440.76444100005574, "strategy_time": 0, "framework_time": 3.7407579998216534},
"0,96,6,0": {"between_method": 0, "block_size_x": 96, "tile_size": 6, "use_method": 0, "time": 38.586435317993164, "times": [36.74496078491211, 38.84128189086914, 38.72431945800781, 38.83193588256836, 38.80732727050781, 38.81062316894531, 38.81779098510742, 38.87801742553711, 38.73353576660156, 38.674560546875], "compile_time": 180.78322199994545, "verification_time": 0, "benchmark_time": 386.81888099995376, "strategy_time": 0, "framework_time": 3.8705110002865695},
"0,96,6,1": {"between_method": 0, "block_size_x": 96, "tile_size": 6, "use_method": 1, "time": 36.90770263671875, "times": [33.3045768737793, 36.92851257324219, 37.436161041259766, 37.34220886230469, 37.341983795166016, 37.344512939453125, 37.343231201171875, 37.347328186035156, 37.343231201171875, 37.345279693603516], "compile_time": 177.80564899999263, "verification_time": 0, "benchmark_time": 370.01705700004095, "strategy_time": 0, "framework_time": 3.801867999982278},
"0,96,6,2": {"between_method": 0, "block_size_x": 96, "tile_size": 6, "use_method": 2, "time": 37.3628288269043, "times": [34.6723518371582, 36.97974395751953, 37.80403137207031, 37.80403137207031, 37.79987335205078, 37.79875183105469, 37.80607986450195, 37.71583938598633, 37.62275314331055, 37.62483215332031], "compile_time": 181.7422080000597, "verification_time": 0, "benchmark_time": 374.5313330000499, "strategy_time": 0, "framework_time": 3.8459809998130368},
"0,96,8,0": {"between_method": 0, "block_size_x": 96, "tile_size": 8, "use_method": 0, "time": 37.794860458374025, "times": [35.895294189453125, 37.843807220458984, 37.91132736206055, 37.919742584228516, 38.06412887573242, 38.06412887573242, 38.06217575073242, 38.06390380859375, 38.06105422973633, 38.06304168701172], "compile_time": 178.90372000010757, "verification_time": 0, "benchmark_time": 378.88503199997103, "strategy_time": 0, "framework_time": 3.8067789998876833},
"0,96,8,1": {"between_method": 0, "block_size_x": 96, "tile_size": 8, "use_method": 1, "time": 34.83594856262207, "times": [31.590335845947266, 34.36729431152344, 35.44780731201172, 35.270591735839844, 35.410945892333984, 35.27782440185547, 35.24812698364258, 35.2492790222168, 35.24915313720703, 35.24812698364258], "compile_time": 181.9820210000671, "verification_time": 0, "benchmark_time": 349.2542250000952, "strategy_time": 0, "framework_time": 3.9278319998174993},
"0,96,8,2": {"between_method": 0, "block_size_x": 96, "tile_size": 8, "use_method": 2, "time": 34.5972282409668, "times": [32.363521575927734, 34.62131118774414, 34.76985549926758, 34.98495864868164, 34.82511901855469, 35.00543975830078, 34.84979248046875, 34.85081481933594, 34.85065460205078, 34.85081481933594], "compile_time": 180.2302050000435, "verification_time": 0, "benchmark_time": 346.9015989999207, "strategy_time": 0, "framework_time": 3.8968660001046374},
"0,96,10,0": {"between_method": 0, "block_size_x": 96, "tile_size": 10, "use_method": 0, "time": 36.60590705871582, "times": [34.94707107543945, 36.42176055908203, 36.838401794433594, 36.83523178100586, 36.836097717285156, 36.83430480957031, 36.84044647216797, 36.83327865600586, 36.83631896972656, 36.836158752441406], "compile_time": 171.3728350000565, "verification_time": 0, "benchmark_time": 367.1038550000958, "strategy_time": 0, "framework_time": 3.932809999696474},
"0,96,10,1": {"between_method": 0, "block_size_x": 96, "tile_size": 10, "use_method": 1, "time": 36.15689201354981, "times": [33.09251022338867, 36.5557746887207, 36.58137512207031, 36.42982482910156, 36.42675018310547, 36.42959976196289, 36.42879867553711, 36.42879867553711, 36.59475326538086, 36.60073471069336], "compile_time": 181.12094599996453, "verification_time": 0, "benchmark_time": 362.376734999998, "strategy_time": 0, "framework_time": 4.00694600011775},
"0,96,10,2": {"between_method": 0, "block_size_x": 96, "tile_size": 10, "use_method": 2, "time": 32.62825355529785, "times": [30.449440002441406, 32.127777099609375, 32.86726379394531, 32.86937713623047, 32.870208740234375, 33.01273727416992, 33.01990509033203, 33.01990509033203, 33.02707290649414, 33.01884841918945], "compile_time": 182.8629470001033, "verification_time": 0, "benchmark_time": 327.06152700006896, "strategy_time": 0, "framework_time": 3.97548799969627},
"0,96,12,0": {"between_method": 0, "block_size_x": 96, "tile_size": 12, "use_method": 0, "time": 35.59223937988281, "times": [34.17875289916992, 35.24607849121094, 35.83484649658203, 35.68403244018555, 35.824737548828125, 35.7806396484375, 35.84819030761719, 35.84307098388672, 35.84102249145508, 35.84102249145508], "compile_time": 186.04596999989553, "verification_time": 0, "benchmark_time": 356.8855139999414, "strategy_time": 0, "framework_time": 4.064193000203886},
"0,96,12,1": {"between_method": 0, "block_size_x": 96, "tile_size": 12, "use_method": 1, "time": 34.63559970855713, "times": [31.36614418029785, 34.27638244628906, 35.20307159423828, 34.97267150878906, 35.128318786621094, 35.03539276123047, 35.139583587646484, 35.136512756347656, 35.0832633972168, 35.01465606689453], "compile_time": 183.8237479998952, "verification_time": 0, "benchmark_time": 347.29974099991523, "strategy_time": 0, "framework_time": 4.037646000369932},
"0,96,12,2": {"between_method": 0, "block_size_x": 96, "tile_size": 12, "use_method": 2, "time": 31.672867012023925, "times": [29.780031204223633, 31.15827178955078, 32.079872131347656, 31.99078369140625, 31.952896118164062, 31.952735900878906, 31.95267105102539, 31.953855514526367, 31.953632354736328, 31.953920364379883], "compile_time": 185.68963799998528, "verification_time": 0, "benchmark_time": 317.62521099994956, "strategy_time": 0, "framework_time": 4.038003999994544},
"0,96,14,0": {"between_method": 0, "block_size_x": 96, "tile_size": 14, "use_method": 0, "time": 35.3846019744873, "times": [34.260990142822266, 35.295135498046875, 35.580928802490234, 35.523521423339844, 35.5695686340332, 35.48160171508789, 35.42118453979492, 35.56147384643555, 35.57683181762695, 35.57478332519531], "compile_time": 190.49288900009742, "verification_time": 0, "benchmark_time": 354.786464999961, "strategy_time": 0, "framework_time": 4.117345999929967},
"0,96,14,1": {"between_method": 0, "block_size_x": 96, "tile_size": 14, "use_method": 1, "time": 34.58530864715576, "times": [31.4388484954834, 34.83443069458008, 35.04844665527344, 34.86617660522461, 34.95414352416992, 34.94179153442383, 34.94374465942383, 34.94188690185547, 34.94268798828125, 34.9409294128418], "compile_time": 177.49153099998694, "verification_time": 0, "benchmark_time": 346.7575409999881, "strategy_time": 0, "framework_time": 4.120982000131335},
"0,96,14,2": {"between_method": 0, "block_size_x": 96, "tile_size": 14, "use_method": 2, "time": 31.808787155151368, "times": [30.0185604095459, 31.946752548217773, 31.898624420166016, 32.15254211425781, 32.02867126464844, 32.01225662231445, 32.01001739501953, 32.00611114501953, 32.00716781616211, 32.00716781616211], "compile_time": 189.32807299984233, "verification_time": 0, "benchmark_time": 319.0193210000416, "strategy_time": 0, "framework_time": 4.159821000030206},
"0,96,16,0": {"between_method": 0, "block_size_x": 96, "tile_size": 16, "use_method": 0, "time": 35.57399368286133, "times": [34.482017517089844, 35.490753173828125, 35.70387268066406, 35.73455810546875, 35.68511962890625, 35.68025588989258, 35.763038635253906, 35.76115036010742, 35.67494583129883, 35.764225006103516], "compile_time": 194.34841600013897, "verification_time": 0, "benchmark_time": 356.6755749998265, "strategy_time": 0, "framework_time": 4.142537000006996},
"0,96,16,1": {"between_method": 0, "block_size_x": 96, "tile_size": 16, "use_method": 1, "time": 34.8997184753418, "times": [32.46966552734375, 34.65625762939453, 35.344383239746094, 35.22150421142578, 35.217247009277344, 35.21830368041992, 35.21839904785156, 35.21648025512695, 35.21843338012695, 35.21651077270508], "compile_time": 190.18568399997093, "verification_time": 0, "benchmark_time": 349.9292079998213, "strategy_time": 0, "framework_time": 4.173315000116418},
"0,96,16,2": {"between_method": 0, "block_size_x": 96, "tile_size": 16, "use_method": 2, "time": 32.208381462097165, "times": [30.536672592163086, 32.19968032836914, 32.417057037353516, 32.42086410522461, 32.41779327392578, 32.42067337036133, 32.41881561279297, 32.41779327392578, 32.41872024536133, 32.41574478149414], "compile_time": 193.32144700001663, "verification_time": 0, "benchmark_time": 322.95120300000235, "strategy_time": 0, "framework_time": 4.235075999986293},
"0,96,18,0": {"between_method": 0, "block_size_x": 96, "tile_size": 18, "use_method": 0, "time": 27.903564834594725, "times": [26.620927810668945, 27.76678466796875, 28.15078353881836, 28.051456451416016, 28.107519149780273, 28.066816329956055, 28.069887161254883, 28.066816329956055, 28.067840576171875, 28.066816329956055], "compile_time": 198.04598100017756, "verification_time": 0, "benchmark_time": 279.9798629998804, "strategy_time": 0, "framework_time": 4.2523229999460455},
"0,96,18,1": {"between_method": 0, "block_size_x": 96, "tile_size": 18, "use_method": 1, "time": 35.502255249023435, "times": [32.34918212890625, 35.710784912109375, 35.895294189453125, 35.79289627075195, 35.89039993286133, 35.79779052734375, 35.88300704956055, 35.890174865722656, 35.906558990478516, 35.906463623046875], "compile_time": 192.09005699985937, "verification_time": 0, "benchmark_time": 355.9539399998357, "strategy_time": 0, "framework_time": 4.245207000394657},
"0,96,18,2": {"between_method": 0, "block_size_x": 96, "tile_size": 18, "use_method": 2, "time": 32.27051181793213, "times": [30.874624252319336, 32.277503967285156, 32.40959930419922, 32.4851188659668, 32.40140914916992, 32.40038299560547, 32.482303619384766, 32.42086410522461, 32.47407913208008, 32.47923278808594], "compile_time": 198.3774350001113, "verification_time": 0, "benchmark_time": 323.58161699994525, "strategy_time": 0, "framework_time": 4.355236999799672},
"0,96,20,0": {"between_method": 0, "block_size_x": 96, "tile_size": 20, "use_method": 0, "time": 27.06967372894287, "times": [25.91744041442871, 26.73151969909668, 27.240575790405273, 27.242496490478516, 27.258880615234375, 27.261728286743164, 27.259904861450195, 27.262176513671875, 27.261951446533203, 27.26006317138672], "compile_time": 202.15853200011225, "verification_time": 0, "benchmark_time": 271.5166110001519, "strategy_time": 0, "framework_time": 4.344105999734893},
"0,96,20,1": {"between_method": 0, "block_size_x": 96, "tile_size": 20, "use_method": 1, "time": 36.30118064880371, "times": [33.65769577026367, 36.56787109375, 36.49433517456055, 36.598785400390625, 36.61414337158203, 36.615169525146484, 36.61414337158203, 36.615230560302734, 36.6192626953125, 36.615169525146484], "compile_time": 196.8668090000847, "verification_time": 0, "benchmark_time": 363.892038999893, "strategy_time": 0, "framework_time": 4.322616999843376},
"0,96,20,2": {"between_method": 0, "block_size_x": 96, "tile_size": 20, "use_method": 2, "time": 32.30723247528076, "times": [31.026975631713867, 32.09907150268555, 32.5847053527832, 32.52230453491211, 32.47411346435547, 32.47411346435547, 32.471038818359375, 32.47305679321289, 32.47385787963867, 32.473087310791016], "compile_time": 201.5358369999376, "verification_time": 0, "benchmark_time": 324.10096299986435, "strategy_time": 0, "framework_time": 4.330070000150954},
"0,128,1,0": {"between_method": 0, "block_size_x": 128, "tile_size": 1, "use_method": 0, "time": 106.01951599121094, "times": [102.95091247558594, 105.34194946289062, 105.30406188964844, 105.29996490478516, 105.30099487304688, 105.30201721191406, 105.29894256591797, 105.45033264160156, 111.79622650146484, 108.1497573852539], "compile_time": 179.40270099984446, "verification_time": 0, "benchmark_time": 1061.1490300000241, "strategy_time": 0, "framework_time": 4.305662999968263},
"0,128,1,1": {"between_method": 0, "block_size_x": 128, "tile_size": 1, "use_method": 1, "time": 110.0731101989746, "times": [105.96758270263672, 109.0324478149414, 109.0150375366211, 109.0150375366211, 109.15961456298828, 109.15840148925781, 109.47481536865234, 112.19347381591797, 117.20172882080078, 110.5129623413086], "compile_time": 175.83703400009654, "verification_time": 0, "benchmark_time": 1101.661520000107, "strategy_time": 0, "framework_time": 4.383368999924642},
"0,128,1,2": {"between_method": 0, "block_size_x": 128, "tile_size": 1, "use_method": 2, "time": 103.2861312866211, "times": [100.06524658203125, 102.23401641845703, 102.9068832397461, 102.58432006835938, 102.42047882080078, 102.434814453125, 102.42662048339844, 102.44710540771484, 108.901123046875, 106.44070434570312], "compile_time": 178.08185700005197, "verification_time": 0, "benchmark_time": 1033.747157000107, "strategy_time": 0, "framework_time": 4.42608799971822},
"0,128,2,0": {"between_method": 0, "block_size_x": 128, "tile_size": 2, "use_method": 0, "time": 65.88644485473633, "times": [63.52588653564453, 65.9599380493164, 66.22624206542969, 66.23334503173828, 66.23129272460938, 66.23206329345703, 66.09382629394531, 65.92511749267578, 66.20646667480469, 66.23027038574219], "compile_time": 175.75183899998592, "verification_time": 0, "benchmark_time": 659.7252100000333, "strategy_time": 0, "framework_time": 4.446115999826361},
"0,128,2,1": {"between_method": 0, "block_size_x": 128, "tile_size": 2, "use_method": 1, "time": 64.89845695495606, "times": [61.57503890991211, 65.45609283447266, 65.28102111816406, 65.27283477783203, 65.32505798339844, 65.2748794555664, 65.2709732055664, 65.14787292480469, 65.112060546875, 65.26873779296875], "compile_time": 174.32578400007515, "verification_time": 0, "benchmark_time": 650.0328150000314, "strategy_time": 0, "framework_time": 4.5139379997181095},
"0,128,2,2": {"between_method": 0, "block_size_x": 128, "tile_size": 2, "use_method": 2, "time": 64.13990669250488, "times": [61.24748611450195, 64.35100555419922, 64.49126434326172, 64.3921890258789, 64.4853744506836, 64.4843521118164, 64.49056243896484, 64.48627471923828, 64.4843521118164, 64.4862060546875], "compile_time": 176.02675400007683, "verification_time": 0, "benchmark_time": 642.3913280000306, "strategy_time": 0, "framework_time": 4.500591999885728},
"0,128,4,0": {"between_method": 0, "block_size_x": 128, "tile_size": 4, "use_method": 0, "time": 44.51310081481934, "times": [41.77475357055664, 44.9167366027832, 44.77849578857422, 44.77449417114258, 44.78464126586914, 44.97817611694336, 44.821502685546875, 44.77004623413086, 44.76620864868164, 44.765953063964844], "compile_time": 157.13039699994624, "verification_time": 0, "benchmark_time": 445.9870379998847, "strategy_time": 0, "framework_time": 4.568623000068328},
"0,128,4,1": {"between_method": 0, "block_size_x": 128, "tile_size": 4, "use_method": 1, "time": 43.76950035095215, "times": [40.27391815185547, 44.033023834228516, 44.082176208496094, 44.21510314941406, 44.21529769897461, 44.170143127441406, 44.06563186645508, 44.210174560546875, 44.21219253540039, 44.217342376708984], "compile_time": 174.62684700012687, "verification_time": 0, "benchmark_time": 438.68665700006204, "strategy_time": 0, "framework_time": 4.599938999717779},
"0,128,4,2": {"between_method": 0, "block_size_x": 128, "tile_size": 4, "use_method": 2, "time": 43.89117431640625, "times": [41.205440521240234, 44.0186882019043, 44.214271545410156, 44.21209716796875, 44.21219253540039, 44.212223052978516, 44.20924758911133, 44.2081298828125, 44.210174560546875, 44.20927810668945], "compile_time": 175.9841600000982, "verification_time": 0, "benchmark_time": 439.86262499993245, "strategy_time": 0, "framework_time": 4.516645999956381},
"0,128,6,0": {"between_method": 0, "block_size_x": 128, "tile_size": 6, "use_method": 0, "time": 38.463257217407225, "times": [36.45030212402344, 38.83126449584961, 38.74406433105469, 38.64441680908203, 38.64883041381836, 38.800384521484375, 38.63030242919922, 38.628353118896484, 38.62732696533203, 38.62732696533203], "compile_time": 181.0177450001902, "verification_time": 0, "benchmark_time": 385.5681210000057, "strategy_time": 0, "framework_time": 4.639570999870557},
"0,128,6,1": {"between_method": 0, "block_size_x": 128, "tile_size": 6, "use_method": 1, "time": 36.88845710754394, "times": [33.298431396484375, 36.920318603515625, 37.336063385009766, 37.33299255371094, 37.34329605102539, 37.3309440612793, 37.3298225402832, 37.3309440612793, 37.3309440612793, 37.330814361572266], "compile_time": 179.656930000192, "verification_time": 0, "benchmark_time": 369.7219379998842, "strategy_time": 0, "framework_time": 4.666716999736309},
"0,128,6,2": {"between_method": 0, "block_size_x": 128, "tile_size": 6, "use_method": 2, "time": 37.32197189331055, "times": [34.690303802490234, 37.47635269165039, 37.70880126953125, 37.621761322021484, 37.619712829589844, 37.619712829589844, 37.62086486816406, 37.619712829589844, 37.619712829589844, 37.62278366088867], "compile_time": 169.88733199991657, "verification_time": 0, "benchmark_time": 374.1581980000319, "strategy_time": 0, "framework_time": 4.678165000086665},
"0,128,8,0": {"between_method": 0, "block_size_x": 128, "tile_size": 8, "use_method": 0, "time": 37.82164192199707, "times": [35.52272033691406, 38.10611343383789, 38.157310485839844, 38.06422424316406, 38.06227111816406, 38.061824798583984, 38.06288146972656, 38.05900955200195, 38.05900955200195, 38.06105422973633], "compile_time": 179.92846700008158, "verification_time": 0, "benchmark_time": 379.22553899989, "strategy_time": 0, "framework_time": 4.695733000062319},
"0,128,8,1": {"between_method": 0, "block_size_x": 128, "tile_size": 8, "use_method": 1, "time": 34.91927032470703, "times": [32.14566421508789, 35.21638488769531, 35.12419128417969, 35.23072052001953, 35.24505615234375, 35.24812698364258, 35.24720001220703, 35.24531173706055, 35.244991302490234, 35.24505615234375], "compile_time": 182.7077670000108, "verification_time": 0, "benchmark_time": 350.0312760002089, "strategy_time": 0, "framework_time": 4.832833999898867},
"0,128,8,2": {"between_method": 0, "block_size_x": 128, "tile_size": 8, "use_method": 2, "time": 34.36761302947998, "times": [31.81260871887207, 34.37260818481445, 34.69094467163086, 34.68697738647461, 34.6879997253418, 34.68726348876953, 34.68601608276367, 34.683902740478516, 34.68492889404297, 34.68288040161133], "compile_time": 177.50356600004125, "verification_time": 0, "benchmark_time": 344.62254699997175, "strategy_time": 0, "framework_time": 4.719088000001648},
"0,128,10,0": {"between_method": 0, "block_size_x": 128, "tile_size": 10, "use_method": 0, "time": 36.58584022521973, "times": [34.92863845825195, 36.66227340698242, 36.87196731567383, 36.83225631713867, 36.761600494384766, 36.7655029296875, 36.75852966308594, 36.75852966308594, 36.7564811706543, 36.76262283325195], "compile_time": 181.05427399996188, "verification_time": 0, "benchmark_time": 366.8690339998193, "strategy_time": 0, "framework_time": 4.73377800039998},
"0,128,10,1": {"between_method": 0, "block_size_x": 128, "tile_size": 10, "use_method": 1, "time": 36.19704933166504, "times": [32.80281448364258, 36.510719299316406, 36.337825775146484, 36.43571090698242, 36.66124725341797, 36.527103424072266, 36.6827507019043, 36.56694412231445, 36.775936126708984, 36.66944122314453], "compile_time": 179.26526900009776, "verification_time": 0, "benchmark_time": 362.91736299995137, "strategy_time": 0, "framework_time": 4.8638590001246484},
"0,128,10,2": {"between_method": 0, "block_size_x": 128, "tile_size": 10, "use_method": 2, "time": 32.67918663024902, "times": [30.532608032226562, 32.271583557128906, 33.049598693847656, 33.017601013183594, 32.95743942260742, 32.95539093017578, 32.97779083251953, 33.1038703918457, 32.95420837402344, 32.97177505493164], "compile_time": 182.87679600007323, "verification_time": 0, "benchmark_time": 327.7661160000207, "strategy_time": 0, "framework_time": 4.843972999879043},
"0,128,12,0": {"between_method": 0, "block_size_x": 128, "tile_size": 12, "use_method": 0, "time": 35.55572509765625, "times": [33.97119903564453, 35.30547332763672, 35.782657623291016, 35.683326721191406, 35.77446365356445, 35.820350646972656, 35.75302505493164, 35.84409713745117, 35.84409713745117, 35.778560638427734], "compile_time": 186.33506200012562, "verification_time": 0, "benchmark_time": 356.4087439999639, "strategy_time": 0, "framework_time": 4.880281999930958},
"0,128,12,1": {"between_method": 0, "block_size_x": 128, "tile_size": 12, "use_method": 1, "time": 34.79602603912353, "times": [31.95699119567871, 35.06585693359375, 35.12934494018555, 34.97574234008789, 35.00032043457031, 35.22364807128906, 35.164161682128906, 35.15478515625, 35.158016204833984, 35.13139343261719], "compile_time": 175.12563700006467, "verification_time": 0, "benchmark_time": 348.91889900018214, "strategy_time": 0, "framework_time": 4.837481999857118},
"0,128,12,2": {"between_method": 0, "block_size_x": 128, "tile_size": 12, "use_method": 2, "time": 31.737536239624024, "times": [29.79203224182129, 31.947776794433594, 31.99385643005371, 31.9835205078125, 31.944704055786133, 31.979520797729492, 31.952896118164062, 31.947776794433594, 31.944639205932617, 31.888639450073242], "compile_time": 185.3436710000551, "verification_time": 0, "benchmark_time": 318.40043900001547, "strategy_time": 0, "framework_time": 4.878660999793283},
"0,128,14,0": {"between_method": 0, "block_size_x": 128, "tile_size": 14, "use_method": 0, "time": 35.34141120910645, "times": [33.95686340332031, 35.1201286315918, 35.6003532409668, 35.4969596862793, 35.560447692871094, 35.5676155090332, 35.56556701660156, 35.47750473022461, 35.562496185302734, 35.50617599487305], "compile_time": 181.3981259999764, "verification_time": 0, "benchmark_time": 354.1994680001608, "strategy_time": 0, "framework_time": 4.9063049998494535},
"0,128,14,1": {"between_method": 0, "block_size_x": 128, "tile_size": 14, "use_method": 1, "time": 34.45306873321533, "times": [31.37331199645996, 34.323455810546875, 34.913150787353516, 34.803680419921875, 34.89484786987305, 34.764801025390625, 34.75455856323242, 34.89689636230469, 34.84774398803711, 34.9582405090332], "compile_time": 186.18645499986997, "verification_time": 0, "benchmark_time": 345.4811809999683, "strategy_time": 0, "framework_time": 4.98617500011278},
"0,128,14,2": {"between_method": 0, "block_size_x": 128, "tile_size": 14, "use_method": 2, "time": 31.645660972595216, "times": [29.98271942138672, 31.54729652404785, 31.889408111572266, 31.964160919189453, 31.856639862060547, 31.84435272216797, 31.842304229736328, 31.842304229736328, 31.84332847595215, 31.84409523010254], "compile_time": 190.50404000017807, "verification_time": 0, "benchmark_time": 317.2757869999714, "strategy_time": 0, "framework_time": 4.959118999977363},
"0,128,16,0": {"between_method": 0, "block_size_x": 128, "tile_size": 16, "use_method": 0, "time": 35.530329895019534, "times": [34.48912048339844, 35.553279876708984, 35.8287353515625, 35.751808166503906, 35.65683364868164, 35.5522575378418, 35.502079010009766, 35.65465545654297, 35.65776062011719, 35.656768798828125], "compile_time": 182.54341400006524, "verification_time": 0, "benchmark_time": 356.1698199998773, "strategy_time": 0, "framework_time": 4.916513999887684},
"0,128,16,1": {"between_method": 0, "block_size_x": 128, "tile_size": 16, "use_method": 1, "time": 34.685430717468265, "times": [31.758527755737305, 34.24972915649414, 35.16534423828125, 35.108863830566406, 34.95616149902344, 35.0832633972168, 35.19776153564453, 35.22252655029297, 35.10464096069336, 35.00748825073242], "compile_time": 188.2899830000042, "verification_time": 0, "benchmark_time": 347.76558199996543, "strategy_time": 0, "framework_time": 4.974139999831095},
"0,128,16,2": {"between_method": 0, "block_size_x": 128, "tile_size": 16, "use_method": 2, "time": 32.14888038635254, "times": [30.504127502441406, 32.23347091674805, 32.39731216430664, 32.44054412841797, 32.31942367553711, 32.31622314453125, 32.31526565551758, 32.320289611816406, 32.323585510253906, 32.31856155395508], "compile_time": 193.90996099991753, "verification_time": 0, "benchmark_time": 322.2978989999774, "strategy_time": 0, "framework_time": 5.003949000183638},
"0,128,18,0": {"between_method": 0, "block_size_x": 128, "tile_size": 18, "use_method": 0, "time": 27.90858554840088, "times": [26.604543685913086, 27.974655151367188, 28.098400115966797, 28.059648513793945, 28.057600021362305, 28.058624267578125, 28.060640335083008, 28.056575775146484, 28.058591842651367, 28.056575775146484], "compile_time": 196.28858399983073, "verification_time": 0, "benchmark_time": 279.96435700015354, "strategy_time": 0, "framework_time": 5.0706299998637405},
"0,128,18,1": {"between_method": 0, "block_size_x": 128, "tile_size": 18, "use_method": 1, "time": 35.067497444152835, "times": [31.933439254760742, 35.204097747802734, 35.53887939453125, 35.376129150390625, 35.43859100341797, 35.43654251098633, 35.43958282470703, 35.43654251098633, 35.43475341796875, 35.43641662597656], "compile_time": 192.55697500011593, "verification_time": 0, "benchmark_time": 351.51188400004685, "strategy_time": 0, "framework_time": 5.0541179996344},
"0,128,18,2": {"between_method": 0, "block_size_x": 128, "tile_size": 18, "use_method": 2, "time": 32.22296371459961, "times": [30.845951080322266, 32.129825592041016, 32.27638244628906, 32.47411346435547, 32.38684844970703, 32.38809585571289, 32.475040435791016, 32.39424133300781, 32.47411346435547, 32.38502502441406], "compile_time": 198.66449599999214, "verification_time": 0, "benchmark_time": 323.1597699998474, "strategy_time": 0, "framework_time": 5.036345000235087},
"0,128,20,0": {"between_method": 0, "block_size_x": 128, "tile_size": 20, "use_method": 0, "time": 27.115106964111327, "times": [25.838560104370117, 27.280384063720703, 27.250688552856445, 27.253887176513672, 27.255807876586914, 27.254783630371094, 27.253759384155273, 27.254783630371094, 27.253759384155273, 27.254655838012695], "compile_time": 201.7365140000038, "verification_time": 0, "benchmark_time": 272.03341100016587, "strategy_time": 0, "framework_time": 5.088713999839456},
"0,128,20,1": {"between_method": 0, "block_size_x": 128, "tile_size": 20, "use_method": 1, "time": 35.82474212646484, "times": [32.91136169433594, 36.205440521240234, 36.16963195800781, 36.1638069152832, 36.150272369384766, 35.99871826171875, 36.1605110168457, 36.16563034057617, 36.161537170410156, 36.1605110168457], "compile_time": 195.69573600006152, "verification_time": 0, "benchmark_time": 358.99469300011333, "strategy_time": 0, "framework_time": 5.109731999937139},
"0,128,20,2": {"between_method": 0, "block_size_x": 128, "tile_size": 20, "use_method": 2, "time": 32.31811180114746, "times": [31.230976104736328, 32.53734588623047, 32.5456657409668, 32.429054260253906, 32.40873718261719, 32.40854263305664, 32.404415130615234, 32.40639877319336, 32.40550231933594, 32.40447998046875], "compile_time": 201.65087400005177, "verification_time": 0, "benchmark_time": 324.07523999995647, "strategy_time": 0, "framework_time": 5.223990999866146},
"0,160,1,0": {"between_method": 0, "block_size_x": 160, "tile_size": 1, "use_method": 0, "time": 106.42401885986328, "times": [102.51055908203125, 105.49852752685547, 105.53753662109375, 105.67993927001953, 105.68089294433594, 105.5815658569336, 105.5868148803711, 106.1181411743164, 113.67731475830078, 108.368896484375], "compile_time": 177.23986500004685, "verification_time": 0, "benchmark_time": 1065.2480960000048, "strategy_time": 0, "framework_time": 5.182317999924635},
