cached_data_used/cachefiles/pnpoly/RTX_Titan.json
{
"device_name": "NVIDIA TITAN RTX",
"kernel_name": "cn_pnpoly",
"problem_size": 20000000,
"tune_params_keys": [
"between_method",
"block_size_x",
"tile_size",
"use_method"
],
"tune_params": {
"between_method": [
0,
1,
2,
3
],
"block_size_x": [
32,
64,
96,
128,
160,
192,
224,
256,
288,
320,
352,
384,
416,
448,
480,
512,
544,
576,
608,
640,
672,
704,
736,
768,
800,
832,
864,
896,
928,
960,
992
],
"tile_size": [
1,
2,
4,
6,
8,
10,
12,
14,
16,
18,
20
],
"use_method": [
0,
1,
2
]
},
"objective": "time",
"cache": {
"3,256,1,0": {"between_method": 3, "block_size_x": 256, "tile_size": 1, "use_method": 0, "time": 0.0766464002430439, "times": [0.08108799904584885, 0.0764160007238388, 0.07577600330114365, 0.07542400062084198, 0.07532799988985062, 0.0759039968252182, 0.07529599964618683, 0.07574400305747986, 0.07782399654388428, 0.07766400277614594], "compile_time": 0.02142001176252961, "verification_time": 0, "benchmark_time": 1.3255980156827718, "strategy_time": 72.76836698292755, "framework_time": 0.30966801568865776, "timestamp": "2023-01-26 19:47:39.876766+00:00"},
"3,256,12,0": {"between_method": 3, "block_size_x": 256, "tile_size": 12, "use_method": 0, "time": 0.023920000158250333, "times": [0.05392000079154968, 0.026623999699950218, 0.021727999672293663, 0.019360000267624855, 0.020479999482631683, 0.01788800023496151, 0.016383999958634377, 0.021888000890612602, 0.018400000408291817, 0.02252800017595291], "compile_time": 108.6076490173582, "verification_time": 0, "benchmark_time": 0.9269520232919604, "strategy_time": 0.2418779768049717, "framework_time": 0.36986698978580534, "timestamp": "2023-01-26 19:47:39.986935+00:00"},
"3,256,16,0": {"between_method": 3, "block_size_x": 256, "tile_size": 16, "use_method": 0, "time": 0.020131200086325407, "times": [0.04684799909591675, 0.02457600086927414, 0.01836800016462803, 0.018239999189972878, 0.016383999958634377, 0.015456000342965126, 0.02252800017595291, 0.014336000196635723, 0.01228800043463707, 0.01228800043463707], "compile_time": 118.04591500549577, "verification_time": 0, "benchmark_time": 0.9437520056962967, "strategy_time": 0.00444002216681838, "framework_time": 0.4414749564602971, "timestamp": "2023-01-26 19:47:40.106387+00:00"},
"3,256,18,0": {"between_method": 3, "block_size_x": 256, "tile_size": 18, "use_method": 0, "time": 0.01650240011513233, "times": [0.04915200173854828, 0.01616000011563301, 0.01369599997997284, 0.01235199999064207, 0.014047999866306782, 0.012095999903976917, 0.012191999703645706, 0.01228800043463707, 0.010975999757647514, 0.01206399966031313], "compile_time": 118.44034201931208, "verification_time": 0, "benchmark_time": 0.8399620128329843, "strategy_time": 0.0035800039768218994, "framework_time": 0.3845359606202692, "timestamp": "2023-01-26 19:47:40.226076+00:00"},
"3,256,6,0": {"between_method": 3, "block_size_x": 256, "tile_size": 6, "use_method": 0, "time": 0.022790400125086308, "times": [0.05110400170087814, 0.02348800003528595, 0.02070399932563305, 0.02022399939596653, 0.019328000023961067, 0.01913600042462349, 0.018880000337958336, 0.018303999677300453, 0.01817600056529045, 0.018559999763965607], "compile_time": 103.37008800706826, "verification_time": 0, "benchmark_time": 0.8524620207026601, "strategy_time": 0.004120025550946593, "framework_time": 0.3910169471055269, "timestamp": "2023-01-26 19:47:40.330709+00:00"},
"3,256,10,0": {"between_method": 3, "block_size_x": 256, "tile_size": 10, "use_method": 0, "time": 0.01850239997729659, "times": [0.04710400104522705, 0.01897599920630455, 0.016383999958634377, 0.01532800029963255, 0.014336000196635723, 0.01603199914097786, 0.015615999698638916, 0.013824000023305416, 0.014336000196635723, 0.013088000006973743], "compile_time": 108.61177000333555, "verification_time": 0, "benchmark_time": 0.8510420157108456, "strategy_time": 0.0036400160752236843, "framework_time": 0.431715976446867, "timestamp": "2023-01-26 19:47:40.440621+00:00"},
"3,256,14,0": {"between_method": 3, "block_size_x": 256, "tile_size": 14, "use_method": 0, "time": 0.01847040019929409, "times": [0.04553600028157234, 0.018432000651955605, 0.016383999958634377, 0.0161920003592968, 0.014783999882638454, 0.014336000196635723, 0.014816000126302242, 0.015424000099301338, 0.0144640002399683, 0.014336000196635723], "compile_time": 112.48612598865293, "verification_time": 0, "benchmark_time": 0.8668919908814132, "strategy_time": 0.00366999302059412, "framework_time": 0.4194960347376764, "timestamp": "2023-01-26 19:47:40.554413+00:00"},
"3,256,20,0": {"between_method": 3, "block_size_x": 256, "tile_size": 20, "use_method": 0, "time": 0.014905600063502788, "times": [0.04095999896526337, 0.014655999839305878, 0.01228800043463707, 0.01228800043463707, 0.012256000190973282, 0.011264000087976456, 0.01104000024497509, 0.012032000347971916, 0.010304000228643417, 0.01196799986064434], "compile_time": 117.83758600358851, "verification_time": 0, "benchmark_time": 0.8248930098488927, "strategy_time": 0.003510009264573455, "framework_time": 0.44962597894482315, "timestamp": "2023-01-26 19:47:40.673545+00:00"},
"3,256,2,0": {"between_method": 3, "block_size_x": 256, "tile_size": 2, "use_method": 0, "time": 0.04546560011804104, "times": [0.06758400052785873, 0.04710400104522705, 0.044544000178575516, 0.04265600070357323, 0.042688000947237015, 0.042847998440265656, 0.04217600077390671, 0.0414079986512661, 0.04217600077390671, 0.041471999138593674], "compile_time": 101.35936699225567, "verification_time": 0, "benchmark_time": 0.8734919829294086, "strategy_time": 0.0039000005926936865, "framework_time": 0.46148503315635026, "timestamp": "2023-01-26 19:47:40.776259+00:00"},
"3,256,4,0": {"between_method": 3, "block_size_x": 256, "tile_size": 4, "use_method": 0, "time": 0.0263136001303792, "times": [0.04700800031423569, 0.026623999699950218, 0.02505600079894066, 0.023360000923275948, 0.024224000051617622, 0.02409599907696247, 0.022655999287962914, 0.023360000923275948, 0.023711999878287315, 0.02304000034928322], "compile_time": 102.78110398212448, "verification_time": 0, "benchmark_time": 0.7938219932839274, "strategy_time": 0.0037199934013187885, "framework_time": 0.45490602497011423, "timestamp": "2023-01-26 19:47:40.880307+00:00"},
"3,256,8,0": {"between_method": 3, "block_size_x": 256, "tile_size": 8, "use_method": 0, "time": 0.024425600282847883, "times": [0.0716480016708374, 0.02348800003528595, 0.02054399996995926, 0.01894400082528591, 0.018751999363303185, 0.018432000651955605, 0.018303999677300453, 0.017823999747633934, 0.018432000651955605, 0.01788800023496151], "compile_time": 103.84622600395232, "verification_time": 0, "benchmark_time": 0.9689619764685631, "strategy_time": 0.0037399877328425646, "framework_time": 0.47746405471116304, "timestamp": "2023-01-26 19:47:40.985620+00:00"},
"0,256,20,0": {"between_method": 0, "block_size_x": 256, "tile_size": 20, "use_method": 0, "time": 0.016598400194197893, "times": [0.04707200080156326, 0.01894400082528591, 0.014592000283300877, 0.013663999736309052, 0.013567999936640263, 0.01228800043463707, 0.012000000104308128, 0.010463999584317207, 0.011103999800980091, 0.01228800043463707], "compile_time": 120.23855399456806, "verification_time": 0, "benchmark_time": 0.8736419840715826, "strategy_time": 0.28673699125647545, "framework_time": 0.6358740210998803, "timestamp": "2023-01-26 19:47:41.107673+00:00"},
"1,256,20,0": {"between_method": 1, "block_size_x": 256, "tile_size": 20, "use_method": 0, "time": 0.01655359985306859, "times": [0.040863998234272, 0.018303999677300453, 0.015168000012636185, 0.014336000196635723, 0.014336000196635723, 0.013088000006973743, 0.012415999546647072, 0.012480000033974648, 0.01228800043463707, 0.012256000190973282], "compile_time": 119.80155800119974, "verification_time": 0, "benchmark_time": 0.8632320095784962, "strategy_time": 0.0033399846870452166, "framework_time": 0.4831960250157863, "timestamp": "2023-01-26 19:47:41.228839+00:00"},
"2,256,20,0": {"between_method": 2, "block_size_x": 256, "tile_size": 20, "use_method": 0, "time": 0.016662400029599667, "times": [0.04505600035190582, 0.017184000462293625, 0.01462399959564209, 0.014336000196635723, 0.01321600005030632, 0.01414399966597557, 0.012415999546647072, 0.01228800043463707, 0.011071999557316303, 0.01228800043463707], "compile_time": 120.49154299893416, "verification_time": 0, "benchmark_time": 0.8707020024303347, "strategy_time": 0.0037400168366730213, "framework_time": 0.494195002829656, "timestamp": "2023-01-26 19:47:41.350714+00:00"},
"3,256,20,1": {"between_method": 3, "block_size_x": 256, "tile_size": 20, "use_method": 1, "time": 0.01814720006659627, "times": [0.04505600035190582, 0.01849599927663803, 0.01664000004529953, 0.015231999568641186, 0.014816000126302242, 0.015104000456631184, 0.014336000196635723, 0.015039999969303608, 0.01398400031030178, 0.012768000364303589], "compile_time": 118.39705100283027, "verification_time": 0, "benchmark_time": 0.8720920013729483, "strategy_time": 0.027170026442036033, "framework_time": 0.5074849759694189, "timestamp": "2023-01-26 19:47:41.470533+00:00"},
"3,256,20,2": {"between_method": 3, "block_size_x": 256, "tile_size": 20, "use_method": 2, "time": 0.01906560016795993, "times": [0.046560000628232956, 0.018432000651955605, 0.0163199994713068, 0.015647999942302704, 0.014592000283300877, 0.014655999839305878, 0.016383999958634377, 0.01648000068962574, 0.016383999958634377, 0.015200000256299973], "compile_time": 117.63231799704954, "verification_time": 0, "benchmark_time": 0.9274119802284986, "strategy_time": 0.003549997927621007, "framework_time": 0.5355050088837743, "timestamp": "2023-01-26 19:47:41.589648+00:00"},
"3,448,20,0": {"between_method": 3, "block_size_x": 448, "tile_size": 20, "use_method": 0, "time": 0.016278399992734192, "times": [0.04531199857592583, 0.016736000776290894, 0.01462399959564209, 0.01283199992030859, 0.01228800043463707, 0.012480000033974648, 0.01228800043463707, 0.012032000347971916, 0.012415999546647072, 0.011776000261306763], "compile_time": 120.16351500642486, "verification_time": 0, "benchmark_time": 0.8753720030654222, "strategy_time": 0.049919995944947004, "framework_time": 0.7310429937206209, "timestamp": "2023-01-26 19:47:41.711487+00:00"},
"3,608,20,0": {"between_method": 3, "block_size_x": 608, "tile_size": 20, "use_method": 0, "time": 0.01592639982700348, "times": [0.03891199827194214, 0.015359999611973763, 0.014336000196635723, 0.013088000006973743, 0.013632000423967838, 0.013919999822974205, 0.013567999936640263, 0.012319999746978283, 0.011839999817311764, 0.01228800043463707], "compile_time": 120.01814600080252, "verification_time": 0, "benchmark_time": 0.765392993343994, "strategy_time": 0.0038800062611699104, "framework_time": 0.5103760049678385, "timestamp": "2023-01-26 19:47:41.832799+00:00"},
"3,224,20,0": {"between_method": 3, "block_size_x": 224, "tile_size": 20, "use_method": 0, "time": 0.01442240010946989, "times": [0.03481600061058998, 0.014336000196635723, 0.012512000277638435, 0.011680000461637974, 0.01104000024497509, 0.01532800029963255, 0.012543999589979649, 0.011327999643981457, 0.010239999741315842, 0.010400000028312206], "compile_time": 114.88642400945537, "verification_time": 0, "benchmark_time": 0.7976920169312507, "strategy_time": 0.003110006218776107, "framework_time": 0.52774598589167, "timestamp": "2023-01-26 19:47:41.949029+00:00"},
"3,352,20,0": {"between_method": 3, "block_size_x": 352, "tile_size": 20, "use_method": 0, "time": 0.015200000163167715, "times": [0.041728001087903976, 0.016383999958634377, 0.013376000337302685, 0.01228800043463707, 0.011744000017642975, 0.012128000147640705, 0.011776000261306763, 0.01152000017464161, 0.01033599954098463, 0.01071999967098236], "compile_time": 115.91498399502598, "verification_time": 0, "benchmark_time": 0.8386719855479896, "strategy_time": 0.0038399884942919016, "framework_time": 0.5461260443553329, "timestamp": "2023-01-26 19:47:42.066347+00:00"},
"3,32,20,0": {"between_method": 3, "block_size_x": 32, "tile_size": 20, "use_method": 0, "time": 0.036627200245857236, "times": [0.06377600133419037, 0.04694399982690811, 0.03276799991726875, 0.03276799991726875, 0.03215999901294708, 0.03094400092959404, 0.03152000159025192, 0.030751999467611313, 0.03190400078892708, 0.032735999673604965], "compile_time": 117.48687899671495, "verification_time": 0, "benchmark_time": 0.9435819811187685, "strategy_time": 0.0035199918784201145, "framework_time": 0.5744740483351052, "timestamp": "2023-01-26 19:47:42.185373+00:00"},
"3,768,20,0": {"between_method": 3, "block_size_x": 768, "tile_size": 20, "use_method": 0, "time": 0.01601280001923442, "times": [0.04505600035190582, 0.016383999958634377, 0.014336000196635723, 0.01398400031030178, 0.01283199992030859, 0.012575999833643436, 0.012319999746978283, 0.011680000461637974, 0.010239999741315842, 0.01071999967098236], "compile_time": 120.51883299136534, "verification_time": 0, "benchmark_time": 0.8553719962947071, "strategy_time": 0.0051000097300857306, "framework_time": 0.8238420123234391, "timestamp": "2023-01-26 19:47:42.307594+00:00"},
"3,992,20,0": {"between_method": 3, "block_size_x": 992, "tile_size": 20, "use_method": 0, "time": "RuntimeFailedConfig", "compile_time": 122.63852299656719, "verification_time": 0, "benchmark_time": 0.16584800323471427, "strategy_time": 0.0035400153137743473, "framework_time": 0.5282359779812396, "timestamp": "2023-01-26 19:47:42.430946+00:00"},
"3,576,20,0": {"between_method": 3, "block_size_x": 576, "tile_size": 20, "use_method": 0, "time": 0.016713600140064955, "times": [0.04598399996757507, 0.01833599992096424, 0.014336000196635723, 0.014271999709308147, 0.012608000077307224, 0.01228800043463707, 0.01228800043463707, 0.01244799979031086, 0.01228800043463707, 0.01228800043463707], "compile_time": 119.9751170061063, "verification_time": 0, "benchmark_time": 0.8498920069541782, "strategy_time": 0.004659988917410374, "framework_time": 0.6673040043096989, "timestamp": "2023-01-26 19:47:42.552462+00:00"},
"3,320,20,0": {"between_method": 3, "block_size_x": 320, "tile_size": 20, "use_method": 0, "time": 0.016451200004667044, "times": [0.045024000108242035, 0.01759999990463257, 0.014560000039637089, 0.013952000066637993, 0.013344000093638897, 0.012319999746978283, 0.012415999546647072, 0.01228800043463707, 0.01071999967098236, 0.01228800043463707], "compile_time": 117.72621699492447, "verification_time": 0, "benchmark_time": 0.8485419966746122, "strategy_time": 0.0037600111681967974, "framework_time": 0.6015750113874674, "timestamp": "2023-01-26 19:47:42.671657+00:00"},
"3,672,20,0": {"between_method": 3, "block_size_x": 672, "tile_size": 20, "use_method": 0, "time": 0.015587200038135051, "times": [0.04499199986457825, 0.01583999954164028, 0.013663999736309052, 0.01228800043463707, 0.01228800043463707, 0.011103999800980091, 0.011264000087976456, 0.012095999903976917, 0.011776000261306763, 0.01056000031530857], "compile_time": 118.5899700212758, "verification_time": 0, "benchmark_time": 0.8328820113092661, "strategy_time": 0.0032999960239976645, "framework_time": 0.581253960262984, "timestamp": "2023-01-26 19:47:42.791680+00:00"},
"3,480,20,0": {"between_method": 3, "block_size_x": 480, "tile_size": 20, "use_method": 0, "time": 0.018236800190061332, "times": [0.047200001776218414, 0.018432000651955605, 0.017055999487638474, 0.014879999682307243, 0.0144640002399683, 0.014431999996304512, 0.014944000169634819, 0.013279999606311321, 0.013952000066637993, 0.013728000223636627], "compile_time": 118.41078198631294, "verification_time": 0, "benchmark_time": 0.8675220014993101, "strategy_time": 0.0032400130294263363, "framework_time": 0.6021849985700101, "timestamp": "2023-01-26 19:47:42.911579+00:00"},
"3,384,20,0": {"between_method": 3, "block_size_x": 384, "tile_size": 20, "use_method": 0, "time": 0.015900800190865993, "times": [0.04713600128889084, 0.01740800030529499, 0.014592000283300877, 0.011776000261306763, 0.01228800043463707, 0.011103999800980091, 0.012256000190973282, 0.010847999714314938, 0.011359999887645245, 0.010239999741315842], "compile_time": 122.89398998836987, "verification_time": 0, "benchmark_time": 0.8708520035725087, "strategy_time": 0.003749999450519681, "framework_time": 0.6098239973653108, "timestamp": "2023-01-26 19:47:43.035972+00:00"},
"3,928,20,0": {"between_method": 3, "block_size_x": 928, "tile_size": 20, "use_method": 0, "time": "RuntimeFailedConfig", "compile_time": 119.77692999062128, "verification_time": 0, "benchmark_time": 0.13415899593383074, "strategy_time": 0.004060013452544808, "framework_time": 0.5982939910609275, "timestamp": "2023-01-26 19:47:43.156500+00:00"},
"3,864,20,0": {"between_method": 3, "block_size_x": 864, "tile_size": 20, "use_method": 0, "time": 0.016915200091898442, "times": [0.05344000086188316, 0.0163199994713068, 0.01321600005030632, 0.013919999822974205, 0.013728000223636627, 0.01228800043463707, 0.011071999557316303, 0.01228800043463707, 0.01104000024497509, 0.011839999817311764], "compile_time": 118.87238698545843, "verification_time": 0, "benchmark_time": 0.8701320039108396, "strategy_time": 0.004530011210590601, "framework_time": 0.6637629994656891, "timestamp": "2023-01-26 19:47:43.276929+00:00"},
"3,544,20,0": {"between_method": 3, "block_size_x": 544, "tile_size": 20, "use_method": 0, "time": 0.0179776000790298, "times": [0.04585599899291992, 0.01820800080895424, 0.016383999958634377, 0.014336000196635723, 0.014336000196635723, 0.014336000196635723, 0.014208000153303146, 0.013919999822974205, 0.014336000196635723, 0.013856000266969204], "compile_time": 120.7629190175794, "verification_time": 0, "benchmark_time": 0.8784719975665212, "strategy_time": 0.00379001721739769, "framework_time": 0.7106939738150686, "timestamp": "2023-01-26 19:47:43.399302+00:00"},
"3,960,20,0": {"between_method": 3, "block_size_x": 960, "tile_size": 20, "use_method": 0, "time": "RuntimeFailedConfig", "compile_time": 114.82691398123279, "verification_time": 0, "benchmark_time": 0.1259789860341698, "strategy_time": 0.0035700213629752398, "framework_time": 0.5962350114714354, "timestamp": "2023-01-26 19:47:43.514869+00:00"},
"3,640,20,0": {"between_method": 3, "block_size_x": 640, "tile_size": 20, "use_method": 0, "time": 0.017308800108730794, "times": [0.05478399991989136, 0.01548799965530634, 0.013567999936640263, 0.013952000066637993, 0.01360000018030405, 0.012575999833643436, 0.012256000190973282, 0.01228800043463707, 0.01228800043463707, 0.01228800043463707], "compile_time": 116.59860800136812, "verification_time": 0, "benchmark_time": 0.8674919954501092, "strategy_time": 0.0040800077840685844, "framework_time": 0.6718729855492711, "timestamp": "2023-01-26 19:47:43.633026+00:00"},
"3,192,20,0": {"between_method": 3, "block_size_x": 192, "tile_size": 20, "use_method": 0, "time": 0.014630400203168392, "times": [0.04108799993991852, 0.014431999996304512, 0.01228800043463707, 0.012032000347971916, 0.01228800043463707, 0.010944000445306301, 0.01056000031530857, 0.010751999914646149, 0.011680000461637974, 0.010239999741315842], "compile_time": 115.7282359781675, "verification_time": 0, "benchmark_time": 0.8162120066117495, "strategy_time": 0.0039000005926936865, "framework_time": 0.6491850363090634, "timestamp": "2023-01-26 19:47:43.750239+00:00"},
"3,832,20,0": {"between_method": 3, "block_size_x": 832, "tile_size": 20, "use_method": 0, "time": 0.016063999850302935, "times": [0.05321599915623665, 0.014879999682307243, 0.013407999649643898, 0.012095999903976917, 0.010847999714314938, 0.011680000461637974, 0.011744000017642975, 0.010367999784648418, 0.010816000401973724, 0.01158399973064661], "compile_time": 118.29396200482734, "verification_time": 0, "benchmark_time": 0.8152730006258935, "strategy_time": 0.003809982445091009, "framework_time": 0.6451840163208544, "timestamp": "2023-01-26 19:47:43.870022+00:00"},
"3,416,20,0": {"between_method": 3, "block_size_x": 416, "tile_size": 20, "use_method": 0, "time": 0.015471999999135733, "times": [0.04710400104522705, 0.014783999882638454, 0.01375999953597784, 0.013376000337302685, 0.01235199999064207, 0.010847999714314938, 0.011648000217974186, 0.010239999741315842, 0.010239999741315842, 0.010367999784648418], "compile_time": 121.18252500658855, "verification_time": 0, "benchmark_time": 0.8462830155622214, "strategy_time": 0.0040000013541430235, "framework_time": 0.6936629652045667, "timestamp": "2023-01-26 19:47:43.992774+00:00"},
"3,704,20,0": {"between_method": 3, "block_size_x": 704, "tile_size": 20, "use_method": 0, "time": 0.019984000269323586, "times": [0.06777600198984146, 0.018559999763965607, 0.015904000028967857, 0.01539199985563755, 0.014336000196635723, 0.013632000423967838, 0.01228800043463707, 0.013407999649643898, 0.014208000153303146, 0.014336000196635723], "compile_time": 123.03509999765083, "verification_time": 0, "benchmark_time": 0.9473109967075288, "strategy_time": 0.0035599805414676666, "framework_time": 0.7057330221869051, "timestamp": "2023-01-26 19:47:44.117483+00:00"},
"3,96,20,0": {"between_method": 3, "block_size_x": 96, "tile_size": 20, "use_method": 0, "time": 0.020275199972093105, "times": [0.06348799914121628, 0.017791999503970146, 0.016383999958634377, 0.015168000012636185, 0.015519999898970127, 0.014336000196635723, 0.01571200042963028, 0.015584000386297703, 0.014336000196635723, 0.014431999996304512], "compile_time": 121.65698100579903, "verification_time": 0, "benchmark_time": 0.8332629804499447, "strategy_time": 0.004789995728060603, "framework_time": 1.0231800260953605, "timestamp": "2023-01-26 19:47:44.241020+00:00"},
"3,288,20,0": {"between_method": 3, "block_size_x": 288, "tile_size": 20, "use_method": 0, "time": 0.016511999908834694, "times": [0.05363199859857559, 0.014336000196635723, 0.014047999866306782, 0.013791999779641628, 0.012512000277638435, 0.012608000077307224, 0.010432000271975994, 0.01071999967098236, 0.011744000017642975, 0.011296000331640244], "compile_time": 121.0836179961916, "verification_time": 0, "benchmark_time": 0.8184019825421274, "strategy_time": 0.0036599813029170036, "framework_time": 0.6995540461502969, "timestamp": "2023-01-26 19:47:44.363641+00:00"},
"3,512,20,0": {"between_method": 3, "block_size_x": 512, "tile_size": 20, "use_method": 0, "time": 0.0172927999868989, "times": [0.04710400104522705, 0.016383999958634377, 0.014655999839305878, 0.014271999709308147, 0.014303999952971935, 0.013535999692976475, 0.013567999936640263, 0.012543999589979649, 0.012608000077307224, 0.013952000066637993], "compile_time": 120.8255089877639, "verification_time": 0, "benchmark_time": 0.8340030035469681, "strategy_time": 0.0037599820643663406, "framework_time": 0.7183330308180302, "timestamp": "2023-01-26 19:47:44.486038+00:00"},
"3,800,20,0": {"between_method": 3, "block_size_x": 800, "tile_size": 20, "use_method": 0, "time": 0.017683199886232615, "times": [0.053247999399900436, 0.014655999839305878, 0.016383999958634377, 0.014336000196635723, 0.014047999866306782, 0.013439999893307686, 0.012608000077307224, 0.013407999649643898, 0.012384000234305859, 0.012319999746978283], "compile_time": 117.79411599854939, "verification_time": 0, "benchmark_time": 0.839043001178652, "strategy_time": 0.003390014171600342, "framework_time": 0.7345129852183163, "timestamp": "2023-01-26 19:47:44.605424+00:00"},
"3,64,20,0": {"between_method": 3, "block_size_x": 64, "tile_size": 20, "use_method": 0, "time": 0.023385600186884403, "times": [0.05881600081920624, 0.02252800017595291, 0.02035200037062168, 0.02022399939596653, 0.018464000895619392, 0.0191040001809597, 0.019807999953627586, 0.01849599927663803, 0.017376000061631203, 0.018688000738620758], "compile_time": 118.17499401513487, "verification_time": 0, "benchmark_time": 0.8428019937127829, "strategy_time": 0.003569992259144783, "framework_time": 0.7263039879035205, "timestamp": "2023-01-26 19:47:44.725187+00:00"},
"3,896,20,0": {"between_method": 3, "block_size_x": 896, "tile_size": 20, "use_method": 0, "time": 0.01499520018696785, "times": [0.04358400031924248, 0.01414399966597557, 0.01228800043463707, 0.01196799986064434, 0.011680000461637974, 0.011008000001311302, 0.010688000358641148, 0.01228800043463707, 0.010623999871313572, 0.011680000461637974], "compile_time": 115.00966298626736, "verification_time": 0, "benchmark_time": 0.8339119958691299, "strategy_time": 0.003589986590668559, "framework_time": 0.7406320364680141, "timestamp": "2023-01-26 19:47:44.841791+00:00"},
"3,160,20,0": {"between_method": 3, "block_size_x": 160, "tile_size": 20, "use_method": 0, "time": 0.016211200039833784, "times": [0.04476799815893173, 0.015296000055968761, 0.014336000196635723, 0.013952000066637993, 0.01228800043463707, 0.012512000277638435, 0.01228800043463707, 0.01228800043463707, 0.012095999903976917, 0.01228800043463707], "compile_time": 115.82032500882633, "verification_time": 0, "benchmark_time": 0.8470819739159197, "strategy_time": 0.0037199934013187885, "framework_time": 0.752133026253432, "timestamp": "2023-01-26 19:47:44.959229+00:00"},
"3,736,20,0": {"between_method": 3, "block_size_x": 736, "tile_size": 20, "use_method": 0, "time": 0.016812799964100122, "times": [0.05315199866890907, 0.014879999682307243, 0.014336000196635723, 0.012768000364303589, 0.013567999936640263, 0.012384000234305859, 0.011071999557316303, 0.012032000347971916, 0.012256000190973282, 0.011680000461637974], "compile_time": 118.21533300098963, "verification_time": 0, "benchmark_time": 0.8120720158331096, "strategy_time": 0.004310015356168151, "framework_time": 0.76012295903638, "timestamp": "2023-01-26 19:47:45.079036+00:00"},
"3,128,20,0": {"between_method": 3, "block_size_x": 128, "tile_size": 20, "use_method": 0, "time": 0.01689919987693429, "times": [0.0424639992415905, 0.018239999189972878, 0.014751999638974667, 0.014271999709308147, 0.013632000423967838, 0.012640000320971012, 0.014336000196635723, 0.01360000018030405, 0.012608000077307224, 0.01244799979031086], "compile_time": 114.88660299801268, "verification_time": 0, "benchmark_time": 0.8347130205947906, "strategy_time": 0.0034500262700021267, "framework_time": 0.7581629324704409, "timestamp": "2023-01-26 19:47:45.195535+00:00"},
"3,224,12,0": {"between_method": 3, "block_size_x": 224, "tile_size": 12, "use_method": 0, "time": 0.01764160031452775, "times": [0.04419200122356415, 0.018432000651955605, 0.015744000673294067, 0.014336000196635723, 0.014336000196635723, 0.014303999952971935, 0.013856000266969204, 0.013279999606311321, 0.01360000018030405, 0.014336000196635723], "compile_time": 104.54742799629457, "verification_time": 0, "benchmark_time": 0.8420429949183017, "strategy_time": 0.19111798610538244, "framework_time": 0.797192013124004, "timestamp": "2023-01-26 19:47:45.301928+00:00"},
"3,224,16,0": {"between_method": 3, "block_size_x": 224, "tile_size": 16, "use_method": 0, "time": 0.01691840011626482, "times": [0.05331199988722801, 0.0161920003592968, 0.013279999606311321, 0.01369599997997284, 0.013311999849975109, 0.01228800043463707, 0.01190400030463934, 0.01228800043463707, 0.012000000104308128, 0.010912000201642513], "compile_time": 110.362695006188, "verification_time": 0, "benchmark_time": 0.8498420065734535, "strategy_time": 0.0034400145523250103, "framework_time": 0.8030319877434522, "timestamp": "2023-01-26 19:47:45.413962+00:00"},
"3,224,6,0": {"between_method": 3, "block_size_x": 224, "tile_size": 6, "use_method": 0, "time": 0.024435199797153473, "times": [0.04745600000023842, 0.026208000257611275, 0.022784000262618065, 0.02112000063061714, 0.020767999812960625, 0.021663999184966087, 0.02067199908196926, 0.022207999601960182, 0.020735999569296837, 0.020735999569296837], "compile_time": 104.77871500188485, "verification_time": 0, "benchmark_time": 0.8809419814497232, "strategy_time": 0.003589986590668559, "framework_time": 0.8103030268102884, "timestamp": "2023-01-26 19:47:45.520451+00:00"},
"3,224,2,0": {"between_method": 3, "block_size_x": 224, "tile_size": 2, "use_method": 0, "time": 0.04932480007410049, "times": [0.07651200145483017, 0.05113599821925163, 0.04681599885225296, 0.04560000076889992, 0.045343998819589615, 0.04553600028157234, 0.04505600035190582, 0.04505600035190582, 0.04572800174355507, 0.04646399989724159], "compile_time": 103.35777900763787, "verification_time": 0, "benchmark_time": 0.8540120034012944, "strategy_time": 0.0038600119296461344, "framework_time": 0.8511019987054169, "timestamp": "2023-01-26 19:47:45.625533+00:00"},
"3,224,18,0": {"between_method": 3, "block_size_x": 224, "tile_size": 18, "use_method": 0, "time": 0.016412799898535013, "times": [0.043807998299598694, 0.018432000651955605, 0.014495999552309513, 0.012575999833643436, 0.014271999709308147, 0.013439999893307686, 0.01235199999064207, 0.01228800043463707, 0.01142400037497282, 0.01104000024497509], "compile_time": 115.42184700374492, "verification_time": 0, "benchmark_time": 0.8668219961691648, "strategy_time": 0.0035599805414676666, "framework_time": 0.8327540417667478, "timestamp": "2023-01-26 19:47:45.742672+00:00"},
"3,224,14,0": {"between_method": 3, "block_size_x": 224, "tile_size": 14, "use_method": 0, "time": 0.01877760011702776, "times": [0.04214400053024292, 0.02956799976527691, 0.016383999958634377, 0.014399999752640724, 0.014336000196635723, 0.014336000196635723, 0.014336000196635723, 0.014336000196635723, 0.01398400031030178, 0.013952000066637993], "compile_time": 112.73302399786189, "verification_time": 0, "benchmark_time": 0.8971720235422254, "strategy_time": 0.003409979399293661, "framework_time": 0.8450619934592396, "timestamp": "2023-01-26 19:47:45.857167+00:00"},
"3,224,1,0": {"between_method": 3, "block_size_x": 224, "tile_size": 1, "use_method": 0, "time": 0.08936640098690987, "times": [0.1157120019197464, 0.09008000046014786, 0.08614400029182434, 0.10028800368309021, 0.08396799862384796, 0.08271999657154083, 0.08243200182914734, 0.08240000158548355, 0.08348800241947174, 0.08643200248479843], "compile_time": 101.60824400372803, "verification_time": 0, "benchmark_time": 1.4223270118236542, "strategy_time": 0.004970002919435501, "framework_time": 1.247598003828898, "timestamp": "2023-01-26 19:47:45.961470+00:00"},
"3,224,8,0": {"between_method": 3, "block_size_x": 224, "tile_size": 8, "use_method": 0, "time": 0.02107520028948784, "times": [0.04710400104522705, 0.02252800017595291, 0.01990400068461895, 0.019071999937295914, 0.017632000148296356, 0.016704000532627106, 0.016831999644637108, 0.01692800037562847, 0.017664000391960144, 0.016383999958634377], "compile_time": 106.36125100427307, "verification_time": 0, "benchmark_time": 0.8563630108255893, "strategy_time": 0.0047800131142139435, "framework_time": 1.246617961442098, "timestamp": "2023-01-26 19:47:46.069957+00:00"},
"3,224,10,0": {"between_method": 3, "block_size_x": 224, "tile_size": 10, "use_method": 0, "time": 0.019958400167524815, "times": [0.045504000037908554, 0.02035200037062168, 0.018400000408291817, 0.016992000862956047, 0.016704000532627106, 0.01740800030529499, 0.01651199907064438, 0.016383999958634377, 0.015456000342965126, 0.01587199978530407], "compile_time": 107.85912699066103, "verification_time": 0, "benchmark_time": 0.8813419844955206, "strategy_time": 0.003930006641894579, "framework_time": 0.8543030126020312, "timestamp": "2023-01-26 19:47:46.179571+00:00"},
"3,224,4,0": {"between_method": 3, "block_size_x": 224, "tile_size": 4, "use_method": 0, "time": 0.031187200173735618, "times": [0.05939200147986412, 0.03276799991726875, 0.029279999434947968, 0.02908799983561039, 0.028672000393271446, 0.027904000133275986, 0.026528000831604004, 0.026623999699950218, 0.025407999753952026, 0.026208000257611275], "compile_time": 100.45091499341652, "verification_time": 0, "benchmark_time": 0.8792720036581159, "strategy_time": 0.003690016455948353, "framework_time": 0.8421729726251215, "timestamp": "2023-01-26 19:47:46.281762+00:00"},
"3,224,20,2": {"between_method": 3, "block_size_x": 224, "tile_size": 20, "use_method": 2, "time": 0.01981759984046221, "times": [0.04710400104522705, 0.01945599913597107, 0.01756799966096878, 0.016256000846624374, 0.016383999958634377, 0.016287999227643013, 0.015904000028967857, 0.01603199914097786, 0.01679999940097332, 0.016383999958634377], "compile_time": 121.82398900040425, "verification_time": 0, "benchmark_time": 0.9071719832718372, "strategy_time": 0.02842000685632229, "framework_time": 0.9049010113812983, "timestamp": "2023-01-26 19:47:46.405443+00:00"},
"3,224,20,1": {"between_method": 3, "block_size_x": 224, "tile_size": 20, "use_method": 1, "time": 0.019270399957895278, "times": [0.047680001705884933, 0.02022399939596653, 0.016383999958634377, 0.016095999628305435, 0.01603199914097786, 0.015039999969303608, 0.016383999958634377, 0.01500799972563982, 0.015519999898970127, 0.014336000196635723], "compile_time": 118.68671901174821, "verification_time": 0, "benchmark_time": 0.8947119931690395, "strategy_time": 0.004809990059584379, "framework_time": 1.4561869902536273, "timestamp": "2023-01-26 19:47:46.526504+00:00"},
"2,224,20,0": {"between_method": 2, "block_size_x": 224, "tile_size": 20, "use_method": 0, "time": 0.016118399892002346, "times": [0.04678399860858917, 0.017855999991297722, 0.01500799972563982, 0.01228800043463707, 0.01228800043463707, 0.011872000060975552, 0.010944000445306301, 0.01206399966031313, 0.01071999967098236, 0.011359999887645245], "compile_time": 117.70104800234549, "verification_time": 0, "benchmark_time": 0.8662219916004688, "strategy_time": 0.011149997590109706, "framework_time": 0.22820703452453017, "timestamp": "2023-01-26 19:47:46.646846+00:00"},
"1,224,20,0": {"between_method": 1, "block_size_x": 224, "tile_size": 20, "use_method": 0, "time": 0.017257600370794535, "times": [0.04371200129389763, 0.018432000651955605, 0.01635199971497059, 0.01571200042963028, 0.014336000196635723, 0.01321600005030632, 0.013632000423967838, 0.01228800043463707, 0.012608000077307224, 0.01228800043463707], "compile_time": 123.12953898799606, "verification_time": 0, "benchmark_time": 0.8619920117780566, "strategy_time": 0.00410998472943902, "framework_time": 0.9024810278788209, "timestamp": "2023-01-26 19:47:46.771758+00:00"},
"0,224,20,0": {"between_method": 0, "block_size_x": 224, "tile_size": 20, "use_method": 0, "time": 0.014553600363433361, "times": [0.03686400130391121, 0.014976000413298607, 0.01228800043463707, 0.012480000033974648, 0.01228800043463707, 0.01228800043463707, 0.010912000201642513, 0.012256000190973282, 0.01027199998497963, 0.010912000201642513], "compile_time": 113.98012100835331, "verification_time": 0, "benchmark_time": 0.821962981717661, "strategy_time": 0.003809982445091009, "framework_time": 0.901702034752816, "timestamp": "2023-01-26 19:47:46.887480+00:00"},
"2,736,18,2": {"between_method": 2, "block_size_x": 736, "tile_size": 18, "use_method": 2, "time": 0.015440000407397746, "times": [0.03840000182390213, 0.015904000028967857, 0.014336000196635723, 0.01228800043463707, 0.012512000277638435, 0.01228800043463707, 0.01228800043463707, 0.01228800043463707, 0.012191999703645706, 0.01190400030463934], "compile_time": 113.54817499523051, "verification_time": 0, "benchmark_time": 0.8301719790324569, "strategy_time": 0.09312000474892557, "framework_time": 0.9174820152111351, "timestamp": "2023-01-26 19:47:47.002883+00:00"},
"2,736,6,2": {"between_method": 2, "block_size_x": 736, "tile_size": 6, "use_method": 2, "time": 0.026243199966847895, "times": [0.050912000238895416, 0.028351999819278717, 0.023520000278949738, 0.02300800010561943, 0.023615999147295952, 0.023871999233961105, 0.022592000663280487, 0.022112000733613968, 0.02252800017595291, 0.02191999927163124], "compile_time": 101.42241499852389, "verification_time": 0, "benchmark_time": 0.8361719956155866, "strategy_time": 0.18553802510723472, "framework_time": 0.8901929541025311, "timestamp": "2023-01-26 19:47:47.106232+00:00"},
"2,736,20,2": {"between_method": 2, "block_size_x": 736, "tile_size": 20, "use_method": 2, "time": "RuntimeFailedConfig", "compile_time": 116.14943199674599, "verification_time": 0, "benchmark_time": 0.10017899330705404, "strategy_time": 0.0032600073609501123, "framework_time": 0.876892008818686, "timestamp": "2023-01-26 19:47:47.223376+00:00"},
"2,736,16,2": {"between_method": 2, "block_size_x": 736, "tile_size": 16, "use_method": 2, "time": 0.017523200064897538, "times": [0.04755200073122978, 0.018432000651955605, 0.015904000028967857, 0.01548799965530634, 0.013952000066637993, 0.013055999763309956, 0.012799999676644802, 0.012415999546647072, 0.013344000093638897, 0.01228800043463707], "compile_time": 113.73170200386085, "verification_time": 0, "benchmark_time": 0.8594520040787756, "strategy_time": 0.004069996066391468, "framework_time": 0.9596320160198957, "timestamp": "2023-01-26 19:47:47.338945+00:00"},
"2,736,14,2": {"between_method": 2, "block_size_x": 736, "tile_size": 14, "use_method": 2, "time": 0.016953600011765955, "times": [0.04198399931192398, 0.017376000061631203, 0.014879999682307243, 0.014208000153303146, 0.014336000196635723, 0.014336000196635723, 0.013088000006973743, 0.013728000223636627, 0.012640000320971012, 0.012959999963641167], "compile_time": 112.56056500133127, "verification_time": 0, "benchmark_time": 0.8195219852495939, "strategy_time": 0.0035390257835388184, "framework_time": 0.9127529920078814, "timestamp": "2023-01-26 19:47:47.453257+00:00"},
"2,736,12,2": {"between_method": 2, "block_size_x": 736, "tile_size": 12, "use_method": 2, "time": 0.018905600346624852, "times": [0.047200001776218414, 0.02006400004029274, 0.018079999834299088, 0.016383999958634377, 0.015456000342965126, 0.015584000386297703, 0.013376000337302685, 0.014336000196635723, 0.014336000196635723, 0.014240000396966934], "compile_time": 106.90789599902928, "verification_time": 0, "benchmark_time": 0.8402130042668432, "strategy_time": 0.0036700221244245768, "framework_time": 0.9787909802980721, "timestamp": "2023-01-26 19:47:47.562002+00:00"},
"2,736,8,2": {"between_method": 2, "block_size_x": 736, "tile_size": 8, "use_method": 2, "time": 0.021856000088155268, "times": [0.04707200080156326, 0.02239999920129776, 0.01958400011062622, 0.018912000581622124, 0.019840000197291374, 0.01849599927663803, 0.018432000651955605, 0.0180479995906353, 0.017343999817967415, 0.018432000651955605], "compile_time": 103.27285900712013, "verification_time": 0, "benchmark_time": 0.8301619964186102, "strategy_time": 0.00379001721739769, "framework_time": 0.9464519680477679, "timestamp": "2023-01-26 19:47:47.667071+00:00"},
"2,736,2,2": {"between_method": 2, "block_size_x": 736, "tile_size": 2, "use_method": 2, "time": 0.05717119947075844, "times": [0.08416000008583069, 0.05750399827957153, 0.05491200089454651, 0.05363199859857559, 0.05484800040721893, 0.05366399884223938, 0.053408000618219376, 0.0530879981815815, 0.053247999399900436, 0.053247999399900436], "compile_time": 97.3584019811824, "verification_time": 0, "benchmark_time": 0.8415420015808195, "strategy_time": 0.0036200217436999083, "framework_time": 0.9441919974051416, "timestamp": "2023-01-26 19:47:47.766233+00:00"},
"2,736,4,2": {"between_method": 2, "block_size_x": 736, "tile_size": 4, "use_method": 2, "time": 0.034963200055062774, "times": [0.06143999844789505, 0.0363520011305809, 0.03292800113558769, 0.0326399989426136, 0.031488001346588135, 0.03222399950027466, 0.0307839997112751, 0.030719999223947525, 0.03094400092959404, 0.030112000182271004], "compile_time": 101.3548869814258, "verification_time": 0, "benchmark_time": 0.8713419956620783, "strategy_time": 0.0036500277929008007, "framework_time": 0.9757500083651394, "timestamp": "2023-01-26 19:47:47.869453+00:00"},
"2,736,1,2": {"between_method": 2, "block_size_x": 736, "tile_size": 1, "use_method": 2, "time": 0.10357439890503883, "times": [0.12931199371814728, 0.10627199709415436, 0.10239999741315842, 0.10035199671983719, 0.1000640019774437, 0.09996800124645233, 0.09993600100278854, 0.0995199978351593, 0.09881599992513657, 0.09910400211811066], "compile_time": 100.59267401811667, "verification_time": 0, "benchmark_time": 1.3755169929936528, "strategy_time": 0.003939989255741239, "framework_time": 0.9871109796222299, "timestamp": "2023-01-26 19:47:47.972427+00:00"},
"2,736,10,2": {"between_method": 2, "block_size_x": 736, "tile_size": 10, "use_method": 2, "time": 0.0216992000117898, "times": [0.04915200173854828, 0.023231999948620796, 0.01897599920630455, 0.01817600056529045, 0.018432000651955605, 0.017376000061631203, 0.01913600042462349, 0.018015999346971512, 0.01651199907064438, 0.017983999103307724], "compile_time": 110.00783799681813, "verification_time": 0, "benchmark_time": 0.9033920068759471, "strategy_time": 0.003610010026022792, "framework_time": 0.9696219931356609, "timestamp": "2023-01-26 19:47:48.084326+00:00"},
"2,512,18,2": {"between_method": 2, "block_size_x": 512, "tile_size": 18, "use_method": 2, "time": 0.018508799932897092, "times": [0.04492799937725067, 0.020447999238967896, 0.016896000131964684, 0.01600000075995922, 0.015296000055968761, 0.014879999682307243, 0.0144640002399683, 0.013824000023305416, 0.014336000196635723, 0.014015999622642994], "compile_time": 120.45756197767332, "verification_time": 0, "benchmark_time": 0.8407330024056137, "strategy_time": 0.036618992453441024, "framework_time": 0.9967610239982605, "timestamp": "2023-01-26 19:47:48.206673+00:00"},
"2,128,18,2": {"between_method": 2, "block_size_x": 128, "tile_size": 18, "use_method": 2, "time": 0.017481599934399128, "times": [0.041120000183582306, 0.020287999883294106, 0.016095999628305435, 0.014783999882638454, 0.014336000196635723, 0.012927999719977379, 0.013663999736309052, 0.012959999963641167, 0.014336000196635723, 0.014303999952971935], "compile_time": 118.39262201101519, "verification_time": 0, "benchmark_time": 0.8330130076501518, "strategy_time": 0.0038600119296461344, "framework_time": 0.999709969619289, "timestamp": "2023-01-26 19:47:48.326916+00:00"},
"2,960,18,2": {"between_method": 2, "block_size_x": 960, "tile_size": 18, "use_method": 2, "time": "RuntimeFailedConfig", "compile_time": 115.65028497716412, "verification_time": 0, "benchmark_time": 0.10358900181017816, "strategy_time": 0.0038190046325325966, "framework_time": 0.9494030091445893, "timestamp": "2023-01-26 19:47:48.443641+00:00"},
"2,224,18,2": {"between_method": 2, "block_size_x": 224, "tile_size": 18, "use_method": 2, "time": 0.017238400131464004, "times": [0.042527999728918076, 0.018432000651955605, 0.015807999297976494, 0.014336000196635723, 0.014336000196635723, 0.014336000196635723, 0.014336000196635723, 0.012608000077307224, 0.012896000407636166, 0.012768000364303589], "compile_time": 115.17558101331815, "verification_time": 0, "benchmark_time": 0.8269719837699085, "strategy_time": 0.004310015356168151, "framework_time": 1.105981005821377, "timestamp": "2023-01-26 19:47:48.560771+00:00"},
"2,896,18,2": {"between_method": 2, "block_size_x": 896, "tile_size": 18, "use_method": 2, "time": "RuntimeFailedConfig", "compile_time": 119.29978401167318, "verification_time": 0, "benchmark_time": 0.11281899060122669, "strategy_time": 0.0043199979700148106, "framework_time": 1.3405779900494963, "timestamp": "2023-01-26 19:47:48.681543+00:00"},
"2,992,18,2": {"between_method": 2, "block_size_x": 992, "tile_size": 18, "use_method": 2, "time": "RuntimeFailedConfig", "compile_time": 115.58303699712269, "verification_time": 0, "benchmark_time": 0.10555901098996401, "strategy_time": 0.004090019501745701, "framework_time": 1.165428984677419, "timestamp": "2023-01-26 19:47:48.798417+00:00"},
"2,480,18,2": {"between_method": 2, "block_size_x": 480, "tile_size": 18, "use_method": 2, "time": 0.017705599963665008, "times": [0.04095999896526337, 0.018751999363303185, 0.015968000516295433, 0.014336000196635723, 0.015968000516295433, 0.014655999839305878, 0.014783999882638454, 0.012992000207304955, 0.014303999952971935, 0.014336000196635723], "compile_time": 113.81358199287206, "verification_time": 0, "benchmark_time": 0.8264030038844794, "strategy_time": 0.004430010449141264, "framework_time": 1.0788300132844597, "timestamp": "2023-01-26 19:47:48.914154+00:00"},
"2,64,18,2": {"between_method": 2, "block_size_x": 64, "tile_size": 18, "use_method": 2, "time": 0.024771200120449068, "times": [0.05104000121355057, 0.026240000501275063, 0.02252800017595291, 0.022495999932289124, 0.02051199972629547, 0.021536000072956085, 0.021568000316619873, 0.020479999482631683, 0.0208320003002882, 0.020479999482631683], "compile_time": 115.05947198020294, "verification_time": 0, "benchmark_time": 0.8670520037412643, "strategy_time": 0.003789988113567233, "framework_time": 1.0500010394025594, "timestamp": "2023-01-26 19:47:49.031149+00:00"},
"2,448,18,2": {"between_method": 2, "block_size_x": 448, "tile_size": 18, "use_method": 2, "time": 0.019324799720197915, "times": [0.04297599941492081, 0.020735999569296837, 0.017952000722289085, 0.016383999958634377, 0.016063999384641647, 0.017503999173641205, 0.016063999384641647, 0.01587199978530407, 0.015359999611973763, 0.014336000196635723], "compile_time": 118.7085279962048, "verification_time": 0, "benchmark_time": 0.8359019993804395, "strategy_time": 0.0035400153137743473, "framework_time": 1.0488620027899742, "timestamp": "2023-01-26 19:47:49.151763+00:00"},
"2,576,18,2": {"between_method": 2, "block_size_x": 576, "tile_size": 18, "use_method": 2, "time": 0.01678080027922988, "times": [0.041728001087903976, 0.016704000532627106, 0.014336000196635723, 0.014208000153303146, 0.014336000196635723, 0.014175999909639359, 0.013887999579310417, 0.013856000266969204, 0.01228800043463707, 0.01228800043463707], "compile_time": 116.16056200000457, "verification_time": 0, "benchmark_time": 0.8300920017063618, "strategy_time": 0.003830005880445242, "framework_time": 1.1042999976780266, "timestamp": "2023-01-26 19:47:49.269876+00:00"},
"2,384,18,2": {"between_method": 2, "block_size_x": 384, "tile_size": 18, "use_method": 2, "time": 0.016300799883902074, "times": [0.04057599976658821, 0.016543999314308167, 0.016383999958634377, 0.013952000066637993, 0.013120000250637531, 0.012799999676644802, 0.012575999833643436, 0.01228800043463707, 0.012223999947309494, 0.012543999589979649], "compile_time": 115.2512599946931, "verification_time": 0, "benchmark_time": 0.8769120031502098, "strategy_time": 0.003618974005803466, "framework_time": 1.0834610147867352, "timestamp": "2023-01-26 19:47:49.387106+00:00"},
"2,192,18,2": {"between_method": 2, "block_size_x": 192, "tile_size": 18, "use_method": 2, "time": 0.01649279994890094, "times": [0.04294399917125702, 0.018239999189972878, 0.015647999942302704, 0.014336000196635723, 0.012671999633312225, 0.01228800043463707, 0.012223999947309494, 0.01228800043463707, 0.012256000190973282, 0.012032000347971916], "compile_time": 118.82607699953951, "verification_time": 0, "benchmark_time": 0.8439520024694502, "strategy_time": 0.00344999716617167, "framework_time": 1.0776800045277923, "timestamp": "2023-01-26 19:47:49.507874+00:00"},
"2,32,18,2": {"between_method": 2, "block_size_x": 32, "tile_size": 18, "use_method": 2, "time": 0.03637439981102943, "times": [0.058368001133203506, 0.03807999938726425, 0.035071998834609985, 0.03315199911594391, 0.03283200040459633, 0.03340800106525421, 0.03315199911594391, 0.03407999873161316, 0.03283200040459633, 0.03276799991726875], "compile_time": 112.4432559881825, "verification_time": 0, "benchmark_time": 0.8329419943038374, "strategy_time": 0.003530003596097231, "framework_time": 1.0923900408670306, "timestamp": "2023-01-26 19:47:49.622261+00:00"},
"2,768,18,2": {"between_method": 2, "block_size_x": 768, "tile_size": 18, "use_method": 2, "time": 0.01552959978580475, "times": [0.03891199827194214, 0.016767999157309532, 0.012703999876976013, 0.013151999562978745, 0.01244799979031086, 0.01228800043463707, 0.012415999546647072, 0.01228800043463707, 0.012032000347971916, 0.01228800043463707], "compile_time": 112.99877098645084, "verification_time": 0, "benchmark_time": 0.8335220045410097, "strategy_time": 0.0037700228858739138, "framework_time": 1.100560009945184, "timestamp": "2023-01-26 19:47:49.737212+00:00"},
"2,416,18,2": {"between_method": 2, "block_size_x": 416, "tile_size": 18, "use_method": 2, "time": 0.02054719990119338, "times": [0.04633599892258644, 0.02236800082027912, 0.020096000283956528, 0.018239999189972878, 0.017855999991297722, 0.016607999801635742, 0.015296000055968761, 0.016256000846624374, 0.016095999628305435, 0.0163199994713068], "compile_time": 115.46466799336486, "verification_time": 0, "benchmark_time": 0.8489720057696104, "strategy_time": 0.003390014171600342, "framework_time": 1.112479978473857, "timestamp": "2023-01-26 19:47:49.854656+00:00"},
"2,96,18,2": {"between_method": 2, "block_size_x": 96, "tile_size": 18, "use_method": 2, "time": 0.02014399990439415, "times": [0.04320000112056732, 0.022207999601960182, 0.01974399946630001, 0.018271999433636665, 0.017952000722289085, 0.01651199907064438, 0.01462399959564209, 0.016383999958634377, 0.01616000011563301, 0.016383999958634377], "compile_time": 118.34521201672032, "verification_time": 0, "benchmark_time": 0.8442020043730736, "strategy_time": 0.003549997927621007, "framework_time": 1.1072189954575151, "timestamp": "2023-01-26 19:47:49.974971+00:00"},
"2,800,18,2": {"between_method": 2, "block_size_x": 800, "tile_size": 18, "use_method": 2, "time": "RuntimeFailedConfig", "compile_time": 118.537648988422, "verification_time": 0, "benchmark_time": 0.1112589961849153, "strategy_time": 0.003930006641894579, "framework_time": 1.076351007213816, "timestamp": "2023-01-26 19:47:50.094715+00:00"},
"2,832,18,2": {"between_method": 2, "block_size_x": 832, "tile_size": 18, "use_method": 2, "time": "RuntimeFailedConfig", "compile_time": 115.11251100455411, "verification_time": 0, "benchmark_time": 0.11276899022050202, "strategy_time": 0.00444002216681838, "framework_time": 1.2066489725839347, "timestamp": "2023-01-26 19:47:50.211167+00:00"},
"2,640,18,2": {"between_method": 2, "block_size_x": 640, "tile_size": 18, "use_method": 2, "time": 0.017942399997264147, "times": [0.045823998749256134, 0.018464000895619392, 0.016543999314308167, 0.015904000028967857, 0.01484800036996603, 0.014688000082969666, 0.014336000196635723, 0.012671999633312225, 0.013504000380635262, 0.012640000320971012], "compile_time": 118.38533202535473, "verification_time": 0, "benchmark_time": 0.8792220032773912, "strategy_time": 0.004559988155961037, "framework_time": 1.1849389993585646, "timestamp": "2023-01-26 19:47:50.331637+00:00"},
"2,160,18,2": {"between_method": 2, "block_size_x": 160, "tile_size": 18, "use_method": 2, "time": 0.016595200262963773, "times": [0.03884800150990486, 0.016767999157309532, 0.015776000916957855, 0.014336000196635723, 0.014336000196635723, 0.01369599997997284, 0.012512000277638435, 0.013439999893307686, 0.012736000120639801, 0.013504000380635262], "compile_time": 115.79678297857754, "verification_time": 0, "benchmark_time": 0.8381929947063327, "strategy_time": 0.004090019501745701, "framework_time": 1.1460999958217144, "timestamp": "2023-01-26 19:47:50.449437+00:00"},
"2,608,18,2": {"between_method": 2, "block_size_x": 608, "tile_size": 18, "use_method": 2, "time": 0.017619199957698582, "times": [0.04255999997258186, 0.019936000928282738, 0.016767999157309532, 0.01462399959564209, 0.01462399959564209, 0.014175999909639359, 0.013856000266969204, 0.013024000450968742, 0.013535999692976475, 0.013088000006973743], "compile_time": 115.35820900462568, "verification_time": 0, "benchmark_time": 0.8561629801988602, "strategy_time": 0.0033800024539232254, "framework_time": 1.1474690400063992, "timestamp": "2023-01-26 19:47:50.566817+00:00"},
"2,672,18,2": {"between_method": 2, "block_size_x": 672, "tile_size": 18, "use_method": 2, "time": 0.017753600142896175, "times": [0.041152000427246094, 0.018432000651955605, 0.016063999384641647, 0.014879999682307243, 0.014336000196635723, 0.014336000196635723, 0.014336000196635723, 0.014112000353634357, 0.015552000142633915, 0.014336000196635723], "compile_time": 115.45754800317809, "verification_time": 0, "benchmark_time": 0.8798719791229814, "strategy_time": 0.003730005118995905, "framework_time": 1.1302600323688239, "timestamp": "2023-01-26 19:47:50.684304+00:00"},
"2,864,18,2": {"between_method": 2, "block_size_x": 864, "tile_size": 18, "use_method": 2, "time": "RuntimeFailedConfig", "compile_time": 115.734174993122, "verification_time": 0, "benchmark_time": 0.10650898911990225, "strategy_time": 0.00467998324893415, "framework_time": 1.306107034906745, "timestamp": "2023-01-26 19:47:50.801469+00:00"},
"2,352,18,2": {"between_method": 2, "block_size_x": 352, "tile_size": 18, "use_method": 2, "time": 0.016796799935400487, "times": [0.05129599943757057, 0.016383999958634377, 0.014112000353634357, 0.012415999546647072, 0.01228800043463707, 0.012415999546647072, 0.012543999589979649, 0.012128000147640705, 0.01228800043463707, 0.012095999903976917], "compile_time": 114.17283999617212, "verification_time": 0, "benchmark_time": 0.8494819921907037, "strategy_time": 0.004650006303563714, "framework_time": 1.2022400042042136, "timestamp": "2023-01-26 19:47:50.917714+00:00"},
"2,704,18,2": {"between_method": 2, "block_size_x": 704, "tile_size": 18, "use_method": 2, "time": 0.01759679997339845, "times": [0.04137599840760231, 0.018432000651955605, 0.01635199971497059, 0.014816000126302242, 0.014655999839305878, 0.014303999952971935, 0.014336000196635723, 0.014112000353634357, 0.014336000196635723, 0.013248000293970108], "compile_time": 115.24427001131698, "verification_time": 0, "benchmark_time": 0.887842004885897, "strategy_time": 0.0037800054997205734, "framework_time": 1.2100099993404, "timestamp": "2023-01-26 19:47:51.035076+00:00"},
"2,320,18,2": {"between_method": 2, "block_size_x": 320, "tile_size": 18, "use_method": 2, "time": 0.016550400014966726, "times": [0.043136000633239746, 0.016543999314308167, 0.015424000099301338, 0.014336000196635723, 0.012512000277638435, 0.01244799979031086, 0.012768000364303589, 0.012319999746978283, 0.013472000136971474, 0.012543999589979649], "compile_time": 114.50517500634305, "verification_time": 0, "benchmark_time": 0.8429720182903111, "strategy_time": 0.003789988113567233, "framework_time": 1.2165989901404828, "timestamp": "2023-01-26 19:47:51.151661+00:00"},
"2,256,18,2": {"between_method": 2, "block_size_x": 256, "tile_size": 18, "use_method": 2, "time": 0.016150400415062903, "times": [0.04169600084424019, 0.01772800087928772, 0.014336000196635723, 0.01228800043463707, 0.013824000023305416, 0.01228800043463707, 0.012480000033974648, 0.01228800043463707, 0.01228800043463707, 0.01228800043463707], "compile_time": 112.89265099912882, "verification_time": 0, "benchmark_time": 0.8295729930978268, "strategy_time": 0.00366999302059412, "framework_time": 1.2462090235203505, "timestamp": "2023-01-26 19:47:51.266649+00:00"},
"2,288,18,2": {"between_method": 2, "block_size_x": 288, "tile_size": 18, "use_method": 2, "time": 0.017660799995064737, "times": [0.04064000025391579, 0.01897599920630455, 0.016383999958634377, 0.016127999871969223, 0.016127999871969223, 0.014336000196635723, 0.01321600005030632, 0.013791999779641628, 0.012896000407636166, 0.014112000353634357], "compile_time": 115.11123197851703, "verification_time": 0, "benchmark_time": 0.8503120043314993, "strategy_time": 0.0035799748729914427, "framework_time": 1.1949080508202314, "timestamp": "2023-01-26 19:47:51.383824+00:00"},
"2,928,18,2": {"between_method": 2, "block_size_x": 928, "tile_size": 18, "use_method": 2, "time": "RuntimeFailedConfig", "compile_time": 114.99757200363092, "verification_time": 0, "benchmark_time": 0.13573901378549635, "strategy_time": 0.0036489800550043583, "framework_time": 1.1723600036930293, "timestamp": "2023-01-26 19:47:51.500148+00:00"},
"2,544,18,2": {"between_method": 2, "block_size_x": 544, "tile_size": 18, "use_method": 2, "time": 0.02071999981999397, "times": [0.06531199812889099, 0.01926399953663349, 0.016448000445961952, 0.015135999768972397, 0.015231999568641186, 0.01616000011563301, 0.014592000283300877, 0.014399999752640724, 0.015584000386297703, 0.015072000212967396], "compile_time": 118.72661800589412, "verification_time": 0, "benchmark_time": 0.9377319947816432, "strategy_time": 0.005939975380897522, "framework_time": 1.495176024036482, "timestamp": "2023-01-26 19:47:51.621345+00:00"},
"3,736,18,2": {"between_method": 3, "block_size_x": 736, "tile_size": 18, "use_method": 2, "time": 0.017152000032365323, "times": [0.04742399975657463, 0.017023999243974686, 0.015104000456631184, 0.015615999698638916, 0.014112000353634357, 0.013024000450968742, 0.012703999876976013, 0.01228800043463707, 0.01228800043463707, 0.011935999616980553], "compile_time": 115.1725210074801, "verification_time": 0, "benchmark_time": 0.8721919730305672, "strategy_time": 0.02749002305790782, "framework_time": 1.2613279977813363, "timestamp": "2023-01-26 19:47:51.738694+00:00"},
"1,736,18,2": {"between_method": 1, "block_size_x": 736, "tile_size": 18, "use_method": 2, "time": 0.015891199931502342, "times": [0.04108799993991852, 0.016383999958634377, 0.014303999952971935, 0.012640000320971012, 0.012319999746978283, 0.012671999633312225, 0.012543999589979649, 0.01228800043463707, 0.012415999546647072, 0.012256000190973282], "compile_time": 117.65216701314785, "verification_time": 0, "benchmark_time": 0.8373330056201667, "strategy_time": 0.0031200179364532232, "framework_time": 1.233838964253664, "timestamp": "2023-01-26 19:47:51.858435+00:00"},
"0,736,18,2": {"between_method": 0, "block_size_x": 736, "tile_size": 18, "use_method": 2, "time": 0.01665920000523329, "times": [0.04095999896526337, 0.018432000651955605, 0.016287999227643013, 0.014527999795973301, 0.014336000196635723, 0.012896000407636166, 0.01228800043463707, 0.01235199999064207, 0.01228800043463707, 0.012223999947309494], "compile_time": 114.32819798937999, "verification_time": 0, "benchmark_time": 0.8563029987271875, "strategy_time": 0.0037599820643663406, "framework_time": 1.2505580380093306, "timestamp": "2023-01-26 19:47:51.974889+00:00"},
"2,736,18,1": {"between_method": 2, "block_size_x": 736, "tile_size": 18, "use_method": 1, "time": "RuntimeFailedConfig", "compile_time": 109.60116001660936, "verification_time": 0, "benchmark_time": 0.09940899326466024, "strategy_time": 0.02823001705110073, "framework_time": 1.1926899896934628, "timestamp": "2023-01-26 19:47:52.085825+00:00"},
"2,736,18,0": {"between_method": 2, "block_size_x": 736, "tile_size": 18, "use_method": 0, "time": 0.016784000117331742, "times": [0.04364800080657005, 0.018303999677300453, 0.014688000082969666, 0.013887999579310417, 0.01360000018030405, 0.012384000234305859, 0.012736000120639801, 0.01228800043463707, 0.013919999822974205, 0.012384000234305859], "compile_time": 115.05078201298602, "verification_time": 0, "benchmark_time": 0.8804009994491935, "strategy_time": 0.004359986633062363, "framework_time": 1.2870189966633916, "timestamp": "2023-01-26 19:47:52.203063+00:00"},
"2,928,6,0": {"between_method": 2, "block_size_x": 928, "tile_size": 6, "use_method": 0, "time": 0.024064000137150286, "times": [0.047520000487565994, 0.02457600086927414, 0.022816000506281853, 0.026688000187277794, 0.02022399939596653, 0.020479999482631683, 0.020479999482631683, 0.019680000841617584, 0.01894400082528591, 0.019231999292969704], "compile_time": 107.62734900345095, "verification_time": 0, "benchmark_time": 0.8519830007571727, "strategy_time": 0.09458899148739874, "framework_time": 1.3083470112178475, "timestamp": "2023-01-26 19:47:52.312962+00:00"},
"2,864,6,0": {"between_method": 2, "block_size_x": 864, "tile_size": 6, "use_method": 0, "time": 0.02507839985191822, "times": [0.04899200052022934, 0.026623999699950218, 0.022975999861955643, 0.022175999358296394, 0.022048000246286392, 0.022207999601960182, 0.022143999114632607, 0.02070399932563305, 0.02208000048995018, 0.0208320003002882], "compile_time": 106.92851600470021, "verification_time": 0, "benchmark_time": 0.8738519973121583, "strategy_time": 0.19274797523394227, "framework_time": 1.2490690278355032, "timestamp": "2023-01-26 19:47:52.422222+00:00"},
"2,672,6,0": {"between_method": 2, "block_size_x": 672, "tile_size": 6, "use_method": 0, "time": 0.028384000435471533, "times": [0.05302400141954422, 0.029472000896930695, 0.026655999943614006, 0.024639999493956566, 0.02566399984061718, 0.02457600086927414, 0.02457600086927414, 0.02486399933695793, 0.02579200081527233, 0.02457600086927414], "compile_time": 103.6866850045044, "verification_time": 0, "benchmark_time": 0.8614919788669795, "strategy_time": 0.003410008503124118, "framework_time": 1.319488015724346, "timestamp": "2023-01-26 19:47:52.528109+00:00"},
"2,768,6,0": {"between_method": 2, "block_size_x": 768, "tile_size": 6, "use_method": 0, "time": 0.02590080015361309, "times": [0.04915200173854828, 0.028063999488949776, 0.024800000712275505, 0.022911999374628067, 0.02377600036561489, 0.02252800017595291, 0.02127999998629093, 0.021503999829292297, 0.02252800017595291, 0.022463999688625336], "compile_time": 108.38758299360052, "verification_time": 0, "benchmark_time": 0.8383019885513932, "strategy_time": 0.005390000296756625, "framework_time": 1.4784370141569525, "timestamp": "2023-01-26 19:47:52.638835+00:00"},
"2,736,6,0": {"between_method": 2, "block_size_x": 736, "tile_size": 6, "use_method": 0, "time": 0.02738240044564009, "times": [0.06128000095486641, 0.028672000393271446, 0.02457600086927414, 0.023840000852942467, 0.024064000695943832, 0.02252800017595291, 0.02252800017595291, 0.02252800017595291, 0.02179200015962124, 0.022016000002622604], "compile_time": 103.91491299378686, "verification_time": 0, "benchmark_time": 0.8496319933328778, "strategy_time": 0.0037199934013187885, "framework_time": 1.2815400259569287, "timestamp": "2023-01-26 19:47:52.744899+00:00"},
"2,64,6,0": {"between_method": 2, "block_size_x": 64, "tile_size": 6, "use_method": 0, "time": 0.04894719980657101, "times": [0.06947200000286102, 0.04915200173854828, 0.04710400104522705, 0.04742399975657463, 0.046751998364925385, 0.04540799930691719, 0.046431999653577805, 0.04639999940991402, 0.04527999833226204, 0.04604800045490265], "compile_time": 105.31014000298455, "verification_time": 0, "benchmark_time": 0.8509320032317191, "strategy_time": 0.0045800115913152695, "framework_time": 1.9353229727130383, "timestamp": "2023-01-26 19:47:52.853018+00:00"},
"2,416,6,0": {"between_method": 2, "block_size_x": 416, "tile_size": 6, "use_method": 0, "time": 0.02337279971688986, "times": [0.04623999819159508, 0.024191999807953835, 0.02191999927163124, 0.020479999482631683, 0.020479999482631683, 0.02038400061428547, 0.020479999482631683, 0.020160000771284103, 0.018912000581622124, 0.020479999482631683], "compile_time": 101.05351899983361, "verification_time": 0, "benchmark_time": 0.8060730178840458, "strategy_time": 0.0031700183171778917, "framework_time": 1.3158079818822443, "timestamp": "2023-01-26 19:47:52.956212+00:00"},
"2,384,6,0": {"between_method": 2, "block_size_x": 384, "tile_size": 6, "use_method": 0, "time": 0.025356800109148026, "times": [0.04931199923157692, 0.026688000187277794, 0.02300800010561943, 0.022943999618291855, 0.02252800017595291, 0.021344000473618507, 0.02252800017595291, 0.02175999991595745, 0.022304000332951546, 0.02115200087428093], "compile_time": 103.88871299801394, "verification_time": 0, "benchmark_time": 0.8548719924874604, "strategy_time": 0.004139001248404384, "framework_time": 1.3443490315694362, "timestamp": "2023-01-26 19:47:53.062319+00:00"},
